seasonType,eventId,commentaryOrder,playId,clockDisplayValue,commentaryText,updateDateTime
12565,711032,6,43581324,59',Maxime Sivis (Dinamo Bucuresti) Yellow Card at 59',2024-08-19 05:41:14
12565,711032,7,43581474,67',Cristian Costin (Dinamo Bucuresti) Substitution at 67',2024-08-19 05:41:14
12565,711032,8,43581475,67',Adrian Caragea (Dinamo Bucuresti) Substitution at 67',2024-08-19 05:41:14
12565,711032,9,43581601,75',Razvan Oaida (Rapid Bucuresti) Substitution at 75',2024-08-19 05:41:14
12565,711032,10,43581602,76',Borisav Burmaz (Rapid Bucuresti) Substitution at 76',2024-08-19 05:41:14
12565,711032,11,43581632,77',Cristian Ignat (Rapid Bucuresti) Yellow Card at 77',2024-08-19 05:41:14
12565,711032,12,43581660,79',Astrit Seljmani (Dinamo Bucuresti) Penalty - Scored at 79',2024-08-19 05:41:14
12565,711032,13,43581757,82',Catalin Cirjan (Dinamo Bucuresti) Yellow Card at 82',2024-08-19 05:41:14
12565,711032,14,43581862,85',Omar El Sawy (Rapid Bucuresti) Substitution at 85',2024-08-19 05:41:14
12565,711032,15,43581863,86',Andrei Borza (Rapid Bucuresti) Yellow Card at 86',2024-08-19 05:41:14
12565,711032,16,43581954,88',Astrit Seljmani (Dinamo Bucuresti) Yellow Card at 88',2024-08-19 05:41:14
12565,711032,17,43581955,89',Cristian Licsandru (Dinamo Bucuresti) Substitution at 89',2024-08-19 05:41:14
12565,711032,18,43582108,90'+4',Paul Iacob (Rapid Bucuresti) Substitution at 94',2024-08-19 05:41:14
12565,711032,19,43582163,90'+8',Razvan Patriche (Dinamo Bucuresti) Substitution at 98',2024-08-19 05:41:14
12565,711033,0,43632072,20',Diego Ferares Scheda (Gloria Buzau) Yellow Card at 20',2024-08-27 05:40:14
12565,711033,1,43632080,27',Dan Nistor (Universitatea Cluj) Penalty - Scored at 27',2024-08-27 05:40:14
12565,711033,2,43632100,33',Ovidiu Popescu (Universitatea Cluj) Yellow Card at 33',2024-08-27 05:40:14
12565,711033,3,43632126,43',Mamadou Thiam (Universitatea Cluj) Goal at 43',2024-08-27 05:40:14
12565,711033,4,43632130,45',Rassambek Akhmatov (Gloria Buzau) Yellow Card at 45',2024-08-27 05:40:14
12565,711033,5,43632169,45',Gabriel Simion (Universitatea Cluj) Substitution at 45',2024-08-27 05:40:14
12565,711033,6,43632170,45',Dragos Sebastian Tescan (Gloria Buzau) Substitution at 45',2024-08-27 05:40:14
12565,711033,7,43632171,45',Constantin Budescu (Gloria Buzau) Substitution at 45',2024-08-27 05:40:14
12565,711033,8,43632172,45',Sergiu Pîrvulescu (Gloria Buzau) Substitution at 45',2024-08-27 05:40:14
12565,711033,9,43632189,57',Cristian Dumitru (Gloria Buzau) Substitution at 57',2024-08-27 05:40:14
12565,711033,10,43632193,62',Edvinas Gertmonas (Universitatea Cluj) Yellow Card at 62',2024-08-27 05:40:14
12565,711033,11,43632197,64',Dario Canadjija (Gloria Buzau) Yellow Card at 64',2024-08-27 05:40:14
12565,711033,12,43632215,72',Matei Moraru (Universitatea Cluj) Substitution at 72',2024-08-27 05:40:14
12565,711033,13,43632216,73',Bogdan Mitrea (Universitatea Cluj) Substitution at 73',2024-08-27 05:40:14
12565,711033,14,43632225,77',Lucas Masoero (Universitatea Cluj) Yellow Card at 77',2024-08-27 05:40:14
12565,711033,15,43632237,81',Andreas Mihaiu (Gloria Buzau) Substitution at 81',2024-08-27 05:40:14
12565,711033,16,43632252,85',Dorinel Gabriel Oancea (Universitatea Cluj) Substitution at 85',2024-08-27 05:40:14
12565,711033,17,43632253,86',Hildeberto Pereira (Universitatea Cluj) Substitution at 86',2024-08-27 05:40:14
12565,711034,0,43623264,30',Alejandro Díez Salomon (FC Botosani) Yellow Card at 30',2024-08-26 05:34:12
12565,711034,1,43623412,37',Louis Munteanu (CFR Cluj-Napoca) Yellow Card at 37',2024-08-26 05:34:12
12565,711034,2,43623936,45',Vasile Mogos (CFR Cluj-Napoca) Substitution at 45',2024-08-26 05:34:12
12565,711034,3,43624038,52',Beni N'Kololo (CFR Cluj-Napoca) Goal at 52',2024-08-26 05:34:12
12565,711034,4,43624049,53',Juan Cruz Kaprof (FC Botosani) Substitution at 53',2024-08-26 05:34:12
12565,711034,5,43624258,67',Adi Chica-Rosa (FC Botosani) Substitution at 67',2024-08-26 05:34:12
12565,711034,6,43624259,67',Francisco Júnior (FC Botosani) Substitution at 67',2024-08-26 05:34:12
12565,711034,7,43624274,70',Damjan Djokovic (CFR Cluj-Napoca) Goal at 70',2024-08-26 05:34:12
12565,711034,8,43624327,73',David Eugen Gabriel (FC Botosani) Substitution at 73',2024-08-26 05:34:12
12565,711034,9,43624328,73',Jaly Mouaddib (FC Botosani) Substitution at 73',2024-08-26 05:34:12
12565,711034,10,43624364,76',Anton Kresic (CFR Cluj-Napoca) Substitution at 76',2024-08-26 05:34:12
12565,711034,11,43624512,82',Andrei Artean (CFR Cluj-Napoca) Substitution at 82',2024-08-26 05:34:12
12565,711034,12,43624560,85',Robert Filip (CFR Cluj-Napoca) Substitution at 85',2024-08-26 05:34:12
12565,711034,13,43624561,85',Meriton Korenica (CFR Cluj-Napoca) Substitution at 85',2024-08-26 05:34:12
12565,711034,14,43624571,86',Robert Filip (CFR Cluj-Napoca) Goal at 86',2024-08-26 05:34:12
12565,711034,15,43625551,86',Patricio Matricardi (FC Botosani) Yellow Card at 86',2024-08-26 05:34:12
12565,711035,0,43632555,22',Benjamin Van Durmen (UTA Arad) Goal at 22',2024-08-27 05:40:14
12565,711035,1,43632646,35',Victor Robert Dican (FC Farul Constanta) Substitution at 35',2024-08-27 05:40:14
12565,711035,2,43632913,60',Jordan Attah Kadiri (UTA Arad) Substitution at 60',2024-08-27 05:40:14
12565,711035,3,43632914,61',Lamine Ghezali (UTA Arad) Substitution at 61',2024-08-27 05:40:14
12565,711035,4,43632915,61',Cristian Mihai (UTA Arad) Substitution at 61',2024-08-27 05:40:14
12565,711035,5,43632916,62',Mihai Balasa (FC Farul Constanta) Yellow Card at 62',2024-08-27 05:40:14
12565,711035,6,43632944,65',Denis Alibec (FC Farul Constanta) Substitution at 65',2024-08-27 05:40:14
12565,711035,7,43632945,66',Eric Omondi (UTA Arad) Yellow Card at 66',2024-10-14 07:06:39
12565,711035,8,43633026,75',Victor Robert Dican (FC Farul Constanta) Yellow Card at 75',2024-08-27 05:40:14
12565,711035,9,43633064,79',Dan Sîrbu (FC Farul Constanta) Substitution at 79',2024-08-27 05:40:14
12565,711035,10,43633065,79',João Pedro (UTA Arad) Substitution at 79',2024-08-28 05:40:50
12565,711035,11,43633066,79',Iustin Doicaru (FC Farul Constanta) Substitution at 79',2024-08-27 05:40:14
12565,711035,12,43633067,79',Alexandru Stoian (FC Farul Constanta) Substitution at 79',2024-08-27 05:40:14
12565,711035,13,43633071,81',Constantin Grameni (FC Farul Constanta) Yellow Card at 81',2024-08-27 05:40:14
12565,711035,14,43633093,84',Kouya Aristide Mabea (UTA Arad) Substitution at 84',2024-08-27 05:40:14
12565,711035,15,43633139,90',Kouya Aristide Mabea (UTA Arad) Yellow Card at 90',2024-08-27 05:40:14
12565,711035,16,43633159,90'+5',Victor Robert Dican (FC Farul Constanta) Goal at 95',2024-08-27 05:40:14
12565,711035,17,43633162,90'+6',Ibrahima Sory Conté (UTA Arad) Yellow Card at 96',2024-08-27 05:40:14
12565,711036,0,43608832,14',Isnik Alimi (Sepsi Sfantu Gheorghe) Yellow Card at 14',2024-08-25 05:40:01
12565,711036,1,43609048,40',Marius Coleman (Sepsi Sfantu Gheorghe) Yellow Card at 40',2024-08-25 05:40:01
12565,711036,2,43609049,40',Ariel López (Unirea Slobozia) Yellow Card at 40',2024-08-25 05:40:01
12565,711036,3,43609362,45',Sherif Kallaku (Sepsi Sfantu Gheorghe) Substitution at 45',2024-08-25 05:40:01
12565,711036,4,43609392,45',Laurentiu Vlasceanu (Unirea Slobozia) Substitution at 45',2024-08-25 05:40:01
12565,711036,5,43609393,45',Ionut Coada (Unirea Slobozia) Substitution at 45',2024-08-25 05:40:01
12565,711036,6,43609452,51',Sherif Kallaku (Sepsi Sfantu Gheorghe) Yellow Card at 51',2024-08-25 05:40:01
12565,711036,7,43609629,60',Branislav Ninaj (Sepsi Sfantu Gheorghe) Yellow Card at 60',2024-08-25 05:40:01
12565,711036,8,43609630,61',Laurentiu Vlasceanu (Unirea Slobozia) Yellow Card at 61',2024-08-25 05:40:01
12565,711036,9,43609686,66',Paolo Medina (Unirea Slobozia) Yellow Card at 66',2024-08-25 05:40:01
12565,711036,10,43609687,67',Adnan Aganovic (Unirea Slobozia) Substitution at 67',2024-08-25 05:40:01
12565,711036,11,43609713,69',Darius Oroian (Sepsi Sfantu Gheorghe) Substitution at 69',2024-08-25 05:40:01
12565,711036,12,43609714,69',Marian Liviu Draghiceanu (Sepsi Sfantu Gheorghe) Substitution at 69',2024-08-25 05:40:01
12565,711036,13,43609715,69',Sota Mino (Sepsi Sfantu Gheorghe) Substitution at 69',2024-08-25 05:40:01
12565,711036,14,43609811,78',Dmytro Pospelov (Unirea Slobozia) Penalty - Scored at 78',2024-08-25 05:40:01
12565,711036,15,43609862,81',Stefan Hajdin (Sepsi Sfantu Gheorghe) Substitution at 81',2024-08-25 05:40:01
12565,711036,16,43609906,84',Branislav Ninaj (Sepsi Sfantu Gheorghe) Red Card at 84',2024-08-25 05:40:01
12565,711036,17,43609953,87',Dmytro Pospelov (Unirea Slobozia) Yellow Card at 87',2024-08-25 05:40:01
12565,711036,18,43610049,90'+3',Stefan Pacionel (Unirea Slobozia) Substitution at 93',2024-08-25 05:40:01
12565,711036,19,43610073,90'+5',Filip Ilie (Unirea Slobozia) Substitution at 95',2024-08-25 05:40:01
12565,711037,0,43600535,44',Alexandru Pascanu (Rapid Bucuresti) Goal at 44',2024-08-24 05:39:57
12565,711037,1,43600581,45'+4',Jayson Papeau (Rapid Bucuresti) Yellow Card at 49',2024-08-24 05:39:57
12565,711037,2,43600610,45'+6',Christopher Braun (Rapid Bucuresti) Yellow Card at 51',2024-08-24 05:39:57
12565,711037,3,43600783,45',Stefan Stefanovici (Politehnica Iasi) Substitution at 45',2024-08-24 05:39:57
12565,711037,4,43600867,53',Rares Pop (Rapid Bucuresti) Goal at 53',2024-08-24 05:39:57
12565,711037,5,43600907,55',Cristian Ignat (Rapid Bucuresti) Substitution at 55',2024-08-24 05:39:57
12565,711037,6,43600970,59',Gonçalo Teixeira (Politehnica Iasi) Substitution at 59',2024-08-24 05:39:57
12565,711037,7,43600971,59',Robert Miskovic (Politehnica Iasi) Substitution at 59',2024-08-24 05:39:57
12565,711037,8,43600972,60',Tailson (Politehnica Iasi) Substitution at 60',2024-08-24 05:39:57
12565,711037,9,43600973,62',Mihai Bordeianu (Politehnica Iasi) Yellow Card at 62',2024-08-24 05:39:57
12565,711037,10,43601030,69',Florent Hasani (Rapid Bucuresti) Substitution at 69',2024-08-24 05:39:57
12565,711037,11,43601031,69',Claudiu Micovschi (Rapid Bucuresti) Substitution at 69',2024-08-24 05:39:57
12565,711037,12,43601085,74',Shayon Harrison (Politehnica Iasi) Substitution at 74',2024-08-24 05:39:57
12565,711037,13,43601109,78',Gonçalo Teixeira (Politehnica Iasi) Goal at 78',2024-08-24 05:39:57
12565,711037,14,43601180,86',Cristian Ignat (Rapid Bucuresti) Yellow Card at 86',2024-08-24 05:39:57
12565,711037,15,43601209,90'+1',Timotej Jambor (Rapid Bucuresti) Substitution at 91',2024-08-24 05:39:57
12565,711037,16,43601215,90'+4',Nicolas Samayoa (Politehnica Iasi) Yellow Card at 94',2024-08-24 05:39:57
12565,711037,17,43601235,90'+6',Timotej Jambor (Rapid Bucuresti) Yellow Card at 96',2024-08-24 05:39:57
12565,711038,0,43599645,33',Vasilije Duric (Otelul Galati) Yellow Card at 33',2024-08-24 05:39:57
12565,711038,1,43599684,56',Alexandru Pop (Otelul Galati) Substitution at 56',2024-08-24 05:39:57
12565,711038,2,43599687,57',João Lameira (Otelul Galati) Yellow Card at 57',2024-08-24 05:39:57
12565,711038,3,43599718,60',Mihai Adascalitei (Otelul Galati) Substitution at 60',2024-08-24 05:39:57
12565,711038,4,43599719,60',Razvan Tanasa (Otelul Galati) Substitution at 60',2024-08-24 05:39:57
12565,711038,5,43599731,64',Nana Akosah-Bempah (Petrolul Ploiesti) Substitution at 64',2024-08-24 05:39:57
12565,711038,6,43599732,64',Mihnea Radulescu (Petrolul Ploiesti) Substitution at 64',2024-08-24 05:39:57
12565,711038,7,43599744,73',Teles (Otelul Galati) Substitution at 73',2024-08-24 05:39:57
12565,711038,8,43599746,73',Maxim Cojocaru (Otelul Galati) Substitution at 73',2024-08-24 05:39:57
12565,711038,9,43599794,90'+1',Fabricio Baiano (Petrolul Ploiesti) Substitution at 91',2024-08-24 05:39:57
12565,711038,10,43599798,90'+5',Jonathan Cissé (Otelul Galati) Yellow Card at 95',2024-08-24 05:39:57
12565,711039,0,43627337,45',Octavian Popescu (FCSB) Substitution at 45',2024-08-27 05:40:14
12565,711039,1,43627338,45',Vlad Chiriches (FCSB) Substitution at 45',2024-08-27 05:40:14
12565,711039,2,43627641,56',Alessandro Murgia (Hermannstadt) Goal at 56',2024-08-27 05:40:14
12565,711039,3,43627756,60',Valentin Cretu (FCSB) Substitution at 60',2024-08-27 05:40:14
12565,711039,4,43627874,66',Iancu Petru Dragos (Hermannstadt) Substitution at 66',2024-08-27 05:40:14
12565,711039,5,43627875,66',Cristian Daniel Negut (Hermannstadt) Substitution at 66',2024-08-27 05:40:14
12565,711039,6,43628068,74',Baba Alhassan (FCSB) Substitution at 74',2024-08-27 05:40:14
12565,711039,7,43628069,74',David Raul Miculescu (FCSB) Substitution at 74',2024-08-27 05:40:14
12565,711039,8,43628230,81',Ronaldo Deaconu (Hermannstadt) Substitution at 81',2024-08-27 05:40:14
12565,711039,9,43628255,83',Joyskim Dawa (FCSB) Yellow Card at 83',2024-08-27 05:40:14
12565,711039,10,43628335,86',Florin Bejan (Hermannstadt) Substitution at 86',2024-08-27 05:40:14
12565,711039,11,43628507,90'+6',Ronaldo Deaconu (Hermannstadt) Goal at 96',2024-08-27 05:40:14
12565,711040,0,43611312,1',Ahmed Bani (Dinamo Bucuresti) Goal at 1',2024-08-25 05:40:01
12565,711040,1,43611501,12',Carlos Mora (CSU Craiova) Substitution at 12',2024-08-25 05:40:01
12565,711040,2,43612061,42',Eddy Gnahoré (Dinamo Bucuresti) Goal at 42',2024-08-25 05:40:01
12565,711040,3,43612128,44',Elvir Koljic (CSU Craiova) Goal at 44',2024-08-25 05:40:01
12565,711040,4,43612751,49',Lyes Houri (CSU Craiova) Substitution at 49',2024-08-25 05:40:01
12565,711040,5,43612752,49',Raul Oprut (Dinamo Bucuresti) Yellow Card at 49',2024-08-25 05:40:01
12565,711040,6,43613026,58',Maxime Sivis (Dinamo Bucuresti) Red Card at 58',2024-08-25 05:40:01
12565,711040,7,43613105,61',Cristian Costin (Dinamo Bucuresti) Substitution at 61',2024-08-25 05:40:01
12565,711040,8,43613208,65',Stefan Vladoiu (CSU Craiova) Yellow Card at 65',2024-08-25 05:40:01
12565,711040,9,43613338,71',Andrei Ivan (CSU Craiova) Substitution at 71',2024-08-25 05:40:01
12565,711040,10,43613339,71',Stefan Baiaram (CSU Craiova) Substitution at 71',2024-08-25 05:40:01
12565,711040,11,43613506,77',Razvan Patriche (Dinamo Bucuresti) Substitution at 77',2024-08-25 05:40:01
12565,711040,12,43613507,77',Cristian Licsandru (Dinamo Bucuresti) Substitution at 77',2024-08-25 05:40:01
12565,711040,13,43613545,80',Josué Homawoo (Dinamo Bucuresti) Yellow Card at 80',2024-08-25 05:40:01
12565,711040,14,43613649,82',Josué Homawoo (Dinamo Bucuresti) Red Card at 82',2024-08-25 05:40:01
12565,711040,15,43613741,85',Iulius Marginean (Dinamo Bucuresti) Substitution at 85',2024-08-25 05:40:01
12565,711040,16,43613766,87',Lyes Houri (CSU Craiova) Yellow Card at 87',2024-08-25 05:40:01
12565,711040,17,43613775,87',Iulius Marginean (Dinamo Bucuresti) Yellow Card at 87',2024-08-25 05:40:01
12565,711040,18,43613819,87',Cristian Licsandru (Dinamo Bucuresti) Yellow Card at 87',2024-08-25 05:40:01
12565,711040,19,43613961,90'+4',Adnan Golubovic (Dinamo Bucuresti) Yellow Card at 94',2024-08-25 05:40:01
12565,711040,20,43613982,90'+6',Cristian Costin (Dinamo Bucuresti) Yellow Card at 96',2024-08-25 05:40:01
12565,711041,0,43669675,18',Lucian Mihai Dumitriu (Petrolul Ploiesti) Yellow Card at 18',2024-09-02 05:44:00
12565,711041,1,43669722,22',Juan Cruz Kaprof (FC Botosani) Yellow Card at 22',2024-09-02 05:44:00
12565,711041,2,43670296,45',Adi Chica-Rosa (FC Botosani) Substitution at 45',2024-09-02 05:44:00
12565,711041,3,43670297,45',Rijad Sadiku (FC Botosani) Substitution at 45',2024-09-02 05:44:00
12565,711041,4,43670335,49',Eduard Florescu (FC Botosani) Yellow Card at 49',2024-09-02 05:44:00
12565,711041,5,43670371,53',Paul Papp (Petrolul Ploiesti) Yellow Card at 53',2024-09-02 05:44:00
12565,711041,6,43670458,57',Jaly Mouaddib (FC Botosani) Substitution at 57',2024-09-02 05:44:00
12565,711041,7,43670459,57',Alejandro Díez Salomon (FC Botosani) Substitution at 57',2024-09-02 05:44:00
12565,711041,8,43670498,60',Mihnea Radulescu (Petrolul Ploiesti) Substitution at 60',2024-09-02 05:44:00
12565,711041,9,43670499,60',Fabricio Baiano (Petrolul Ploiesti) Substitution at 60',2024-09-02 05:44:00
12565,711041,10,43670612,69',Zoran Mitrov (FC Botosani) Substitution at 69',2024-09-02 05:44:00
12565,711041,11,43670613,69',Nana Akosah-Bempah (Petrolul Ploiesti) Substitution at 69',2024-09-02 05:44:00
12565,711041,12,43670848,79',Mario Bratu (Petrolul Ploiesti) Substitution at 79',2024-09-02 05:44:00
12565,711041,13,43670987,86',Zoran Mitrov (FC Botosani) Yellow Card at 86',2024-09-02 05:44:00
12565,711041,14,43671131,90'+2',Nana Akosah-Bempah (Petrolul Ploiesti) Yellow Card at 92',2024-09-02 05:44:00
12565,711041,15,43671167,90'+4',Mihnea Radulescu (Petrolul Ploiesti) Goal at 94',2024-09-02 05:44:00
12565,711041,16,43671227,90'+6',Gheorghe Grozav (Petrolul Ploiesti) Goal at 96',2024-09-02 05:44:00
12565,711042,0,43656794,3',Silviu Balaure (Hermannstadt) Goal at 3',2024-09-01 05:45:55
12565,711042,1,43657066,9',Ronaldo Deaconu (Hermannstadt) Goal at 9',2024-09-01 05:45:55
12565,711042,2,43657597,19',Ianis Stoica (Hermannstadt) Goal at 19',2024-09-01 05:45:55
12565,711042,3,43657672,29',Robert Miskovic (Politehnica Iasi) Substitution at 29',2024-09-01 05:45:55
12565,711042,4,43657673,29',Catalin Itu (Politehnica Iasi) Substitution at 29',2024-09-01 05:45:55
12565,711042,5,43657760,41',Catalin Itu (Politehnica Iasi) Yellow Card at 41',2024-09-01 05:45:55
12565,711042,6,43657762,42',Aurelian Chitu (Hermannstadt) Goal at 42',2024-09-01 05:45:55
12565,711042,7,43657835,45'+3',Gonçalo Teixeira (Politehnica Iasi) Goal at 48',2024-09-01 05:45:55
12565,711042,8,43657874,45'+6',Andrei Cosmin Gheorghita (Politehnica Iasi) Yellow Card at 51',2024-09-01 05:45:55
12565,711042,9,43658227,58',Silviu Balaure (Hermannstadt) Goal at 58',2024-09-01 05:45:55
12565,711042,10,43658261,60',Stefan Stefanovici (Politehnica Iasi) Substitution at 60',2024-09-01 05:45:55
12565,711042,11,43658262,60',Tailson (Politehnica Iasi) Substitution at 60',2024-09-03 05:46:55
12565,711042,12,43658303,63',Cristian Daniel Negut (Hermannstadt) Substitution at 63',2024-09-01 05:45:55
12565,711042,13,43658304,64',Sergiu Bus (Hermannstadt) Substitution at 64',2024-09-01 05:45:55
12565,711042,14,43658305,64',Ionut Biceanu (Hermannstadt) Substitution at 64',2024-09-01 05:45:55
12565,711042,15,43658387,70',Shayon Harrison (Politehnica Iasi) Substitution at 70',2024-09-01 05:45:55
12565,711042,16,43658485,75',Robert Popescu (Hermannstadt) Substitution at 75',2024-09-01 05:45:55
12565,711042,17,43658486,76',Alexandru Luca (Hermannstadt) Substitution at 76',2024-09-01 05:45:55
12565,711042,18,43658544,78',Robert Popescu (Hermannstadt) Goal at 78',2024-09-01 05:45:55
12565,711042,19,43658625,82',Stefan Stefanovici (Politehnica Iasi) Goal at 82',2024-09-01 05:45:55
12565,711043,0,43648732,22',Alexandru Pop (Otelul Galati) Goal at 22',2024-08-31 05:42:26
12565,711043,1,43648806,35',Akos Kecskes (Sepsi Sfantu Gheorghe) Yellow Card at 35',2024-08-31 05:42:26
12565,711043,2,43648859,42',Alexandru Pop (Otelul Galati) Goal at 42',2024-08-31 05:42:26
12565,711043,3,43649017,45',Marius Coleman (Sepsi Sfantu Gheorghe) Substitution at 45',2024-08-31 05:42:26
12565,711043,4,43649018,45',Dimitri Oberlin (Sepsi Sfantu Gheorghe) Substitution at 45',2024-08-31 05:42:26
12565,711043,5,43649019,45',Darius Oroian (Sepsi Sfantu Gheorghe) Substitution at 45',2024-08-31 05:42:26
12565,711043,6,43649079,52',Juri Cisotti (Otelul Galati) Yellow Card at 52',2024-08-31 05:42:26
12565,711043,7,43649164,59',Teles (Otelul Galati) Substitution at 59',2024-08-31 05:42:26
12565,711043,8,43649165,59',Mihai Adascalitei (Otelul Galati) Substitution at 59',2024-08-31 05:42:26
12565,711043,9,43649239,65',Stipe Juric (Otelul Galati) Yellow Card at 65',2024-08-31 05:42:26
12565,711043,10,43649348,68',Razvan Tanasa (Otelul Galati) Substitution at 68',2024-08-31 05:42:26
12565,711043,11,43649349,69',Vasilije Duric (Otelul Galati) Substitution at 69',2024-08-31 05:42:26
12565,711043,12,43649417,75',Mihajlo Neskovic (Sepsi Sfantu Gheorghe) Substitution at 75',2024-08-31 05:42:26
12565,711043,13,43649463,79',Florin Stefan (Sepsi Sfantu Gheorghe) Yellow Card at 79',2024-08-31 05:42:26
12565,711043,14,43649617,90',Cristian Chira (Otelul Galati) Substitution at 90',2024-08-31 05:42:26
12565,711044,0,43691157,6',Tudor Calin (Gloria Buzau) Substitution at 6',2024-09-03 05:46:55
12565,711044,1,43691158,45'+1',Cristian Barbut (Unirea Slobozia) Substitution at 46',2024-09-03 05:46:55
12565,711044,2,43691159,45'+7',Dmytro Pospelov (Unirea Slobozia) Penalty - Scored at 52',2024-09-03 05:46:55
12565,711044,3,43691161,45',Constantin Budescu (Gloria Buzau) Substitution at 45',2024-09-03 05:46:55
12565,711044,4,43691162,45',Cristian Dumitru (Gloria Buzau) Substitution at 45',2024-09-03 05:46:55
12565,711044,5,43691163,58',Sékou Amadou Camara (Unirea Slobozia) Substitution at 58',2024-09-03 05:46:55
12565,711044,6,43691164,62',Alexandru Stan (Gloria Buzau) Substitution at 62',2024-09-03 05:46:55
12565,711044,7,43691165,65',Alexandru Stan (Gloria Buzau) Goal at 65',2024-09-03 05:46:55
12565,711044,8,43691166,67',Sékou Amadou Camara (Unirea Slobozia) Yellow Card at 67',2024-09-03 05:46:55
12565,711044,9,43691167,72',Stefan Pacionel (Unirea Slobozia) Substitution at 72',2024-09-03 05:46:55
12565,711044,10,43691170,90'+2',Stefan Pacionel (Unirea Slobozia) Yellow Card at 92',2024-09-03 05:46:55
12565,711044,11,43691171,90'+3',Dmytro Pospelov (Unirea Slobozia) Goal at 93',2024-09-03 05:46:55
12565,711045,0,43691255,51',Ovidiu Popescu (Universitatea Cluj) Yellow Card at 51',2024-09-04 05:45:28
12565,711045,1,43691267,62',Gabriel Simion (Universitatea Cluj) Substitution at 62',2024-09-04 05:45:28
12565,711045,2,43691268,62',Ovidiu Bic (Universitatea Cluj) Goal at 62',2024-09-04 05:45:28
12565,711045,3,43691270,63',Alberto Soro (Dinamo Bucuresti) Substitution at 63',2024-09-04 05:45:28
12565,711045,4,43691271,63',Adrian Caragea (Dinamo Bucuresti) Substitution at 63',2024-09-04 05:45:28
12565,711045,5,43691274,65',Vadim Rata (Universitatea Cluj) Yellow Card at 65',2024-09-04 05:45:28
12565,711045,6,43691294,74',Iulius Marginean (Dinamo Bucuresti) Substitution at 74',2024-09-04 05:45:28
12565,711045,7,43691306,80',Josué Homawoo (Dinamo Bucuresti) Yellow Card at 80',2024-09-04 05:45:28
12565,711045,8,43691307,80',Dorin Marian Codrea (Universitatea Cluj) Substitution at 80',2024-09-04 05:45:28
12565,711045,9,43691308,81',Alberto Soro (Dinamo Bucuresti) Yellow Card at 81',2024-09-04 05:45:28
12565,711045,10,43691318,85',Gabriel Simion (Universitatea Cluj) Yellow Card at 85',2024-09-04 05:45:28
12565,711045,11,43691319,86',Razvan Patriche (Dinamo Bucuresti) Substitution at 86',2024-09-04 05:45:28
12565,711045,12,43691331,89',Dorinel Gabriel Oancea (Universitatea Cluj) Substitution at 89',2024-09-04 05:45:28
12565,711045,13,43691332,89',Franck Tchassem (Universitatea Cluj) Substitution at 89',2024-09-04 05:45:28
12565,711045,14,43691346,90'+4',Astrit Seljmani (Dinamo Bucuresti) Yellow Card at 94',2024-09-04 05:45:28
12565,711046,0,43672109,27',Ciprian Deac (CFR Cluj-Napoca) Goal at 27',2024-09-02 05:44:00
12565,711046,1,43672376,39',Victor Robert Dican (FC Farul Constanta) Yellow Card at 39',2024-09-02 05:44:00
12565,711046,2,43672377,40',Mihai Balasa (FC Farul Constanta) Yellow Card at 40',2024-09-02 05:44:00
12565,711046,3,43672432,42',Mohammed Kamara (CFR Cluj-Napoca) Yellow Card at 42',2024-09-02 05:44:00
12565,711046,4,43672505,45'+1',Louis Munteanu (CFR Cluj-Napoca) Yellow Card at 46',2024-09-02 05:44:00
12565,711046,5,43672864,45',Denis Alibec (FC Farul Constanta) Substitution at 45',2024-09-02 05:44:00
12565,711046,6,43672865,45',Beni N'Kololo (CFR Cluj-Napoca) Substitution at 45',2024-09-02 05:44:00
12565,711046,7,43673023,53',Ionut Vina (FC Farul Constanta) Yellow Card at 53',2024-09-02 05:44:00
12565,711046,8,43673054,55',Léo Bolgado (CFR Cluj-Napoca) Goal at 55',2024-09-02 05:44:00
12565,711046,9,43673095,60',Dan Sîrbu (FC Farul Constanta) Substitution at 60',2024-09-02 05:44:00
12565,711046,10,43673096,60',Iustin Doicaru (FC Farul Constanta) Substitution at 60',2024-09-02 05:44:00
12565,711046,11,43673150,67',Meriton Korenica (CFR Cluj-Napoca) Substitution at 67',2024-09-02 05:44:00
12565,711046,12,43673265,77',Robert Filip (CFR Cluj-Napoca) Substitution at 77',2024-09-02 05:44:00
12565,711046,13,43673266,77',Daniel Birligea (CFR Cluj-Napoca) Substitution at 77',2024-09-02 05:44:00
12565,711046,14,43673303,80',Alexandru Stoian (FC Farul Constanta) Substitution at 80',2024-09-02 05:44:00
12565,711046,15,43673304,80',Eduard Radaslavescu (FC Farul Constanta) Substitution at 80',2024-09-02 05:44:00
12565,711046,16,43673357,87',Andrei Artean (CFR Cluj-Napoca) Substitution at 87',2024-09-02 05:44:00
12565,711046,17,43673427,90'+3',Meriton Korenica (CFR Cluj-Napoca) Goal at 93',2024-09-02 05:44:00
12565,711047,0,43675540,15',Ravy Tsouka Dozi (UTA Arad) Yellow Card at 15',2024-09-02 05:44:00
12565,711047,1,43675808,16',Siyabonga Ngezana (FCSB) Goal at 16',2024-09-02 05:44:00
12565,711047,2,43678938,45',Alexandru Pantea (FCSB) Substitution at 45',2024-09-02 05:44:00
12565,711047,3,43678939,45',David Raul Miculescu (FCSB) Substitution at 45',2024-09-02 05:44:00
12565,711047,4,43678940,45',William Baeten (FCSB) Substitution at 45',2024-09-02 05:44:00
12565,711047,5,43679741,58',Alexandru Baluta (FCSB) Shot Off Target at 58',2024-09-02 05:44:00
12565,711047,6,43679743,60',Malcom Sylas Edjomou (FCSB) Substitution at 60',2024-09-02 05:44:00
12565,711047,7,43680018,64',Lamine Ghezali (UTA Arad) Substitution at 64',2024-09-02 05:44:00
12565,711047,8,43680269,70',Baba Alhassan (FCSB) Yellow Card at 70',2024-09-02 05:44:00
12565,711047,9,43680535,77',Ioan Andrei Vasile Dumiter (UTA Arad) Substitution at 77',2024-09-02 05:44:00
12565,711047,10,43680536,77',Imoh Ezekiel (UTA Arad) Substitution at 77',2024-09-02 05:44:00
12565,711047,11,43681098,82',Raoul Cristea (UTA Arad) Substitution at 82',2024-09-02 05:44:00
12565,711047,12,43681099,82',João Pedro (UTA Arad) Substitution at 82',2024-09-02 05:44:00
