seasonType,eventId,commentaryOrder,playId,clockDisplayValue,commentaryText,updateDateTime
12815,715681,7,44539512,78',Rubén García Canales (Asteras Tripoli) Yellow Card at 78',2025-01-20 14:37:13
12815,715681,8,44539530,81',Fabricio Pedrozo (Levadiakos) Substitution at 81',2025-01-20 14:37:13
12815,715681,9,44539531,82',Pepe Castaño (Asteras Tripoli) Yellow Card at 82',2025-01-20 14:37:13
12815,715681,10,44539558,85',Fanis Tzandaris (Asteras Tripoli) Substitution at 85',2025-01-20 14:37:13
12815,715681,11,44539658,90'+4',Federico Macheda (Asteras Tripoli) Penalty - Scored at 94',2025-01-20 14:37:13
12815,715681,12,44539699,90'+5',Nikolaos Zouglis (Asteras Tripoli) Substitution at 95',2025-01-20 14:37:13
12815,715681,13,44539700,90'+5',Konstantinos Triantafyllopoulos (Asteras Tripoli) Substitution at 95',2025-01-20 14:37:13
12815,715681,14,44539701,90'+6',Federico Macheda (Asteras Tripoli) Yellow Card at 96',2025-01-20 14:37:13
12815,715682,0,44541718,75',Fedor Chalov (PAOK Salonika) Substitution at 75',2025-01-20 14:37:13
12815,715682,1,44541759,83',Sergio Peña (PAOK Salonika) Substitution at 83',2025-01-20 14:37:13
12815,715682,2,44541760,83',Pione Sisto (Aris) Substitution at 83',2025-01-20 14:37:13
12815,715682,3,44541761,83',Joan Sastre (PAOK Salonika) Substitution at 83',2025-01-20 14:37:13
12815,715682,4,44541781,86',Álvaro Zamora (Aris) Substitution at 86',2025-01-20 14:37:13
12815,715682,5,44541782,86',Stefan Schwab (PAOK Salonika) Substitution at 86',2025-01-20 14:37:13
12815,715682,6,44541793,86',Shola Shoretire (PAOK Salonika) Substitution at 86',2025-01-20 14:37:13
12815,715682,7,44541799,90'+1',Tomasz Kedziora (PAOK Salonika) Yellow Card at 91',2025-01-20 14:37:13
12815,715682,8,44541803,90'+3',Álvaro Zamora (Aris) Yellow Card at 93',2025-01-20 14:37:13
12815,715683,0,44536941,18',Panagiotis Retsos (Olympiacos) Goal at 18',2025-01-20 14:37:13
12815,715683,1,44546721,19',Dimitris Tsakmakis (Atromitos) Yellow Card at 19',2025-01-22 05:39:36
12815,715683,2,44536976,23',Ayoub El Kaabi (Olympiacos) Goal at 23',2025-01-22 05:39:36
12815,715683,3,44537076,37',Costinha (Olympiacos) Own Goal at 37',2025-01-23 05:39:04
12815,715683,4,44537361,49',Mansur (Atromitos) Yellow Card at 49',2025-01-22 05:39:36
12815,715683,5,44537509,58',Kristoffer Velde (Olympiacos) Yellow Card at 58',2025-01-22 05:39:36
12815,715683,6,44537589,62',Giorgos Tzovaras (Atromitos) Substitution at 62',2025-01-22 05:39:36
12815,715683,7,44537773,71',Tom van Weert (Atromitos) Substitution at 71',2025-01-22 05:39:36
12815,715683,8,44537774,72',Panagiotis Retsos (Olympiacos) Yellow Card at 72',2025-01-22 05:39:36
12815,715683,9,44537868,77',Francisco Ortega (Olympiacos) Substitution at 77',2025-01-22 05:39:36
12815,715683,10,44537869,77',Christos Mouzakitis (Olympiacos) Substitution at 77',2025-01-22 05:39:36
12815,715683,11,44537870,78',Chiquinho (Olympiacos) Substitution at 78',2025-01-22 05:39:36
12815,715683,12,44537871,78',Dimitris Tsakmakis (Atromitos) Substitution at 78',2025-01-22 05:39:36
12815,715683,13,44537872,78',Dimitrios Kaloskamis (Atromitos) Substitution at 78',2025-01-22 05:39:36
12815,715683,14,44537989,84',David Carmo (Olympiacos) Substitution at 84',2025-01-22 05:39:36
12815,715683,15,44538083,89',Roman Yaremchuk (Olympiacos) Substitution at 89',2025-01-22 05:39:36
12815,715683,16,44538184,90'+7',Tom van Weert (Atromitos) Penalty - Saved at 97',2025-01-22 05:39:36
12815,715684,0,44528040,33',Lazaros Lamprou (Volos NFC) Yellow Card at 33',2025-01-19 05:38:43
12815,715684,1,44528147,35',Alessandro Mercati (Athens Kallithea) Yellow Card at 35',2025-01-19 05:38:43
12815,715684,2,44529893,65',Javier Matilla (Athens Kallithea) Substitution at 65',2025-01-19 05:38:43
12815,715684,3,44529894,65',Demethryus (Athens Kallithea) Substitution at 65',2025-01-20 14:37:13
12815,715684,4,44529895,66',Maximiliano Comba (Volos NFC) Substitution at 66',2025-01-19 05:38:43
12815,715684,5,44529896,66',Pedro Perez Conde (Volos NFC) Substitution at 66',2025-01-19 05:38:43
12815,715684,6,44530028,69',Anastasios Tsokanis (Volos NFC) Yellow Card at 69',2025-01-19 05:38:43
12815,715684,7,44530124,72',Nemanjic Glavcic (Volos NFC) Substitution at 72',2025-01-19 05:38:43
12815,715684,8,44530125,72',Júnior Mendieta (Volos NFC) Substitution at 72',2025-01-19 05:38:43
12815,715684,9,44530143,73',Pyry Soiri (Athens Kallithea) Goal at 73',2025-01-19 05:38:43
12815,715684,10,44530287,76',Samba Diba (Athens Kallithea) Substitution at 76',2025-01-19 05:38:43
12815,715684,11,44530357,78',Georgios Mygas (Volos NFC) Substitution at 78',2025-01-19 05:38:43
12815,715684,12,44530495,80',Josua Mejías (Athens Kallithea) Yellow Card at 80',2025-01-19 05:38:43
12815,715684,13,44530872,88',Nicolas Isimat-Mirin (Athens Kallithea) Substitution at 88',2025-01-19 05:38:43
12815,715684,14,44530873,88',Elia Giani (Athens Kallithea) Substitution at 88',2025-01-19 05:38:43
12815,715684,15,44530874,89',Javier Matilla (Athens Kallithea) Yellow Card at 89',2025-01-19 05:38:43
12815,715684,16,44530945,90'+4',Demethryus (Athens Kallithea) Goal at 94',2025-01-20 14:37:13
12815,715685,0,44580377,14',David Carmo (Olympiacos) Goal at 14',2025-01-28 15:11:25
12815,715685,1,44580465,24',Santiago Hezze (Olympiacos) Yellow Card at 24',2025-01-28 15:11:25
12815,715685,2,44580572,39',Georgios Vagiannidis (Panathinaikos) Yellow Card at 39',2025-01-28 15:11:25
12815,715685,3,44580587,41',Filip Mladenovic (Panathinaikos) Yellow Card at 41',2025-01-28 15:11:25
12815,715685,4,44580668,45'+2',Costinha (Olympiacos) Red Card at 47',2025-01-28 15:11:25
12815,715685,5,44580821,45',Dani García (Olympiacos) Substitution at 45',2025-01-28 15:11:25
12815,715685,6,44580822,45',Azzedine Ounahi (Panathinaikos) Substitution at 45',2025-01-28 15:11:25
12815,715685,7,44580823,45',Giannis Kotsiras (Panathinaikos) Substitution at 45',2025-01-28 15:11:25
12815,715685,8,44580925,53',Filip Djuricic (Panathinaikos) Yellow Card at 53',2025-01-28 15:11:25
12815,715685,9,44581002,61',Mateus Tetê (Panathinaikos) Substitution at 61',2025-01-28 15:11:25
12815,715685,10,44581028,64',Sverrir Ingason (Panathinaikos) Yellow Card at 64',2025-01-28 15:11:25
12815,715685,11,44581076,69',Alexander Jeremejeff (Panathinaikos) Substitution at 69',2025-01-28 15:11:25
12815,715685,12,44581099,73',David Carmo (Olympiacos) Yellow Card at 73',2025-01-28 15:11:25
12815,715685,13,44581116,74',Fotis Ioannidis (Panathinaikos) Penalty - Scored at 74',2025-01-28 15:11:25
12815,715685,14,44581127,75',Fotis Ioannidis (Panathinaikos) Yellow Card at 75',2025-01-28 15:11:25
12815,715685,15,44581128,75',Rodinei (Olympiacos) Yellow Card at 75',2025-01-28 15:11:25
12815,715685,16,44581142,76',Charalambos Kostoulas (Olympiacos) Substitution at 76',2025-01-28 15:11:25
12815,715685,17,44581240,83',Dimitrios Limnios (Panathinaikos) Substitution at 83',2025-01-28 15:11:25
12815,715685,18,44581278,85',Willian Arão (Panathinaikos) Yellow Card at 85',2025-01-28 15:11:25
12815,715685,19,44581304,88',Roman Yaremchuk (Olympiacos) Substitution at 88',2025-01-29 14:52:37
12815,715685,20,44581386,90'+4',Sverrir Ingason (Panathinaikos) Red Card at 94',2025-01-28 15:11:25
12815,715686,0,44579498,6',Enis Cokaj (Levadiakos) Yellow Card at 6',2025-01-28 15:11:25
12815,715686,1,44579964,36',Joel Abu Hanna (Levadiakos) Yellow Card at 36',2025-01-28 15:11:25
12815,715686,2,44580368,52',Magomed Ozdoev (PAOK Salonika) Substitution at 52',2025-01-28 15:11:25
12815,715686,3,44580405,55',Lamarana Jallow (Levadiakos) Substitution at 55',2025-01-28 15:11:25
12815,715686,4,44580481,70',Taison (PAOK Salonika) Substitution at 70',2025-01-28 15:11:25
12815,715686,5,44580482,71',Fedor Chalov (PAOK Salonika) Substitution at 71',2025-01-28 15:11:25
12815,715686,6,44580571,82',Mady Camara (PAOK Salonika) Goal at 82',2025-01-28 15:11:25
12815,715686,7,44580651,85',Dimitris Pelkas (PAOK Salonika) Substitution at 85',2025-01-28 15:11:25
12815,715686,8,44580652,86',Vieirinha (PAOK Salonika) Substitution at 86',2025-01-28 15:11:25
12815,715686,9,44580653,86',Georgios Katris (Levadiakos) Substitution at 86',2025-01-28 15:11:25
12815,715686,10,44580654,86',Alen Ozbolt (Levadiakos) Substitution at 86',2025-01-28 15:11:25
12815,715686,11,44580733,90'+5',Ioannis Kosti (Levadiakos) Yellow Card at 95',2025-01-28 15:11:25
12815,715686,12,44580751,90'+10',Alen Ozbolt (Levadiakos) Yellow Card at 100',2025-01-28 15:11:25
12815,715687,0,44559930,30',Franco Ferrari (Volos NFC) Yellow Card at 30',2025-01-25 05:34:02
12815,715687,1,44560082,51',Maximiliano Comba (Volos NFC) Yellow Card at 51',2025-01-25 05:34:02
12815,715687,2,44560083,51',Carlitos (Atromitos) Red Card at 51',2025-01-26 05:42:44
12815,715687,3,44560142,62',Jasin-Amin Assehnoun (Volos NFC) Substitution at 62',2025-01-25 05:34:02
12815,715687,4,44560151,65',Amr Warda (Atromitos) Substitution at 65',2025-01-25 05:34:02
12815,715687,5,44560152,65',Makana Baku (Atromitos) Substitution at 65',2025-01-25 05:34:02
12815,715687,6,44560168,71',Simon Skrabb (Volos NFC) Yellow Card at 71',2025-01-25 05:34:02
12815,715687,7,44560169,72',Márk Koszta (Volos NFC) Substitution at 72',2025-01-25 05:34:02
12815,715687,8,44560170,73',Mattheos Mountes (Atromitos) Substitution at 73',2025-01-25 05:34:02
12815,715687,9,44560221,81',Mansur (Atromitos) Goal at 81',2025-01-26 05:42:44
12815,715687,10,44560240,82',Nacho Gil (Volos NFC) Substitution at 82',2025-01-25 05:34:02
12815,715687,11,44560241,82',Georgios Mygas (Volos NFC) Substitution at 82',2025-01-25 05:34:02
12815,715687,12,44560242,82',Daniel Sundgren (Volos NFC) Yellow Card at 82',2025-01-25 05:34:02
12815,715687,13,44560255,85',Nicolaos Athanasiou (Atromitos) Yellow Card at 85',2025-01-25 05:34:02
12815,715687,14,44560256,86',Dimitrios Stavropoulos (Atromitos) Substitution at 86',2025-01-25 05:34:02
12815,715687,15,44560279,89',Thanasis Karamanis (Atromitos) Yellow Card at 89',2025-01-25 05:34:02
12815,715687,16,44560280,89',Jasin-Amin Assehnoun (Volos NFC) Yellow Card at 89',2025-01-25 05:34:02
12815,715687,17,44560313,90'+4',Mattheos Mountes (Atromitos) Yellow Card at 94',2025-01-25 05:34:02
12815,715688,0,44570605,28',Charalampos Mavrias (Panetolikos) Yellow Card at 28',2025-01-26 05:42:44
12815,715688,1,44571131,49',Giannis Bouzoukis (Panetolikos) Yellow Card at 49',2025-01-26 05:42:44
12815,715688,2,44571231,56',Anthony Martial (AEK Athens) Goal at 56',2025-01-26 05:42:44
12815,715688,3,44571372,65',Sebastián Lomónaco (Panetolikos) Substitution at 65',2025-01-26 05:42:44
12815,715688,4,44571373,65',Sergio Diaz (Panetolikos) Substitution at 65',2025-01-26 05:42:44
12815,715688,5,44571374,66',Georgios Liavas (Panetolikos) Substitution at 66',2025-01-26 05:42:44
12815,715688,6,44571454,72',Moses Odubajo (AEK Athens) Yellow Card at 72',2025-01-26 05:42:44
12815,715688,7,44571496,77',Damian Szymanski (AEK Athens) Substitution at 77',2025-01-26 05:42:44
12815,715688,8,44571497,78',Frantzdy Pierrot (AEK Athens) Substitution at 78',2025-01-26 05:42:44
12815,715688,9,44571553,79',Sebastián Lomónaco (Panetolikos) Yellow Card at 79',2025-01-26 05:42:44
12815,715688,10,44571554,81',Christos Belevonis (Panetolikos) Substitution at 81',2025-01-26 05:42:44
12815,715688,11,44571555,83',Robert Ljubicic (AEK Athens) Substitution at 83',2025-01-26 05:42:44
12815,715688,12,44571556,83',Vangelis Nikolaou (Panetolikos) Substitution at 83',2025-01-26 05:42:44
12815,715688,13,44571589,87',Niclas Eliasson (AEK Athens) Substitution at 87',2025-01-28 15:11:25
12815,715688,14,44571590,88',Petros Mantalos (AEK Athens) Substitution at 88',2025-01-28 15:11:25
12815,715689,0,44565794,22',Nikolaos Kaltsas (Asteras Tripoli) Goal at 22',2025-01-26 05:42:44
12815,715689,1,44565891,25',Francesc Regis (Asteras Tripoli) Yellow Card at 25',2025-01-26 05:42:44
12815,715689,2,44566442,41',Georgios Vrakas (Athens Kallithea) Yellow Card at 41',2025-01-26 05:42:44
12815,715689,3,44567100,45',Demethryus (Athens Kallithea) Substitution at 45',2025-01-26 05:42:44
12815,715689,4,44567616,55',François Mughe (Athens Kallithea) Substitution at 55',2025-01-26 05:42:44
12815,715689,5,44567869,61',Eder Gonzalez (Asteras Tripoli) Substitution at 61',2025-01-26 05:42:44
12815,715689,6,44568256,69',Eder Gonzalez (Asteras Tripoli) Yellow Card at 69',2025-01-26 05:42:44
12815,715689,7,44568533,74',Alessandro Mercati (Athens Kallithea) Substitution at 74',2025-01-26 05:42:44
12815,715689,8,44568534,74',Elia Giani (Athens Kallithea) Substitution at 74',2025-01-26 05:42:44
12815,715689,9,44568535,75',Oluwatobiloba Alagbe (Asteras Tripoli) Substitution at 75',2025-01-26 05:42:44
12815,715689,10,44568700,79',Elia Giani (Athens Kallithea) Yellow Card at 79',2025-01-26 05:42:44
12815,715689,11,44568877,81',Nikolaos Kaltsas (Asteras Tripoli) Yellow Card at 81',2025-01-26 05:42:44
12815,715689,12,44569133,87',François Mughe (Athens Kallithea) Red Card at 87',2025-01-26 05:42:44
12815,715689,13,44569258,89',Migouel Alfarela (Athens Kallithea) Substitution at 89',2025-01-26 05:42:44
12815,715689,14,44569259,89',Josua Mejías (Athens Kallithea) Yellow Card at 89',2025-01-26 05:42:44
12815,715689,15,44569260,90',Nikolai Alho (Asteras Tripoli) Substitution at 90',2025-01-26 05:42:44
12815,715689,16,44569261,90',Diamantis Chouchoumis (Asteras Tripoli) Substitution at 90',2025-01-26 05:42:44
12815,715690,0,44565313,6',Thiago Thomas Nuss (OFI Crete) Goal at 6',2025-01-26 05:42:44
12815,715690,1,44565868,23',Jefté (Panserraikos FC) Goal at 23',2025-01-28 15:11:25
12815,715690,2,44566522,42',Paschalis Staikos (Panserraikos FC) Yellow Card at 42',2025-01-26 05:42:44
12815,715690,3,44566696,45'+1',Thiago Thomas Nuss (OFI Crete) Goal at 46',2025-01-28 15:11:25
12815,715690,4,44567716,54',Gabriel (Panserraikos FC) Substitution at 54',2025-01-28 15:11:25
12815,715690,5,44567804,55',Thanasis Androutsos (OFI Crete) Yellow Card at 55',2025-01-26 05:42:44
12815,715690,6,44567996,60',Angelos Liasos (Panserraikos FC) Yellow Card at 60',2025-01-26 05:42:44
12815,715690,7,44568020,61',Emil Bergström (Panserraikos FC) Yellow Card at 61',2025-01-26 05:42:44
12815,715690,8,44568080,62',Borja González (OFI Crete) Goal at 62',2025-01-26 05:42:44
12815,715690,9,44568469,65',Eddie Salcedo (OFI Crete) Substitution at 65',2025-01-26 05:42:44
12815,715690,10,44568470,65',Giannis Apostolakis (OFI Crete) Substitution at 65',2025-01-26 05:42:44
12815,715690,11,44568471,67',Borja González (OFI Crete) Yellow Card at 67',2025-01-26 05:42:44
12815,715690,12,44568472,68',Zisis Karachalios (OFI Crete) Yellow Card at 68',2025-01-26 05:42:44
12815,715690,13,44568473,70',Alexandros Maskanakis (Panserraikos FC) Substitution at 70',2025-01-26 05:42:44
12815,715690,14,44568646,75',Juan Camilo Salazar (Panserraikos FC) Goal at 75',2025-01-26 05:42:44
12815,715690,15,44568756,76',Taxiarchis Fountas (OFI Crete) Yellow Card at 76',2025-01-26 05:42:44
12815,715690,16,44569043,82',Mohammed Al Rashdi (Panserraikos FC) Substitution at 82',2025-01-26 05:42:44
12815,715690,17,44569044,82',Moussa Wagué (Panserraikos FC) Substitution at 82',2025-01-26 05:42:44
12815,715690,18,44569045,82',Stavros Petavrakis (Panserraikos FC) Substitution at 82',2025-01-26 05:42:44
12815,715690,19,44569323,88',Juan Ángel Neira (OFI Crete) Substitution at 88',2025-01-26 05:42:44
12815,715690,20,44569324,88',Jordan Silva (OFI Crete) Substitution at 88',2025-01-26 05:42:44
12815,715690,21,44569325,88',Thiago Thomas Nuss (OFI Crete) Yellow Card at 88',2025-01-26 05:42:44
12815,715690,22,44569387,90',Thiago Thomas Nuss (OFI Crete) Red Card at 90',2025-01-26 05:42:44
12815,715690,23,44569461,90'+3',Nikos Christogeorgos (OFI Crete) Yellow Card at 93',2025-01-26 05:42:44
12815,715690,24,44569529,90'+4',Giannis Theodosoulakis (OFI Crete) Substitution at 94',2025-01-26 05:42:44
12815,715690,25,44584703,90'+6',Panagiotis Deligiannidis (Panserraikos FC) Yellow Card at 96',2025-01-28 15:11:25
12815,715691,0,44577343,11',Hamza Mendyl (Aris) Substitution at 11',2025-01-28 15:11:25
12815,715691,1,44578216,51',Hamza Mendyl (Aris) Yellow Card at 51',2025-01-28 15:11:25
12815,715691,2,44578313,57',Lorenzo Morón (Aris) Yellow Card at 57',2025-01-28 15:11:25
12815,715691,3,44578314,58',Robert Ibáñez (Lamia) Substitution at 58',2025-01-28 15:11:25
12815,715691,4,44578315,58',Vassilis Vitlis (Lamia) Yellow Card at 58',2025-01-28 15:11:25
12815,715691,5,44578392,66',Lorenzo Morón (Aris) Goal at 66',2025-01-28 15:11:25
12815,715691,6,44578513,71',Enrique Saverio (Aris) Substitution at 71',2025-01-28 15:11:25
12815,715691,7,44578514,72',Álvaro Zamora (Aris) Substitution at 72',2025-01-28 15:11:25
12815,715691,8,44578555,75',Andrés Chávez (Lamia) Substitution at 75',2025-01-28 15:11:25
12815,715691,9,44578556,75',Toshio Lake (Lamia) Substitution at 75',2025-01-28 15:11:25
12815,715691,10,44578607,79',Lorenzo Morón (Aris) Goal at 79',2025-01-28 15:11:25
12815,715691,11,44578779,89',Gustavo Furtado (Lamia) Red Card at 89',2025-01-28 15:11:25
12815,715691,12,44578814,90',Vedad Radonja (Lamia) Substitution at 90',2025-01-28 15:11:25
12815,715691,13,44578815,90',Robin Quaison (Aris) Substitution at 90',2025-01-28 15:11:25
12815,715692,0,44620922,20',Joannis Gelios (Athens Kallithea) Substitution at 20',2025-02-03 14:53:27
12815,715692,1,44620966,22',Hamza Mendyl (Aris) Goal at 22',2025-02-03 14:53:27
12815,715692,2,44621322,45',Hamza Mendyl (Aris) Yellow Card at 45',2025-02-03 14:53:27
12815,715692,3,44621642,55',Nikos Kainourgios (Athens Kallithea) Yellow Card at 55',2025-02-03 14:53:27
12815,715692,4,44621714,60',Migouel Alfarela (Athens Kallithea) Substitution at 60',2025-02-03 14:53:27
12815,715692,5,44621715,60',James McGarry (Athens Kallithea) Substitution at 60',2025-02-03 14:53:27
12815,715692,6,44621772,64',Enrique Saverio (Aris) Substitution at 64',2025-02-03 14:53:27
12815,715692,7,44621773,64',Dario Spikic (Aris) Substitution at 64',2025-02-05 05:44:35
12815,715692,8,44621818,68',Nicolas Isimat-Mirin (Athens Kallithea) Yellow Card at 68',2025-02-03 14:53:27
12815,715692,9,44621909,75',Miguel Mellado (Athens Kallithea) Substitution at 75',2025-02-03 14:53:27
12815,715692,10,44621910,75',Elia Giani (Athens Kallithea) Substitution at 75',2025-02-03 14:53:27
12815,715692,11,44621943,77',José Cifuentes (Aris) Yellow Card at 77',2025-02-03 14:53:27
12815,715692,12,44622050,84',Álvaro Zamora (Aris) Yellow Card at 84',2025-02-03 14:53:27
12815,715692,13,44622051,85',Robin Quaison (Aris) Substitution at 85',2025-02-03 14:53:27
12815,715692,14,44622052,85',Valentino Fattore (Aris) Substitution at 85',2025-02-03 14:53:27
12815,715692,15,44622173,90'+2',Jean Jules Sepp Mvondo (Aris) Substitution at 92',2025-02-03 14:53:27
12815,715692,16,44622196,90'+4',James McGarry (Athens Kallithea) Yellow Card at 94',2025-02-03 14:53:27
12815,715692,17,44637017,90'+5',Mathieu Valbuena (Athens Kallithea) Yellow Card at 95',2025-02-05 05:44:35
12815,715693,0,44620350,7',Panagiotis Liagas (Levadiakos) Yellow Card at 7',2025-02-03 14:53:27
12815,715693,1,44620705,34',Dani García (Olympiacos) Yellow Card at 34',2025-02-03 14:53:27
12815,715693,2,44620894,45'+2',Joel Abu Hanna (Levadiakos) Yellow Card at 47',2025-02-03 14:53:27
12815,715693,3,44621206,45',Lamarana Jallow (Levadiakos) Substitution at 45',2025-02-03 14:53:27
12815,715693,4,44621391,59',Ayoub El Kaabi (Olympiacos) Substitution at 59',2025-02-03 14:53:27
12815,715693,5,44637007,63',Giannis Gianniotas (Levadiakos) Yellow Card at 63',2025-02-05 05:44:35
12815,715693,6,44621538,70',Santiago Hezze (Olympiacos) Substitution at 70',2025-02-05 05:44:35
12815,715693,7,44621539,70',Gelson Martins (Olympiacos) Substitution at 70',2025-02-05 05:44:35
12815,715693,8,44621540,71',Triantafyllos Tsapras (Levadiakos) Substitution at 71',2025-02-05 05:44:35
12815,715693,9,44621541,72',Fabricio Pedrozo (Levadiakos) Substitution at 72',2025-02-05 05:44:35
12815,715693,10,44621609,83',Sérgio Oliveira (Olympiacos) Substitution at 83',2025-02-05 05:44:35
12815,715693,11,44621613,85',Christos Mouzakitis (Olympiacos) Goal at 85',2025-02-05 05:44:35
12815,715693,12,44621668,88',Alen Ozbolt (Levadiakos) Substitution at 88',2025-02-05 05:44:35
12815,715693,13,44621669,88',José Romo (Levadiakos) Substitution at 88',2025-02-05 05:44:35
12815,715693,14,44621709,90'+1',Lamarana Jallow (Levadiakos) Yellow Card at 91',2025-02-05 05:44:35
12815,715694,0,44633187,25',Vassilis Vitlis (Lamia) Yellow Card at 25',2025-02-04 05:37:22
12815,715694,1,44633209,33',Konstantinos Triantafyllopoulos (Asteras Tripoli) Goal at 33',2025-02-04 05:37:22
12815,715694,2,44633232,38',Eder Gonzalez (Asteras Tripoli) Red Card at 38',2025-02-04 05:37:22
12815,715694,3,44633341,45',Evgeni Yablonski (Asteras Tripoli) Substitution at 45',2025-02-04 05:37:22
12815,715694,4,44633358,47',Vassilis Vitlis (Lamia) Red Card at 47',2025-02-04 05:37:22
12815,715694,5,44633386,53',Andrés Chávez (Lamia) Substitution at 53',2025-02-04 05:37:22
12815,715694,6,44633395,57',Federico Macheda (Asteras Tripoli) Yellow Card at 57',2025-02-04 05:37:22
12815,715694,7,44633432,62',Nikolaos Kaltsas (Asteras Tripoli) Yellow Card at 62',2025-02-04 05:37:22
12815,715694,8,44633433,63',Anestis Vlachomitros (Lamia) Substitution at 63',2025-02-04 05:37:22
12815,715694,9,44633434,64',Robert Ibáñez (Lamia) Substitution at 64',2025-02-04 05:37:22
12815,715694,10,44633443,67',Andrés Chávez (Lamia) Yellow Card at 67',2025-02-04 05:37:22
12815,715694,11,44633469,74',Oluwatobiloba Alagbe (Asteras Tripoli) Substitution at 74',2025-02-04 05:37:22
12815,715694,12,44633470,74',Nikolaos Zouglis (Asteras Tripoli) Substitution at 74',2025-02-04 05:37:22
12815,715694,13,44633481,79',Nicholas Gioacchini (Asteras Tripoli) Substitution at 79',2025-02-04 05:37:22
12815,715694,14,44633505,89',Rubén García Canales (Asteras Tripoli) Substitution at 89',2025-02-04 05:37:22
12815,715694,15,44633517,90'+3',Carles Soria (Lamia) Yellow Card at 93',2025-02-04 05:37:22
12815,715695,0,44622879,22',Erik Lamela (AEK Athens) Yellow Card at 22',2025-02-03 14:53:27
12815,715695,1,44622899,23',Frantzdy Pierrot (AEK Athens) Yellow Card at 23',2025-02-03 14:53:27
12815,715695,2,44623067,35',Jonny (PAOK Salonika) Yellow Card at 35',2025-02-03 14:53:27
12815,715695,3,44623071,37',Erik Lamela (AEK Athens) Goal at 37',2025-02-03 14:53:27
12815,715695,4,44623192,45'+2',Mady Camara (PAOK Salonika) Yellow Card at 47',2025-02-03 14:53:27
12815,715695,5,44623205,45'+3',Lazaros Rota (AEK Athens) Yellow Card at 48',2025-02-03 14:53:27
12815,715695,6,44623326,47',Erik Lamela (AEK Athens) Goal at 47',2025-02-03 14:53:27
12815,715695,7,44623368,52',Abdul Rahman Baba (PAOK Salonika) Goal at 52',2025-02-03 14:53:27
12815,715695,8,44623386,54',Mbwana Samatta (PAOK Salonika) Substitution at 54',2025-02-03 14:53:27
12815,715695,9,44623387,54',Dimitris Pelkas (PAOK Salonika) Substitution at 54',2025-02-03 14:53:27
12815,715695,10,44623432,58',Moses Odubajo (AEK Athens) Substitution at 58',2025-02-03 14:53:27
12815,715695,11,44623455,61',Moses Odubajo (AEK Athens) Yellow Card at 61',2025-02-03 14:53:27
12815,715695,12,44623464,65',Robert Ljubicic (AEK Athens) Substitution at 65',2025-02-03 14:53:27
12815,715695,13,44623465,65',Aboubakary Koita (AEK Athens) Substitution at 65',2025-02-03 14:53:27
12815,715695,14,44623572,76',Souahilo Meïté (PAOK Salonika) Substitution at 76',2025-02-03 14:53:27
12815,715695,15,44623634,81',Harold Moukoudi (AEK Athens) Yellow Card at 81',2025-02-04 05:37:22
12815,715695,16,44623677,83',Niclas Eliasson (AEK Athens) Substitution at 83',2025-02-03 14:53:27
12815,715695,17,44623678,83',Roberto Pereyra (AEK Athens) Yellow Card at 83',2025-02-03 14:53:27
12815,715695,18,44623679,83',Damian Szymanski (AEK Athens) Substitution at 83',2025-02-03 14:53:27
12815,715695,19,44623680,85',Stefan Schwab (PAOK Salonika) Substitution at 85',2025-02-03 14:53:27
12815,715695,20,44623681,85',Vieirinha (PAOK Salonika) Substitution at 85',2025-02-03 14:53:27
12815,715695,21,44623733,90',Aboubakary Koita (AEK Athens) Yellow Card at 90',2025-02-03 14:53:27
12815,715695,22,44628245,90'+4',Alberto Brignoli (AEK Athens) Yellow Card at 94',2025-02-04 05:37:22
12815,715695,23,44623786,90'+6',Dimitris Pelkas (PAOK Salonika) Yellow Card at 96',2025-02-04 05:37:22
12815,715696,0,44612582,16',Nacho Gil (Volos NFC) Yellow Card at 16',2025-02-02 14:52:51
12815,715696,1,44612595,19',Georgios Mygas (Volos NFC) Yellow Card at 19',2025-02-02 14:52:51
12815,715696,2,44612617,22',Zisis Chatzistravos (Panserraikos FC) Goal at 22',2025-02-02 14:52:51
12815,715696,3,44612697,26',Pedro Perez Conde (Volos NFC) Yellow Card at 26',2025-02-02 14:52:51
12815,715696,4,44612698,26',Luka Gugeshashvili (Panserraikos FC) Yellow Card at 26',2025-02-02 14:52:51
12815,715696,5,44612814,37',Juan Camilo Salazar (Panserraikos FC) Yellow Card at 37',2025-02-02 14:52:51
12815,715696,6,44612968,45'+2',Milos Deletic (Panserraikos FC) Yellow Card at 47',2025-02-02 14:52:51
12815,715696,7,44613153,45',Kyriakos Aslanidis (Volos NFC) Substitution at 45',2025-02-02 14:52:51
12815,715696,8,44613154,45',Stephane Omeonga (Panserraikos FC) Substitution at 45',2025-02-02 14:52:51
12815,715696,9,44613197,48',Joeri de Kamps (Volos NFC) Yellow Card at 48',2025-02-02 14:52:51
12815,715696,10,44613314,54',Maximiliano Comba (Volos NFC) Yellow Card at 54',2025-02-02 14:52:51
12815,715696,11,44613442,62',Marios Sofianos (Panserraikos FC) Substitution at 62',2025-02-02 14:52:51
12815,715696,12,44613443,63',Franco Ferrari (Volos NFC) Substitution at 63',2025-02-02 14:52:51
12815,715696,13,44613444,63',Jasin-Amin Assehnoun (Volos NFC) Substitution at 63',2025-02-02 14:52:51
12815,715696,14,44613455,66',Simon Skrabb (Volos NFC) Goal at 66',2025-02-02 14:52:51
12815,715696,15,44613495,68',Angelos Liasos (Panserraikos FC) Substitution at 68',2025-02-02 14:52:51
12815,715696,16,44613509,70',Márk Koszta (Volos NFC) Substitution at 70',2025-02-02 14:52:51
12815,715696,17,44613665,80',Anastasios Tsokanis (Volos NFC) Substitution at 80',2025-02-02 14:52:51
