seasonType,eventId,commentaryOrder,playId,clockDisplayValue,commentaryText,updateDateTime
12647,721594,0,44091294,12',Ayoub Qasmi (Al Raed) Yellow Card at 12',2024-10-31 05:23:49
12647,721594,1,44091295,30',Zakaria Al Hawsawi (Al Raed) Yellow Card at 30',2024-10-31 05:23:49
12647,721594,2,44091296,31',Osama Zaid Abdulaziz Al Bowardi (Al Najma) Red Card at 31',2024-10-31 05:23:49
12647,721594,3,44091297,34',Ziyad Al Qahtani (Al Najma) Yellow Card at 34',2024-10-31 05:23:49
12647,721594,4,44091298,38',Saleh Al-Jamaan (Al Raed) Goal at 38',2024-10-31 05:23:49
12647,721594,5,44091300,45'+1',Mubarak Abdul Rahman Al Rajeh (Al Raed) Yellow Card at 46',2024-10-31 05:23:49
12647,721594,6,44091301,45'+2',Tilica (Al Najma) Shot Off Target at 47',2024-10-31 05:23:49
12647,721594,7,44091303,45'+11',Mathias Normann (Al Raed) Yellow Card at 56',2024-10-31 05:23:49
12647,721594,8,44091308,46',Bilel Aouacheria (Al Najma) Yellow Card at 46',2024-10-31 05:23:49
12647,721594,9,44091316,57',Riyadh Al Asmari (Al Najma) Substitution at 57',2024-10-31 05:23:49
12647,721594,10,44091317,61',Abdullah Hazazi (Al Raed) Substitution at 61',2024-10-31 05:23:49
12647,721594,11,44091318,61',Omar Ahmed Shami (Al Raed) Substitution at 61',2024-10-31 05:23:49
12647,721594,12,44091333,74',Raid Al-Ghamdi (Al Raed) Substitution at 74',2024-10-31 05:23:49
12647,721594,13,44091334,74',Abdullah Al Yousif (Al Raed) Substitution at 74',2024-10-31 05:23:49
12647,721594,14,44091335,76',Abdullah Khattab (Al Najma) Substitution at 76',2024-10-31 05:23:49
12647,721594,15,44091351,90',Ahmed Saeed (Al Najma) Yellow Card at 90',2024-10-31 05:23:49
12647,721594,16,44091399,90'+4',Anas Al Zahrani (Al Raed) Substitution at 94',2024-10-31 05:23:49
12647,721595,0,44088672,4',Abdulaziz Al-Bishi (Al Ittihad) Goal at 4',2024-10-31 05:23:49
12647,721595,1,44088727,45',Abdulrahman Al-Obud (Al Ittihad) Goal at 45',2024-10-31 05:23:49
12647,721595,2,44088836,62',Hassan Abu Shaheen (Al Jandal) Substitution at 62',2024-10-31 05:23:49
12647,721595,3,44088837,63',Chisom Egbuchulam (Al Jandal) Substitution at 63',2024-10-31 05:23:49
12647,721595,4,44088870,71',Awad Al Nashri (Al Ittihad) Substitution at 71',2024-10-31 05:23:49
12647,721595,5,44088871,71',Saad Al Mosa (Al Ittihad) Substitution at 71',2024-10-31 05:23:49
12647,721595,6,44088872,72',Turki Namis (Al Jandal) Substitution at 72',2024-10-31 05:23:49
12647,721595,7,44088880,76',Steven Bergwijn (Al Ittihad) Substitution at 76',2024-10-31 05:23:49
12647,721595,8,44088881,77',Moussa Diaby (Al Ittihad) Substitution at 77',2024-10-31 05:23:49
12647,721595,9,44088892,87',Ahmed Al Ghamdi (Al Ittihad) Substitution at 87',2024-10-31 05:23:49
12647,721595,10,44088898,89',Ibrahim Al Harbi (Al Jandal) Substitution at 89',2024-10-31 05:23:49
12647,721595,11,44088899,90',Sajir-Al-Shammari (Al Jandal) Substitution at 90',2024-10-31 05:23:49
12647,721596,0,44099561,9',Léo Lacroix (Al Jabalain) Goal at 9',2024-10-31 05:23:49
12647,721596,1,44099572,41',Vitinho (Al Ettifaq) Penalty - Scored at 41',2024-10-31 05:23:49
12647,721596,2,44099579,45',Madallah Al-Olayan (Al Ettifaq) Substitution at 45',2024-10-31 05:23:49
12647,721596,3,44099581,57',Kaká (Al Jabalain) Goal at 57',2024-10-31 05:23:49
12647,721596,4,44099582,60',Karl Toko Ekambi (Al Ettifaq) Substitution at 60',2024-10-31 05:23:49
12647,721596,5,44099594,67',Abdulelah Albukhari (Al Jabalain) Yellow Card at 67',2024-10-31 05:23:49
12647,721596,6,44099597,69',Moussa Dembélé (Al Ettifaq) Substitution at 69',2024-10-31 05:23:49
12647,721596,7,44099598,73',Saad Alsaluli (Al Jabalain) Goal at 73',2024-10-31 05:23:49
12647,721596,8,44099600,77',Ahmed Al-Fiqi (Al Jabalain) Substitution at 77',2024-10-31 05:23:49
12647,721596,9,44099603,83',Ibrahim Al Nakhli (Al Jabalain) Substitution at 83',2024-10-31 05:23:49
12647,721596,10,44099604,83',Abdullah Madu (Al Ettifaq) Substitution at 83',2024-10-31 05:23:49
12647,721596,11,44099610,89',Masood Bekheet (Al Jabalain) Yellow Card at 89',2024-11-02 14:41:56
12647,721596,12,44099611,90',Iyad Luay Ali Madani (Al Jabalain) Substitution at 90',2024-10-31 05:23:49
12647,721596,13,44099612,90',Moayed Al Mohammadi (Al Jabalain) Substitution at 90',2024-10-31 05:23:49
12647,721597,0,44091291,3',Ahmed Al-Juwaid (Al Tai) Yellow Card at 3',2024-10-31 05:23:49
12647,721597,1,44091292,5',Abdullah Al-Hamddan (Al Hilal) Goal at 5',2024-10-31 05:23:49
12647,721597,2,44091293,7',Ahmed Al-Juwaid (Al Tai) Goal at 7',2024-10-31 05:23:49
12647,721597,3,44091299,38',Khalid Al-Ghannam (Al Hilal) Goal at 38',2024-10-31 05:23:49
12647,721597,4,44091309,47',Hussain Salem (Al Tai) Yellow Card at 47',2024-10-31 05:23:49
12647,721597,5,44091310,49',Abdullah Al-Hamddan (Al Hilal) Goal at 49',2024-10-31 05:23:49
12647,721597,6,44091311,53',Marcos Leonardo (Al Hilal) Goal at 53',2024-10-31 05:23:49
12647,721597,7,44091313,55',Ibrahima Tandia (Al Tai) Substitution at 55',2024-10-31 05:23:49
12647,721597,8,44091320,63',João Cancelo (Al Hilal) Substitution at 63',2024-10-31 05:23:49
12647,721597,9,44091321,63',Malcom (Al Hilal) Substitution at 63',2024-10-31 05:23:49
12647,721597,10,44091322,63',Sergej Milinkovic-Savic (Al Hilal) Substitution at 63',2024-10-31 05:23:49
12647,721597,11,44091332,70',Hassan Alamri (Al Tai) Substitution at 70',2024-10-31 05:23:49
12647,721597,12,44091336,79',Aleksandar Mitrovic (Al Hilal) Substitution at 79',2024-10-31 05:23:49
12647,721597,13,44091337,79',Hamad Altuhayfan (Al Hilal) Substitution at 79',2024-10-31 05:23:49
12647,721597,14,44091338,81',Rakan Shamlan (Al Tai) Substitution at 81',2024-10-31 05:23:49
12647,721597,15,44091339,81',Mansour Alnakhli (Al Tai) Substitution at 81',2024-10-31 05:23:49
12647,721597,16,44091340,81',Ahmed Alshuwayfie (Al Tai) Substitution at 81',2024-10-31 05:23:49
12647,721598,0,44088301,37',Haroune Camara (Al Shabab) Goal at 37',2024-10-31 05:23:49
12647,721598,1,44088487,45',Marzouq Tambakti (Al Riyadh) Substitution at 45',2024-10-31 05:23:49
12647,721598,2,44088488,45',Bernard Mensah (Al Riyadh) Substitution at 45',2024-10-31 05:23:49
12647,721598,3,44088489,45',Tozé (Al Riyadh) Substitution at 45',2024-10-31 05:23:49
12647,721598,4,44088512,66',Giacomo Bonaventura (Al Shabab) Substitution at 66',2024-10-31 05:23:49
12647,721598,5,44088514,68',Majed Kanabah (Al Shabab) Yellow Card at 68',2024-10-31 05:23:49
12647,721598,6,44088524,74',Mohamed Al Oqil (Al Riyadh) Substitution at 74',2024-10-31 05:23:49
12647,721598,7,44088525,74',Rayan Al Bloushi (Al Riyadh) Substitution at 74',2024-10-31 05:23:49
12647,721598,8,44088538,77',Nawaf Al Saadi (Al Shabab) Substitution at 77',2024-10-31 05:23:49
12647,721598,9,44088539,78',Mohammed Essa Harbush (Al Shabab) Substitution at 78',2024-10-31 05:23:49
12647,721598,10,44088543,81',Yoann Barbet (Al Riyadh) Yellow Card at 81',2024-10-31 05:23:49
12647,721598,11,44088554,88',Abdulelah Al Khaibari (Al Riyadh) Yellow Card at 88',2024-10-31 05:23:49
12647,721598,12,44088563,90'+3',Giacomo Bonaventura (Al Shabab) Goal at 93',2024-10-31 05:23:49
12647,721599,0,44091868,12',Nawaf Al-Harthi (Al Fayha) Substitution at 12',2024-10-31 05:23:49
12647,721599,1,44091979,20',Abdulsalam Al Shamsan (Al Arabi) Substitution at 20',2024-10-31 05:23:49
12647,721599,2,44092225,42',Renzo López (Al Fayha) Goal at 42',2024-10-31 05:23:49
12647,721599,3,44092309,45'+2',Manaf Yabes (Al Arabi) Yellow Card at 47',2024-10-31 05:23:49
12647,721599,4,44092810,45',Reinaldo (Al Arabi) Substitution at 45',2024-10-31 05:23:49
12647,721599,5,44092878,45',Nawaf Al Bakheet (Al Arabi) Substitution at 45',2024-10-31 05:23:49
12647,721599,6,44093099,58',Mansor Faiez Al-Beshe (Al Fayha) Yellow Card at 58',2024-10-31 05:23:49
12647,721599,7,44093164,65',Sulaiman Al Nakhli (Al Arabi) Substitution at 65',2024-10-31 05:23:49
12647,721599,8,44093235,71',Saud bin Zaydan (Al Fayha) Substitution at 71',2024-10-31 05:23:49
12647,721599,9,44093330,78',Malek Al Abdulmonam (Al Fayha) Substitution at 78',2024-10-31 05:23:49
12647,721599,10,44093331,79',Aldry Contreras (Al Fayha) Substitution at 79',2024-10-31 05:23:49
12647,721599,11,44093332,79',Rakan Kaabi (Al Fayha) Substitution at 79',2024-10-31 05:23:49
12647,721599,12,44093372,81',Nawaf Al Bakheet (Al Arabi) Yellow Card at 81',2024-10-31 05:23:49
12647,721599,13,44093373,81',Thamer Al Mousa (Al Arabi) Substitution at 81',2024-10-31 05:23:49
12647,721599,14,44157569,90',Al-Moelw Al-Mohanna (Al Arabi) Yellow Card at 90',2024-11-07 06:22:41
12647,721600,0,44092074,34',Waleed Al-Ahmed (Al Taawoun) Yellow Card at 34',2024-10-31 05:23:49
12647,721600,1,44093065,65',Sultan Al-Ghannam (Al Nassr) Substitution at 65',2024-10-31 05:23:49
12647,721600,2,44093066,65',Abdulrahman Ghareeb (Al Nassr) Substitution at 65',2024-10-31 05:23:49
12647,721600,3,44093067,65',Otávio (Al Nassr) Substitution at 65',2024-10-31 05:23:49
12647,721600,4,44093132,70',Sadio Mané (Al Nassr) Substitution at 70',2024-10-31 05:23:49
12647,721600,5,44093133,71',Waleed Al-Ahmed (Al Taawoun) Goal at 71',2024-10-31 05:23:49
12647,721600,6,44093247,81',Renne Rivas (Al Taawoun) Substitution at 81',2024-10-31 05:23:49
12647,721600,7,44093295,84',Hatan Bahbri (Al Taawoun) Substitution at 84',2024-10-31 05:23:49
12647,721600,8,44093296,84',Sultan Al Farhan (Al Taawoun) Substitution at 84',2024-10-31 05:23:49
12647,721600,9,44093297,85',Mohammed Maran (Al Nassr) Substitution at 85',2024-10-31 05:23:49
12647,721600,10,44093365,90'+1',Abdulfattah Adam (Al Taawoun) Substitution at 91',2024-10-31 05:23:49
12647,721600,11,44093394,90'+4',Al Mufarrij (Al Taawoun) Yellow Card at 94',2024-10-31 05:23:49
12647,721600,12,44093405,90'+5',Aschraf El Mahdioui (Al Taawoun) Yellow Card at 95',2024-10-31 05:23:49
12647,721600,13,44140872,90'+6',Cristiano Ronaldo (Al Nassr) Penalty - Missed at 96',2024-11-05 22:55:55
12647,721601,0,44088686,7',Juninho Bacuna (Al Wehda) Goal at 7',2024-10-31 05:23:49
12647,721601,1,44088722,37',Julián Quiñones (Al Qadsiah) Goal at 37',2024-10-31 05:23:49
12647,721601,2,44088741,45'+4',Julián Quiñones (Al Qadsiah) Goal at 49',2024-10-31 05:23:49
12647,721601,3,44088830,62',Saif Rashad Mohamed (Al Qadsiah) Substitution at 62',2024-10-31 05:23:49
12647,721601,4,44088841,65',Abdulaziz Noor (Al Wehda) Substitution at 65',2024-10-31 05:23:49
12647,721601,5,44088842,65',Yahya Naji (Al Wehda) Substitution at 65',2024-10-31 05:23:49
12647,721601,6,44088869,73',Ezequiel Fernández (Al Qadsiah) Substitution at 73',2024-10-31 05:23:49
12647,721601,7,44088878,79',Ali Abdullah Hazzazi (Al Qadsiah) Yellow Card at 79',2024-10-31 05:23:49
12647,721601,8,44088884,80',Odion Ighalo (Al Wehda) Substitution at 80',2024-10-31 05:23:49
12647,721601,9,44088890,86',Abdulrahman Al-Dossari (Al Qadsiah) Substitution at 86',2024-10-31 05:23:49
12647,721601,10,44088891,86',Qassem Lajami (Al Qadsiah) Substitution at 86',2024-10-31 05:23:49
12647,721601,11,44088894,89',Ala Al Hajji (Al Wehda) Substitution at 89',2024-10-31 05:23:49
12647,721601,12,44088895,89',Ahmad Bandar Derwish (Al Wehda) Substitution at 89',2024-10-31 05:23:49
12647,721601,13,44088920,90'+1',Yahya Naji (Al Wehda) Yellow Card at 91',2024-11-08 06:19:10
12647,721601,14,44088900,90'+2',Saeed Al-Mowalad (Al Wehda) Yellow Card at 92',2024-11-08 06:19:10
12648,704201,0,43837916,5',Riad Al Ibrahim (Al Najma) Yellow Card at 5',2024-09-26 05:35:11
12648,704201,1,43837961,36',Ali Adnan Kadhim (Al Najma) Yellow Card at 36',2024-09-26 05:35:11
12648,704201,2,43837964,43',Abdelkader Bedrane (Damac) Yellow Card at 43',2024-09-26 05:35:11
12648,704201,3,43837965,45'+6',Hazzaa Al Ghamdi (Damac) Yellow Card at 51',2024-09-26 05:35:11
12648,704201,4,43837990,45',Bilel Aouacheria (Al Najma) Substitution at 45',2024-09-26 05:35:11
12648,704201,5,43837997,45',Abdullah Al Sagheer (Al Najma) Substitution at 45',2024-09-26 05:35:11
12648,704201,6,43838072,59',Tilica (Al Najma) Penalty - Scored at 59',2024-09-26 05:35:11
12648,704201,7,43838110,63',Habib Diallo (Damac) Substitution at 63',2024-09-26 05:35:11
12648,704201,8,43838111,63',Georges-Kévin N'Koudou (Damac) Substitution at 63',2024-09-26 05:35:11
12648,704201,9,43838112,63',Tariq Mohammed (Damac) Substitution at 63',2024-09-26 05:35:11
12648,704201,10,43838146,72',Abdullah Khattab (Al Najma) Substitution at 72',2024-09-26 05:35:11
12648,704201,11,43838147,72',Khaled Al Shammari (Al Najma) Substitution at 72',2024-09-26 05:35:11
12648,704201,12,43838171,75',Riyadh Al Asmari (Al Najma) Yellow Card at 75',2024-09-26 05:35:11
12648,704201,13,43838184,76',Faisal Al Mutairi (Al Najma) Yellow Card at 76',2024-09-26 05:35:11
12648,704201,14,43838228,78',Abdullah Almogren (Damac) Substitution at 78',2024-09-26 05:35:11
12648,704201,15,43838244,85',Bilel Aouacheria (Al Najma) Goal at 85',2024-09-26 05:35:11
12648,704201,16,43838263,87',Abdulrahman Al Obaid (Al Najma) Substitution at 87',2024-09-26 05:35:11
12648,704201,17,43838264,87',Mohammed Alkhaibari (Damac) Substitution at 87',2024-09-26 05:35:11
12648,704201,18,43838309,90'+3',Abdulrahman Al-Obaid (Damac) Yellow Card at 93',2024-09-26 05:35:11
12648,704201,19,43838310,90'+5',Khaled Al Shammari (Al Najma) Yellow Card at 95',2024-09-26 05:35:11
12648,704202,0,43824949,39',Waleed Bakhashwain (Al Wehda) Substitution at 39',2024-09-25 05:39:55
12648,704202,1,43825486,45',Craig Goodwin (Al Wehda) Substitution at 45',2024-09-25 05:39:55
12648,704202,2,43825487,45',Odion Ighalo (Al Wehda) Substitution at 45',2024-09-25 05:39:55
12648,704202,3,43825550,48',Lucas Souza (Al-Faisaly) Goal at 48',2024-09-25 05:39:55
12648,704202,4,43825605,51',Odion Ighalo (Al Wehda) Goal at 51',2024-09-25 05:39:55
12648,704202,5,43825683,51',Abdulaziz Makin (Al-Faisaly) Substitution at 51',2024-09-25 05:39:55
12648,704202,6,43825661,54',Meshal Alaeli (Al Wehda) Yellow Card at 54',2024-09-25 05:39:55
12648,704202,7,43825920,65',Abdullah Subayt (Al-Faisaly) Substitution at 65',2024-09-25 05:39:55
12648,704202,8,43825921,66',Yazid Joshan (Al-Faisaly) Substitution at 66',2024-09-25 05:39:55
12648,704202,9,43825922,66',Saad Al Qahtani (Al Wehda) Substitution at 66',2024-09-25 05:39:55
12648,704202,10,43826006,70',Saad Al Qahtani (Al Wehda) Yellow Card at 70',2024-09-25 05:39:55
12648,704202,11,43826239,85',Mohamed Al Makahasi (Al Wehda) Substitution at 85',2024-09-25 05:39:55
12648,704202,12,43826250,86',Juninho Bacuna (Al Wehda) Yellow Card at 86',2024-09-25 05:39:55
12648,704202,13,43826356,90'+5',Ahmad Al Badah (Al-Faisaly) Substitution at 95',2024-09-25 05:39:55
12648,704202,14,43826357,90'+5',Mohammed Majrashi (Al-Faisaly) Substitution at 95',2024-09-25 05:39:55
12648,704202,15,43826588,90',Ahmad Bandar Derwish (Al Wehda) Substitution at 90',2024-09-25 05:39:55
12648,704202,16,43826728,97',Ali Al Salem (Al Wehda) Yellow Card at 97',2024-09-25 05:39:55
12648,704202,17,43826786,101',Ahmad Bandar Derwish (Al Wehda) Yellow Card at 101',2024-09-25 05:39:55
12648,704202,18,43826990,107',Ahmad Al Badah (Al-Faisaly) Yellow Card at 107',2024-09-25 05:39:55
12648,704202,19,43827132,115',Waleed Bakhashwain (Al Wehda) Yellow Card at 115',2024-09-25 05:39:55
12648,704203,0,43830960,45',Abdullah Al-Salim (Al Khaleej) Own Goal at 45',2024-09-24 05:41:59
12648,704203,1,43830966,45'+4',Andrei Cordea (Al Tai) Yellow Card at 49',2024-09-24 05:41:59
12648,704203,2,43830979,45',Khaled Narey (Al Khaleej) Substitution at 45',2024-09-24 05:41:59
12648,704203,3,43830980,45',Kostas Fortounis (Al Khaleej) Substitution at 45',2024-09-24 05:41:59
12648,704203,4,43830984,49',Ibrahim Alnakhli (Al Tai) Goal at 49',2024-09-24 05:41:59
12648,704203,5,43830996,55',Abdullah Al-Salim (Al Khaleej) Goal at 55',2024-09-24 05:41:59
12648,704203,6,43831001,58',Ibrahim Sehic (Al Khaleej) Red Card at 58',2024-09-24 05:41:59
12648,704203,7,43831007,64',Marwan Al Haidari (Al Khaleej) Substitution at 64',2024-09-24 05:41:59
12648,704203,8,43831008,65',Dimitrios Kourbelis (Al Khaleej) Substitution at 65',2024-09-24 05:41:59
12648,704203,9,43831009,65',Rebocho (Al Khaleej) Substitution at 65',2024-09-24 05:41:59
12648,704203,10,43831018,73',Léandre Tawamba (Al Tai) Yellow Card at 73',2024-09-24 05:41:59
12648,704203,11,43831044,85',Ibrahim Alnakhli (Al Tai) Yellow Card at 85',2024-09-24 05:41:59
12648,704203,12,43831049,88',Marwan Al Haidari (Al Khaleej) Yellow Card at 88',2024-09-24 05:41:59
12648,704203,13,43831048,90'+2',Kostas Fortounis (Al Khaleej) Penalty - Scored at 92',2024-09-24 05:41:59
12648,704203,14,43831050,90'+2',Mohammed Al Marri (Al Tai) Substitution at 92',2024-09-24 05:41:59
12648,704203,15,43831051,90'+10',Hussain Salem (Al Tai) Yellow Card at 100',2024-09-24 05:41:59
12648,704203,16,43831053,95',Saeed Al Hamsal (Al Khaleej) Substitution at 95',2024-09-24 05:41:59
12648,704203,17,43831056,99',Ibrahima Tandia (Al Tai) Goal at 99',2024-09-24 05:41:59
12648,704203,18,43831061,103',Abdulaziz Al Faraj (Al Tai) Goal at 103',2024-09-24 05:41:59
12648,704203,19,43831075,109',Hassan Alamri (Al Tai) Substitution at 109',2024-09-24 05:41:59
12648,704203,20,43831102,120',Léandre Tawamba (Al Tai) Goal at 120',2024-09-24 05:41:59
12648,704203,21,43831105,120',Marko Dugandzic (Al Tai) Substitution at 120',2024-09-24 05:41:59
12648,704204,0,43824573,10',Julián Quiñones (Al Qadsiah) Goal at 10',2024-09-25 05:39:55
12648,704204,1,43824928,37',Cameron Puertas (Al Qadsiah) Goal at 37',2024-09-25 05:39:55
12648,704204,2,43825065,45'+1',Jehad Abdullatif Ahm (Al Qadsiah) Yellow Card at 46',2024-09-25 05:39:55
12648,704204,3,43825464,45',Emmanuel Boateng (Al Orobah) Substitution at 45',2024-09-25 05:39:55
12648,704204,4,43825465,45',Brad Young (Al Orobah) Substitution at 45',2024-09-25 05:39:55
12648,704204,5,43825466,45',Fahad Zubaidi (Al Orobah) Substitution at 45',2024-09-25 05:39:55
12648,704204,6,43825495,45',Ibrahim Al-Zubaidi (Al Orobah) Substitution at 45',2024-09-25 05:39:55
12648,704204,7,43825599,51',Julián Quiñones (Al Qadsiah) Goal at 51',2024-09-25 05:39:55
12648,704204,8,43825729,58',Ismal Kandouss (Al Orobah) Yellow Card at 58',2024-09-25 05:39:55
12648,704204,9,43825891,64',Gastón Álvarez (Al Qadsiah) Substitution at 64',2024-09-25 05:39:55
12648,704204,10,43825892,64',Ali Abdullah Hazzazi (Al Qadsiah) Substitution at 64',2024-09-25 05:39:55
12648,704204,11,43825893,65',Mohammed Abu Al Shamat (Al Qadsiah) Substitution at 65',2024-09-25 05:39:55
12648,704204,12,43826128,78',Abdulrahman Al-Dossari (Al Qadsiah) Substitution at 78',2024-09-25 05:39:55
12648,704204,13,43826129,79',Mohammed Qassem Al-Nakhli (Al Qadsiah) Substitution at 79',2024-09-25 05:39:55
12648,704204,14,43826207,84',Fahad Zubaidi (Al Orobah) Yellow Card at 84',2024-09-25 05:39:55
12648,704204,15,43826273,88',Fahad Al Reshedi (Al Orobah) Substitution at 88',2024-09-25 05:39:55
12648,704204,16,43826304,90'+1',Pierre-Emerick Aubameyang (Al Qadsiah) Goal at 91',2024-09-25 05:39:55
12648,704204,17,43826354,90'+5',Koen Casteels (Al Qadsiah) Yellow Card at 95',2024-09-25 05:39:55
12648,704204,18,43826355,90'+6',Jóhann Gudmundsson (Al Orobah) Penalty - Scored at 96',2024-09-25 05:39:55
12648,704205,0,43822064,8',Romell Quioto (Al Arabi) Goal at 8',2024-09-25 05:39:55
12648,704205,1,43822116,10',Romell Quioto (Al Arabi) Goal at 10',2024-09-25 05:39:55
12648,704205,2,43822181,13',Ali Daqarshawi (Al Arabi) Yellow Card at 13',2024-09-25 05:39:55
12648,704205,3,43822334,25',Damion Lowe (Al Okhdood) Yellow Card at 25',2024-09-25 05:39:55
12648,704205,4,43823182,45',Awad Khamis (Al Okhdood) Substitution at 45',2024-09-25 05:39:55
12648,704205,5,43823183,45',Juan Pedroza (Al Okhdood) Substitution at 45',2024-09-25 05:39:55
12648,704205,6,43823184,45',Reinaldo (Al Arabi) Substitution at 45',2024-09-25 05:39:55
12648,704205,7,43823204,45',Mohanad Al Qaydhi (Al Okhdood) Substitution at 45',2024-09-25 05:39:55
12648,704205,8,43823457,64',Musleh Al Shaikh (Al Arabi) Substitution at 64',2024-09-25 05:39:55
12648,704205,9,43823482,66',Diego Ferreira (Al Okhdood) Substitution at 66',2024-09-25 05:39:55
12648,704205,10,43823510,68',Manaf Yabes (Al Arabi) Yellow Card at 68',2024-09-25 05:39:55
12648,704205,11,43823544,70',Abdalrahman Al Masoudi (Al Arabi) Substitution at 70',2024-09-25 05:39:55
12648,704205,12,43823670,76',Damion Lowe (Al Okhdood) Red Card at 76',2024-09-25 05:39:55
12648,704205,13,43823760,83',Mohammed Mansour Mile (Al Arabi) Substitution at 83',2024-09-25 05:39:55
12648,704205,14,43823845,88',Abdulaziz Al Hatila (Al Okhdood) Goal at 88',2024-09-25 05:39:55
12648,704205,15,43824005,90'+6',Hamidou Traoré (Al Arabi) Yellow Card at 96',2024-09-25 05:39:55
12648,704206,0,43834447,25',William Troost-Ekong (Al Kholood) Yellow Card at 25',2024-09-25 05:39:55
12648,704206,1,43834476,29',Myziane Maolida (Al Kholood) Goal at 29',2024-09-25 05:39:55
12648,704206,2,43834509,36',Giacomo Bonaventura (Al Shabab) Goal at 36',2024-09-25 05:39:55
12648,704206,3,43834596,45'+3',Norbert Gyömbér (Al Kholood) Yellow Card at 48',2024-09-25 05:39:55
12648,704206,4,43835132,64',Muhammad Sawan (Al Kholood) Substitution at 64',2024-09-25 05:39:55
12648,704206,5,43835133,65',Abderrazak Hamdallah (Al Shabab) Goal at 65',2024-09-25 05:39:55
12648,704206,6,43835210,70',Cristian Guanca (Al Shabab) Yellow Card at 70',2024-09-25 05:39:55
12648,704206,7,43835322,78',Nawaf Al Saadi (Al Shabab) Substitution at 78',2024-09-25 05:39:55
12648,704206,8,43835323,79',Majed Kanabah (Al Shabab) Substitution at 79',2024-09-25 05:39:55
12648,704206,9,43835324,80',Abderrazak Hamdallah (Al Shabab) Goal at 80',2024-09-25 05:39:55
12648,704206,10,43835347,82',Hamdan Al Shamrani (Al Kholood) Substitution at 82',2024-09-25 05:39:55
12648,704206,11,43835435,88',Abdulfattah Asiri (Al Kholood) Substitution at 88',2024-09-25 05:39:55
12648,704206,12,43835436,88',Mohammed Essa Harbush (Al Shabab) Substitution at 88',2024-09-25 05:39:55
12648,704206,13,43835437,88',Hassan Al-Asmari (Al Kholood) Substitution at 88',2024-09-25 05:39:55
12648,704206,14,43835471,90'+3',Haroune Camara (Al Shabab) Substitution at 93',2024-09-25 05:39:55
12648,704206,15,43835472,90'+3',Majed Abdullah (Al Shabab) Substitution at 93',2024-09-25 05:39:55
12648,704207,0,43834314,6',Ziyad Al Refaei (Al Ain) Substitution at 6',2024-09-25 05:39:55
12648,704207,1,43834446,25',Saleh Al-Shehri (Al Ittihad) Goal at 25',2024-09-25 05:39:55
12648,704207,2,43834477,29',Saleh Al-Shehri (Al Ittihad) Goal at 29',2024-10-17 05:19:27
12648,704207,3,43834875,45',Al Motasim Sediq (Al Ain) Substitution at 45',2024-09-25 05:39:55
12648,704207,4,43834876,45',Gozie Ugwu (Al Ain) Substitution at 45',2024-09-25 05:39:55
12648,704207,5,43834941,49',Yasser Yaqoub Ibrahim (Al Ain) Yellow Card at 49',2024-09-25 05:39:55
12648,704207,6,43835106,59',Mohammed Abbas Al Nakhli (Al Ain) Substitution at 59',2024-09-25 05:39:55
12648,704207,7,43835138,65',Saleh Al-Shehri (Al Ittihad) Penalty - Scored at 65',2024-09-25 05:39:55
12648,704207,8,43835248,69',Steven Bergwijn (Al Ittihad) Substitution at 69',2024-09-25 05:39:55
12648,704207,9,43835249,71',Karim Benzema (Al Ittihad) Substitution at 71',2024-09-25 05:39:55
12648,704207,10,43835250,71',Moussa Diaby (Al Ittihad) Substitution at 71',2024-09-25 05:39:55
12648,704207,11,43835251,71',Houssem Aouar (Al Ittihad) Substitution at 71',2024-09-25 05:39:55
12648,704207,12,43835252,72',Abdulmajeed Al Anazi (Al Ain) Substitution at 72',2024-09-25 05:39:55
12648,704207,13,43835301,77',Ahmed Al Ghamdi (Al Ittihad) Substitution at 77',2024-09-25 05:39:55
12648,704207,14,43835343,82',Mohammed Abbas Al Nakhli (Al Ain) Yellow Card at 82',2024-09-25 05:39:55
12648,704208,0,43830932,5',Abdullah Al Samtai (Al Hazem) Yellow Card at 5',2024-09-25 05:39:55
12648,704208,1,43830949,33',Abdulaziz Aldhuwayhi (Al Hazem) Yellow Card at 33',2024-09-25 05:39:55
12648,704208,2,43830950,37',Abdullah Al-Khaibari (Al Nassr) Substitution at 37',2024-09-25 05:39:55
12648,704208,3,43830955,45'+2',Abdurahman Al-Dakheel (Al Hazem) Yellow Card at 47',2024-09-25 05:39:55
12648,704208,4,43830956,45'+6',Sadio Mané (Al Nassr) Goal at 51',2024-09-25 05:39:55
12648,704208,5,43830972,45',Wesley Ribeiro (Al Nassr) Substitution at 45',2024-09-25 05:39:55
12648,704208,6,43830974,45',Ibrahima Ndiaye (Al Hazem) Substitution at 45',2024-09-25 05:39:55
12648,704208,7,43830981,54',Ahmed Al-Nakhli (Al Hazem) Substitution at 54',2024-09-25 05:39:55
12648,704208,8,43830985,57',Sadio Mané (Al Nassr) Yellow Card at 57',2024-09-25 05:39:55
12648,704208,9,43830988,57',Juriën Gaari (Al Hazem) Yellow Card at 57',2024-09-25 05:39:55
12648,704208,10,43830994,61',Salem Al Najdi (Al Nassr) Substitution at 61',2024-09-25 05:39:55
12648,704208,11,43830995,62',Basil Yousef Al-Sayyali (Al Hazem) Goal at 62',2024-09-25 05:39:55
12648,704208,12,43830999,63',Turki Al-Mutairi (Al Hazem) Substitution at 63',2024-09-25 05:39:55
12648,704208,13,43831000,64',Ahmed Al-Nakhli (Al Hazem) Yellow Card at 64',2024-09-25 05:39:55
12648,704208,14,43831019,80',Mohammed Maran (Al Nassr) Substitution at 80',2024-09-25 05:39:55
12648,704208,15,43831020,80',Mohamed Simakan (Al Nassr) Substitution at 80',2024-09-25 05:39:55
12648,704208,16,43831042,90'+2',Nawaf Boushal (Al Nassr) Goal at 92',2024-09-25 05:39:55
12648,704209,0,43830939,20',Mohammed Adams (Al Batin) Yellow Card at 20',2024-09-25 05:39:55
12648,704209,1,43830944,30',Renzo López (Al Fayha) Goal at 30',2024-09-25 05:39:55
12648,704209,2,43830948,36',Alejandro Pozuelo (Al Fayha) Goal at 36',2024-09-25 05:39:55
12648,704209,3,43830963,45',Kevin Luckassen (Al Batin) Substitution at 45',2024-09-25 05:39:55
12648,704209,4,43830964,45',Saqr Al Enazi (Al Batin) Substitution at 45',2024-09-25 05:39:55
12648,704209,5,43830965,47',Nawaf Al-Harthi (Al Fayha) Goal at 47',2024-09-25 05:39:55
12648,704209,6,43830970,51',Nawaf Al Sehimai (Al Batin) Yellow Card at 51',2024-09-25 05:39:55
12648,704209,7,43830973,55',Otabek Shukurov (Al Fayha) Yellow Card at 55',2024-09-25 05:39:55
12648,704209,8,43830975,56',Gojko Cimirot (Al Fayha) Substitution at 56',2024-09-25 05:39:55
