seasonType,eventId,commentaryOrder,playId,clockDisplayValue,commentaryText,updateDateTime
12722,709439,17,44221095,90'+4',Adrián de la Fuente (Levante) Yellow Card at 94',2024-11-18 06:05:44
12722,709439,18,44221101,90'+5',Andrés Fernández (Levante) Yellow Card at 95',2024-11-18 06:05:44
12722,709440,0,44220306,12',Marco Sangalli (Racing Santander) Goal at 12',2024-11-17 06:06:55
12722,709440,1,44220407,23',Aitor Córdoba (Burgos) Yellow Card at 23',2024-11-17 06:06:55
12722,709440,2,44220417,24',Francisco Montero (Racing Santander) Goal at 24',2024-11-17 06:06:55
12722,709440,3,44220484,40',Manu (Racing Santander) Red Card at 40',2024-11-17 06:06:55
12722,709440,4,44220542,45'+1',Daniel Ojeda (Burgos) Yellow Card at 46',2024-11-17 06:06:55
12722,709440,5,44220722,45',Edu Espiau (Burgos) Substitution at 45',2024-11-18 06:05:44
12722,709440,6,44220723,45',Javier Castro (Racing Santander) Substitution at 45',2024-11-18 06:05:44
12722,709440,7,44220875,59',Florian Miguel (Burgos) Yellow Card at 59',2024-11-18 06:05:44
12722,709440,8,44220969,66',Clement Michelin (Racing Santander) Substitution at 66',2024-11-18 06:05:44
12722,709440,9,44220970,66',Maguette Gueye (Racing Santander) Substitution at 66',2024-11-18 06:05:44
12722,709440,10,44220971,66',Marco Carrascal (Racing Santander) Substitution at 66',2024-11-18 06:05:44
12722,709440,11,44220981,68',Miguel Atienza (Burgos) Yellow Card at 68',2024-11-18 06:05:44
12722,709440,12,44220995,69',Borja Sánchez (Burgos) Substitution at 69',2024-11-18 06:05:44
12722,709440,13,44221052,82',Pipa (Burgos) Yellow Card at 82',2024-11-18 06:05:44
12722,709440,14,44221062,83',Ekain Zenitagoia (Racing Santander) Substitution at 83',2024-11-18 06:05:44
12722,709440,15,44221073,86',Anderson Arroyo (Burgos) Substitution at 86',2024-11-18 06:05:44
12722,709440,16,44221090,90'+1',Aritz Aldasoro (Racing Santander) Yellow Card at 91',2024-11-18 06:05:44
12722,709441,0,44224586,9',Kwasi Sibo (Real Oviedo) Goal at 9',2024-11-18 06:05:44
12722,709441,1,44224631,16',Haissem Hassan (Real Oviedo) Goal at 16',2024-11-18 06:05:44
12722,709441,2,44224644,19',Fernando Medrano Gastanaga (Tenerife) Yellow Card at 19',2024-11-18 06:05:44
12722,709441,3,44224690,27',Daniel Paraschiv (Real Oviedo) Substitution at 27',2024-11-18 06:05:44
12722,709441,4,44224750,34',Lucas (Real Oviedo) Yellow Card at 34',2024-11-18 06:05:44
12722,709441,5,44224785,44',Luis Cruz (Tenerife) Penalty - Saved at 44',2024-11-18 06:05:44
12722,709441,6,44224822,45',Aarón Martin Luis (Tenerife) Substitution at 45',2024-11-18 06:05:44
12722,709441,7,44224823,45',David Rodríguez Ramos (Tenerife) Substitution at 45',2024-11-18 06:05:44
12722,709441,8,44224846,58',Sebas Moyano (Real Oviedo) Substitution at 58',2024-11-18 06:05:44
12722,709441,9,44224847,58',Jaime Seoane (Real Oviedo) Substitution at 58',2024-11-18 06:05:44
12722,709441,10,44224848,58',Alassán Manjam Gutiérrez (Tenerife) Substitution at 58',2024-11-19 18:40:05
12722,709441,11,44224859,66',Teto (Tenerife) Substitution at 66',2024-11-18 06:05:44
12722,709441,12,44224862,68',Jaime Seoane (Real Oviedo) Goal at 68',2024-11-18 06:05:44
12722,709441,13,44224863,70',Jeremy Mellot (Tenerife) Yellow Card at 70',2024-11-18 06:05:44
12722,709441,14,44224871,72',Alberto Del Moral (Real Oviedo) Substitution at 72',2024-11-18 06:05:44
12722,709441,15,44224872,72',Federico Viñas (Real Oviedo) Substitution at 72',2024-11-18 06:05:44
12722,709441,16,44224873,73',Alejandro Cantero (Tenerife) Substitution at 73',2024-11-18 06:05:44
12722,709441,17,44224888,80',Jaime Vázquez (Real Oviedo) Yellow Card at 80',2024-11-18 06:05:44
12722,709441,18,44224889,81',José León (Tenerife) Goal at 81',2024-11-18 06:05:44
12722,709441,19,44224947,86',Oier Luengo (Real Oviedo) Yellow Card at 86',2024-11-18 06:05:44
12722,709441,20,44224957,89',Daniel Calvo (Real Oviedo) Yellow Card at 89',2024-11-19 18:40:05
12722,709442,0,44226022,15',David Larrubia (Málaga) Yellow Card at 15',2024-11-18 06:05:44
12722,709442,1,44226083,19',Malcom Adu Ares (Real Zaragoza) Yellow Card at 19',2024-11-18 06:05:44
12722,709442,2,44226288,35',Kevin Villodres (Málaga) Red Card at 35',2024-11-18 06:05:44
12722,709442,3,44226294,35',Luismi (Málaga) Yellow Card at 35',2024-11-19 18:40:05
12722,709442,4,44226416,45'+1',Víctor García (Málaga) Yellow Card at 46',2024-11-18 06:05:44
12722,709442,5,44226587,45',Adrián Liso (Real Zaragoza) Substitution at 45',2024-11-18 06:05:44
12722,709442,6,44226588,45',Antonio Moya (Real Zaragoza) Substitution at 45',2024-11-18 06:05:44
12722,709442,7,44226589,45',Dani Sánchez (Málaga) Substitution at 45',2024-11-18 06:05:44
12722,709442,8,44226607,45',Sergio Castel (Málaga) Substitution at 45',2024-11-18 06:05:44
12722,709442,9,44226720,59',Dani Sánchez (Málaga) Yellow Card at 59',2024-11-18 06:05:44
12722,709442,10,44226739,63',Francho Serrano (Real Zaragoza) Yellow Card at 63',2024-11-18 06:05:44
12722,709442,11,44226792,69',Marcos Luna Marcos Ruiz (Real Zaragoza) Substitution at 69',2024-11-18 06:05:44
12722,709442,12,44226810,72',Yanis Rahmani (Málaga) Substitution at 72',2024-11-18 06:05:44
12722,709442,13,44226844,74',Marcos Luna Marcos Ruiz (Real Zaragoza) Yellow Card at 74',2024-11-18 06:05:44
12722,709442,14,44226857,76',Alberto Marí (Real Zaragoza) Substitution at 76',2024-11-18 06:05:44
12722,709442,15,44226919,82',Carlos Puga (Málaga) Substitution at 82',2024-11-18 06:05:44
12722,709442,16,44226945,85',Álex Pastor (Málaga) Substitution at 85',2024-11-18 06:05:44
12722,709442,17,44227004,90'+3',Iván Calero Ruiz (Real Zaragoza) Yellow Card at 93',2024-11-18 06:05:44
12722,709442,18,44227014,90'+5',Sergio Bermejo Lillo (Real Zaragoza) Substitution at 95',2024-11-19 18:40:05
12722,709443,0,44221951,54',Shon Weissman (Granada) Goal at 54',2024-11-17 06:06:55
12722,709443,1,44222023,60',Juan Otero (Sporting Gijón) Goal at 60',2024-11-17 06:06:55
12722,709443,2,44222072,64',Víctor Campuzano (Sporting Gijón) Substitution at 64',2024-11-19 18:40:05
12722,709443,3,44222073,64',Ignacio Martín (Sporting Gijón) Substitution at 64',2024-11-19 18:40:05
12722,709443,4,44222172,73',Gonzalo Villar (Granada) Substitution at 73',2024-11-17 06:06:55
12722,709443,5,44222206,75',Jordy Caicedo (Sporting Gijón) Substitution at 75',2024-11-17 06:06:55
12722,709443,6,44222286,79',Lucas Boyé (Granada) Yellow Card at 79',2024-11-17 06:06:55
12722,709443,7,44222287,80',Pablo Sáenz (Granada) Substitution at 80',2024-11-17 06:06:55
12722,709443,8,44222288,80',Siren Diao (Granada) Substitution at 80',2024-11-17 06:06:55
12722,709443,9,44222305,82',Siren Diao (Granada) Goal at 82',2024-11-17 06:06:55
12722,709443,10,44222356,86',Iker Martínez (Sporting Gijón) Substitution at 86',2024-11-17 06:06:55
12722,709443,11,44222357,86',José Ángel (Sporting Gijón) Substitution at 86',2024-12-10 05:58:50
12722,709443,12,44222409,90',Rubén Sánchez (Granada) Substitution at 90',2024-11-17 06:06:55
12722,709444,0,44268210,13',Josep Gaya (Tenerife) Yellow Card at 13',2024-11-24 16:00:45
12722,709444,1,44268309,34',Higinio Marín (Albacete) Penalty - Scored at 34',2024-11-24 16:00:45
12722,709444,2,44268319,35',Antonio Pacheco Ruiz (Albacete) Substitution at 35',2024-11-24 16:00:45
12722,709444,3,44268386,44',David Rodríguez Ramos (Tenerife) Substitution at 44',2024-11-24 16:00:45
12722,709444,4,44268494,45',Yanis Senhadji (Tenerife) Substitution at 45',2024-11-24 16:00:45
12722,709444,5,44268497,45',Alassán Manjam Gutiérrez (Tenerife) Substitution at 45',2024-11-24 16:00:45
12722,709444,6,44268598,52',Agus Medina (Albacete) Yellow Card at 52',2024-11-24 16:00:45
12722,709444,7,44268767,66',Teto (Tenerife) Substitution at 66',2024-11-24 16:00:45
12722,709444,8,44268884,73',Jon Morcillo (Albacete) Substitution at 73',2024-11-24 16:00:45
12722,709444,9,44268885,74',Álvaro Rodríguez Pérez (Albacete) Substitution at 74',2024-11-24 16:00:45
12722,709444,10,44268886,74',Nabili Touaizi (Albacete) Substitution at 74',2024-11-24 16:00:45
12722,709444,11,44268905,76',Maikel Mesa (Tenerife) Goal at 76',2024-11-24 16:00:45
12722,709444,12,44268969,81',Jon Morcillo (Albacete) Goal at 81',2024-11-24 16:00:45
12722,709444,13,44269020,82',Daniel Fernández (Tenerife) Substitution at 82',2024-11-24 16:00:45
12722,709444,14,44269070,85',Jon García (Albacete) Substitution at 85',2024-11-24 16:00:45
12722,709444,15,44269071,86',Jon García (Albacete) Yellow Card at 86',2024-11-24 16:00:45
12722,709445,0,44262633,36',Sergio Álvarez (Eibar) Yellow Card at 36',2024-11-24 16:00:45
12722,709445,1,44262936,45',David López (Burgos) Substitution at 45',2024-11-24 16:00:45
12722,709445,2,44263039,53',Ivan Ruiz Morante (Burgos) Yellow Card at 53',2024-11-24 16:00:45
12722,709445,3,44263094,59',Jorge Pascual Medina (Eibar) Yellow Card at 59',2024-11-24 16:00:45
12722,709445,4,44263127,60',Jon Bautista (Eibar) Yellow Card at 60',2024-11-24 16:00:45
12722,709445,5,44263153,61',Daniel Ojeda (Burgos) Yellow Card at 61',2024-11-24 16:00:45
12722,709445,6,44263213,64',Borja Sánchez (Burgos) Substitution at 64',2024-11-24 16:00:45
12722,709445,7,44263214,64',Fernando Niño (Burgos) Substitution at 64',2024-11-24 16:00:45
12722,709445,8,44263215,64',Xeber Alkain (Eibar) Substitution at 64',2024-11-24 16:00:45
12722,709445,9,44263261,67',Curro (Burgos) Goal at 67',2024-11-25 16:11:24
12722,709445,10,44263419,73',Marcelo Expósito (Burgos) Substitution at 73',2024-11-24 16:00:45
12722,709445,11,44263420,75',Ander Madariaga (Eibar) Substitution at 75',2024-11-24 16:00:45
12722,709445,12,44263421,75',Cristian Gutiérrez (Eibar) Substitution at 75',2024-11-24 16:00:45
12722,709445,13,44263435,78',Xeber Alkain (Eibar) Yellow Card at 78',2024-11-24 16:00:45
12722,709445,14,44263556,82',Mario Cantero (Burgos) Substitution at 82',2024-11-24 16:00:45
12722,709445,15,44263557,83',Slavy (Eibar) Substitution at 83',2024-11-24 16:00:45
12722,709446,0,44262256,11',Keidi Bare (Real Zaragoza) Yellow Card at 11',2024-11-24 16:00:45
12722,709446,1,44262322,14',Adrián Lapeña Ruíz (Córdoba) Yellow Card at 14',2024-11-24 16:00:45
12722,709446,2,44262323,16',Francho Serrano (Real Zaragoza) Goal at 16',2024-11-24 16:00:45
12722,709446,3,44262561,30',Theo Zidane (Córdoba) Goal at 30',2024-11-24 16:00:45
12722,709446,4,44263028,47',Ager Aketxe (Real Zaragoza) Yellow Card at 47',2024-11-24 16:00:45
12722,709446,5,44263126,56',Marcos Luna Marcos Ruiz (Real Zaragoza) Goal at 56',2024-11-24 16:00:45
12722,709446,6,44263175,58',Jacobo González (Córdoba) Goal at 58',2024-11-24 16:00:45
12722,709446,7,44263241,61',Alex Sala (Córdoba) Substitution at 61',2024-11-24 16:00:45
12722,709446,8,44263284,64',Alex Sala (Córdoba) Yellow Card at 64',2024-11-24 16:00:45
12722,709446,9,44263361,67',Antonio Casas (Córdoba) Yellow Card at 67',2024-11-24 16:00:45
12722,709446,10,44263362,68',Malcom Adu Ares (Real Zaragoza) Substitution at 68',2024-11-24 16:00:45
12722,709446,11,44263363,69',Dani Tasende (Real Zaragoza) Yellow Card at 69',2024-11-24 16:00:45
12722,709446,12,44263412,72',Samed Bazdar (Real Zaragoza) Yellow Card at 72',2024-11-24 16:00:45
12722,709446,13,44263413,72',Isma Ruiz (Córdoba) Yellow Card at 72',2024-11-24 16:00:45
12722,709446,14,44263468,75',Enrique Clemente (Real Zaragoza) Substitution at 75',2024-11-24 16:00:45
12722,709446,15,44263469,75',Antonio Moya (Real Zaragoza) Substitution at 75',2024-11-24 16:00:45
12722,709446,16,44263519,77',Adilson (Córdoba) Substitution at 77',2024-11-24 16:00:45
12722,709446,17,44263631,83',Iván Calero Ruiz (Real Zaragoza) Substitution at 83',2024-11-24 16:00:45
12722,709446,18,44263632,84',Alberto Marí (Real Zaragoza) Substitution at 84',2024-11-24 16:00:45
12722,709446,19,44263633,84',Nikolai Óbolo (Córdoba) Substitution at 84',2024-11-24 16:00:45
12722,709446,20,44263634,84',Kuki Zalazar (Córdoba) Substitution at 84',2024-11-24 16:00:45
12722,709446,21,44263771,90'+3',Jacobo González (Córdoba) Yellow Card at 93',2024-11-24 16:00:45
12722,709447,0,44270023,29',Guillermo Rosas (Sporting Gijón) Yellow Card at 29',2024-11-25 16:11:24
12722,709447,1,44270700,71',César Gelabert (Sporting Gijón) Substitution at 71',2024-11-25 16:11:24
12722,709447,2,44270750,73',Alex Petxarromán (Deportivo La Coruña) Substitution at 73',2024-11-25 16:11:24
12722,709447,3,44270751,73',Cristian Herrera (Deportivo La Coruña) Substitution at 73',2024-11-25 16:11:24
12722,709447,4,44270778,77',Víctor Campuzano (Sporting Gijón) Substitution at 77',2024-11-25 16:11:24
12722,709447,5,44270779,77',Ignacio Méndez (Sporting Gijón) Goal at 77',2024-11-25 16:11:24
12722,709447,6,44270829,81',Juan Gauto (Deportivo La Coruña) Substitution at 81',2024-11-25 16:11:24
12722,709447,7,44270865,84',David Mella (Deportivo La Coruña) Goal at 84',2024-11-27 06:06:31
12722,709447,8,44270941,90',Lucas Pérez (Deportivo La Coruña) Yellow Card at 90',2024-11-25 16:11:24
12722,709447,9,44270942,90'+1',Alejandro Alfaro (Deportivo La Coruña) Substitution at 91',2024-11-25 16:11:24
12722,709447,10,44270943,90'+1',Sergio Escudero (Deportivo La Coruña) Substitution at 91',2024-11-25 16:11:24
12722,709447,11,44270959,90'+3',Jesús Bernal (Sporting Gijón) Substitution at 93',2024-11-25 16:11:24
12722,709448,0,44272727,4',Jaime Vázquez (Real Oviedo) Yellow Card at 4',2024-11-25 16:11:24
12722,709448,1,44272739,5',Nicolás Fernández (Elche) Penalty - Scored at 5',2024-11-25 16:11:24
12722,709448,2,44273208,23',David Affengruber (Elche) Substitution at 23',2024-11-25 16:11:24
12722,709448,3,44273353,31',Yago Alonso (Elche) Yellow Card at 31',2024-11-25 16:11:24
12722,709448,4,44273688,45'+3',Agustín Álvarez Martínez (Elche) Goal at 48',2024-11-25 16:11:24
12722,709448,5,44273946,51',Agustín Álvarez Martínez (Elche) Yellow Card at 51',2024-11-25 16:11:24
12722,709448,6,44273965,53',Nicolás Fernández (Elche) Goal at 53',2024-11-25 16:11:24
12722,709448,7,44274040,58',Febas (Elche) Yellow Card at 58',2024-12-10 05:58:50
12722,709448,8,44274116,62',Nicolás Fernández (Elche) Penalty - Missed at 62',2024-11-25 16:11:24
12722,709448,9,44274117,63',Sebas Moyano (Real Oviedo) Substitution at 63',2024-11-25 16:11:24
12722,709448,10,44274118,63',Francisco Portillo (Real Oviedo) Substitution at 63',2024-11-25 16:11:24
12722,709448,11,44274252,72',Nicolás Castro (Elche) Substitution at 72',2024-11-25 16:11:24
12722,709448,12,44274253,72',Mario (Elche) Substitution at 72',2024-12-10 05:58:50
12722,709448,13,44274254,73',Kwasi Sibo (Real Oviedo) Substitution at 73',2024-11-25 16:11:24
12722,709448,14,44274255,73',Daniel Paraschiv (Real Oviedo) Substitution at 73',2024-11-25 16:11:24
12722,709448,15,44274523,82',Ilyas Chaira (Real Oviedo) Yellow Card at 82',2024-11-25 16:11:24
12722,709448,16,44274524,82',Sory Kaba (Elche) Substitution at 82',2024-11-25 16:11:24
12722,709448,17,44274525,82',Álex Martín (Elche) Substitution at 82',2024-11-27 06:06:31
12722,709448,18,44274530,83',Nicolás Castro (Elche) Goal at 83',2024-11-25 16:11:24
12722,709448,19,44274567,84',Álex Suárez (Real Oviedo) Substitution at 84',2024-11-25 16:11:24
12722,709448,20,44274685,90'+1',Oier Luengo (Real Oviedo) Yellow Card at 91',2024-11-25 16:11:24
12722,709448,21,44274774,90'+5',Aarón Escandell (Real Oviedo) Yellow Card at 95',2024-11-25 16:11:24
12722,709449,0,44256308,6',Edgar González (Almería) Yellow Card at 6',2024-11-24 16:00:45
12722,709449,1,44256497,24',Sergio Arribas (Almería) Goal at 24',2024-11-24 16:00:45
12722,709449,2,44256537,35',Gastón Valles (FC Cartagena) Goal at 35',2024-11-24 16:00:45
12722,709449,3,44257031,54',Sergio Guerrero Romero (FC Cartagena) Yellow Card at 54',2024-11-24 16:00:45
12722,709449,4,44257032,54',Damián Musto (FC Cartagena) Yellow Card at 54',2024-11-24 16:00:45
12722,709449,5,44257127,60',Nicolás Melamed (Almería) Substitution at 60',2024-11-24 16:00:45
12722,709449,6,44257128,60',Alejandro Pozo (Almería) Substitution at 60',2024-11-24 16:00:45
12722,709449,7,44257170,65',Luis Suárez (Almería) Goal at 65',2024-11-24 16:00:45
12722,709449,8,44257270,70',Luis Muñoz (FC Cartagena) Substitution at 70',2024-11-24 16:00:45
12722,709449,9,44257271,70',Andy (FC Cartagena) Substitution at 70',2024-11-24 16:00:45
12722,709449,10,44257343,77',Lucas Román (FC Cartagena) Substitution at 77',2024-11-24 16:00:45
12722,709449,11,44257414,82',Alfredo Ortuño (FC Cartagena) Substitution at 82',2024-11-24 16:00:45
12722,709449,12,44257447,83',Kaiky (Almería) Substitution at 83',2024-11-24 16:00:45
12722,709449,13,44257531,90',Guilherme Borges Guedes (Almería) Substitution at 90',2024-11-24 16:00:45
12722,709449,14,44257532,90',Marko Milovanovic (Almería) Substitution at 90',2024-11-24 16:00:45
12722,709450,0,44259689,45'+3',Javi Ontiveros (Cádiz) Yellow Card at 48',2024-11-24 16:00:45
12722,709450,1,44259724,45'+3',Reiner (Granada) Yellow Card at 48',2024-11-27 06:06:31
12722,709450,2,44259725,45'+4',Miguel Rubio (Granada) Yellow Card at 49',2024-11-24 16:00:45
12722,709450,3,44261207,64',Myrto Uzuni (Granada) Substitution at 64',2024-11-24 16:00:45
12722,709450,4,44261208,64',Oscar Naasei Oppong (Granada) Substitution at 64',2024-11-24 16:00:45
12722,709450,5,44261209,64',Giorgi Tsitaishvili (Granada) Substitution at 64',2024-11-27 06:06:31
12722,709450,6,44261470,67',Fede San Emeterio (Cádiz) Yellow Card at 67',2024-11-24 16:00:45
12722,709450,7,44261471,71',Iván Alejo (Cádiz) Substitution at 71',2024-11-24 16:00:45
12722,709450,8,44261633,76',Miguel Ángel Brau (Granada) Yellow Card at 76',2024-11-24 16:00:45
12722,709450,9,44261634,77',Martin Hongla (Granada) Substitution at 77',2024-11-24 16:00:45
12722,709450,10,44261635,78',Óscar Melendo (Cádiz) Substitution at 78',2024-11-24 16:00:45
12722,709450,11,44261636,78',Chris Ramos (Cádiz) Substitution at 78',2024-11-24 16:00:45
12722,709450,12,44261700,83',Álex Fernández (Cádiz) Substitution at 83',2024-11-24 16:00:45
12722,709450,13,44261701,83',Rubén Sobrino (Cádiz) Substitution at 83',2024-11-24 16:00:45
12722,709450,14,44261759,85',Pablo Sáenz (Granada) Substitution at 85',2024-11-27 06:06:31
12722,709450,15,44261800,90',Fali (Cádiz) Yellow Card at 90',2024-11-24 16:00:45
12722,709450,16,44261857,90'+4',Martin Hongla (Granada) Yellow Card at 94',2024-11-24 16:00:45
12722,709451,0,44271422,13',Miguel Loureiro (Huesca) Yellow Card at 13',2024-11-25 16:11:24
12722,709451,1,44271840,48',Jorge Pulido (Huesca) Yellow Card at 48',2024-11-25 16:11:24
12722,709451,2,44271911,59',Javier Mier (Huesca) Substitution at 59',2024-11-27 06:06:31
12722,709451,3,44271970,68',Javi Hernandez (Huesca) Substitution at 68',2024-11-25 16:11:24
12722,709451,4,44271971,69',Joaquín Muñoz (Huesca) Substitution at 69',2024-11-25 16:11:24
12722,709451,5,44271972,70',Douglas Aurélio (Castellón) Goal at 70',2024-11-25 16:11:24
12722,709451,6,44271996,74',Daijiro Chirino (Castellón) Yellow Card at 74',2024-11-25 16:11:24
12722,709451,7,44271997,74',Jozhua Vertrouwd (Castellón) Substitution at 74',2024-11-25 16:11:24
12722,709451,8,44271998,75',Israel Suero (Castellón) Substitution at 75',2024-11-25 16:11:24
12722,709451,9,44272057,80',Iker Unzueta (Huesca) Substitution at 80',2024-11-25 16:11:24
12722,709451,10,44272058,80',José Antonio Abad (Huesca) Substitution at 80',2024-11-25 16:11:24
12722,709451,11,44272079,83',Serge Patrick Njoh (Huesca) Goal at 83',2024-11-25 16:11:24
12722,709451,12,44272158,89',Javier Mier (Huesca) Yellow Card at 89',2024-11-25 16:11:24
12722,709451,13,44272193,90'+1',Mats Seuntjens (Castellón) Yellow Card at 91',2024-11-25 16:11:24
12722,709451,14,44272234,90'+2',Jetro Willems (Castellón) Yellow Card at 92',2024-11-25 16:11:24
12722,709452,0,44269788,17',Joel Jorquera (Eldense) Yellow Card at 17',2024-11-25 16:11:24
12722,709452,1,44269992,29',Julio Alonso (Mirandés) Yellow Card at 29',2024-11-25 16:11:24
12722,709452,2,44271819,49',Luis López (Mirandés) Yellow Card at 49',2024-11-25 16:11:24
12722,709452,3,44270497,56',Alberto Rodríguez (Mirandés) Substitution at 56',2024-11-25 16:11:24
12722,709452,4,44270516,59',Youness Lachhab (Eldense) Substitution at 59',2024-11-25 16:11:24
12722,709452,5,44270517,59',Cristian Montes (Eldense) Substitution at 59',2024-11-25 16:11:24
12722,709452,6,44270555,64',Alberto Rodríguez (Mirandés) Yellow Card at 64',2024-11-25 16:11:24
12722,709452,7,44270656,70',Víctor García (Eldense) Substitution at 70',2024-11-25 16:11:24
12722,709452,8,44270657,71',Juanto (Eldense) Substitution at 71',2024-11-25 16:11:24
12722,709452,9,44270669,71',Alberto Reina (Mirandés) Goal at 71',2024-11-25 16:11:24
12722,709452,10,44270734,76',Casals (Mirandés) Substitution at 76',2024-11-25 16:11:24
12722,709452,11,44270735,76',Santiago Homenchenko (Mirandés) Substitution at 76',2024-11-25 16:11:24
12722,709452,12,44270796,82',Ander Martín (Mirandés) Substitution at 82',2024-11-25 16:11:24
12722,709452,13,44270797,82',Álex Bernal (Eldense) Substitution at 82',2024-11-25 16:11:24
12722,709452,14,44270922,90'+3',Iñigo (Eldense) Yellow Card at 93',2024-11-25 16:11:24
12722,709453,0,44264255,23',Marco Sangalli (Racing Santander) Yellow Card at 23',2024-11-24 16:00:45
12722,709453,1,44264425,40',Alvaro Mantilla (Racing Santander) Yellow Card at 40',2024-11-24 16:00:45
12722,709453,2,44264437,42',Luismi (Málaga) Yellow Card at 42',2024-11-27 06:06:31
12722,709453,3,44264438,42',Iñigo Vicente (Racing Santander) Yellow Card at 42',2024-11-24 16:00:45
12722,709453,4,44264600,45',Dioni (Málaga) Substitution at 45',2024-11-27 06:06:31
12722,709453,5,44264601,45',Clement Michelin (Racing Santander) Substitution at 45',2024-11-24 16:00:45
12722,709453,6,44264602,45',Maguette Gueye (Racing Santander) Substitution at 45',2024-11-24 16:00:45
12722,709453,7,44264637,48',Carlos Puga (Málaga) Yellow Card at 48',2024-11-24 16:00:45
12722,709453,8,44264795,59',Antonio Cordero (Málaga) Substitution at 59',2024-11-27 06:06:31
12722,709453,9,44264796,59',Jokin Gabilondo (Málaga) Substitution at 59',2024-11-24 16:00:45
12722,709453,10,44264918,68',Sergio Castel (Málaga) Substitution at 68',2024-11-24 16:00:45
12722,709453,11,44264919,69',Lago Junior (Racing Santander) Substitution at 69',2024-11-24 16:00:45
12722,709453,12,44265120,81',Suleiman Camara (Racing Santander) Substitution at 81',2024-11-24 16:00:45
12722,709453,13,44265121,83',Aarón Moloney (Málaga) Substitution at 83',2024-11-24 16:00:45
12722,709453,14,44265191,89',Ekain Zenitagoia (Racing Santander) Substitution at 89',2024-11-24 16:00:45
12722,709454,0,44245241,20',Adrián de la Fuente (Levante) Yellow Card at 20',2024-11-23 06:05:07
12722,709454,1,44245321,32',Álvaro Giménez (Racing Ferrol) Penalty - Saved at 32',2024-11-23 06:05:07
12722,709454,2,44245442,43',Roger Brugué (Levante) Substitution at 43',2024-11-23 06:05:07
12722,709454,3,44245456,45',Aleksa Puric (Racing Ferrol) Yellow Card at 45',2024-11-23 06:05:07
12722,709454,4,44245652,45',David Castro (Racing Ferrol) Substitution at 45',2024-11-23 06:05:07
12722,709454,5,44245994,61',Bebé (Racing Ferrol) Substitution at 61',2024-11-24 16:00:45
12722,709454,6,44246007,63',Álvaro Sanz (Racing Ferrol) Yellow Card at 63',2024-11-23 06:05:07
12722,709454,7,44246406,73',Christian Borrego (Racing Ferrol) Substitution at 73',2024-11-23 06:05:07
12722,709454,8,44246407,74',Giorgi Kochorashvili (Levante) Yellow Card at 74',2024-11-24 16:00:45
12722,709454,9,44246408,75',Jorge Cabello (Levante) Substitution at 75',2024-11-23 06:05:07
12722,709454,10,44246409,75',Fabrício Santos (Levante) Substitution at 75',2024-11-23 06:05:07
12722,709454,11,44246410,76',Ángel Algobia (Levante) Substitution at 76',2024-11-23 06:05:07
12722,709454,12,44246818,83',Julián Delmás (Racing Ferrol) Substitution at 83',2024-11-23 06:05:07
12722,709454,13,44246820,83',Sergio Lozano (Levante) Substitution at 83',2024-11-23 06:05:07
12722,709454,14,44246911,83',David Carballo (Racing Ferrol) Substitution at 83',2024-11-23 06:05:07
12722,709455,0,44306401,8',Guilherme Borges Guedes (Almería) Yellow Card at 8',2024-12-01 06:03:04
12722,709455,1,44307453,40',Pablo Insua (Granada) Yellow Card at 40',2024-12-01 06:03:04
12722,709455,2,44307543,45'+1',Myrto Uzuni (Granada) Goal at 46',2024-12-01 06:03:04
12722,709455,3,44308221,45',Gonzalo Melero (Almería) Substitution at 45',2024-12-01 06:03:04
12722,709455,4,44309004,62',Arnau Puigmal (Almería) Substitution at 62',2024-12-01 06:03:04
12722,709455,5,44309005,62',Alejandro Pozo (Almería) Substitution at 62',2024-12-01 06:03:04
12722,709455,6,44309242,67',Sergio Ruiz (Granada) Substitution at 67',2024-12-01 06:03:04
12722,709455,7,44309243,68',Pablo Sáenz (Granada) Substitution at 68',2024-12-01 06:03:04
12722,709455,8,44309384,72',Nicolás Melamed (Almería) Substitution at 72',2024-12-01 06:03:04
12722,709455,9,44309562,76',Manu Trigueros (Granada) Substitution at 76',2024-12-01 06:03:04
12722,709455,10,44309563,77',Rubén Sánchez (Granada) Substitution at 77',2024-12-01 06:03:04
12722,709455,11,44309730,83',Luis Suárez (Almería) Goal at 83',2024-12-01 06:03:04
12722,709455,12,44309775,85',Gonzalo Melero (Almería) Yellow Card at 85',2024-12-01 06:03:04
12722,709455,13,44309800,87',Gonzalo Melero (Almería) Goal at 87',2024-12-01 06:03:04
12722,709455,14,44309815,89',Shon Weissman (Granada) Substitution at 89',2024-12-01 06:03:04
12722,709455,15,44309865,90'+1',Marko Milovanovic (Almería) Substitution at 91',2024-12-01 06:03:04
12722,709455,16,44309881,90'+3',Ricard Sánchez (Granada) Yellow Card at 93',2024-12-01 06:03:04
12722,709456,0,44317670,23',Daijiro Chirino (Castellón) Substitution at 23',2024-12-02 06:01:47
12722,709456,1,44317681,25',Thomas van den Belt (Castellón) Goal at 25',2024-12-02 06:01:47
12722,709456,2,44317736,31',Álex Pastor (Málaga) Yellow Card at 31',2024-12-03 06:02:59
12722,709456,3,44318197,45',Antonio Cordero (Málaga) Substitution at 45',2024-12-02 06:01:47
