seasonType,eventId,commentaryOrder,playId,clockDisplayValue,commentaryText,updateDateTime
12716,708932,15,44335015,82',Lewis Richards (Bradford City) Yellow Card at 82',2024-12-05 06:02:23
12716,708933,0,44340012,45',Glenn Morris (Gillingham) Substitution at 45',2024-12-05 06:02:23
12716,708933,1,44340192,54',Cameron Congreve (Bromley) Goal at 54',2024-12-05 06:02:23
12716,708933,2,44340224,56',Robbie Mckenzie (Gillingham) Goal at 56',2024-12-05 06:02:23
12716,708933,3,44340247,57',George Lapslie (Gillingham) Substitution at 57',2024-12-05 06:02:23
12716,708933,4,44340429,65',Ben Thompson (Bromley) Yellow Card at 65',2024-12-05 06:02:23
12716,708933,5,44340489,67',Callum Reynolds (Bromley) Substitution at 67',2024-12-05 06:02:23
12716,708933,6,44340490,68',Olufela Olomola (Bromley) Substitution at 68',2024-12-05 06:02:23
12716,708933,7,44340547,71',Jude Arthurs (Bromley) Goal at 71',2024-12-05 06:02:23
12716,708933,8,44340731,76',Jacob Wakeling (Gillingham) Substitution at 76',2024-12-05 06:02:23
12716,708933,9,44340732,76',Josh Andrews (Gillingham) Substitution at 76',2024-12-05 06:02:23
12716,708933,10,44340733,76',Euan Williams (Gillingham) Substitution at 76',2024-12-05 06:02:23
12716,708933,11,44341122,90'+1',Josh Andrews (Gillingham) Yellow Card at 91',2024-12-05 06:02:23
12716,708934,0,44303931,2',Dominic Sadi (Carlisle United) Goal at 2',2024-12-01 06:03:04
12716,708934,1,44304014,11',James Connolly (Crewe Alexandra) Yellow Card at 11',2024-12-01 06:03:04
12716,708934,2,44304015,12',Lewis Billington (Crewe Alexandra) Yellow Card at 12',2024-12-01 06:03:04
12716,708934,3,44304682,63',Jamie Knight-Lebel (Crewe Alexandra) Substitution at 63',2024-12-01 06:03:04
12716,708934,4,44304683,63',Adrien Thibaut (Crewe Alexandra) Substitution at 63',2024-12-01 06:03:04
12716,708934,5,44304684,63',Charlie Finney (Crewe Alexandra) Substitution at 63',2024-12-01 06:03:04
12716,708934,6,44304685,64',Kadeem Harris (Carlisle United) Yellow Card at 64',2024-12-01 06:03:04
12716,708934,7,44304741,68',Dylan McGeouch (Carlisle United) Substitution at 68',2024-12-01 06:03:04
12716,708934,8,44304742,69',Jordan Jones (Carlisle United) Substitution at 69',2024-12-01 06:03:04
12716,708934,9,44304743,69',Harrison Neal (Carlisle United) Substitution at 69',2024-12-01 06:03:04
12716,708934,10,44304772,72',Jordan Jones (Carlisle United) Yellow Card at 72',2024-12-01 06:03:04
12716,708934,11,44304804,74',Georgie Kelly (Carlisle United) Substitution at 74',2024-12-01 06:03:04
12716,708934,12,44304876,81',Georgie Kelly (Carlisle United) Yellow Card at 81',2024-12-01 06:03:04
12716,708934,13,44304886,82',Jack Lankester (Crewe Alexandra) Penalty - Scored at 82',2024-12-01 06:03:04
12716,708934,14,44304956,84',Owen Lunt (Crewe Alexandra) Substitution at 84',2024-12-01 06:03:04
12716,708934,15,44304994,89',Harrison Neal (Carlisle United) Yellow Card at 89',2024-12-01 06:03:04
12716,708934,16,44304995,90',Kian Breckin (Crewe Alexandra) Substitution at 90',2024-12-01 06:03:04
12716,708934,17,44305033,90'+1',Jack Ellis (Carlisle United) Substitution at 91',2024-12-01 06:03:04
12716,708935,0,44332978,11',Ben Heneghan (Port Vale) Yellow Card at 11',2024-12-04 06:04:46
12716,708935,1,44334259,53',George Miller (Cheltenham Town) Goal at 53',2024-12-04 06:04:46
12716,708935,2,44334503,62',Ronan Curtis (Port Vale) Substitution at 62',2024-12-04 06:04:46
12716,708935,3,44334504,62',Sam Hart (Port Vale) Substitution at 62',2024-12-04 06:04:46
12716,708935,4,44334505,62',Rico Richards (Port Vale) Substitution at 62',2024-12-04 06:04:46
12716,708935,5,44334658,69',Ibrahim Bakare (Cheltenham Town) Yellow Card at 69',2024-12-04 06:04:46
12716,708935,6,44334659,70',Ruari Paton (Port Vale) Substitution at 70',2024-12-04 06:04:46
12716,708935,7,44334929,78',Matt Taylor (Cheltenham Town) Substitution at 78',2024-12-04 06:04:46
12716,708935,8,44334930,78',Thomas Pett (Cheltenham Town) Substitution at 78',2024-12-04 06:04:46
12716,708935,9,44334931,78',Benicio Baker-Boaitey (Port Vale) Substitution at 78',2024-12-04 06:04:46
12716,708935,10,44335094,85',Ryan Croasdale (Port Vale) Yellow Card at 85',2024-12-04 06:04:46
12716,708935,11,44335293,90'+1',Levi Laing (Cheltenham Town) Substitution at 91',2024-12-04 06:04:46
12716,708935,12,44335355,90'+4',Ronan Curtis (Port Vale) Goal at 94',2024-12-04 06:04:46
12716,708935,13,44335354,90'+5',Joe Day (Cheltenham Town) Yellow Card at 95',2024-12-04 06:04:46
12716,708936,0,44332940,9',Harry Smith (Swindon Town) Own Goal at 9',2024-12-04 06:04:46
12716,708936,1,44332976,12',Samson Tovide (Colchester United) Goal at 12',2024-12-04 06:04:46
12716,708936,2,44333237,26',Samson Tovide (Colchester United) Goal at 26',2024-12-04 06:04:46
12716,708936,3,44333357,30',Paul Glatzel (Swindon Town) Substitution at 30',2024-12-04 06:04:46
12716,708936,4,44333494,34',Joel Cotterill (Swindon Town) Yellow Card at 34',2024-12-04 06:04:46
12716,708936,5,44333579,38',Jack Payne (Colchester United) Goal at 38',2024-12-04 06:04:46
12716,708936,6,44333686,43',Grant Hall (Swindon Town) Yellow Card at 43',2024-12-04 06:04:46
12716,708936,7,44334136,45',Rosaire Longelo (Swindon Town) Substitution at 45',2024-12-04 06:04:46
12716,708936,8,44334137,45',Harrison Minturn (Swindon Town) Substitution at 45',2024-12-04 06:04:46
12716,708936,9,44334138,45',Joel Mcgregor (Swindon Town) Substitution at 45',2024-12-04 06:04:46
12716,708936,10,44334452,58',Joel Mcgregor (Swindon Town) Yellow Card at 58',2024-12-04 06:04:46
12716,708936,11,44334583,64',Teddy Bishop (Colchester United) Substitution at 64',2024-12-04 06:04:46
12716,708936,12,44334584,64',Oscar Thorn (Colchester United) Substitution at 64',2024-12-04 06:04:46
12716,708936,13,44334585,64',Lyle Taylor (Colchester United) Substitution at 64',2024-12-04 06:04:46
12716,708936,14,44334719,69',Nnamdi Ofoborh (Swindon Town) Substitution at 69',2024-12-04 06:04:46
12716,708936,15,44334904,75',Rob Hunt (Colchester United) Substitution at 75',2024-12-04 06:04:46
12716,708936,16,44335201,86',Alex Woodyard (Colchester United) Substitution at 86',2024-12-04 06:04:46
12716,708937,0,44338681,9',Tom Anderson (Doncaster Rovers) Yellow Card at 9',2024-12-05 06:02:23
12716,708937,1,44338741,13',Kyle Hurst (Doncaster Rovers) Goal at 13',2024-12-05 06:02:23
12716,708937,2,44338873,19',James Bolton (Fleetwood Town) Yellow Card at 19',2024-12-05 06:02:23
12716,708937,3,44339297,34',Mark Helm (Fleetwood Town) Goal at 34',2024-12-05 06:02:23
12716,708937,4,44339395,39',Owen Bailey (Doncaster Rovers) Goal at 39',2024-12-05 06:02:23
12716,708937,5,44339443,40',Ryan Broom (Fleetwood Town) Substitution at 40',2024-12-05 06:02:23
12716,708937,6,44339473,42',Ryan Graydon (Fleetwood Town) Goal at 42',2024-12-05 06:02:23
12716,708937,7,44339594,45'+3',Billy Sharp (Doncaster Rovers) Goal at 48',2024-12-05 06:02:23
12716,708937,8,44340155,54',Jamie Sterry (Doncaster Rovers) Yellow Card at 54',2024-12-05 06:02:23
12716,708937,9,44340444,68',James Bolton (Fleetwood Town) Own Goal at 68',2024-12-05 06:02:23
12716,708937,10,44340498,69',Kian Harratt (Fleetwood Town) Substitution at 69',2024-12-05 06:02:23
12716,708937,11,44340499,69',Danny Mayor (Fleetwood Town) Substitution at 69',2024-12-05 06:02:23
12716,708937,12,44340500,69',Mackenzie Hunt (Fleetwood Town) Substitution at 69',2024-12-05 06:02:23
12716,708937,13,44340501,69',Luke Molyneux (Doncaster Rovers) Substitution at 69',2024-12-05 06:02:23
12716,708937,14,44340502,70',Jack Senior (Doncaster Rovers) Substitution at 70',2024-12-05 06:02:23
12716,708937,15,44340669,76',Harry Clifton (Doncaster Rovers) Substitution at 76',2024-12-05 06:02:23
12716,708937,16,44340867,83',Owen Devonport (Fleetwood Town) Substitution at 83',2024-12-05 06:02:23
12716,708937,17,44341111,90'+3',Teddy Sharman-Lowe (Doncaster Rovers) Yellow Card at 93',2024-12-05 06:02:23
12716,708938,0,44332831,2',Harvey Rodgers (Grimsby Town) Goal at 2',2024-12-04 06:04:46
12716,708938,1,44332959,11',Jayden Luker (Grimsby Town) Goal at 11',2024-12-04 06:04:46
12716,708938,2,44333081,19',Justin Obikwu (Grimsby Town) Goal at 19',2024-12-04 06:04:46
12716,708938,3,44333427,31',Nelson Khumbeni (Accrington Stanley) Yellow Card at 31',2024-12-04 06:04:46
12716,708938,4,44333438,33',Jordan Davies (Grimsby Town) Penalty - Scored at 33',2024-12-04 06:04:46
12716,708938,5,44333506,35',Seamus Conneely (Accrington Stanley) Substitution at 35',2024-12-04 06:04:46
12716,708938,6,44333507,35',Connor O'Brien (Accrington Stanley) Substitution at 35',2024-12-04 06:04:46
12716,708938,7,44333623,40',Donald Love (Accrington Stanley) Yellow Card at 40',2024-12-04 06:04:46
12716,708938,8,44336660,41',Sonny Aljofree (Accrington Stanley) Yellow Card at 41',2024-12-05 06:02:23
12716,708938,9,44334095,45',Danny Rose (Grimsby Town) Substitution at 45',2024-12-05 06:02:23
12716,708938,10,44334306,54',Douglas Tharme (Grimsby Town) Substitution at 54',2024-12-05 06:02:23
12716,708938,11,44334507,63',Alex Henderson (Accrington Stanley) Goal at 63',2024-12-05 06:02:23
12716,708938,12,44334539,63',Ashley Hunter (Accrington Stanley) Substitution at 63',2024-12-05 06:02:23
12716,708938,13,44334589,66',Curtis Thompson (Grimsby Town) Substitution at 66',2024-12-05 06:02:23
12716,708938,14,44334590,66',Callum Ainley (Grimsby Town) Substitution at 66',2024-12-05 06:02:23
12716,708938,15,44334639,68',Sonny Aljofree (Accrington Stanley) Own Goal at 68',2024-12-05 06:02:23
12716,708938,16,44334754,70',Evan Khouri (Grimsby Town) Substitution at 70',2024-12-05 06:02:23
12716,708938,17,44334955,80',Josh Woods (Accrington Stanley) Goal at 80',2024-12-05 06:02:23
12716,708938,18,44335023,81',Lewis Trickett (Accrington Stanley) Substitution at 81',2024-12-05 06:02:23
12716,708938,19,44335024,82',Anjola Popoola (Accrington Stanley) Substitution at 82',2024-12-05 06:02:23
12716,708938,20,44335212,89',Ashley Hunter (Accrington Stanley) Yellow Card at 89',2024-12-05 06:02:23
12716,708938,21,44336661,90'+4',Connor O'Brien (Accrington Stanley) Yellow Card at 94',2024-12-05 06:02:23
12716,708939,0,44332802,1',Scott Hogan (Milton Keynes Dons) Goal at 1',2024-12-04 06:04:46
12716,708939,1,44332986,13',Darren Oldaker (Chesterfield) Yellow Card at 13',2024-12-04 06:04:46
12716,708939,2,44333241,24',Darren Oldaker (Chesterfield) Red Card at 24',2024-12-04 06:04:46
12716,708939,3,44333242,26',Alex Gilbey (Milton Keynes Dons) Goal at 26',2024-12-04 06:04:46
12716,708939,4,44333311,27',Jamie Grimes (Chesterfield) Substitution at 27',2024-12-04 06:04:46
12716,708939,5,44333414,31',Harvey Araujo (Chesterfield) Yellow Card at 31',2024-12-04 06:04:46
12716,708939,6,44334173,45',Kane Drummond (Chesterfield) Substitution at 45',2024-12-04 06:04:46
12716,708939,7,44334435,58',Callum Hendry (Milton Keynes Dons) Substitution at 58',2024-12-04 06:04:46
12716,708939,8,44334476,61',Stephen Wearne (Milton Keynes Dons) Yellow Card at 61',2024-12-04 06:04:46
12716,708939,9,44334877,75',Branden Horton (Chesterfield) Substitution at 75',2024-12-04 06:04:46
12716,708939,10,44334878,75',Ryan Colclough (Chesterfield) Substitution at 75',2024-12-04 06:04:46
12716,708939,11,44334879,75',James Berry (Chesterfield) Substitution at 75',2024-12-04 06:04:46
12716,708939,12,44334880,75',Thomas Carroll (Milton Keynes Dons) Substitution at 75',2024-12-04 06:04:46
12716,708939,13,44334881,76',Ellis Harrison (Milton Keynes Dons) Substitution at 76',2024-12-04 06:04:46
12716,708939,14,44335064,82',Alex Gilbey (Milton Keynes Dons) Goal at 82',2024-12-04 06:04:46
12716,708939,15,44337373,82',Oliver Banks (Chesterfield) Yellow Card at 82',2024-12-05 06:02:23
12716,708939,16,44335105,84',Lewis Gordon (Chesterfield) Yellow Card at 84',2024-12-05 06:02:23
12716,708939,17,44335358,90'+2',Kane Thompson-Sommers (Milton Keynes Dons) Substitution at 92',2024-12-05 06:02:23
12716,708939,18,44335359,90'+3',Tommy Leigh (Milton Keynes Dons) Substitution at 93',2024-12-05 06:02:23
12716,708940,0,44332954,10',Ben Woodburn (Salford City) Goal at 10',2024-12-04 06:04:46
12716,708940,1,44333253,26',Dean Cornelius (Harrogate Town) Yellow Card at 26',2024-12-04 06:04:46
12716,708940,2,44333448,33',Toby Sims (Harrogate Town) Yellow Card at 33',2024-12-04 06:04:46
12716,708940,3,44334345,57',Thomas Edwards (Salford City) Substitution at 57',2024-12-04 06:04:46
12716,708940,4,44334346,58',Sam Folarin (Harrogate Town) Substitution at 58',2024-12-04 06:04:46
12716,708940,5,44334347,58',Admiral Muskwe (Harrogate Town) Substitution at 58',2024-12-04 06:04:46
12716,708940,6,44334457,63',Cole Stockton (Salford City) Substitution at 63',2024-12-04 06:04:46
12716,708940,7,44334653,70',Matty Daly (Harrogate Town) Substitution at 70',2024-12-04 06:04:46
12716,708940,8,44334669,72',Cole Stockton (Salford City) Goal at 72',2024-12-04 06:04:46
12716,708940,9,44334752,74',Eno Nto (Harrogate Town) Substitution at 74',2024-12-04 06:04:46
12716,708940,10,44334921,80',Haji Mnoga (Salford City) Yellow Card at 80',2024-12-04 06:04:46
12716,708940,11,44337004,87',Ossama Ashley (Salford City) Yellow Card at 87',2024-12-05 06:02:23
12716,708940,12,44335193,89',Conor McAleny (Salford City) Substitution at 89',2024-12-05 06:02:23
12716,708940,13,44335194,89',Kevin Berkoe (Salford City) Substitution at 89',2024-12-05 06:02:23
12716,708941,0,44332969,12',Ben Tollitt (Morecambe) Goal at 12',2024-12-04 06:04:46
12716,708941,1,44333739,45'+1',Harry Burgoyne (Morecambe) Yellow Card at 46',2024-12-04 06:04:46
12716,708941,2,44334110,48',Jordan Turnbull (Tranmere Rovers) Goal at 48',2024-12-04 06:04:46
12716,708941,3,44334168,50',Adam Lewis (Morecambe) Goal at 50',2024-12-04 06:04:46
12716,708941,4,44334373,58',David Tutonda (Morecambe) Substitution at 58',2024-12-04 06:04:46
12716,708941,5,44334374,58',Omari Patrick (Tranmere Rovers) Substitution at 58',2024-12-04 06:04:46
12716,708941,6,44334375,58',Harvey Saunders (Tranmere Rovers) Substitution at 58',2024-12-04 06:04:46
12716,708941,7,44334376,59',David Tutonda (Morecambe) Yellow Card at 59',2024-12-04 06:04:46
12716,708941,8,44334664,71',Yann Songo'o (Morecambe) Substitution at 71',2024-12-04 06:04:46
12716,708941,9,44334741,75',Connor Jennings (Tranmere Rovers) Goal at 75',2024-12-04 06:04:46
12716,708941,10,44334782,76',Rhys Williams (Morecambe) Yellow Card at 76',2024-12-04 06:04:46
12716,708941,11,44335305,90'+3',Ross Millen (Morecambe) Substitution at 93',2024-12-04 06:04:46
12716,708941,12,44335306,90'+4',Kayden Harrack (Morecambe) Substitution at 94',2024-12-04 06:04:46
12716,708942,0,44334109,49',Connor Barrett (Walsall) Yellow Card at 49',2024-12-04 06:04:46
12716,708942,1,44334301,55',Kellan Gordon (Notts County) Substitution at 55',2024-12-04 06:04:46
12716,708942,2,44334302,57',Taylor Allen (Walsall) Goal at 57',2024-12-04 06:04:46
12716,708942,3,44334442,64',George Hall (Walsall) Goal at 64',2024-12-04 06:04:46
12716,708942,4,44334575,68',Cedwyn Scott (Notts County) Substitution at 68',2024-12-04 06:04:46
12716,708942,5,44334698,74',David McGoldrick (Notts County) Penalty - Scored at 74',2024-12-04 06:04:46
12716,708942,6,44334761,75',Albert Adomah (Walsall) Substitution at 75',2024-12-04 06:04:46
12716,708942,7,44334857,79',Tommy Simkin (Walsall) Yellow Card at 79',2024-12-04 06:04:46
12716,708942,8,44335002,84',Jack Earing (Walsall) Substitution at 84',2024-12-04 06:04:46
12716,708942,9,44335050,86',Nathan Lowe (Walsall) Goal at 86',2024-12-04 06:04:46
12716,708942,10,44335281,90'+4',Jack Hinchy (Notts County) Goal at 94',2024-12-04 06:04:46
12716,708943,0,44352903,7',Michael Cheek (Bromley) Goal at 7',2024-12-10 05:58:50
12716,708943,1,44352971,9',Ben Woods (Accrington Stanley) Goal at 9',2024-12-10 05:58:50
12716,708943,2,44353300,23',Liam Coyle (Accrington Stanley) Yellow Card at 23',2024-12-10 05:58:50
12716,708943,3,44354439,45',Connor O'Brien (Accrington Stanley) Substitution at 45',2024-12-10 05:58:50
12716,708943,4,44354616,51',Corey Whitely (Bromley) Yellow Card at 51',2024-12-10 05:58:50
12716,708943,5,44354989,61',Olufela Olomola (Bromley) Substitution at 61',2024-12-10 05:58:50
12716,708943,6,44354990,61',Lewis Leigh (Bromley) Substitution at 61',2024-12-10 05:58:50
12716,708943,7,44355081,63',Idris Odutayo (Bromley) Goal at 63',2024-12-10 05:58:50
12716,708943,8,44355508,75',Ben Woods (Accrington Stanley) Yellow Card at 75',2024-12-10 05:58:50
12716,708943,9,44355764,80',Alex Henderson (Accrington Stanley) Substitution at 80',2024-12-10 05:58:50
12716,708943,10,44355932,85',Grant Smith (Bromley) Yellow Card at 85',2024-12-10 05:58:50
12716,708943,11,44356034,88',Charlie Hall (Accrington Stanley) Substitution at 88',2024-12-11 05:58:01
12716,708943,12,44356124,90'+2',Danny Imray (Bromley) Yellow Card at 92',2024-12-10 05:58:50
12716,708945,0,44353166,14',Declan Drysdale (Tranmere Rovers) Yellow Card at 14',2024-12-10 05:58:50
12716,708945,1,44353500,29',Ryan Colclough (Chesterfield) Goal at 29',2024-12-10 05:58:50
12716,708945,2,44354046,44',Armando Dobra (Chesterfield) Goal at 44',2024-12-10 05:58:50
12716,708945,3,44355046,63',Harvey Araujo (Chesterfield) Yellow Card at 63',2024-12-10 05:58:50
12716,708945,4,44355225,65',James Berry (Chesterfield) Substitution at 65',2024-12-10 05:58:50
12716,708945,5,44355226,66',Sol Solomon (Tranmere Rovers) Substitution at 66',2024-12-10 05:58:50
12716,708945,6,44355227,66',Samuel Taylor (Tranmere Rovers) Substitution at 66',2024-12-10 05:58:50
12716,708945,7,44355228,66',Zak Bradshaw (Tranmere Rovers) Substitution at 66',2024-12-10 05:58:50
12716,708945,8,44355229,66',Lee O'Connor (Tranmere Rovers) Substitution at 66',2024-12-10 05:58:50
12716,708945,9,44355535,75',Bailey Hobson (Chesterfield) Substitution at 75',2024-12-10 05:58:50
12716,708945,10,44355618,77',Ryheem Sheckleford (Chesterfield) Yellow Card at 77',2024-12-10 05:58:50
12716,708945,11,44355834,82',Jamie Grimes (Chesterfield) Substitution at 82',2024-12-10 05:58:50
12716,708945,12,44355835,82',Kane Drummond (Chesterfield) Substitution at 82',2024-12-10 05:58:50
12716,708945,13,44355944,86',Kane Drummond (Chesterfield) Goal at 86',2024-12-10 05:58:50
12716,708945,14,44356022,88',Sam Finley (Tranmere Rovers) Yellow Card at 88',2024-12-10 05:58:50
12716,708945,15,44356228,90'+3',Harvey Saunders (Tranmere Rovers) Yellow Card at 93',2024-12-10 05:58:50
12716,708946,0,44351672,40',Aden Baldwin (Bradford City) Yellow Card at 40',2024-12-10 05:58:50
12716,708946,1,44351790,45',Matús Holícek (Crewe Alexandra) Substitution at 45',2024-12-10 05:58:50
12716,708946,2,44351822,47',Omar Bogle (Crewe Alexandra) Goal at 47',2024-12-10 05:58:50
12716,708946,3,44351859,48',Jay Benn (Bradford City) Yellow Card at 48',2024-12-10 05:58:50
12716,708946,4,44351860,51',Shilow Tracey (Crewe Alexandra) Yellow Card at 51',2024-12-10 05:58:50
12716,708946,5,44351889,54',Max Sanders (Crewe Alexandra) Yellow Card at 54',2024-12-10 05:58:50
12716,708946,6,44351891,55',Alex Pattison (Bradford City) Goal at 55',2024-12-10 05:58:50
12716,708946,7,44351905,57',Alex Pattison (Bradford City) Red Card at 57',2024-12-10 05:58:50
12716,708946,8,44374212,57',Jamie Knight-Lebel (Crewe Alexandra) Yellow Card at 57',2024-12-13 05:56:51
12716,708946,9,44351921,58',Michael Williams (Crewe Alexandra) Yellow Card at 58',2024-12-13 05:56:51
12716,708946,10,44351922,58',Richard Smallwood (Bradford City) Yellow Card at 58',2024-12-13 05:56:51
12716,708946,11,44352015,66',Jack Powell (Crewe Alexandra) Substitution at 66',2024-12-13 05:56:51
12716,708946,12,44352053,70',Charlie Finney (Crewe Alexandra) Substitution at 70',2024-12-13 05:56:51
12716,708946,13,44352158,80',Vadaine Oliver (Bradford City) Substitution at 80',2024-12-13 05:56:51
12716,708946,14,44352159,80',Brad Halliday (Bradford City) Substitution at 80',2024-12-13 05:56:51
12716,708946,15,44352255,89',Adrien Thibaut (Crewe Alexandra) Substitution at 89',2024-12-13 05:56:51
12716,708946,16,44352300,90'+2',Jack Powell (Crewe Alexandra) Yellow Card at 92',2024-12-13 05:56:51
12716,708946,17,44352326,90'+6',Jack Shepherd (Bradford City) Yellow Card at 96',2024-12-13 05:56:51
12716,708946,18,44352333,90'+7',Sam Walker (Bradford City) Yellow Card at 97',2024-12-13 05:56:51
12716,708947,0,44353174,15',Owen Bailey (Doncaster Rovers) Own Goal at 15',2024-12-10 05:58:50
12716,708947,1,44353411,26',Jay Mcgrath (Doncaster Rovers) Yellow Card at 26',2024-12-10 05:58:50
12716,708947,2,44353657,34',Kyle Hurst (Doncaster Rovers) Yellow Card at 34',2024-12-10 05:58:50
12716,708947,3,44354488,45',Jack Senior (Doncaster Rovers) Substitution at 45',2024-12-10 05:58:50
12716,708947,4,44354489,45',Jordan Gibson (Doncaster Rovers) Substitution at 45',2024-12-10 05:58:50
12716,708947,5,44354789,53',Joe Sbarra (Doncaster Rovers) Substitution at 53',2024-12-10 05:58:50
12716,708947,6,44354799,55',George Broadbent (Doncaster Rovers) Goal at 55',2024-12-10 05:58:50
12716,708947,7,44354871,56',Ethon Archer (Cheltenham Town) Goal at 56',2024-12-10 05:58:50
12716,708947,8,44355211,66',Liam Kinsella (Cheltenham Town) Yellow Card at 66',2024-12-10 05:58:50
12716,708947,9,44355575,75',Luke Molyneux (Doncaster Rovers) Goal at 75',2024-12-10 05:58:50
12716,708947,10,44355778,79',Lewis Payne (Cheltenham Town) Substitution at 79',2024-12-10 05:58:50
12716,708947,11,44355779,79',Thomas Pett (Cheltenham Town) Substitution at 79',2024-12-10 05:58:50
12716,708947,12,44355847,81',Tom Anderson (Doncaster Rovers) Substitution at 81',2024-12-10 05:58:50
12716,708947,13,44356125,89',Harry Clifton (Doncaster Rovers) Substitution at 89',2024-12-10 05:58:50
12716,708947,14,44356192,90'+1',Matt Taylor (Cheltenham Town) Substitution at 91',2024-12-10 05:58:50
12716,708948,0,44353424,25',Matthew Lund (Salford City) Yellow Card at 25',2024-12-10 05:58:50
12716,708948,1,44353709,35',Jack Nolan (Gillingham) Substitution at 35',2024-12-10 05:58:50
12716,708948,2,44354741,48',Jayden Clarke (Gillingham) Goal at 48',2024-12-10 05:58:50
12716,708948,3,44354970,54',Kylian Kouassi (Salford City) Substitution at 54',2024-12-10 05:58:50
12716,708948,4,44355416,65',Remeao Hutton (Gillingham) Substitution at 65',2024-12-10 05:58:50
12716,708948,5,44355705,73',Curtis Tilt (Salford City) Yellow Card at 73',2024-12-10 05:58:50
12716,708948,6,44355789,73',Jayden Clarke (Gillingham) Yellow Card at 73',2024-12-10 05:58:50
12716,708948,7,44355790,74',Conor McAleny (Salford City) Substitution at 74',2024-12-10 05:58:50
12716,708948,8,44355898,77',Jonny Williams (Gillingham) Substitution at 77',2024-12-10 05:58:50
12716,708948,9,44356367,90'+1',Robbie Mckenzie (Gillingham) Yellow Card at 91',2024-12-10 05:58:50
12716,708948,10,44356412,90'+2',Bradley Dack (Gillingham) Substitution at 92',2024-12-10 05:58:50
12716,708948,11,44356413,90'+2',Shadrach Ogie (Gillingham) Substitution at 92',2024-12-10 05:58:50
12716,708949,0,44353036,12',Josh Kelly (AFC Wimbledon) Goal at 12',2024-12-10 05:58:50
12716,708949,1,44353302,15',Matty Daly (Harrogate Town) Substitution at 15',2024-12-10 05:58:50
12716,708949,2,44353409,22',Anthony O'Connor (Harrogate Town) Yellow Card at 22',2024-12-10 05:58:50
12716,708949,3,44353368,23',John-Joe O'Toole (AFC Wimbledon) Goal at 23',2024-12-10 05:58:50
12716,708949,4,44354593,50',Mathew Stevens (AFC Wimbledon) Goal at 50',2024-12-10 05:58:50
12716,708949,5,44354987,60',Jack Muldoon (Harrogate Town) Substitution at 60',2024-12-10 05:58:50
12716,708949,6,44354988,61',James Daly (Harrogate Town) Yellow Card at 61',2024-12-10 05:58:50
12716,708949,7,44355524,72',Matty Foulds (Harrogate Town) Substitution at 72',2024-12-10 05:58:50
12716,708949,8,44355525,73',Josh Kelly (AFC Wimbledon) Yellow Card at 73',2024-12-10 05:58:50
12716,708949,9,44355662,77',Joe Pigott (AFC Wimbledon) Substitution at 77',2024-12-10 05:58:50
12716,708949,10,44356157,90'+1',Harry Sidwell (AFC Wimbledon) Substitution at 91',2024-12-10 05:58:50
12716,708950,0,44353076,13',Paul Lewis (Morecambe) Yellow Card at 13',2024-12-10 05:58:50
12716,708950,1,44353395,25',Justin Obikwu (Grimsby Town) Goal at 25',2024-12-10 05:58:50
12716,708950,2,44353486,28',Curtis Thompson (Grimsby Town) Yellow Card at 28',2024-12-10 05:58:50
12716,708950,3,44353557,32',Rhys Williams (Morecambe) Yellow Card at 32',2024-12-10 05:58:50
12716,708950,4,44353807,39',Justin Obikwu (Grimsby Town) Goal at 39',2024-12-10 05:58:50
12716,708950,5,44354107,45'+1',Tom White (Morecambe) Yellow Card at 46',2024-12-10 05:58:50
12716,708950,6,44354462,45',Yann Songo'o (Morecambe) Substitution at 45',2024-12-10 05:58:50
12716,708950,7,44354463,45',Hallam Hope (Morecambe) Substitution at 45',2024-12-10 05:58:50
12716,708950,8,44354464,45',Callum Jones (Morecambe) Substitution at 45',2024-12-10 05:58:50
12716,708950,9,44355015,61',Danny Rose (Grimsby Town) Substitution at 61',2024-12-10 05:58:50
12716,708950,10,44355202,65',Harvey Rodgers (Grimsby Town) Yellow Card at 65',2024-12-10 05:58:50
12716,708950,11,44355716,79',Ross Millen (Morecambe) Substitution at 79',2024-12-10 05:58:50
12716,708950,12,44355717,79',Charlie Brown (Morecambe) Substitution at 79',2024-12-10 05:58:50
12716,708950,13,44355718,80',Danny Rose (Grimsby Town) Yellow Card at 80',2024-12-10 05:58:50
12716,708950,14,44355983,85',Jordan Davies (Grimsby Town) Substitution at 85',2024-12-10 05:58:50
12716,708950,15,44355984,85',Evan Khouri (Grimsby Town) Substitution at 85',2024-12-10 05:58:50
12716,708950,16,44355985,86',Callum Ainley (Grimsby Town) Substitution at 86',2024-12-10 05:58:50
12716,708950,17,44356049,88',Charlie Brown (Morecambe) Yellow Card at 88',2024-12-10 05:58:50
12716,708950,18,44356176,90'+1',Danny Rose (Grimsby Town) Goal at 91',2024-12-10 05:58:50
12716,708950,19,44356248,90'+3',Luca Barrington (Grimsby Town) Substitution at 93',2024-12-10 05:58:50
12716,708953,0,44351853,51',Jamille Matt (Walsall) Goal at 51',2024-12-10 05:58:50
12716,708953,1,44351907,56',Connor Barrett (Walsall) Yellow Card at 56',2024-12-10 05:58:50
12716,708953,2,44351931,59',David Okagbue (Walsall) Yellow Card at 59',2024-12-10 05:58:50
