seasonType,eventId,commentaryOrder,playId,clockDisplayValue,commentaryText,updateDateTime
12716,708872,3,44036174,62',Omar Bogle (Crewe Alexandra) Substitution at 62',2024-10-22 23:22:46
12716,708872,4,44036681,75',Ryan Broom (Fleetwood Town) Substitution at 75',2024-10-22 23:22:46
12716,708872,5,44036682,75',Elliott Bonds (Fleetwood Town) Substitution at 75',2024-10-22 23:22:46
12716,708872,6,44036833,80',Conor Thomas (Crewe Alexandra) Substitution at 80',2024-10-22 23:22:46
12716,708872,7,44036834,80',Kian Harratt (Fleetwood Town) Substitution at 80',2024-10-22 23:22:46
12716,708872,8,44037054,87',Ryan Cooney (Crewe Alexandra) Penalty - Scored at 87',2024-10-22 23:22:46
12716,708872,9,44037182,90',Kian Breckin (Crewe Alexandra) Substitution at 90',2024-10-22 23:22:46
12716,708873,0,44034274,3',Kelly N'Mai (Salford City) Goal at 3',2024-10-22 23:22:46
12716,708873,1,44034415,15',Thomas Edwards (Salford City) Yellow Card at 15',2024-10-22 23:22:46
12716,708873,2,44035298,39',George Cox (Swindon Town) Yellow Card at 39',2024-10-22 23:22:46
12716,708873,3,44035864,45',Kabongo Tshimanga (Swindon Town) Substitution at 45',2024-10-22 23:22:46
12716,708873,4,44035865,45',Rosaire Longelo (Swindon Town) Substitution at 45',2024-10-22 23:22:46
12716,708873,5,44035938,50',Harry Smith (Swindon Town) Goal at 50',2024-10-22 23:22:46
12716,708873,6,44036160,60',Jon Taylor (Salford City) Substitution at 60',2024-10-22 23:22:46
12716,708873,7,44036467,69',Jon Taylor (Salford City) Goal at 69',2024-10-22 23:22:46
12716,708873,8,44036529,70',Kylian Kouassi (Salford City) Substitution at 70',2024-10-22 23:22:46
12716,708873,9,44036530,70',Conor McAleny (Salford City) Substitution at 70',2024-10-22 23:22:46
12716,708873,10,44036725,76',Kylian Kouassi (Salford City) Yellow Card at 76',2024-10-22 23:22:46
12716,708873,11,44036872,80',Aaron Drinan (Swindon Town) Substitution at 80',2024-10-22 23:22:46
12716,708873,12,44037084,84',Sean Mcgurk (Swindon Town) Substitution at 84',2024-10-22 23:22:46
12716,708873,13,44037085,84',Grant Hall (Swindon Town) Substitution at 84',2024-10-25 05:18:47
12716,708873,14,44037445,90'+5',Matthew Lund (Salford City) Substitution at 95',2024-10-22 23:22:46
12716,708873,15,44037446,90'+5',Haji Mnoga (Salford City) Substitution at 95',2024-10-22 23:22:46
12716,708874,0,44034322,7',Rory Feely (Barrow) Goal at 7',2024-10-22 23:22:46
12716,708874,1,44034859,24',Rod McDonald (Notts County) Yellow Card at 24',2024-10-22 23:22:46
12716,708874,2,44035110,32',Jeavani Brown (Notts County) Substitution at 32',2024-10-22 23:22:46
12716,708874,3,44035111,32',Kellan Gordon (Notts County) Yellow Card at 32',2024-10-22 23:22:46
12716,708874,4,44035248,37',Robbie Gotts (Barrow) Yellow Card at 37',2024-10-22 23:22:46
12716,708874,5,44035455,43',Daniel Crowley (Notts County) Yellow Card at 43',2024-10-22 23:22:46
12716,708874,6,44036138,58',Jacob Bedeau (Notts County) Substitution at 58',2024-10-22 23:22:46
12716,708874,7,44036139,58',Josh Martin (Notts County) Substitution at 58',2024-10-22 23:22:46
12716,708874,8,44036202,60',Katia Kouyate (Barrow) Yellow Card at 60',2024-10-22 23:22:46
12716,708874,9,44037023,82',Dominic Telford (Barrow) Substitution at 82',2024-10-22 23:22:46
12716,708874,10,44037024,82',Neo Eccleston (Barrow) Substitution at 82',2024-10-22 23:22:46
12716,708874,11,44037025,82',Sam Foley (Barrow) Substitution at 82',2024-10-22 23:22:46
12716,708874,12,44037108,84',Nicholas Tsaroulla (Notts County) Yellow Card at 84',2024-10-22 23:22:46
12716,708874,13,44037290,90',Niall Canavan (Barrow) Substitution at 90',2024-10-22 23:22:46
12716,708874,14,44037381,90'+1',Ben Jackson (Barrow) Yellow Card at 91',2024-10-22 23:22:46
12716,708874,15,44037382,90'+3',David McGoldrick (Notts County) Penalty - Scored at 93',2024-10-22 23:22:46
12716,708875,0,44034295,5',Lewis Payne (Cheltenham Town) Yellow Card at 5',2024-10-22 23:22:46
12716,708875,1,44034323,8',Neill Byrne (Bradford City) Goal at 8',2024-10-22 23:22:46
12716,708875,2,44034425,15',Luke Young (Cheltenham Town) Goal at 15',2024-10-22 23:22:46
12716,708875,3,44034904,26',Joel Colwill (Cheltenham Town) Yellow Card at 26',2024-10-22 23:22:46
12716,708875,4,44035894,45',Ibrahim Bakare (Cheltenham Town) Substitution at 45',2024-10-22 23:22:46
12716,708875,5,44036539,71',Matt Taylor (Cheltenham Town) Substitution at 71',2024-10-22 23:22:46
12716,708875,6,44036540,71',Tyler Smith (Bradford City) Substitution at 71',2024-10-22 23:22:46
12716,708875,7,44036742,77',Ryan Bowman (Cheltenham Town) Substitution at 77',2024-10-22 23:22:46
12716,708875,8,44036887,82',Harrison Sohna (Cheltenham Town) Yellow Card at 82',2024-10-22 23:22:46
12716,708875,9,44036933,83',Cheick Diabate (Bradford City) Yellow Card at 83',2024-10-25 05:18:47
12716,708876,0,44034300,6',Jack Payne (Colchester United) Goal at 6',2024-10-22 23:22:46
12716,708876,1,44034374,11',Ben Goodliffe (Colchester United) Yellow Card at 11',2024-10-22 23:22:46
12716,708876,2,44036268,64',Will Grigg (Chesterfield) Goal at 64',2024-10-22 23:22:46
12716,708876,3,44036552,66',Liam Mandeville (Chesterfield) Substitution at 66',2024-10-25 05:18:47
12716,708876,4,44036360,67',Armando Dobra (Chesterfield) Substitution at 67',2024-10-25 05:18:47
12716,708876,5,44036361,67',Ryan Colclough (Chesterfield) Substitution at 67',2024-10-25 05:18:47
12716,708876,6,44036652,75',Jack Payne (Colchester United) Yellow Card at 75',2024-10-22 23:22:46
12716,708876,7,44036741,76',Harry Anderson (Colchester United) Substitution at 76',2024-10-22 23:22:46
12716,708876,8,44036839,79',Lyle Taylor (Colchester United) Substitution at 79',2024-10-25 05:18:47
12716,708876,9,44036840,80',Patrick Madden (Chesterfield) Substitution at 80',2024-10-22 23:22:46
12716,708876,10,44036902,80',Mandela Egbo (Colchester United) Substitution at 80',2024-10-22 23:22:46
12716,708876,11,44037150,88',Michael Jacobs (Chesterfield) Substitution at 88',2024-10-22 23:22:46
12716,708876,12,44037441,90'+6',Darren Oldaker (Chesterfield) Yellow Card at 96',2024-10-22 23:22:46
12716,708876,13,44037442,90'+6',Lyle Taylor (Colchester United) Yellow Card at 96',2024-10-22 23:22:46
12716,708876,14,44037443,90'+6',Armando Dobra (Chesterfield) Yellow Card at 96',2024-10-22 23:22:46
12716,708877,0,44034564,20',Ben Thompson (Bromley) Goal at 20',2024-10-22 23:22:46
12716,708877,1,44035487,42',Kamarl Grant (Bromley) Yellow Card at 42',2024-10-22 23:22:46
12716,708877,2,44035589,45'+3',Danny Imray (Bromley) Yellow Card at 48',2024-10-22 23:22:46
12716,708877,3,44036413,64',Billy Sharp (Doncaster Rovers) Substitution at 64',2024-10-22 23:22:46
12716,708877,4,44036414,64',Kyle Hurst (Doncaster Rovers) Substitution at 64',2024-10-22 23:22:46
12716,708877,5,44036621,71',Idris Odutayo (Bromley) Yellow Card at 71',2024-10-22 23:22:46
12716,708877,6,44036785,75',Ephraim Yeboah (Doncaster Rovers) Substitution at 75',2024-10-22 23:22:46
12716,708877,7,44036786,75',George Broadbent (Doncaster Rovers) Substitution at 75',2024-10-22 23:22:46
12716,708877,8,44036961,78',Carl Jenkinson (Bromley) Substitution at 78',2024-10-22 23:22:46
12716,708877,9,44036962,80',Carl Jenkinson (Bromley) Yellow Card at 80',2024-10-22 23:22:46
12716,708877,10,44037190,86',Jude Arthurs (Bromley) Substitution at 86',2024-10-22 23:22:46
12716,708877,11,44037191,86',Louis Dennis (Bromley) Substitution at 86',2024-10-22 23:22:46
12716,708877,12,44037273,90',Billy Sharp (Doncaster Rovers) Yellow Card at 90',2024-10-22 23:22:46
12716,708877,13,44042396,90'+5',Grant Smith (Bromley) Yellow Card at 95',2024-10-25 05:18:47
12716,708878,0,44034833,24',Luke McGee (Tranmere Rovers) Yellow Card at 24',2024-10-22 23:22:46
12716,708878,1,44035965,54',Danny Rose (Grimsby Town) Shot Off Target at 54',2024-10-22 23:22:46
12716,708878,2,44036025,59',Justin Obikwu (Grimsby Town) Goal at 59',2024-10-22 23:22:46
12716,708878,3,44036266,66',Cameron Gardner (Grimsby Town) Substitution at 66',2024-10-22 23:22:46
12716,708878,4,44036334,69',Jackson Smith (Grimsby Town) Yellow Card at 69',2024-10-22 23:22:46
12716,708878,5,44036477,73',Lee O'Connor (Tranmere Rovers) Yellow Card at 73',2024-10-22 23:22:46
12716,708878,6,44036578,74',Harvey Saunders (Tranmere Rovers) Substitution at 74',2024-10-22 23:22:46
12716,708878,7,44036579,74',Josh Hawkes (Tranmere Rovers) Substitution at 74',2024-10-22 23:22:46
12716,708878,8,44036590,76',Tyrell Warren (Grimsby Town) Yellow Card at 76',2024-10-22 23:22:46
12716,708878,9,44036685,78',Connor Jennings (Tranmere Rovers) Substitution at 78',2024-10-22 23:22:46
12716,708878,10,44036759,79',George McEachran (Grimsby Town) Substitution at 79',2024-10-22 23:22:46
12716,708878,11,44036760,80',Jordan Turnbull (Tranmere Rovers) Yellow Card at 80',2024-10-22 23:22:46
12716,708878,12,44036836,82',Luke Norris (Tranmere Rovers) Yellow Card at 82',2024-10-22 23:22:46
12716,708878,13,44037346,86',Lewis Cass (Grimsby Town) Substitution at 86',2024-10-22 23:22:46
12716,708878,14,44037176,90'+1',Regan Hendry (Tranmere Rovers) Substitution at 91',2024-10-22 23:22:46
12716,708878,15,44037219,90'+3',Tom Davies (Tranmere Rovers) Yellow Card at 93',2024-10-22 23:22:46
12716,708878,16,44037347,90'+5',Regan Hendry (Tranmere Rovers) Yellow Card at 95',2024-10-22 23:22:46
12716,708879,0,44034256,2',Nathan Lowe (Walsall) Goal at 2',2024-10-22 23:22:46
12716,708879,1,44034775,22',Terell Thomas (Carlisle United) Yellow Card at 22',2024-10-22 23:22:46
12716,708879,2,44035472,44',Jamie Jellis (Walsall) Yellow Card at 44',2024-10-22 23:22:46
12716,708879,3,44035820,45',Dominic Sadi (Carlisle United) Substitution at 45',2024-10-22 23:22:46
12716,708879,4,44035902,49',Jamie Jellis (Walsall) Goal at 49',2024-10-22 23:22:46
12716,708879,5,44035960,53',Jamille Matt (Walsall) Yellow Card at 53',2024-10-22 23:22:46
12716,708879,6,44035998,55',Sam Lavelle (Carlisle United) Yellow Card at 55',2024-10-22 23:22:46
12716,708879,7,44036019,56',Jamille Matt (Walsall) Goal at 56',2024-10-22 23:22:46
12716,708879,8,44036113,60',Tyler Burey (Carlisle United) Substitution at 60',2024-10-22 23:22:46
12716,708879,9,44036114,60',Ethan Robson (Carlisle United) Substitution at 60',2024-10-22 23:22:46
12716,708879,10,44036115,60',Taylor Charters (Carlisle United) Substitution at 60',2024-10-22 23:22:46
12716,708879,11,44036116,61',Albert Adomah (Walsall) Substitution at 61',2024-10-22 23:22:46
12716,708879,12,44036117,61',Jack Earing (Walsall) Substitution at 61',2024-10-22 23:22:46
12716,708879,13,44036526,71',Ben Barclay (Carlisle United) Substitution at 71',2024-10-22 23:22:46
12716,708879,14,44036527,72',Brandon Comley (Walsall) Substitution at 72',2024-10-22 23:22:46
12716,708879,15,44036528,72',George Hall (Walsall) Substitution at 72',2024-10-22 23:22:46
12716,708879,16,44036758,79',Danny Johnson (Walsall) Substitution at 79',2024-10-22 23:22:46
12716,708879,17,44036838,82',Jon Mellish (Carlisle United) Goal at 82',2024-10-22 23:22:46
12716,708880,0,44034247,1',Alex Gilbey (Milton Keynes Dons) Goal at 1',2024-10-22 23:22:46
12716,708880,1,44035160,35',Alex Gilbey (Milton Keynes Dons) Yellow Card at 35',2024-10-22 23:22:46
12716,708880,2,44035420,43',Shaun Whalley (Accrington Stanley) Yellow Card at 43',2024-10-22 23:22:46
12716,708880,3,44035896,45',Thomas Carroll (Milton Keynes Dons) Substitution at 45',2024-10-22 23:22:46
12716,708880,4,44035968,52',Liam Coyle (Accrington Stanley) Yellow Card at 52',2024-10-22 23:22:46
12716,708880,5,44036056,58',Joseph Tomlinson (Milton Keynes Dons) Goal at 58',2024-10-22 23:22:46
12716,708880,6,44036109,59',Josh Woods (Accrington Stanley) Substitution at 59',2024-10-22 23:22:46
12716,708880,7,44036110,59',Tyler Walton (Accrington Stanley) Substitution at 59',2024-10-22 23:22:46
12716,708880,8,44036111,59',Donald Love (Accrington Stanley) Substitution at 59',2024-10-22 23:22:46
12716,708880,9,44036287,65',Ellis Harrison (Milton Keynes Dons) Substitution at 65',2024-10-22 23:22:46
12716,708880,10,44036347,67',Josh Woods (Accrington Stanley) Goal at 67',2024-10-22 23:22:46
12716,708880,11,44036507,72',Jake Batty (Accrington Stanley) Yellow Card at 72',2024-10-22 23:22:46
12716,708880,12,44036547,72',Joseph Tomlinson (Milton Keynes Dons) Yellow Card at 72',2024-10-22 23:22:46
12716,708880,13,44036571,73',Dean Lewington (Milton Keynes Dons) Yellow Card at 73',2024-10-22 23:22:46
12716,708880,14,44036684,75',Jordan Williams (Milton Keynes Dons) Substitution at 75',2024-10-22 23:22:46
12716,708880,15,44036686,75',Ashley Hunter (Accrington Stanley) Substitution at 75',2024-10-22 23:22:46
12716,708880,16,44036842,80',Alex Henderson (Accrington Stanley) Substitution at 80',2024-10-22 23:22:46
12716,708880,17,44036843,81',Donald Love (Accrington Stanley) Yellow Card at 81',2024-10-22 23:22:46
12716,708880,18,44036884,82',Farrend Rawson (Accrington Stanley) Yellow Card at 82',2024-10-22 23:22:46
12716,708880,19,44037046,86',Luke Offord (Milton Keynes Dons) Yellow Card at 86',2024-10-22 23:22:46
12716,708880,20,44037291,90'+3',Ashley Hunter (Accrington Stanley) Yellow Card at 93',2024-10-22 23:22:46
12716,708880,21,44037474,90'+7',Dean Lewington (Milton Keynes Dons) Substitution at 97',2024-10-22 23:22:46
12716,708881,0,44035962,53',Jasper Moon (Harrogate Town) Yellow Card at 53',2024-10-22 23:22:46
12716,708881,1,44035963,54',Ruari Paton (Port Vale) Goal at 54',2024-10-22 23:22:46
12716,708881,2,44036195,63',Sam Folarin (Harrogate Town) Substitution at 63',2024-10-22 23:22:46
12716,708881,3,44036280,66',Jayden Stockley (Port Vale) Substitution at 66',2024-10-22 23:22:46
12716,708881,4,44036281,66',Antwoine Hackford (Port Vale) Substitution at 66',2024-10-22 23:22:46
12716,708881,5,44036416,69',Stephen Duke-McKenna (Harrogate Town) Substitution at 69',2024-10-22 23:22:46
12716,708881,6,44036576,74',Brandon Cover (Port Vale) Substitution at 74',2024-10-22 23:22:46
12716,708881,7,44036705,78',Ronan Curtis (Port Vale) Yellow Card at 78',2024-10-22 23:22:46
12716,708881,8,44036976,85',Zico Asare (Harrogate Town) Substitution at 85',2024-10-22 23:22:46
12716,708881,9,44036977,85',Joshua Falkingham (Harrogate Town) Substitution at 85',2024-10-22 23:22:46
12716,708881,10,44037166,89',Brandon Cover (Port Vale) Yellow Card at 89',2024-10-22 23:22:46
12716,708882,0,44034446,16',Max Clark (Gillingham) Yellow Card at 16',2024-10-22 23:22:46
12716,708882,1,44034448,16',Matthew Baker (Newport County) Goal at 16',2024-10-22 23:22:46
12716,708882,2,44034768,21',Jonny Williams (Gillingham) Substitution at 21',2024-10-22 23:22:46
12716,708882,3,44034860,24',Ciaran Brennan (Newport County) Yellow Card at 24',2024-10-22 23:22:46
12716,708882,4,44035084,33',Kyle Hudlin (Newport County) Goal at 33',2024-10-22 23:22:46
12716,708882,5,44035216,36',Ethan Coleman (Gillingham) Yellow Card at 36',2024-10-22 23:22:46
12716,708882,6,44035926,45',Kai Whitmore (Newport County) Substitution at 45',2024-10-22 23:22:46
12716,708882,7,44035949,49',Kyle Jameson (Newport County) Yellow Card at 49',2024-10-22 23:22:46
12716,708882,8,44036166,60',Kieron Evans (Newport County) Substitution at 60',2024-10-22 23:22:46
12716,708882,9,44036169,60',Courtney Baker-Richardson (Newport County) Substitution at 60',2024-10-22 23:22:46
12716,708882,10,44036263,62',Shadrach Ogie (Gillingham) Substitution at 62',2024-10-22 23:22:46
12716,708882,11,44036264,62',Joseph Gbode (Gillingham) Substitution at 62',2024-10-22 23:22:46
12716,708882,12,44036265,63',Oliver Hawkins (Gillingham) Substitution at 63',2024-10-22 23:22:46
12716,708882,13,44036596,70',Cameron Antwi (Newport County) Substitution at 70',2024-10-22 23:22:46
12716,708882,14,44036736,75',Jacob Wakeling (Gillingham) Substitution at 75',2024-10-22 23:22:46
12716,708882,15,44036918,81',Michael Spellman (Newport County) Substitution at 81',2024-10-22 23:22:46
12716,708883,0,44063495,56',Arthur Read (Colchester United) Substitution at 56',2024-10-27 05:19:50
12716,708883,1,44063496,57',Harry Anderson (Colchester United) Substitution at 57',2024-10-27 05:19:50
12716,708883,2,44063533,61',Kelly N'Mai (Salford City) Goal at 61',2024-10-27 05:19:50
12716,708883,3,44063599,66',Mandela Egbo (Colchester United) Substitution at 66',2024-10-27 05:19:50
12716,708883,4,44063600,66',Anthony Scully (Colchester United) Substitution at 66',2024-10-27 05:19:50
12716,708883,5,44063601,68',Jon Taylor (Salford City) Substitution at 68',2024-10-27 05:19:50
12716,708883,6,44063602,68',Matthew Lund (Salford City) Substitution at 68',2024-10-27 05:19:50
12716,708883,7,44063606,70',Harry Anderson (Colchester United) Goal at 70',2024-10-27 05:19:50
12716,708883,8,44063669,76',Kylian Kouassi (Salford City) Goal at 76',2024-10-27 05:19:50
12716,708883,9,44063693,79',Stephan Negru (Salford City) Substitution at 79',2024-10-27 05:19:50
12716,708883,10,44063866,89',Francis Okoronkwo (Salford City) Substitution at 89',2024-10-27 05:19:50
12716,708883,11,44063867,90',Junior Luamba (Salford City) Substitution at 90',2024-10-27 05:19:50
12716,708884,0,44064946,17',Katia Kouyate (Barrow) Yellow Card at 17',2024-10-27 05:19:50
12716,708884,1,44064966,21',Gerard Garner (Barrow) Goal at 21',2024-10-27 05:19:50
12716,708884,2,44066351,45',Louis Dennis (Bromley) Substitution at 45',2024-10-27 05:19:50
12716,708884,3,44066352,45',Cameron Congreve (Bromley) Substitution at 45',2024-10-27 05:19:50
12716,708884,4,44066353,45',Michael Cheek (Bromley) Substitution at 45',2024-10-27 05:19:50
12716,708884,5,44066383,47',Ben Thompson (Bromley) Yellow Card at 47',2024-10-27 05:19:50
12716,708884,6,44067188,64',Sam Foley (Barrow) Substitution at 64',2024-10-27 05:19:50
12716,708884,7,44067189,64',Connor Mahoney (Barrow) Substitution at 64',2024-10-27 05:19:50
12716,708884,8,44067693,75',Carl Jenkinson (Bromley) Substitution at 75',2024-10-27 05:19:50
12716,708884,9,44068187,84',Kamarl Grant (Bromley) Yellow Card at 84',2024-10-27 05:19:50
12716,708884,10,44068188,85',Gerard Garner (Barrow) Yellow Card at 85',2024-10-27 05:19:50
12716,708884,11,44068234,85',Chris Stokes (Barrow) Substitution at 85',2024-10-27 05:19:50
12716,708884,12,44068235,85',Rory Feely (Barrow) Yellow Card at 85',2024-10-27 05:19:50
12716,708884,13,44068290,86',Chris Stokes (Barrow) Yellow Card at 86',2024-10-27 05:19:50
12716,708884,14,44088258,88',Luke Daniels (Barrow) Yellow Card at 88',2024-10-29 05:21:26
12716,708884,15,44068509,90'+1',Michael Cheek (Bromley) Penalty - Scored at 91',2024-10-29 05:21:26
12716,708885,0,44064470,6',Billy Sharp (Doncaster Rovers) Yellow Card at 6',2024-10-27 05:19:50
12716,708885,1,44065663,6',Jack Shepherd (Bradford City) Yellow Card at 6',2024-10-27 05:19:50
12716,708885,2,44064745,13',Kyle Hurst (Doncaster Rovers) Yellow Card at 13',2024-10-27 05:19:50
12716,708885,3,44065512,36',James Maxwell (Doncaster Rovers) Yellow Card at 36',2024-10-27 05:19:50
12716,708885,4,44066147,36',Cheick Diabate (Bradford City) Yellow Card at 36',2024-10-31 05:23:49
12716,708885,5,44066862,57',Luke Molyneux (Doncaster Rovers) Goal at 57',2024-10-27 05:19:50
12716,708885,6,44067309,66',Billy Sharp (Doncaster Rovers) Goal at 66',2024-10-27 05:19:50
12716,708885,7,44067764,73',Calum Kavanagh (Bradford City) Substitution at 73',2024-10-27 05:19:50
12716,708885,8,44067765,73',Brad Halliday (Bradford City) Substitution at 73',2024-10-27 05:19:50
12716,708885,9,44067766,73',Lewis Richards (Bradford City) Substitution at 73',2024-10-27 05:19:50
12716,708885,10,44067767,73',Vadaine Oliver (Bradford City) Substitution at 73',2024-10-27 05:19:50
12716,708885,11,44067768,74',Corry Evans (Bradford City) Substitution at 74',2024-10-27 05:19:50
12716,708885,12,44068115,81',Brandon Fleming (Doncaster Rovers) Substitution at 81',2024-10-27 05:19:50
12716,708885,13,44068116,82',Harry Clifton (Doncaster Rovers) Substitution at 82',2024-10-27 05:19:50
12716,708885,14,44068122,83',Andy Cook (Bradford City) Goal at 83',2024-10-27 05:19:50
12716,708885,15,44068299,86',Harry Clifton (Doncaster Rovers) Yellow Card at 86',2024-10-31 05:23:49
12716,708885,16,44068529,90',Patrick Kelly (Doncaster Rovers) Substitution at 90',2024-10-27 05:19:50
12716,708885,17,44068530,90',Joe Ironside (Doncaster Rovers) Substitution at 90',2024-10-27 05:19:50
12716,708885,18,44068742,90'+5',Calum Kavanagh (Bradford City) Yellow Card at 95',2024-10-27 05:19:50
12716,708885,19,44068743,90'+5',George Broadbent (Doncaster Rovers) Yellow Card at 95',2024-10-31 05:23:49
12716,708886,0,44066738,54',Donald Love (Accrington Stanley) Yellow Card at 54',2024-10-27 05:19:50
12716,708886,1,44067332,66',Jack Earing (Walsall) Substitution at 66',2024-10-27 05:19:50
12716,708886,2,44067612,72',Jimmy Knowles (Accrington Stanley) Substitution at 72',2024-10-27 05:19:50
12716,708886,3,44068232,84',Danny Johnson (Walsall) Substitution at 84',2024-10-27 05:19:50
12716,708886,4,44068332,86',Josh Woods (Accrington Stanley) Substitution at 86',2024-10-27 05:19:50
12716,708887,0,44064552,9',Grant Hall (Swindon Town) Red Card at 9',2024-10-27 05:19:50
12716,708887,1,44064822,16',Thimothee Dieng (Gillingham) Goal at 16',2024-10-27 05:19:50
12716,708887,2,44064982,21',Miguel Freckleton (Swindon Town) Substitution at 21',2024-10-27 05:19:50
12716,708887,3,44066124,45'+6',Ollie Clarke (Swindon Town) Yellow Card at 51',2024-10-27 05:19:50
12716,708887,4,44067008,56',Rosaire Longelo (Swindon Town) Substitution at 56',2024-10-27 05:19:50
12716,708887,5,44067009,56',Harrison Minturn (Swindon Town) Substitution at 56',2024-10-27 05:19:50
12716,708887,6,44067216,61',Euan Williams (Gillingham) Yellow Card at 61',2024-10-27 05:19:50
12716,708887,7,44067565,67',Armani Little (Gillingham) Substitution at 67',2024-10-27 05:19:50
12716,708887,8,44067566,68',Marcus Wyllie (Gillingham) Substitution at 68',2024-10-27 05:19:50
12716,708887,9,44067685,70',Kabongo Tshimanga (Swindon Town) Substitution at 70',2024-10-27 05:19:50
12716,708887,10,44067686,70',Joel Cotterill (Swindon Town) Substitution at 70',2024-10-27 05:19:50
12716,708887,11,44068124,78',Jonny Williams (Gillingham) Substitution at 78',2024-10-27 05:19:50
12716,708887,12,44068265,81',Oliver Hawkins (Gillingham) Yellow Card at 81',2024-10-27 05:19:50
12716,708887,13,44068410,83',Josh Andrews (Gillingham) Substitution at 83',2024-10-27 05:19:50
12716,708887,14,44068812,90'+3',Harry Smith (Swindon Town) Goal at 93',2024-10-27 05:19:50
12716,708888,0,44064886,17',Ethon Archer (Cheltenham Town) Goal at 17',2024-10-27 05:19:50
12716,708888,1,44065243,29',Sam Stubbs (Cheltenham Town) Yellow Card at 29',2024-10-27 05:19:50
12716,708888,2,44066322,45',Charlie Wyke (Carlisle United) Substitution at 45',2024-10-27 05:19:50
12716,708888,3,44066354,46',Ethan Robson (Carlisle United) Yellow Card at 46',2024-10-27 05:19:50
12716,708888,4,44066704,55',Luke Young (Cheltenham Town) Yellow Card at 55',2024-10-27 05:19:50
12716,708888,5,44066973,60',Harrison Neal (Carlisle United) Substitution at 60',2024-10-27 05:19:50
12716,708888,6,44066974,60',Jon Mellish (Carlisle United) Substitution at 60',2024-10-27 05:19:50
12716,708888,7,44066975,60',Tyler Burey (Carlisle United) Substitution at 60',2024-10-27 05:19:50
12716,708888,8,44067455,69',Harrison Neal (Carlisle United) Yellow Card at 69',2024-10-27 05:19:50
12716,708888,9,44067581,73',Thomas Pett (Cheltenham Town) Substitution at 73',2024-10-27 05:19:50
12716,708888,10,44068046,82',Jon Mellish (Carlisle United) Yellow Card at 82',2024-10-27 05:19:50
12716,708888,11,44068117,83',Dominic Sadi (Carlisle United) Yellow Card at 83',2024-10-29 05:21:26
12716,708888,12,44068183,85',Ibrahim Bakare (Cheltenham Town) Substitution at 85',2024-10-27 05:19:50
12716,708888,13,44068408,89',Joel Colwill (Cheltenham Town) Substitution at 89',2024-10-27 05:19:50
12716,708888,14,44068409,89',Ryan Bowman (Cheltenham Town) Substitution at 89',2024-10-27 05:19:50
12716,708888,15,44068552,90'+1',Lewis Payne (Cheltenham Town) Yellow Card at 91',2024-10-27 05:19:50
12716,708888,16,44068741,90'+6',Joshua Vela (Carlisle United) Substitution at 96',2024-10-27 05:19:50
12716,708889,0,44066874,58',Alassana Jatta (Notts County) Goal at 58',2024-10-27 05:19:50
12716,708889,1,44067449,69',Kellan Gordon (Notts County) Substitution at 69',2024-10-27 05:19:50
12716,708889,2,44067450,69',James Daly (Harrogate Town) Substitution at 69',2024-10-27 05:19:50
12716,708889,3,44067549,72',Sam Folarin (Harrogate Town) Yellow Card at 72',2024-10-27 05:19:50
12716,708889,4,44067800,76',Jack Hinchy (Notts County) Substitution at 76',2024-10-27 05:19:50
12716,708889,5,44067801,76',Jack Muldoon (Harrogate Town) Substitution at 76',2024-10-27 05:19:50
12716,708889,6,44067802,76',Levi Sutton (Harrogate Town) Substitution at 76',2024-10-27 05:19:50
12716,708889,7,44067982,80',Warren Burrell (Harrogate Town) Substitution at 80',2024-10-27 05:19:50
12716,708889,8,44068075,83',Matty Daly (Harrogate Town) Yellow Card at 83',2024-10-27 05:19:50
12716,708889,9,44068369,88',Nicholas Tsaroulla (Notts County) Yellow Card at 88',2024-10-27 05:19:50
12716,708890,0,44065062,24',David Harrington (Fleetwood Town) Yellow Card at 24',2024-10-27 05:19:50
12716,708890,1,44065063,25',Bryn Morris (Newport County) Penalty - Saved at 25',2024-11-25 16:11:24
12716,708890,2,44065471,36',Matthew Virtue-Thick (Fleetwood Town) Yellow Card at 36',2024-10-27 05:19:50
12716,708890,3,44066075,45'+4',Jamie Miley (Newport County) Yellow Card at 49',2024-10-27 05:19:50
12716,708890,4,44067605,68',Kieron Evans (Newport County) Substitution at 68',2024-10-27 05:19:50
12716,708890,5,44067809,70',Ronan Coughlan (Fleetwood Town) Substitution at 70',2024-10-27 05:19:50
12716,708890,6,44067810,71',Tom Lonergan (Fleetwood Town) Substitution at 71',2024-10-27 05:19:50
12716,708890,7,44067811,71',Liam Shaw (Fleetwood Town) Substitution at 71',2024-10-27 05:19:50
12716,708890,8,44067860,74',Danny Mayor (Fleetwood Town) Yellow Card at 74',2024-10-27 05:19:50
12716,708890,9,44068091,77',Courtney Baker-Richardson (Newport County) Substitution at 77',2024-10-27 05:19:50
12716,708890,10,44068092,77',Kai Whitmore (Newport County) Substitution at 77',2024-10-29 05:21:26
