seasonType,eventId,commentaryOrder,playId,clockDisplayValue,commentaryText,updateDateTime
12565,711080,10,43927799,71',Ovidiu Perianu (Unirea Slobozia) Substitution at 71',2024-10-07 05:35:45
12565,711080,11,43928020,75',Razvan Oaida (Universitatea Cluj) Substitution at 75',2024-10-07 05:35:45
12565,711080,12,43928021,76',Gabriel Simion (Universitatea Cluj) Substitution at 76',2024-10-07 05:35:45
12565,711080,13,43928227,78',Florian Purece (Unirea Slobozia) Substitution at 78',2024-10-07 05:35:45
12565,711080,14,43928228,80',Alexandru Chipciu (Universitatea Cluj) Yellow Card at 80',2024-10-07 05:35:45
12565,711080,15,43928799,89',Vladislav Blanuta (Universitatea Cluj) Yellow Card at 89',2024-10-07 05:35:45
12565,711081,0,44011883,40',Peter Godly Michael (CFR Cluj-Napoca) Yellow Card at 40',2024-10-20 11:07:54
12565,711081,1,44012103,45',Louis Munteanu (CFR Cluj-Napoca) Substitution at 45',2024-10-20 11:07:54
12565,711081,2,44012320,57',Herman Moussaki (Petrolul Ploiesti) Substitution at 57',2024-10-20 11:07:54
12565,711081,3,44012361,59',Tommi Jyry (Petrolul Ploiesti) Yellow Card at 59',2024-10-20 11:07:54
12565,711081,4,44012564,68',Constantin Paun-Alexandru (CFR Cluj-Napoca) Substitution at 68',2024-10-20 11:07:54
12565,711081,5,44012604,70',Sergiu Hanca (Petrolul Ploiesti) Yellow Card at 70',2024-10-20 11:07:54
12565,711081,6,44012651,73',Denis Radu (Petrolul Ploiesti) Substitution at 73',2024-10-20 11:07:54
12565,711081,7,44012684,74',Louis Munteanu (CFR Cluj-Napoca) Yellow Card at 74',2024-10-20 11:07:54
12565,711081,8,44012839,83',Virgiliu Postolachi (CFR Cluj-Napoca) Substitution at 83',2024-10-20 11:07:54
12565,711081,9,44012885,85',Alexandru Mateiu (Petrolul Ploiesti) Substitution at 85',2024-10-20 11:07:54
12565,711081,10,44012944,88',Paul Papp (Petrolul Ploiesti) Yellow Card at 88',2024-10-20 11:07:54
12565,711081,11,44013020,90'+4',Andrei Artean (CFR Cluj-Napoca) Substitution at 94',2024-10-20 11:07:54
12565,711082,0,44025505,26',Daniel Birligea (FCSB) Goal at 26',2024-10-21 05:15:20
12565,711082,1,44025622,43',Octavian Popescu (FCSB) Yellow Card at 43',2024-10-21 05:15:20
12565,711082,2,44025906,45',Baba Alhassan (FCSB) Substitution at 45',2024-10-21 05:15:20
12565,711082,3,44026032,54',Hakim Abdallah (Dinamo Bucuresti) Substitution at 54',2024-10-21 05:15:20
12565,711082,4,44026181,64',Dennis Politic (Dinamo Bucuresti) Yellow Card at 64',2024-10-21 05:15:20
12565,711082,5,44026293,71',Daniel Birligea (FCSB) Yellow Card at 71',2024-10-21 05:15:20
12565,711082,6,44026294,72',Darius Olaru (FCSB) Yellow Card at 72',2024-10-21 05:15:20
12565,711082,7,44026324,74',Cristian Costin (Dinamo Bucuresti) Substitution at 74',2024-10-21 05:15:20
12565,711082,8,44026325,75',Iulius Marginean (Dinamo Bucuresti) Substitution at 75',2024-10-21 05:15:20
12565,711082,9,44026326,75',Ahmed Bani (Dinamo Bucuresti) Substitution at 75',2024-10-21 05:15:20
12565,711082,10,44026340,76',Valentin Cretu (FCSB) Yellow Card at 76',2024-10-21 05:15:20
12565,711082,11,44026373,79',Marius Stefanescu (FCSB) Substitution at 79',2024-10-21 05:15:20
12565,711082,12,44026439,82',Malcom Sylas Edjomou (FCSB) Substitution at 82',2024-10-21 05:15:20
12565,711082,13,44026440,83',Luis Phelipe (FCSB) Substitution at 83',2024-10-24 01:17:06
12565,711082,14,44026441,84',Antonio Luna (Dinamo Bucuresti) Substitution at 84',2024-10-21 05:15:20
12565,711082,15,44026517,88',Alexandru Marian (FCSB) Substitution at 88',2024-10-21 05:15:20
12565,711082,16,44026534,90'+3',Alexandru Marian (FCSB) Goal at 93',2024-10-21 05:15:20
12565,711083,0,43997962,45'+2',Constantin Budescu (Gloria Buzau) Penalty - Scored at 47',2024-10-19 05:15:42
12565,711083,1,43997981,45',Dario Canadjija (Gloria Buzau) Substitution at 45',2024-10-19 05:15:42
12565,711083,2,43997982,45',Sergiu Pîrvulescu (Gloria Buzau) Substitution at 45',2024-10-19 05:15:42
12565,711083,3,43997983,48',Antoni Ivanov (Hermannstadt) Yellow Card at 48',2024-10-19 05:15:42
12565,711083,4,43997994,53',Grigore Ioan Turda (Gloria Buzau) Substitution at 53',2024-10-19 05:15:42
12565,711083,5,43997995,54',Antoni Ivanov (Hermannstadt) Red Card at 54',2024-10-19 05:15:42
12565,711083,6,43998002,60',Ianis Stoica (Hermannstadt) Substitution at 60',2024-10-19 05:15:42
12565,711083,7,43998003,61',Aurelian Chitu (Hermannstadt) Substitution at 61',2024-10-19 05:15:42
12565,711083,8,43998004,64',Vahid Selimovic (Hermannstadt) Yellow Card at 64',2024-10-19 05:15:42
12565,711083,9,43998005,67',David Tavares (Gloria Buzau) Substitution at 67',2024-10-19 05:15:42
12565,711083,10,43998006,68',Alessandro Ciranni (Gloria Buzau) Yellow Card at 68',2024-10-19 05:15:42
12565,711083,11,43998008,71',Constantin Budescu (Gloria Buzau) Goal at 71',2024-10-19 05:15:42
12565,711083,12,43998009,73',Valerica Gaman (Hermannstadt) Substitution at 73',2024-10-19 05:15:42
12565,711083,13,43998010,73',Iancu Petru Dragos (Hermannstadt) Substitution at 73',2024-10-19 05:15:42
12565,711083,14,43998015,78',Nana Kwame Antwi (Hermannstadt) Substitution at 78',2024-10-19 05:15:42
12565,711083,15,43998016,79',Silviu Balaure (Hermannstadt) Red Card at 79',2024-10-19 05:15:42
12565,711083,16,43998019,82',Ricardo Matos (Gloria Buzau) Substitution at 82',2024-10-19 05:15:42
12565,711083,17,43998021,89',David Lazar (Gloria Buzau) Yellow Card at 89',2024-10-19 05:15:42
12565,711083,18,43998022,90'+1',Alessandro Murgia (Hermannstadt) Yellow Card at 91',2024-10-19 05:15:42
12565,711083,19,43998023,90'+3',David Tavares (Gloria Buzau) Yellow Card at 93',2024-10-19 05:15:42
12565,711083,20,43998025,90'+4',Ricardo Matos (Gloria Buzau) Goal at 94',2024-10-19 05:15:42
12565,711084,0,44030121,24',Andrei Cosmin Gheorghita (Politehnica Iasi) Goal at 24',2024-10-22 23:22:46
12565,711084,1,44030172,36',Paolo Medina (Unirea Slobozia) Yellow Card at 36',2024-10-22 23:22:46
12565,711084,2,44030306,45',Ovidiu Perianu (Unirea Slobozia) Substitution at 45',2024-10-22 23:22:46
12565,711084,3,44030308,45',Florian Purece (Unirea Slobozia) Substitution at 45',2024-10-22 23:22:46
12565,711084,4,44030378,57',Andrei-Cristian Dorobantu (Unirea Slobozia) Substitution at 57',2024-10-22 23:22:46
12565,711084,5,44030409,65',Sékou Amadou Camara (Unirea Slobozia) Substitution at 65',2024-10-22 23:22:46
12565,711084,6,44030413,67',Tailson  (Politehnica Iasi) Substitution at 67',2024-10-22 23:22:46
12565,711084,7,44030415,70',Rares Ispas (Politehnica Iasi) Yellow Card at 70',2024-10-22 23:22:46
12565,711084,8,44030436,78',Julián Marchio (Politehnica Iasi) Substitution at 78',2024-10-22 23:22:46
12565,711084,9,44030437,79',Stefan Stefanovici (Politehnica Iasi) Substitution at 79',2024-10-22 23:22:46
12565,711084,10,44030438,79',Filip Ilie (Unirea Slobozia) Substitution at 79',2024-10-24 01:17:06
12565,711084,11,44030561,90'+11',Florin Ilie (Politehnica Iasi) Substitution at 101',2024-10-22 23:22:46
12565,711084,12,44030574,90'+15',Nicolas Samayoa (Politehnica Iasi) Yellow Card at 105',2024-10-22 23:22:46
12565,711084,13,44030583,90'+16',Constantin Toma (Unirea Slobozia) Shot Off Target at 106',2024-10-22 23:22:46
12565,711085,0,44022168,60',Alexandru Cicaldau (CSU Craiova) Substitution at 60',2024-10-21 05:15:20
12565,711085,1,44022169,60',Lyes Houri (CSU Craiova) Substitution at 60',2024-10-21 05:15:20
12565,711085,2,44022170,61',Zoran Mitrov (FC Botosani) Substitution at 61',2024-10-21 05:15:20
12565,711085,3,44022344,71',Stefan Bana (CSU Craiova) Substitution at 71',2024-10-21 05:15:20
12565,711085,4,44022345,71',Andrei Ivan (CSU Craiova) Substitution at 71',2024-10-21 05:15:20
12565,711085,5,44022401,74',Lóránd-Levente Fülöp (FC Botosani) Substitution at 74',2024-10-21 05:15:20
12565,711085,6,44022458,78',Zoran Mitrov (FC Botosani) Yellow Card at 78',2024-10-21 05:15:20
12565,711085,7,44022552,82',Alejandro Díez Salomon (FC Botosani) Substitution at 82',2024-10-21 05:15:20
12565,711085,8,44022553,82',David Eugen Gabriel (FC Botosani) Substitution at 82',2024-10-21 05:15:20
12565,711085,9,44022554,83',Patricio Matricardi (FC Botosani) Substitution at 83',2024-10-21 05:15:20
12565,711085,10,44022724,89',Alejandro Díez Salomon (FC Botosani) Yellow Card at 89',2024-10-21 05:15:20
12565,711086,0,43998113,16',Daniel Lasure (Universitatea Cluj) Yellow Card at 16',2024-10-19 05:15:42
12565,711086,1,43998416,45',Vladislav Blanuta (Universitatea Cluj) Substitution at 45',2024-10-19 05:15:42
12565,711086,2,43998417,45',Hildeberto Pereira (Universitatea Cluj) Substitution at 45',2024-10-19 05:15:42
12565,711086,3,43998528,55',Vasilije Duric (Otelul Galati) Substitution at 55',2024-10-19 05:15:42
12565,711086,4,43998529,56',Ovidiu Bic (Universitatea Cluj) Yellow Card at 56',2024-10-19 05:15:42
12565,711086,5,43998593,61',Dan Nistor (Universitatea Cluj) Penalty - Scored at 61',2024-10-19 05:15:42
12565,711086,6,43998707,68',Mihai Adascalitei (Otelul Galati) Substitution at 68',2024-10-19 05:15:42
12565,711086,7,43998708,68',Razvan Tanasa (Otelul Galati) Substitution at 68',2024-10-19 05:15:42
12565,711086,8,43998709,69',Mamadou Thiam (Universitatea Cluj) Goal at 69',2024-10-19 05:15:42
12565,711086,9,43998808,78',Martin Angha (Otelul Galati) Substitution at 78',2024-10-19 05:15:42
12565,711086,10,43998809,78',Nelut Rosu (Otelul Galati) Substitution at 78',2024-10-19 05:15:42
12565,711086,11,43998838,80',Dorin Marian Codrea (Universitatea Cluj) Substitution at 80',2024-10-19 05:15:42
12565,711086,12,43998905,85',Martin Angha (Otelul Galati) Yellow Card at 85',2024-10-19 05:15:42
12565,711086,13,43998952,89',Alexandru Bota (Universitatea Cluj) Substitution at 89',2024-10-19 05:15:42
12565,711086,14,43998986,90'+4',Razvan Oaida (Universitatea Cluj) Substitution at 94',2024-10-19 05:15:42
12565,711087,0,44009841,44',Cosmin Matei (Sepsi Sfantu Gheorghe) Goal at 44',2024-10-20 11:07:54
12565,711087,1,44010063,45',Ioan Andrei Vasile Dumiter (UTA Arad) Substitution at 45',2024-10-20 11:07:54
12565,711087,2,44010064,45',Kouya Aristide Mabea (UTA Arad) Substitution at 45',2024-10-20 11:07:54
12565,711087,3,44010076,45',Andrej Fabry (UTA Arad) Substitution at 45',2024-10-20 11:07:54
12565,711087,4,44010267,61',Isnik Alimi (Sepsi Sfantu Gheorghe) Substitution at 61',2024-10-20 11:07:54
12565,711087,5,44010268,61',Darius Oroian (Sepsi Sfantu Gheorghe) Substitution at 61',2024-10-20 11:07:54
12565,711087,6,44010437,74',Kouya Aristide Mabea (UTA Arad) Yellow Card at 74',2024-10-20 11:07:54
12565,711087,7,44010489,78',Stefan Hajdin (Sepsi Sfantu Gheorghe) Substitution at 78',2024-10-20 11:07:54
12565,711087,8,44010490,78',Dániel Zsóri (UTA Arad) Substitution at 78',2024-10-20 11:07:54
12565,711087,9,44010491,78',Agustín Vuletich (UTA Arad) Substitution at 78',2024-10-20 11:07:54
12565,711087,10,44010613,89',Mihajlo Neskovic (Sepsi Sfantu Gheorghe) Substitution at 89',2024-10-20 11:07:54
12565,711087,11,44010614,89',Dávid Sigér (Sepsi Sfantu Gheorghe) Substitution at 89',2024-10-20 11:07:54
12565,711088,0,44030767,4',Benjamin Siegrist (Rapid Bucuresti) Yellow Card at 4',2024-10-22 23:22:46
12565,711088,1,44030786,6',Cristian Sapunaru (Rapid Bucuresti) Yellow Card at 6',2024-10-22 23:22:46
12565,711088,2,44030825,13',Andrei Borza (Rapid Bucuresti) Goal at 13',2024-10-22 23:22:46
12565,711088,3,44030869,28',Alexandru Stoian (FC Farul Constanta) Substitution at 28',2024-10-22 23:22:46
12565,711088,4,44030873,30',Claudiu Petrila (Rapid Bucuresti) Goal at 30',2024-10-22 23:22:46
12565,711088,5,44030903,36',Eduard Radaslavescu (FC Farul Constanta) Yellow Card at 36',2024-10-22 23:22:46
12565,711088,6,44030904,40',Alexandru Pascanu (Rapid Bucuresti) Goal at 40',2024-10-22 23:22:46
12565,711088,7,44030920,43',Cristian Ignat (Rapid Bucuresti) Substitution at 43',2024-10-22 23:22:46
12565,711088,8,44030924,44',Denis Alibec (FC Farul Constanta) Yellow Card at 44',2024-10-22 23:22:46
12565,711088,9,44031026,45',Dan Sîrbu (FC Farul Constanta) Substitution at 45',2024-10-22 23:22:46
12565,711088,10,44031133,54',Alexandru Pascanu (Rapid Bucuresti) Yellow Card at 54',2024-10-22 23:22:46
12565,711088,11,44031261,66',Alexandru Dobre (Rapid Bucuresti) Substitution at 66',2024-10-22 23:22:46
12565,711088,12,44031277,71',Nicolas Popescu (FC Farul Constanta) Substitution at 71',2024-10-22 23:22:46
12565,711088,13,44031278,71',Luca Basceanu (FC Farul Constanta) Substitution at 71',2024-10-22 23:22:46
12565,711088,14,44031283,72',Alexandru Dobre (Rapid Bucuresti) Goal at 72',2024-10-22 23:22:46
12565,711088,15,44031355,77',Razvan Philippe Onea (Rapid Bucuresti) Yellow Card at 77',2024-10-22 23:22:46
12565,711088,16,44031383,81',Gabriel Leonard Danuleasa (FC Farul Constanta) Substitution at 81',2024-10-22 23:22:46
12565,711088,17,44031392,82',Gabriel Leonard Danuleasa (FC Farul Constanta) Red Card at 82',2024-10-22 23:22:46
12565,711088,18,44031421,85',Mattias Käit (Rapid Bucuresti) Substitution at 85',2024-10-22 23:22:46
12565,711088,19,44031422,85',Claudiu Micovschi (Rapid Bucuresti) Substitution at 85',2024-10-22 23:22:46
12565,711088,20,44031423,85',Constantin Grameni (Rapid Bucuresti) Substitution at 85',2024-10-22 23:22:46
12565,711088,21,44031445,88',Alexandru Dobre (Rapid Bucuresti) Yellow Card at 88',2024-10-22 23:22:46
12565,711088,22,44031446,88',Gustavo Marins (FC Farul Constanta) Yellow Card at 88',2024-10-22 23:22:46
12565,711088,23,44031454,90'+1',Jakub Hromada (Rapid Bucuresti) Red Card at 91',2024-10-22 23:22:46
12565,711088,24,44031481,90'+5',Alexandru Dobre (Rapid Bucuresti) Goal at 95',2024-10-22 23:22:46
12565,711089,0,44088490,4',Stefan Bodistean (FC Botosani) Goal at 4',2024-10-29 05:21:26
12565,711089,1,44088572,45',Lucian Cristea (Universitatea Cluj) Goal at 45',2024-10-29 05:21:26
12565,711089,2,44088603,45',Stefan Panoiu (FC Botosani) Substitution at 45',2024-10-29 05:21:26
12565,711089,3,44088612,53',Patricio Matricardi (FC Botosani) Substitution at 53',2024-10-29 05:21:26
12565,711089,4,44088613,53',John Charles Petro (FC Botosani) Substitution at 53',2024-10-29 05:21:26
12565,711089,5,44088650,63',Hildeberto Pereira (Universitatea Cluj) Yellow Card at 63',2024-10-29 05:21:26
12565,711089,6,44088651,64',Dan Nistor (Universitatea Cluj) Substitution at 64',2024-10-29 05:21:26
12565,711089,7,44088652,67',Radu Boboc (Universitatea Cluj) Yellow Card at 67',2024-10-29 05:21:26
12565,711089,8,44088653,67',Enzo Lopez (FC Botosani) Substitution at 67',2024-10-29 05:21:26
12565,711089,9,44088677,75',Vadim Rata (Universitatea Cluj) Substitution at 75',2024-10-29 05:21:26
12565,711089,10,44088692,79',Adams Friday (FC Botosani) Red Card at 79',2024-10-29 05:21:26
12565,711089,11,44088693,80',Jaly Mouaddib (FC Botosani) Substitution at 80',2024-10-29 05:21:26
12565,711089,12,44088700,86',Vlad Stefan (Universitatea Cluj) Substitution at 86',2024-10-29 05:21:26
12565,711089,13,44088701,86',Franck Tchassem (Universitatea Cluj) Substitution at 86',2024-10-29 05:21:26
12565,711089,14,44088702,86',Artur Miranyan (Universitatea Cluj) Substitution at 86',2024-10-29 05:21:26
12565,711089,15,44088703,88',Artur Miranyan (Universitatea Cluj) Goal at 88',2024-10-29 05:21:26
12565,711089,16,44088833,90'+5',Francisco Júnior (FC Botosani) Yellow Card at 95',2024-10-29 05:21:26
12565,711090,0,44058022,37',Marius Coleman (Sepsi Sfantu Gheorghe) Goal at 37',2024-10-26 13:53:28
12565,711090,1,44058366,45',Constantin Paun-Alexandru (CFR Cluj-Napoca) Substitution at 45',2024-10-26 13:53:28
12565,711090,2,44058367,45',Meriton Korenica (CFR Cluj-Napoca) Substitution at 45',2024-10-26 13:53:28
12565,711090,3,44058534,52',Mohammed Kamara (CFR Cluj-Napoca) Goal at 52',2024-10-26 13:53:28
12565,711090,4,44058626,55',Denis Ciobotariu (Sepsi Sfantu Gheorghe) Goal at 55',2024-10-26 13:53:28
12565,711090,5,44058719,58',Isnik Alimi (Sepsi Sfantu Gheorghe) Yellow Card at 58',2024-10-26 13:53:28
12565,711090,6,44060710,66',Simão Rocha (CFR Cluj-Napoca) Yellow Card at 66',2024-10-26 13:53:28
12565,711090,7,44059100,68',Sherif Kallaku (Sepsi Sfantu Gheorghe) Substitution at 68',2024-10-26 13:53:28
12565,711090,8,44059101,68',Darius Oroian (Sepsi Sfantu Gheorghe) Substitution at 68',2024-10-26 13:53:28
12565,711090,9,44059102,71',Panagiotis Tachtsidis (CFR Cluj-Napoca) Substitution at 71',2024-10-26 13:53:28
12565,711090,10,44059218,76',Dávid Sigér (Sepsi Sfantu Gheorghe) Substitution at 76',2024-10-26 13:53:28
12565,711090,11,44059263,78',Vasile Mogos (CFR Cluj-Napoca) Substitution at 78',2024-10-26 13:53:28
12565,711090,12,44059385,83',Florin Stefan (Sepsi Sfantu Gheorghe) Goal at 83',2024-10-26 13:53:28
12565,711090,13,44059438,85',Stefan Hajdin (Sepsi Sfantu Gheorghe) Substitution at 85',2024-10-26 13:53:28
12565,711090,14,44059449,86',Virgiliu Postolachi (CFR Cluj-Napoca) Goal at 86',2024-10-26 13:53:28
12565,711090,15,44059541,89',Andres Dumitrescu (Sepsi Sfantu Gheorghe) Yellow Card at 89',2024-10-26 13:53:28
12565,711090,16,44059615,90'+3',Robert Filip (CFR Cluj-Napoca) Substitution at 93',2024-10-26 13:53:28
12565,711090,17,44059616,90'+3',Virgiliu Postolachi (CFR Cluj-Napoca) Goal at 93',2024-10-26 13:53:28
12565,711091,0,44083577,36',Xian Emmers (Rapid Bucuresti) Substitution at 36',2024-10-31 05:23:49
12565,711091,1,44084035,47',Clinton N'Jie (Rapid Bucuresti) Yellow Card at 47',2024-10-29 05:21:26
12565,711091,2,44084180,56',Daniel Popa (FCSB) Substitution at 56',2024-10-29 05:21:26
12565,711091,3,44084246,61',Alexandru Dobre (Rapid Bucuresti) Substitution at 61',2024-10-29 05:21:26
12565,711091,4,44084463,77',Baba Alhassan (FCSB) Substitution at 77',2024-10-29 05:21:26
12565,711091,5,44084533,81',Darius Olaru (FCSB) Yellow Card at 81',2024-10-29 05:21:26
12565,711091,6,44084534,81',Tobias Christensen (Rapid Bucuresti) Yellow Card at 81',2024-10-29 05:21:26
12565,711091,7,44084535,84',Alexandru Marian (FCSB) Substitution at 84',2024-10-29 05:21:26
12565,711091,8,44084536,84',Marius Stefanescu (FCSB) Substitution at 84',2024-10-29 05:21:26
12565,711091,9,44084578,87',Claudiu Micovschi (Rapid Bucuresti) Substitution at 87',2024-10-29 05:21:26
12565,711091,10,44084708,90'+6',Aaron-Salem Boupendza (Rapid Bucuresti) Yellow Card at 96',2024-10-29 05:21:26
12565,711092,0,44063874,20',Mihai Bordeianu (Politehnica Iasi) Goal at 20',2024-10-27 05:19:50
12565,711092,1,44063889,22',Alexandru Mateiu (Petrolul Ploiesti) Yellow Card at 22',2024-10-27 05:19:50
12565,711092,2,44063935,25',Gheorghe Grozav (Petrolul Ploiesti) Goal at 25',2024-10-27 05:19:50
12565,711092,3,44064060,36',Marian Huja (Petrolul Ploiesti) Yellow Card at 36',2024-10-27 05:19:50
12565,711092,4,44064100,38',Florian Kamberi (Politehnica Iasi) Red Card at 38',2024-10-27 05:19:50
12565,711092,5,44064455,45',Catalin Itu (Politehnica Iasi) Substitution at 45',2024-10-27 05:19:50
12565,711092,6,44064627,45',Samuel Oum Gouet (Politehnica Iasi) Substitution at 45',2024-10-27 05:19:50
12565,711092,7,44064628,49',David Atanasovski (Politehnica Iasi) Yellow Card at 49',2024-10-27 05:19:50
12565,711092,8,44064726,53',Alexandru Tudorie (Petrolul Ploiesti) Goal at 53',2024-10-27 05:19:50
12565,711092,9,44064840,55',Mihai Bordeianu (Politehnica Iasi) Yellow Card at 55',2024-10-27 05:19:50
12565,711092,10,44065470,74',Herman Moussaki (Petrolul Ploiesti) Substitution at 74',2024-10-27 05:19:50
12565,711092,11,44065670,79',Lucas Zima (Petrolul Ploiesti) Yellow Card at 79',2024-10-27 05:19:50
12565,711092,12,44065671,79',Yohan Roche (Petrolul Ploiesti) Yellow Card at 79',2024-10-27 05:19:50
12565,711092,13,44065827,82',Mario Bratu (Petrolul Ploiesti) Substitution at 82',2024-10-27 05:19:50
12565,711092,14,44065828,82',Denis Radu (Petrolul Ploiesti) Substitution at 82',2024-10-27 05:19:50
12565,711092,15,44066064,87',Gonçalo Teixeira (Politehnica Iasi) Substitution at 87',2024-10-27 05:19:50
12565,711092,16,44066065,87',Shayon Harrison (Politehnica Iasi) Substitution at 87',2024-10-27 05:19:50
12565,711092,17,44066069,88',Mario Bratu (Petrolul Ploiesti) Goal at 88',2024-10-27 05:19:50
12565,711092,18,44066199,90'+2',Victor Stancovici (Petrolul Ploiesti) Substitution at 92',2024-10-27 05:19:50
12565,711092,19,44066200,90'+3',Alin Botogan (Petrolul Ploiesti) Substitution at 93',2024-10-27 05:19:50
12565,711093,0,44078717,30',Juri Cisotti (Otelul Galati) Yellow Card at 30',2024-10-28 05:21:06
12565,711093,1,44079347,47',Ovidiu Perianu (Unirea Slobozia) Goal at 47',2024-10-28 05:21:06
12565,711093,2,44079624,59',Mihai Adascalitei (Otelul Galati) Substitution at 59',2024-10-28 05:21:06
12565,711093,3,44079625,59',Alexandru Pop (Otelul Galati) Substitution at 59',2024-10-28 05:21:06
12565,711093,4,44079626,59',Razvan Tanasa (Otelul Galati) Substitution at 59',2024-10-28 05:21:06
12565,711093,5,44079662,61',Daniel Marius Serbanica (Unirea Slobozia) Substitution at 61',2024-10-28 05:21:06
12565,711093,6,44079800,70',Marius Antoche (Unirea Slobozia) Yellow Card at 70',2024-10-28 05:21:06
12565,711093,7,44079960,77',Nikola Stevanovic (Otelul Galati) Red Card at 77',2024-10-28 05:21:06
12565,711093,8,44079961,78',Constantin Toma (Unirea Slobozia) Shot Off Target at 78',2024-10-28 05:21:06
12565,711093,9,44080019,80',Samy Bourard (Otelul Galati) Substitution at 80',2024-10-28 05:21:06
12565,711093,10,44080050,81',Samy Bourard (Otelul Galati) Yellow Card at 81',2024-10-28 05:21:06
12565,711093,11,44080051,82',Florinel Ibrian (Unirea Slobozia) Substitution at 82',2024-10-28 05:21:06
12565,711093,12,44080093,84',Daniel Marius Serbanica (Unirea Slobozia) Goal at 84',2024-10-28 05:21:06
12565,711094,0,44069207,30',Ahmed Bani (Dinamo Bucuresti) Substitution at 30',2024-10-27 05:19:50
12565,711094,1,44069208,31',Vahid Selimovic (Hermannstadt) Yellow Card at 31',2024-10-27 05:19:50
12565,711094,2,44069220,33',Astrit Seljmani (Dinamo Bucuresti) Penalty - Scored at 33',2024-10-27 05:19:50
12565,711094,3,44069360,45',Maxime Sivis (Dinamo Bucuresti) Yellow Card at 45',2024-10-27 05:19:50
12565,711094,4,44069587,45',Cristian Daniel Negut (Hermannstadt) Substitution at 45',2024-10-27 05:19:50
12565,711094,5,44069588,45',Aurelian Chitu (Hermannstadt) Substitution at 45',2024-10-27 05:19:50
12565,711094,6,44069835,67',Iancu Petru Dragos (Hermannstadt) Substitution at 67',2024-10-27 05:19:50
12565,711094,7,44069891,74',Astrit Seljmani (Dinamo Bucuresti) Yellow Card at 74',2024-10-27 05:19:50
12565,711094,8,44069931,76',Cristian Costin (Dinamo Bucuresti) Substitution at 76',2024-10-27 05:19:50
12565,711094,9,44070067,88',Kennedy Boateng (Dinamo Bucuresti) Goal at 88',2024-10-27 05:19:50
12565,711094,10,44070085,88',Robert Popescu (Hermannstadt) Substitution at 88',2024-10-27 05:19:50
12565,711094,11,44070117,90'+1',Petru Neagu (Dinamo Bucuresti) Substitution at 91',2024-10-27 05:19:50
12565,711094,12,44070118,90'+2',Iulius Marginean (Dinamo Bucuresti) Substitution at 92',2024-10-27 05:19:50
12565,711095,0,44088876,6',Narek Grigoryan (FC Farul Constanta) Goal at 6',2024-10-29 05:21:26
12565,711095,1,44088885,12',Denis Alibec (FC Farul Constanta) Goal at 12',2024-10-29 05:21:26
12565,711095,2,44088901,21',Gustavo Marins (FC Farul Constanta) Yellow Card at 21',2024-10-29 05:21:26
12565,711095,3,44088925,31',Victor Robert Dican (FC Farul Constanta) Yellow Card at 31',2024-10-29 05:21:26
12565,711095,4,44088928,35',Denil Maldonado (CSU Craiova) Yellow Card at 35',2024-10-29 05:21:26
12565,711095,5,44088956,45'+3',Ionut Vina (FC Farul Constanta) Yellow Card at 48',2024-10-29 05:21:26
12565,711095,6,44088982,45',Alexandru Cicaldau (CSU Craiova) Substitution at 45',2024-10-29 05:21:26
12565,711095,7,44088990,48',Ionut Vina (FC Farul Constanta) Red Card at 48',2024-10-29 05:21:26
12565,711095,8,44088995,52',Lyes Houri (CSU Craiova) Penalty - Scored at 52',2024-10-29 05:21:26
12565,711095,9,44089002,55',Jovo Lukic (CSU Craiova) Substitution at 55',2024-10-29 05:21:26
12565,711095,10,44089013,59',Gustavo Marins (FC Farul Constanta) Goal at 59',2024-10-29 05:21:26
12565,711095,11,44089466,65',Dan Sîrbu (FC Farul Constanta) Yellow Card at 65',2024-10-29 05:21:26
12565,711095,12,44089051,66',Lyes Houri (CSU Craiova) Shot Off Target at 66',2024-10-29 05:21:26
12565,711095,13,44089052,67',Rivaldinho (FC Farul Constanta) Substitution at 67',2024-10-31 05:23:49
12565,711095,14,44089053,67',Ionut Cercel (FC Farul Constanta) Substitution at 67',2024-10-29 05:21:26
12565,711095,15,44089084,76',Stefan Bana (CSU Craiova) Substitution at 76',2024-10-29 05:21:26
12565,711095,16,44089085,76',Luis Paradela (CSU Craiova) Substitution at 76',2024-10-29 05:21:26
12565,711095,17,44089098,81',Nicolas Popescu (FC Farul Constanta) Substitution at 81',2024-10-29 05:21:26
12565,711095,18,44089099,81',Gabriel Iancu (FC Farul Constanta) Substitution at 81',2024-10-29 05:21:26
12565,711095,19,44089133,90'+2',Gabriel Nicolae Buta (FC Farul Constanta) Substitution at 92',2024-10-29 05:21:26
12565,711095,20,44089143,90'+5',Luis Paradela (CSU Craiova) Goal at 95',2024-10-29 05:21:26
12565,711095,21,44089144,90'+5',Luis Paradela (CSU Craiova) Yellow Card at 95',2024-10-29 05:21:26
12565,711095,22,44089152,90'+7',Alexandru Buzbuchi (FC Farul Constanta) Yellow Card at 97',2024-10-29 05:21:26
12565,711096,0,44062905,21',Kouya Aristide Mabea (UTA Arad) Yellow Card at 21',2024-10-26 13:53:28
12565,711096,1,44062906,26',Dragos Albu (Gloria Buzau) Yellow Card at 26',2024-10-26 13:53:28
12565,711096,2,44062907,30',Diego Ferares Scheda (Gloria Buzau) Own Goal at 30',2024-10-26 13:53:28
12565,711096,3,44062911,38',Dario Canadjija (Gloria Buzau) Yellow Card at 38',2024-10-26 13:53:28
12565,711096,4,44062976,45',Agustín Vuletich (UTA Arad) Substitution at 45',2024-10-26 13:53:28
12565,711096,5,44062977,45',Sergiu Pîrvulescu (Gloria Buzau) Substitution at 45',2024-10-26 13:53:28
12565,711096,6,44062978,45',Vitó (Gloria Buzau) Substitution at 45',2024-10-27 05:19:50
12565,711096,7,44063022,50',Andrej Fabry (UTA Arad) Yellow Card at 50',2024-10-27 05:19:50
12565,711096,8,44063129,67',Denis Lucian Hrezdac (UTA Arad) Substitution at 67',2024-10-27 05:19:50
12565,711096,9,44063170,72',Ricardo Matos (Gloria Buzau) Substitution at 72',2024-10-27 05:19:50
