seasonType,eventId,commentaryOrder,playId,clockDisplayValue,commentaryText,updateDateTime
12397,710655,0,43393326,13',Piero Serra (Unión Comercio) Yellow Card at 13',2024-07-13 04:30:59
12397,710655,1,43393340,35',Jeizon Chacón (Los Chankas) Goal at 35',2024-07-13 04:30:59
12397,710655,2,43393343,45'+3',Marlon de Jesús (Unión Comercio) Penalty - Scored at 48',2024-07-13 04:30:59
12397,710655,3,43393348,56',Carlos Gamarra (Los Chankas) Yellow Card at 56',2024-07-13 04:30:59
12397,710655,4,43393349,58',Jorge Tandazo (Unión Comercio) Substitution at 58',2024-07-13 04:30:59
12397,710655,5,43393350,58',Denilson Vargas (Unión Comercio) Substitution at 58',2024-07-13 04:30:59
12397,710655,6,43393351,59',Ademar Robles (Los Chankas) Substitution at 59',2024-07-13 04:30:59
12397,710655,7,43393352,68',Sandro Rengifo (Unión Comercio) Substitution at 68',2024-07-13 04:30:59
12397,710655,8,43393353,73',Oshiro Takeuchi (Los Chankas) Substitution at 73',2024-07-13 04:30:59
12397,710655,9,43393354,73',Ayrthon Quintana (Los Chankas) Substitution at 73',2024-07-13 04:30:59
12397,710655,10,43393355,75',Sebastian Aranda (Unión Comercio) Yellow Card at 75',2024-07-13 04:30:59
12397,710655,11,43393356,80',Ángel Ledesma (Los Chankas) Yellow Card at 80',2024-07-13 04:30:59
12397,710655,12,43393358,84',Hector Zeta (Unión Comercio) Substitution at 84',2024-07-13 04:30:59
12397,710655,13,43393363,89',Gonzalo Sánchez (Los Chankas) Substitution at 89',2024-07-13 04:30:59
12397,710655,14,43393364,89',José Luján (Los Chankas) Substitution at 89',2024-07-13 04:30:59
12397,710655,15,43393368,90'+8',Oshiro Takeuchi (Los Chankas) Goal at 98',2024-07-13 04:30:59
12397,710656,0,43393375,6',Alejandro Duarte (Sporting Cristal) Yellow Card at 6',2024-07-13 04:30:59
12397,710656,1,43393379,9',Victor Cedrón (ADT) Penalty - Scored at 9',2024-07-13 04:30:59
12397,710656,2,43393386,25',Martín Cauteruccio (Sporting Cristal) Goal at 25',2024-07-13 04:30:59
12397,710656,3,43393395,45',Gianfranco Chávez (Sporting Cristal) Substitution at 45',2024-07-13 04:30:59
12397,710656,4,43393396,48',Victor Cedrón (ADT) Goal at 48',2024-07-13 04:30:59
12397,710656,5,43393397,54',Alex Rambal (ADT) Yellow Card at 54',2024-07-13 04:30:59
12397,710656,6,43393398,63',Gerald Távara (Sporting Cristal) Substitution at 63',2024-07-13 04:30:59
12397,710656,7,43393399,63',Irven Ávila (Sporting Cristal) Substitution at 63',2024-07-13 04:30:59
12397,710656,8,43393400,77',Alejandro Duarte (Sporting Cristal) Own Goal at 77',2024-07-13 04:30:59
12397,710656,9,43393401,78',Janio Posito (ADT) Substitution at 78',2024-07-13 04:30:59
12397,710656,10,43393402,78',Juan Gonzáles (ADT) Substitution at 78',2024-07-13 04:30:59
12397,710656,11,43393403,79',Gerald Távara (Sporting Cristal) Yellow Card at 79',2024-07-13 04:30:59
12397,710656,12,43393404,83',Rafael Lutiger (Sporting Cristal) Substitution at 83',2024-07-13 04:30:59
12397,710656,13,43393405,83',Maxloren Castro (Sporting Cristal) Substitution at 83',2024-07-13 04:30:59
12397,710656,14,43393407,85',Rafael Lutiger (Sporting Cristal) Yellow Card at 85',2024-07-13 04:30:59
12397,710656,15,43393415,90',Jorge Palomino (ADT) Substitution at 90',2024-07-13 04:30:59
12397,710657,0,43393821,21',José Adalberto Cuero (UTC) Yellow Card at 21',2024-07-13 04:30:59
12397,710657,1,43393882,45',Diego Ramírez (Deportivo Garcilaso) Yellow Card at 45',2024-07-13 04:30:59
12397,710657,2,43393955,45',Carlos Fernandez (UTC) Substitution at 45',2024-07-13 04:30:59
12397,710657,3,43394054,59',Mauricio Cuero (Deportivo Garcilaso) Substitution at 59',2024-07-13 04:30:59
12397,710657,4,43394095,64',Carlos Fernandez (UTC) Yellow Card at 64',2024-07-13 04:30:59
12397,710657,5,43394118,67',Erick Gonzales (Deportivo Garcilaso) Substitution at 67',2024-07-13 04:30:59
12397,710657,6,43394140,72',Anthony Gordillo (Deportivo Garcilaso) Substitution at 72',2024-07-13 04:30:59
12397,710657,7,43394149,75',Mario Otazú (UTC) Yellow Card at 75',2024-07-13 04:30:59
12397,710657,8,43394158,77',Juan Lojas (Deportivo Garcilaso) Goal at 77',2024-07-13 04:30:59
12397,710657,9,43394183,81',Joel Sánchez (UTC) Substitution at 81',2024-07-13 04:30:59
12397,710657,10,43394258,90'+4',Gaspar Gentile (Deportivo Garcilaso) Yellow Card at 94',2024-07-13 04:30:59
12397,710657,11,43394273,90'+7',Jarlín Quintero (UTC) Shot Off Target at 97',2024-07-13 04:30:59
12397,710658,0,43397120,20',Matías Sen (Comerciantes Unidos) Goal at 20',2024-07-14 15:40:18
12397,710658,1,43397131,25',Carlos Garcés (Cienciano del Cusco) Goal at 25',2024-07-14 15:40:18
12397,710658,2,43397148,31',Matías Almirón (Comerciantes Unidos) Yellow Card at 31',2024-07-14 15:40:18
12397,710658,3,43397160,36',Carlos Garcés (Cienciano del Cusco) Goal at 36',2024-07-14 15:40:18
12397,710658,4,43397175,41',Jordan Guivin (Cienciano del Cusco) Yellow Card at 41',2024-07-14 15:40:18
12397,710658,5,43397382,65',Sebastián Gonzáles Zela (Comerciantes Unidos) Substitution at 65',2024-07-14 15:40:18
12397,710658,6,43397383,65',Kenyi Barrios (Comerciantes Unidos) Substitution at 65',2024-07-14 15:40:18
12397,710658,7,43397414,71',Payco  (Comerciantes Unidos) Yellow Card at 71',2024-07-14 15:40:18
12397,710658,8,43397443,74',Jorge Toledo (Comerciantes Unidos) Substitution at 74',2024-07-14 15:40:18
12397,710658,9,43397444,75',Emmanuel Paucar (Comerciantes Unidos) Substitution at 75',2024-07-14 15:40:18
12397,710658,10,43397445,75',Pedro Ibañez (Cienciano del Cusco) Substitution at 75',2024-07-14 15:40:18
12397,710658,11,43397446,75',Alfredo Ramua (Cienciano del Cusco) Substitution at 75',2024-07-14 15:40:18
12397,710658,12,43397495,81',José Parodi (Comerciantes Unidos) Substitution at 81',2024-07-14 15:40:18
12397,710658,13,43397582,90',Jorge Toledo (Comerciantes Unidos) Yellow Card at 90',2024-07-14 15:40:18
12397,710658,14,43397624,90'+4',José Rugel (Cienciano del Cusco) Substitution at 94',2024-07-14 15:40:18
12397,710659,0,43398026,2',Herná Barcos (Alianza Lima) Goal at 2',2024-07-14 15:40:18
12397,710659,1,43398298,24',Josepmir Ballón (César Vallejo) Goal at 24',2024-07-14 15:40:18
12397,710659,2,43398393,34',Yorleys Mena (César Vallejo) Goal at 34',2024-07-14 15:40:18
12397,710659,3,43398755,49',Adrián Arregui (Alianza Lima) Yellow Card at 49',2024-07-14 15:40:18
12397,710659,4,43398776,52',Pierre Da Silva (César Vallejo) Yellow Card at 52',2024-07-14 15:40:18
12397,710659,5,43398859,61',Herná Barcos (Alianza Lima) Penalty - Scored at 61',2024-07-14 15:40:18
12397,710659,6,43398870,62',Osnar Noronha (César Vallejo) Substitution at 62',2024-07-14 15:40:18
12397,710659,7,43398919,70',Pablo Sabbag (Alianza Lima) Substitution at 70',2024-07-14 15:40:18
12397,710659,8,43398920,71',Jiovany Ramos (Alianza Lima) Substitution at 71',2024-07-14 15:40:18
12397,710659,9,43399030,84',Arley Rodríguez (César Vallejo) Yellow Card at 84',2024-07-14 15:40:18
12397,710659,10,43399045,87',Gerson Barreto (César Vallejo) Substitution at 87',2024-07-14 15:40:18
12397,710659,11,43399046,87',Manuel Ganoza (César Vallejo) Substitution at 87',2024-07-14 15:40:18
12397,710659,12,43399047,87',Jesús Castillo (Alianza Lima) Substitution at 87',2024-07-14 15:40:18
12397,710659,13,43399048,87',Antonio Huamán (Alianza Lima) Substitution at 87',2024-07-14 15:40:18
12397,710659,14,43399094,90'+2',Renzo Garcés (Alianza Lima) Goal at 92',2024-07-14 15:40:18
12397,710660,0,43399352,10',Alexander Succar (Carlos A. Mannucci) Yellow Card at 10',2024-07-14 15:40:18
12397,710660,1,43399383,16',Alex Valera (Universitario) Penalty - Scored at 16',2024-07-14 15:40:18
12397,710660,2,43399457,29',Edison Flores (Universitario) Goal at 29',2024-07-14 15:40:18
12397,710660,3,43399747,45',Luis Urruti (Carlos A. Mannucci) Substitution at 45',2024-07-15 06:21:59
12397,710660,4,43399880,56',Martín Guedes (Universitario) Goal at 56',2024-07-15 06:21:59
12397,710660,5,43399972,61',José Rivera (Universitario) Substitution at 61',2024-07-15 06:21:59
12397,710660,6,43399973,62',Segundo Portocarrero (Universitario) Substitution at 62',2024-07-15 06:21:59
12397,710660,7,43400026,64',Carlos Liza (Carlos A. Mannucci) Substitution at 64',2024-07-15 06:21:59
12397,710660,8,43400027,64',Eduardo Rabanal (Carlos A. Mannucci) Substitution at 64',2024-07-15 06:21:59
12397,710660,9,43400028,65',Fabiano Barriga (Carlos A. Mannucci) Substitution at 65',2024-07-15 06:21:59
12397,710660,10,43400142,69',Horacio Calcaterra (Universitario) Substitution at 69',2024-07-15 06:21:59
12397,710660,11,43400143,70',Christopher Olivares (Universitario) Substitution at 70',2024-07-15 06:21:59
12397,710660,12,43400170,72',José Cortés (Carlos A. Mannucci) Substitution at 72',2024-07-15 06:21:59
12397,710660,13,43400171,73',Eduardo Rabanal (Carlos A. Mannucci) Yellow Card at 73',2024-07-15 06:21:59
12397,710660,14,43400242,80',José Rivera (Universitario) Goal at 80',2024-07-15 06:21:59
12397,710660,15,43400271,83',Hugo Ancajima (Universitario) Substitution at 83',2024-07-15 06:21:59
12397,710660,16,43400390,89',Christopher Olivares (Universitario) Goal at 89',2024-07-15 06:21:59
12397,710660,17,43400481,90'+3',José Rivera (Universitario) Goal at 93',2024-07-15 06:21:59
12397,710661,0,43403945,37',Jeremy Rostaing (Atlético Grau) Red Card at 37',2024-07-15 06:21:59
12397,710661,1,43403949,39',Horacio Benincasa (Alianza Atlético) Yellow Card at 39',2024-07-15 06:21:59
12397,710661,2,43403986,45',Fabio Rojas (Atlético Grau) Substitution at 45',2024-07-15 06:21:59
12397,710661,3,43403987,45',Christian Vásquez (Alianza Atlético) Substitution at 45',2024-07-15 06:21:59
12397,710661,4,43404042,59',Federico Illanes (Alianza Atlético) Red Card at 59',2024-07-15 06:21:59
12397,710661,5,43404051,61',Eric Tovo (Alianza Atlético) Yellow Card at 61',2024-07-15 06:21:59
12397,710661,6,43404066,64',Daniel Franco (Atlético Grau) Yellow Card at 64',2024-07-15 06:21:59
12397,710661,7,43404083,66',Freddy Oncoy (Atlético Grau) Substitution at 66',2024-07-15 06:21:59
12397,710661,8,43404084,66',Hernan Lupu (Alianza Atlético) Substitution at 66',2024-07-15 06:21:59
12397,710661,9,43404120,73',Santiago Rebagliati (Alianza Atlético) Substitution at 73',2024-07-15 06:21:59
12397,710661,10,43404121,73',Roberto Siucho (Alianza Atlético) Substitution at 73',2024-07-15 06:21:59
12397,710661,11,43404133,76',Ray Sandoval (Atlético Grau) Substitution at 76',2024-07-15 06:21:59
12397,710661,12,43404134,76',Piero Vivanco (Atlético Grau) Substitution at 76',2024-07-15 06:21:59
12397,710661,13,43404189,89',Christian Flores (Alianza Atlético) Substitution at 89',2024-07-15 06:21:59
12397,710661,14,43404195,90'+5',Cesar Vasquez (Atlético Grau) Substitution at 95',2024-07-15 06:21:59
12397,710662,0,43404298,24',Alexi Gomez (Sport Huancayo) Yellow Card at 24',2024-07-15 06:21:59
12397,710662,1,43404398,41',Cristian Carbajal (Sport Boys) Yellow Card at 41',2024-07-15 06:21:59
12397,710662,2,43404401,43',Carlos Correa (Sport Boys) Yellow Card at 43',2024-07-15 06:21:59
12397,710662,3,43404489,45',Ray Gómez (Sport Huancayo) Substitution at 45',2024-07-15 06:21:59
12397,710662,4,43404490,45',Ángel Pérez (Sport Huancayo) Substitution at 45',2024-07-15 06:21:59
12397,710662,5,43404491,45',Ronal Huacca (Sport Huancayo) Substitution at 45',2024-07-15 06:21:59
12397,710662,6,43404492,45',Pablo Bueno (Sport Boys) Substitution at 45',2024-07-15 06:21:59
12397,710662,7,43404494,55',Hugo Angeles (Sport Huancayo) Yellow Card at 55',2024-07-15 06:21:59
12397,710662,8,43404495,61',Renzo Salazar (Sport Boys) Substitution at 61',2024-07-16 06:18:53
12397,710662,9,43404496,61',Brandon Palacios (Sport Boys) Substitution at 61',2024-07-16 06:18:53
12397,710662,10,43404497,62',Joel Pissano (Sport Boys) Substitution at 62',2024-07-16 06:18:53
12397,710662,11,43404498,63',Cristian Techera (Sport Boys) Goal at 63',2024-07-16 06:18:53
12397,710662,12,43404499,66',Lucas Cano (Sport Huancayo) Yellow Card at 66',2024-07-16 06:18:53
12397,710662,13,43404500,67',Matías Pérez García (Sport Huancayo) Substitution at 67',2024-07-16 06:18:53
12397,710662,14,43404505,83',Brandon Palacios (Sport Boys) Goal at 83',2024-07-16 06:18:53
12397,710662,15,43404507,84',Kevin Peña (Sport Boys) Substitution at 84',2024-07-16 06:18:53
12397,710662,16,43404513,90'+5',Ronal Huacca (Sport Huancayo) Goal at 95',2024-07-16 06:18:53
12397,710663,0,43404347,17',Paolo Reyna (Melgar) Goal at 17',2024-07-15 06:21:59
12397,710663,1,43404456,36',Jose Zevallos (Cusco FC) Yellow Card at 36',2024-07-15 06:21:59
12397,710663,2,43404477,40',Tomás Martínez (Melgar) Goal at 40',2024-07-15 06:21:59
12397,710663,3,43404501,54',Stefano Olaya (Cusco FC) Substitution at 54',2024-07-16 06:18:53
12397,710663,4,43404504,62',Jean Pierre Archimbaud (Melgar) Substitution at 62',2024-07-16 06:18:53
12397,710663,5,43404506,69',Juan Manuel Tévez (Cusco FC) Substitution at 69',2024-07-16 06:18:53
12397,710663,6,43404508,72',Jefferson Caceres (Melgar) Substitution at 72',2024-07-16 06:18:53
12397,710663,7,43404509,72',Jean Pierre Archimbaud (Melgar) Yellow Card at 72',2024-07-16 06:18:53
12397,710663,8,43404510,75',Jean Pierre Archimbaud (Melgar) Goal at 75',2024-07-16 06:18:53
12397,710663,9,43404511,79',Alexis Martín Arias (Melgar) Substitution at 79',2024-07-17 06:08:33
12397,710663,10,43404512,80',Elías Ramos (Melgar) Substitution at 80',2024-07-16 06:18:53
12397,711419,0,43420692,13',Oswaldo Valenzuela (Cusco FC) Yellow Card at 13',2024-07-30 07:58:59
12397,711419,1,43420711,17',Jarlín Quintero (UTC) Penalty - Scored at 17',2024-07-30 07:58:59
12397,711419,2,43420770,35',Carlos Fernandez (UTC) Yellow Card at 35',2024-07-30 07:58:59
12397,711419,3,43420819,45',Piero Guzmán (Cusco FC) Substitution at 45',2024-07-30 07:58:59
12397,711419,4,43420820,45',Jefferson Portales (UTC) Substitution at 45',2024-07-30 07:58:59
12397,711419,5,43420824,47',Piero Guzmán (Cusco FC) Yellow Card at 47',2024-07-30 07:58:59
12397,711419,6,43420852,57',Kevin Ruíz (UTC) Substitution at 57',2024-07-30 07:58:59
12397,711419,7,43420860,63',Neil Marcos (UTC) Substitution at 63',2024-07-30 07:58:59
12397,711419,8,43420881,67',Juan Manuel Tévez (Cusco FC) Substitution at 67',2024-07-30 07:58:59
12397,711419,9,43420902,76',Relly Fernández (Cusco FC) Substitution at 76',2024-07-30 07:58:59
12397,711419,10,43420913,79',Mario Otazú (UTC) Yellow Card at 79',2024-07-30 07:58:59
12397,711419,11,43420928,82',Stefano Olaya (Cusco FC) Substitution at 82',2024-07-30 07:58:59
12397,711419,12,43420929,83',Luis Ramos (Cusco FC) Goal at 83',2024-07-30 07:58:59
12397,711419,13,43420947,89',Jimmy Pérez (UTC) Goal at 89',2024-07-30 07:58:59
12397,711419,14,43420964,90'+3',Luis Cano (UTC) Substitution at 93',2024-07-30 07:58:59
12397,711419,15,43420977,90'+7',Jimmy Pérez (UTC) Yellow Card at 97',2024-07-30 07:58:59
12397,711420,0,43421003,37',Mauricio Cuero (Deportivo Garcilaso) Substitution at 37',2024-07-30 07:58:59
12397,711420,1,43421004,40',Mauricio Cuero (Deportivo Garcilaso) Yellow Card at 40',2024-07-30 07:58:59
12397,711420,2,43421005,44',Luis Chicaiza (Deportivo Garcilaso) Yellow Card at 44',2024-07-30 07:58:59
12397,711420,3,43421007,45',Luis Benites (Sport Huancayo) Substitution at 45',2024-07-30 07:58:59
12397,711420,4,43421008,62',Anthony Gordillo (Deportivo Garcilaso) Substitution at 62',2024-07-30 07:58:59
12397,711420,5,43421009,63',Jose Luis Bazan (Deportivo Garcilaso) Substitution at 63',2024-07-30 07:58:59
12397,711420,6,43421012,66',Alexi Gomez (Sport Huancayo) Substitution at 66',2024-07-30 07:58:59
12397,711420,7,43421011,67',Diego Mina (Sport Huancayo) Substitution at 67',2024-07-30 07:58:59
12397,711420,8,43421015,73',Lucas Cano (Sport Huancayo) Goal at 73',2024-07-30 07:58:59
12397,711420,9,43421016,79',Paulo Rodríguez (Deportivo Garcilaso) Substitution at 79',2024-07-30 07:58:59
12397,711420,10,43421018,79',Héctor Salazar (Deportivo Garcilaso) Substitution at 79',2024-07-30 07:58:59
12397,711420,11,43421019,82',Luis Benites (Sport Huancayo) Yellow Card at 82',2024-07-30 07:58:59
12397,711420,12,43421027,89',Javier Eduardo Núñez Mendoza (Sport Huancayo) Substitution at 89',2024-07-30 07:58:59
12397,711420,13,43421044,90'+4',Mauricio Cuero (Deportivo Garcilaso) Red Card at 94',2024-07-30 07:58:59
12397,711420,14,43421055,90'+6',Paulo Rodríguez (Deportivo Garcilaso) Yellow Card at 96',2024-07-30 07:58:59
12397,711420,15,43421066,90'+9',Anthony Gordillo (Deportivo Garcilaso) Yellow Card at 99',2024-07-30 07:58:59
12397,711421,0,43424114,13',Cristian Mejía (Los Chankas) Yellow Card at 13',2024-07-30 07:58:59
12397,711421,1,43424131,18',Piero Magallanes (Comerciantes Unidos) Yellow Card at 18',2024-07-30 07:58:59
12397,711421,2,43424205,39',Matías Sen (Comerciantes Unidos) Yellow Card at 39',2024-07-30 07:58:59
12397,711421,3,43424250,45',Oshiro Takeuchi (Los Chankas) Substitution at 45',2024-07-30 07:58:59
12397,711421,4,43424251,45',Ángel Ledesma (Los Chankas) Substitution at 45',2024-07-30 07:58:59
12397,711421,5,43424307,53',Daniel Ferreyra (Los Chankas) Yellow Card at 53',2024-07-30 07:58:59
12397,711421,6,43424305,55',José Parodi (Comerciantes Unidos) Substitution at 55',2024-07-30 07:58:59
12397,711421,7,43424306,56',Duván Palacios (Comerciantes Unidos) Substitution at 56',2024-07-30 07:58:59
12397,711421,8,43424345,62',Kenyi Barrios (Comerciantes Unidos) Yellow Card at 62',2024-07-30 07:58:59
12397,711421,9,43424349,64',Carlos López (Los Chankas) Goal at 64',2024-07-30 07:58:59
12397,711421,10,43424379,68',Franco Medina (Comerciantes Unidos) Substitution at 68',2024-07-30 07:58:59
12397,711421,11,43424380,68',Emmanuel Paucar (Comerciantes Unidos) Substitution at 68',2024-07-30 07:58:59
12397,711421,12,43424413,72',Sebastián Gonzáles Zela (Comerciantes Unidos) Substitution at 72',2024-07-30 07:58:59
12397,711421,13,43424424,75',Ademar Robles (Los Chankas) Substitution at 75',2024-07-30 07:58:59
12397,711421,14,43424463,78',Ederson Mogollón (Los Chankas) Substitution at 78',2024-07-30 07:58:59
12397,711421,15,43424464,78',Ayrthon Quintana (Los Chankas) Substitution at 78',2024-07-30 07:58:59
12397,711421,16,43424514,87',José Parodi (Comerciantes Unidos) Yellow Card at 87',2024-07-30 07:58:59
12397,711421,17,43424544,90'+2',José Caballero (Comerciantes Unidos) Yellow Card at 92',2024-07-30 07:58:59
12397,711421,18,43424549,90'+3',Emmanuel Paucar (Comerciantes Unidos) Yellow Card at 93',2024-07-30 07:58:59
12397,711421,19,43424552,90'+6',José Manzaneda (Los Chankas) Goal at 96',2024-07-30 07:58:59
12397,711422,0,43424739,3',Bernardo Cuesta (Melgar) Goal at 3',2024-07-30 07:58:59
12397,711422,1,43424754,6',Jairo Vélez (César Vallejo) Goal at 6',2024-07-30 07:58:59
12397,711422,2,43424948,30',José Bolivar (César Vallejo) Yellow Card at 30',2024-07-30 07:58:59
12397,711422,3,43425005,44',Jean Pierre Archimbaud (Melgar) Goal at 44',2024-07-30 07:58:59
12397,711422,4,43425017,45'+1',Jairo Vélez (César Vallejo) Yellow Card at 46',2024-07-30 07:58:59
12397,711422,5,43425427,62',Pierre Da Silva (César Vallejo) Substitution at 62',2024-07-30 07:58:59
12397,711422,6,43425482,66',Jefferson Caceres (Melgar) Substitution at 66',2024-07-30 07:58:59
12397,711422,7,43425483,67',Matías Lazo (Melgar) Substitution at 67',2024-07-30 07:58:59
12397,711422,8,43425484,67',Kenji Cabrera (Melgar) Substitution at 67',2024-07-30 07:58:59
12397,711422,9,43425503,68',Bernardo Cuesta (Melgar) Goal at 68',2024-07-30 07:58:59
12397,711422,10,43425564,75',Edgar Benítez (César Vallejo) Substitution at 75',2024-07-30 07:58:59
12397,711422,11,43425571,75',Osnar Noronha (César Vallejo) Substitution at 75',2024-07-30 07:58:59
12397,711422,12,43425602,77',Walter Tandazo (Melgar) Substitution at 77',2024-07-30 07:58:59
12397,711422,13,43425603,78',Jefferson Caceres (Melgar) Goal at 78',2024-07-30 07:58:59
12397,711422,14,43425611,81',Alexis Arias (Melgar) Substitution at 81',2024-07-30 07:58:59
12397,711422,15,43425629,85',Jefferson Caceres (Melgar) Goal at 85',2024-07-30 07:58:59
12397,711422,16,43425660,90'+2',Jairo Vélez (César Vallejo) Goal at 92',2024-07-30 07:58:59
12397,711423,0,43427186,38',Herná Barcos (Alianza Lima) Penalty - Scored at 38',2024-07-30 07:58:59
12397,711423,1,43428175,53',Alessandro Milesi (Alianza Atlético) Yellow Card at 53',2024-07-30 07:58:59
12397,711423,2,43428267,56',Adrián Arregui (Alianza Lima) Yellow Card at 56',2024-07-30 07:58:59
12397,711423,3,43428340,59',Cecilio Waterman (Alianza Lima) Substitution at 59',2024-07-30 07:58:59
12397,711423,4,43428341,59',Antonio Huamán (Alianza Lima) Substitution at 59',2024-07-30 07:58:59
12397,711423,5,43428673,74',Christian Flores (Alianza Atlético) Substitution at 74',2024-07-30 07:58:59
12397,711423,6,43428674,74',Roberto Siucho (Alianza Atlético) Substitution at 74',2024-07-30 07:58:59
12397,711423,7,43428675,74',Guillermo Larios (Alianza Atlético) Substitution at 74',2024-07-30 07:58:59
12397,711423,8,43428758,79',Carlos Zambrano (Alianza Lima) Yellow Card at 79',2024-07-30 07:58:59
12397,711423,9,43428800,82',Jiovany Ramos (Alianza Lima) Substitution at 82',2024-07-30 07:58:59
12397,711423,10,43428801,82',Jesús Castillo (Alianza Lima) Substitution at 82',2024-07-30 07:58:59
12397,711423,11,43428823,84',Herná Barcos (Alianza Lima) Goal at 84',2024-07-30 07:58:59
12397,711423,12,43428877,85',Jesús Mendieta (Alianza Atlético) Substitution at 85',2024-07-30 07:58:59
12397,711423,13,43428878,85',Adrian Fernandez (Alianza Atlético) Substitution at 85',2024-07-30 07:58:59
12397,711423,14,43428943,90'+2',Axel Moyano (Alianza Lima) Substitution at 92',2024-07-30 07:58:59
12397,711423,15,43429361,90'+3',Axel Moyano (Alianza Lima) Yellow Card at 93',2024-07-30 07:58:59
12397,711424,0,43431736,37',Alex Valera (Universitario) Goal at 37',2024-07-30 07:58:59
12397,711424,1,43431755,44',Mauro Da Luz (Atlético Grau) Goal at 44',2024-07-30 07:58:59
12397,711424,2,43431809,47',Jherson Reyes (Atlético Grau) Yellow Card at 47',2024-07-30 07:58:59
12397,711424,3,43431884,53',Fabio Rojas (Atlético Grau) Substitution at 53',2024-07-30 07:58:59
12397,711424,4,43431979,65',Segundo Portocarrero (Universitario) Substitution at 65',2024-07-30 07:58:59
12397,711424,5,43431980,65',Horacio Calcaterra (Universitario) Substitution at 65',2024-07-30 07:58:59
12397,711424,6,43432031,69',José Rivera (Universitario) Substitution at 69',2024-07-30 07:58:59
12397,711424,7,43432074,78',Freddy Oncoy (Atlético Grau) Substitution at 78',2024-07-30 07:58:59
12397,711424,8,43432134,84',Jorge Murrugarra (Universitario) Substitution at 84',2024-07-30 07:58:59
12397,711424,9,43432135,84',Christopher Olivares (Universitario) Substitution at 84',2024-07-30 07:58:59
12397,711424,10,43432175,89',Ray Sandoval (Atlético Grau) Substitution at 89',2024-07-30 07:58:59
12397,711424,11,43432196,90'+5',Horacio Calcaterra (Universitario) Red Card at 95',2024-07-30 07:58:59
12397,711424,12,43432216,90'+6',Aldo Corzo (Universitario) Yellow Card at 96',2024-07-30 07:58:59
12397,711425,0,43432252,12',Hansell Riojas (Unión Comercio) Yellow Card at 12',2024-07-30 07:58:59
12397,711425,1,43432455,33',Ángel Benítez (Carlos A. Mannucci) Yellow Card at 33',2024-07-30 07:58:59
12397,711425,2,43432827,45',Carlos Uribe (Unión Comercio) Substitution at 45',2024-07-30 07:58:59
12397,711425,3,43432828,45',William Mimbela (Carlos A. Mannucci) Substitution at 45',2024-07-30 07:58:59
12397,711425,4,43432938,64',José Cortés (Carlos A. Mannucci) Substitution at 64',2024-07-30 07:58:59
12397,711425,5,43433018,71',Teodoro Paredes (Unión Comercio) Substitution at 71',2024-07-30 07:58:59
12397,711425,6,43433019,72',Luis Navea (Unión Comercio) Substitution at 72',2024-07-30 07:58:59
12397,711425,7,43433062,72',Willy Diaz (Unión Comercio) Yellow Card at 72',2024-07-30 07:58:59
12397,711425,8,43433086,77',Roberto Villamarín (Unión Comercio) Yellow Card at 77',2024-07-30 07:58:59
12397,711425,9,43433151,81',Carlos Liza (Carlos A. Mannucci) Substitution at 81',2024-07-30 07:58:59
12397,711425,10,43433200,84',Jorge Tandazo (Unión Comercio) Substitution at 84',2024-07-30 07:58:59
12397,711425,11,43433201,84',Tarek Carranza (Unión Comercio) Substitution at 84',2024-07-30 07:58:59
12397,711425,12,43433214,86',Alexander Succar (Carlos A. Mannucci) Yellow Card at 86',2024-07-30 07:58:59
12397,711425,13,43433347,90'+6',Joaquín Aguirre (Unión Comercio) Yellow Card at 96',2024-07-30 07:58:59
12397,711426,0,43432583,19',Alejandro Posito (Sporting Cristal) Yellow Card at 19',2024-07-30 07:58:59
12397,711426,1,43432712,30',Martín Cauteruccio (Sporting Cristal) Goal at 30',2024-07-30 07:58:59
12397,711426,2,43432804,41',Cristian Techera (Sport Boys) Yellow Card at 41',2024-07-30 07:58:59
12397,711426,3,43432953,45',Joel Pissano (Sport Boys) Substitution at 45',2024-07-30 07:58:59
12397,711426,4,43432954,45',Renzo Salazar (Sport Boys) Substitution at 45',2024-07-30 07:58:59
12397,711426,5,43432955,45',Brandon Palacios (Sport Boys) Substitution at 45',2024-07-30 07:58:59
12397,711426,6,43433145,60',Santiago González (Sporting Cristal) Yellow Card at 60',2024-07-30 07:58:59
12397,711426,7,43433225,65',Gerald Távara (Sporting Cristal) Substitution at 65',2024-07-30 07:58:59
12397,711426,8,43433226,65',Jostin Alarcón (Sporting Cristal) Substitution at 65',2024-07-30 07:58:59
12397,711426,9,43433321,72',Rafael Lutiger (Sporting Cristal) Substitution at 72',2024-07-30 07:58:59
12397,711426,10,43433372,75',Cristian Benavente (Sport Boys) Substitution at 75',2024-07-30 07:58:59
12397,711426,11,43433373,76',Martín Cauteruccio (Sporting Cristal) Goal at 76',2024-07-30 07:58:59
12397,711426,12,43433432,79',Irven Ávila (Sporting Cristal) Substitution at 79',2024-07-30 07:58:59
12397,711426,13,43433433,79',Fernando Pacheco (Sporting Cristal) Substitution at 79',2024-07-30 07:58:59
12397,711426,14,43433539,88',Gilmar Rodríguez (Sport Boys) Substitution at 88',2024-07-30 07:58:59
