seasonType,eventId,commentaryOrder,playId,clockDisplayValue,commentaryText,updateDateTime
12397,715335,6,43817466,55',Paolo Guerrero (Alianza Lima) Goal at 55',2024-09-23 05:36:57
12397,715335,7,43817558,59',Jesús Castillo (Alianza Lima) Substitution at 59',2024-09-23 05:36:57
12397,715335,8,43817559,59',Herná Barcos (Alianza Lima) Substitution at 59',2024-09-23 05:36:57
12397,715335,9,43817718,72',Juan Morales (Sport Boys) Yellow Card at 72',2024-09-23 05:36:57
12397,715335,10,43817783,75',Antonio Huamán (Alianza Lima) Substitution at 75',2024-09-23 05:36:57
12397,715335,11,43817784,75',Matías Succar (Alianza Lima) Substitution at 75',2024-09-23 05:36:57
12397,715335,12,43817785,75',Kevin Peña (Sport Boys) Yellow Card at 75',2024-09-23 05:36:57
12397,715335,13,43817828,77',Jesús Barco (Sport Boys) Substitution at 77',2024-09-23 05:36:57
12397,715335,14,43817829,77',Fabrizio Roca (Sport Boys) Substitution at 77',2024-09-23 05:36:57
12397,715335,15,43817830,78',Erick Noriega (Alianza Lima) Yellow Card at 78',2024-09-23 05:36:57
12397,715336,0,43829298,59',José Rivera (Universitario) Substitution at 59',2024-09-24 05:41:59
12397,715336,1,43829299,59',Gabriel Costa (Universitario) Substitution at 59',2024-09-24 05:41:59
12397,715336,2,43829377,67',Aldo Corzo (Universitario) Goal at 67',2024-09-24 05:41:59
12397,715336,3,43829396,68',Segundo Portocarrero (Universitario) Substitution at 68',2024-09-24 05:41:59
12397,715336,4,43829407,70',Martín Guedes (Universitario) Yellow Card at 70',2024-09-24 05:41:59
12397,715336,5,43829452,73',Sebastian Britos Rodriguez (Universitario) Yellow Card at 73',2024-09-24 05:41:59
12397,715336,6,43829453,73',Hernán Pérez (Unión Comercio) Yellow Card at 73',2024-09-24 05:41:59
12397,715336,7,43829472,76',Osama Jiménez (Unión Comercio) Substitution at 76',2024-09-24 05:41:59
12397,715336,8,43829549,82',Jorge Murrugarra (Universitario) Substitution at 82',2024-09-24 05:41:59
12397,715336,9,43829646,88',Hector Zeta (Unión Comercio) Substitution at 88',2024-09-24 05:41:59
12397,715336,10,43829715,90'+3',Patrick Espinoza (Unión Comercio) Substitution at 93',2024-09-24 05:41:59
12397,715337,0,43814302,15',Juan Lojas (Deportivo Garcilaso) Goal at 15',2024-09-23 05:36:57
12397,715337,1,43814874,45',Alejandro Ramirez Zarate (Cienciano del Cusco) Substitution at 45',2024-09-23 05:36:57
12397,715337,2,43815067,57',Christian Cueva (Cienciano del Cusco) Substitution at 57',2024-09-23 05:36:57
12397,715337,3,43815112,58',Pablo Erustes (Deportivo Garcilaso) Yellow Card at 58',2024-09-23 05:36:57
12397,715337,4,43815327,68',Juan Lojas (Deportivo Garcilaso) Red Card at 68',2024-09-23 05:36:57
12397,715337,5,43815488,72',Freddy Yovera (Deportivo Garcilaso) Substitution at 72',2024-09-23 05:36:57
12397,715337,6,43815489,72',Héctor Salazar (Deportivo Garcilaso) Substitution at 72',2024-09-23 05:36:57
12397,715337,7,43815490,73',Marco Rodríguez (Cienciano del Cusco) Substitution at 73',2024-09-23 05:36:57
12397,715337,8,43815491,73',Erick Gonzales (Deportivo Garcilaso) Substitution at 73',2024-09-23 05:36:57
12397,715337,9,43815492,73',Didier La Torre (Cienciano del Cusco) Substitution at 73',2024-09-23 05:36:57
12397,715337,10,43815645,81',Marco Rodríguez (Cienciano del Cusco) Yellow Card at 81',2024-09-23 05:36:57
12397,715337,11,43815671,81',Erick Canales (Deportivo Garcilaso) Yellow Card at 81',2024-09-23 05:36:57
12397,715337,12,43815783,85',Erick Perleche (Deportivo Garcilaso) Substitution at 85',2024-10-11 05:34:00
12397,715337,13,43815784,85',Pedro Ibañez (Cienciano del Cusco) Substitution at 85',2024-10-11 05:34:00
12397,715337,14,43815965,90'+4',Danilo Carando (Deportivo Garcilaso) Substitution at 94',2024-10-11 05:34:00
12397,715338,0,43830120,7',Alex Rambal (ADT) Yellow Card at 7',2024-09-24 05:41:59
12397,715338,1,43830227,24',Jairo Vélez (César Vallejo) Yellow Card at 24',2024-09-24 05:41:59
12397,715338,2,43830356,44',Luiz Da Silva (ADT) Yellow Card at 44',2024-09-24 05:41:59
12397,715338,3,43830438,48',Jhon Narváez (ADT) Yellow Card at 48',2024-09-24 05:41:59
12397,715338,4,43830446,52',Josepmir Ballón (César Vallejo) Yellow Card at 52',2024-09-24 05:41:59
12397,715338,5,43830453,56',Arley Rodríguez (César Vallejo) Substitution at 56',2024-09-24 05:41:59
12397,715338,6,43830528,70',Edgar Benítez (César Vallejo) Substitution at 70',2024-09-24 05:41:59
12397,715338,7,43830576,79',José Bolivar (César Vallejo) Substitution at 79',2024-09-24 05:41:59
12397,715338,8,43830577,79',Gerson Barreto (César Vallejo) Substitution at 79',2024-09-24 05:41:59
12397,715338,9,43830613,84',Jorge Palomino (ADT) Substitution at 84',2024-09-24 05:41:59
12397,715338,10,43830654,90',Luiz Da Silva (ADT) Red Card at 90',2024-09-24 05:41:59
12397,715338,11,43830667,90'+2',Alec Deneumostier (César Vallejo) Yellow Card at 92',2024-09-24 05:41:59
12397,715339,0,43826510,10',Gustavo Cazonatti (Sporting Cristal) Goal at 10',2024-09-23 05:36:57
12397,715339,1,43826691,19',Martín Cauteruccio (Sporting Cristal) Shot Off Target at 19',2024-09-23 05:36:57
12397,715339,2,43827039,38',Juan Manuel Tévez (Cusco FC) Penalty - Scored at 38',2024-09-23 05:36:57
12397,715339,3,43827559,62',Gerald Távara (Sporting Cristal) Substitution at 62',2024-09-23 05:36:57
12397,715339,4,43827560,62',Irven Ávila (Sporting Cristal) Substitution at 62',2024-09-23 05:36:57
12397,715339,5,43827602,66',Alan Pérez (Cusco FC) Yellow Card at 66',2024-09-23 05:36:57
12397,715339,6,43827692,74',Rubén Ramírez (Cusco FC) Substitution at 74',2024-09-23 05:36:57
12397,715339,7,43829781,74',Relly Fernández (Cusco FC) Substitution at 74',2024-09-24 05:41:59
12397,715339,8,43827748,77',Maxloren Castro (Sporting Cristal) Substitution at 77',2024-09-24 05:41:59
12397,715339,9,43827749,77',Jostin Alarcón (Sporting Cristal) Substitution at 77',2024-09-24 05:41:59
12397,715339,10,43827750,78',Luis Ramos (Cusco FC) Substitution at 78',2024-09-24 05:41:59
12397,715339,11,43829681,83',Diego Enriquez (Sporting Cristal) Yellow Card at 83',2024-09-24 05:41:59
12397,715339,12,43827864,86',Gerald Távara (Sporting Cristal) Yellow Card at 86',2024-09-24 05:41:59
12397,715339,13,43829518,86',Juan Manuel Tévez (Cusco FC) Yellow Card at 86',2024-09-24 05:41:59
12397,715339,14,43828006,90'+3',Fernando Pacheco (Sporting Cristal) Substitution at 93',2024-09-24 05:41:59
12397,715339,15,43829556,90'+3',Andy Vidal (Cusco FC) Yellow Card at 93',2024-09-24 05:41:59
12397,715339,16,43837721,90'+8',Relly Fernández (Cusco FC) Yellow Card at 98',2024-09-27 05:39:21
12397,715340,0,43832785,15',Leonel Galeano (Melgar) Yellow Card at 15',2024-09-25 05:39:55
12397,715340,1,43832844,27',Leonel González (Melgar) Yellow Card at 27',2024-09-25 05:39:55
12397,715340,2,43833061,45'+3',Kenji Cabrera (Melgar) Substitution at 48',2024-09-25 05:39:55
12397,715340,3,43833305,59',Walter Tandazo (Melgar) Substitution at 59',2024-09-25 05:39:55
12397,715340,4,43833306,59',Pablo Lavandeira (Melgar) Substitution at 59',2024-09-25 05:39:55
12397,715340,5,43833344,68',Mauro Da Luz (Atlético Grau) Substitution at 68',2024-09-25 05:39:55
12397,715340,6,43833380,75',Horacio Orzan (Melgar) Yellow Card at 75',2024-09-25 05:39:55
12397,715340,7,43833413,83',José Rosell (Atlético Grau) Substitution at 83',2024-09-25 05:39:55
12397,715340,8,43833426,83',Diego Rodríguez (Melgar) Substitution at 83',2024-09-25 05:39:55
12397,715340,9,43833427,83',Matías Noble (Melgar) Substitution at 83',2024-09-25 05:39:55
12397,715340,10,43833453,90'+4',Benjamín García (Atlético Grau) Substitution at 94',2024-09-25 05:39:55
12397,715341,0,43888670,14',Javier Eduardo Núñez Mendoza (Sport Huancayo) Substitution at 14',2024-09-30 05:42:44
12397,715341,1,43888901,28',Minzum Quina (Sport Huancayo) Goal at 28',2024-09-30 05:42:44
12397,715341,2,43889065,36',Alexander Succar (Carlos A. Mannucci) Goal at 36',2024-09-30 05:42:44
12397,715341,3,43889833,61',Nicolás Albarracin (Carlos A. Mannucci) Substitution at 61',2024-09-30 05:42:44
12397,715341,4,43889970,66',Marcelo Gaona (Carlos A. Mannucci) Red Card at 66',2024-09-30 05:42:44
12397,715341,5,43889880,67',Gut (Sport Huancayo) Substitution at 67',2024-09-30 05:42:44
12397,715341,6,43889941,71',José Cortés (Carlos A. Mannucci) Substitution at 71',2024-09-30 05:42:44
12397,715341,7,43889942,71',Alexis Cossio (Carlos A. Mannucci) Substitution at 71',2024-09-30 05:42:44
12397,715341,8,43889943,71',Eduardo Rabanal (Carlos A. Mannucci) Substitution at 71',2024-09-30 05:42:44
12397,715341,9,43889944,73',Guti  (Sport Huancayo) Yellow Card at 73',2024-09-30 05:42:44
12397,715341,10,43890020,78',Luis Garro (Sport Huancayo) Substitution at 78',2024-09-30 05:42:44
12397,715341,11,43890021,78',Luis Benites (Sport Huancayo) Substitution at 78',2024-09-30 05:42:44
12397,715341,12,43890088,82',Eduardo Urtecho (Carlos A. Mannucci) Substitution at 82',2024-09-30 05:42:44
12397,715341,13,43890217,90'+5',Marcos Lliuya (Sport Huancayo) Yellow Card at 95',2024-09-30 05:42:44
12397,715341,14,43890223,90'+6',Lucas Cano (Sport Huancayo) Goal at 96',2024-09-30 05:42:44
12397,715342,0,43894248,30',Neri Bandiera (Atlético Grau) Goal at 30',2024-10-01 05:45:06
12397,715342,1,43894459,48',Jarlín Quintero (UTC) Red Card at 48',2024-10-01 05:45:06
12397,715342,2,43894485,51',Nicolás Figueroa (Atlético Grau) Yellow Card at 51',2024-10-01 05:45:06
12397,715342,3,43894486,52',Carlos Fernandez (UTC) Substitution at 52',2024-10-01 05:45:06
12397,715342,4,43894529,56',Neri Bandiera (Atlético Grau) Goal at 56',2024-10-01 05:45:06
12397,715342,5,43894589,58',Tomás Sandoval (Atlético Grau) Substitution at 58',2024-10-01 05:45:06
12397,715342,6,43894590,58',Cesar Vasquez (Atlético Grau) Substitution at 58',2024-10-01 05:45:06
12397,715342,7,43894653,64',Jherson Reyes (Atlético Grau) Substitution at 64',2024-10-01 05:45:06
12397,715342,8,43894678,69',Angel Ojeda (UTC) Substitution at 69',2024-10-01 05:45:06
12397,715342,9,43894784,78',Leonel Solís (Atlético Grau) Substitution at 78',2024-10-01 05:45:06
12397,715342,10,43894785,79',Freddy Oncoy (Atlético Grau) Substitution at 79',2024-10-01 05:45:06
12397,715342,11,43894843,89',Paulo de la Cruz (Atlético Grau) Goal at 89',2024-10-01 05:45:06
12397,715342,12,43894880,90'+1',Jimmy Pérez (UTC) Substitution at 91',2024-10-01 05:45:06
12397,715342,13,43894881,90'+1',Pedro Requena (UTC) Substitution at 91',2024-10-01 05:45:06
12397,715342,14,43894889,90'+4',Tomás Sandoval (Atlético Grau) Penalty - Scored at 94',2024-10-01 05:45:06
12397,715343,0,43859166,31',Hernán Pérez (Unión Comercio) Red Card at 31',2024-09-29 05:45:29
12397,715343,1,43859335,45'+5',Teodoro Paredes (Unión Comercio) Yellow Card at 50',2024-09-29 05:45:29
12397,715343,2,43859337,45'+6',Jesús Barco (Sport Boys) Yellow Card at 51',2024-09-29 05:45:29
12397,715343,3,43859528,45',Osama Jiménez (Unión Comercio) Substitution at 45',2024-09-29 05:45:29
12397,715343,4,43859588,50',Pablo Bueno (Sport Boys) Goal at 50',2024-09-29 05:45:29
12397,715343,5,43859821,60',Alexis Huaman (Sport Boys) Substitution at 60',2024-09-29 05:45:29
12397,715343,6,43859822,60',Sebastian Aranda (Unión Comercio) Yellow Card at 60',2024-09-29 05:45:29
12397,715343,7,43859858,63',Josue Torres (Unión Comercio) Yellow Card at 63',2024-09-29 05:45:29
12397,715343,8,43860000,67',Carlos Correa (Sport Boys) Substitution at 67',2024-09-29 05:45:29
12397,715343,9,43860001,67',Joel Pissano (Sport Boys) Substitution at 67',2024-09-29 05:45:29
12397,715343,10,43860002,67',Dalexander Rios (Unión Comercio) Substitution at 67',2024-09-29 05:45:29
12397,715343,11,43860003,67',Hector Zeta (Unión Comercio) Substitution at 67',2024-09-29 05:45:29
12397,715343,12,43860014,70',Alexis Huaman (Sport Boys) Goal at 70',2024-09-29 05:45:29
12397,715343,13,43860264,80',Gilmar Rodríguez (Sport Boys) Substitution at 80',2024-09-29 05:45:29
12397,715343,14,43860266,80',Sebastian Alvarado (Sport Boys) Substitution at 80',2024-09-29 05:45:29
12397,715343,15,43860267,81',Jhon Alvarez (Unión Comercio) Substitution at 81',2024-09-29 05:45:29
12397,715343,16,43860313,81',Kevin Ferreyra (Unión Comercio) Substitution at 81',2024-09-29 05:45:29
12397,715344,0,43885273,7',Martín Cauteruccio (Sporting Cristal) Goal at 7',2024-09-30 05:42:44
12397,715344,1,43885601,27',Gerson Barreto (César Vallejo) Yellow Card at 27',2024-09-30 05:42:44
12397,715344,2,43885607,30',Martín Cauteruccio (Sporting Cristal) Goal at 30',2024-09-30 05:42:44
12397,715344,3,43885727,35',Johan Madrid (César Vallejo) Goal at 35',2024-09-30 05:42:44
12397,715344,4,43886173,45',Josepmir Ballón (César Vallejo) Substitution at 45',2024-09-30 05:42:44
12397,715344,5,43886174,45',Dennis Perez (César Vallejo) Substitution at 45',2024-09-30 05:42:44
12397,715344,6,43886250,50',Dennis Perez (César Vallejo) Yellow Card at 50',2024-09-30 05:42:44
12397,715344,7,43886326,53',Franco Romero (Sporting Cristal) Yellow Card at 53',2024-09-30 05:42:44
12397,715344,8,43886366,59',Santiago González (Sporting Cristal) Goal at 59',2024-09-30 05:42:44
12397,715344,9,43886377,60',Edgar Benítez (César Vallejo) Substitution at 60',2024-09-30 05:42:44
12397,715344,10,43886426,65',Gerald Távara (Sporting Cristal) Substitution at 65',2024-09-30 05:42:44
12397,715344,11,43886555,76',Ian Wisdom (Sporting Cristal) Substitution at 76',2024-09-30 05:42:44
12397,715344,12,43886556,76',Carlos Lora (Sporting Cristal) Substitution at 76',2024-09-30 05:42:44
12397,715344,13,43886557,77',Osnar Noronha (César Vallejo) Substitution at 77',2024-09-30 05:42:44
12397,715344,14,43886611,81',Jesús Pretell (Sporting Cristal) Substitution at 81',2024-09-30 05:42:44
12397,715344,15,43886612,81',Alejandro Posito (Sporting Cristal) Substitution at 81',2024-09-30 05:42:44
12397,715344,16,43886617,83',Nicolás Amasifuen (César Vallejo) Substitution at 83',2024-09-30 05:42:44
12397,715344,17,43886650,86',Arley Rodríguez (César Vallejo) Yellow Card at 86',2024-09-30 05:42:44
12397,715344,18,43886701,90'+7',Gerald Távara (Sporting Cristal) Penalty - Scored at 97',2024-09-30 05:42:44
12397,715345,0,43886934,17',Ángel Ledesma (Los Chankas) Goal at 17',2024-09-30 05:42:44
12397,715345,1,43887147,43',Jose Luis Bazan (Deportivo Garcilaso) Yellow Card at 43',2024-09-30 05:42:44
12397,715345,2,43887597,45',Erick Gonzales (Deportivo Garcilaso) Substitution at 45',2024-09-30 05:42:44
12397,715345,3,43887598,45',Mauricio Cuero (Deportivo Garcilaso) Substitution at 45',2024-09-30 05:42:44
12397,715345,4,43887858,57',Erick Gonzales (Deportivo Garcilaso) Yellow Card at 57',2024-09-30 05:42:44
12397,715345,5,43887986,62',Luis Chicaiza (Deportivo Garcilaso) Substitution at 62',2024-09-30 05:42:44
12397,715345,6,43887987,62',Erick Perleche (Deportivo Garcilaso) Substitution at 62',2024-09-30 05:42:44
12397,715345,7,43887988,64',Ademar Robles (Los Chankas) Substitution at 64',2024-09-30 05:42:44
12397,715345,8,43888267,74',Danilo Carando (Deportivo Garcilaso) Substitution at 74',2024-09-30 05:42:44
12397,715345,9,43888268,75',Ederson Mogollón (Los Chankas) Substitution at 75',2024-09-30 05:42:44
12397,715345,10,43888269,76',Rodrigo Salinas (Los Chankas) Substitution at 76',2024-09-30 05:42:44
12397,715345,11,43888333,82',Diego Temoche (Los Chankas) Substitution at 82',2024-09-30 05:42:44
12397,715345,12,43888334,83',Gonzalo Sánchez (Los Chankas) Substitution at 83',2024-09-30 05:42:44
12397,715346,0,43889180,12',Horacio Calcaterra (Universitario) Goal at 12',2024-09-30 05:42:44
12397,715346,1,43889444,24',Diego Campos (Comerciantes Unidos) Yellow Card at 24',2024-09-30 05:42:44
12397,715346,2,43890018,49',Jorge Bosmediano (Comerciantes Unidos) Substitution at 49',2024-09-30 05:42:44
12397,715346,3,43890090,54',Edison Flores (Universitario) Goal at 54',2024-09-30 05:42:44
12397,715346,4,43890178,58',Italo Regalado (Comerciantes Unidos) Substitution at 58',2024-09-30 05:42:44
12397,715346,5,43890266,66',Gabriel Costa (Universitario) Substitution at 66',2024-09-30 05:42:44
12397,715346,6,43890267,66',Jairo Concha (Universitario) Substitution at 66',2024-09-30 05:42:44
12397,715346,7,43890268,67',Sebastian Britos Rodriguez (Universitario) Yellow Card at 67',2024-09-30 05:42:44
12397,715346,8,43890365,76',José Rivera (Universitario) Substitution at 76',2024-09-30 05:42:44
12397,715346,9,43890366,76',Nelson Cabanillas (Universitario) Substitution at 76',2024-09-30 05:42:44
12397,715346,10,43890460,83',Rodrigo Urena (Universitario) Substitution at 83',2024-09-30 05:42:44
12397,715346,11,43890461,83',Franco Medina (Comerciantes Unidos) Substitution at 83',2024-09-30 05:42:44
12397,715347,0,43875658,32',Didier La Torre (Cienciano del Cusco) Yellow Card at 32',2024-09-30 05:42:44
12397,715347,1,43875659,32',German Mera (Cienciano del Cusco) Goal at 32',2024-09-30 05:42:44
12397,715347,2,43875751,42',Luis Ramos (Cusco FC) Penalty - Scored at 42',2024-09-30 05:42:44
12397,715347,3,43875821,42',Relly Fernández (Cusco FC) Substitution at 42',2024-09-30 05:42:44
12397,715347,4,43875761,45',Luis Ramos (Cusco FC) Goal at 45',2024-09-30 05:42:44
12397,715347,5,43876243,55',Christian Cueva (Cienciano del Cusco) Substitution at 55',2024-09-30 05:42:44
12397,715347,6,43876489,68',Marco Rodríguez (Cienciano del Cusco) Substitution at 68',2024-09-30 05:42:44
12397,715347,7,43876513,73',Jonathan Bilbao (Cusco FC) Yellow Card at 73',2024-09-30 05:42:44
12397,715347,8,43876597,77',Juan Manuel Tévez (Cusco FC) Substitution at 77',2024-09-30 05:42:44
12397,715347,9,43876598,77',Pablo Cárdenas (Cusco FC) Substitution at 77',2024-09-30 05:42:44
12397,715347,10,43876599,77',Rubén Ramírez (Cusco FC) Substitution at 77',2024-09-30 05:42:44
12397,715347,11,43876601,77',Jordan Guivin (Cienciano del Cusco) Substitution at 77',2024-09-30 05:42:44
12397,715347,12,43876753,84',Rubén Ramírez (Cusco FC) Yellow Card at 84',2024-09-30 05:42:44
12397,715347,13,43876969,90'+1',Alonso Tamariz Ramirez (Cusco FC) Substitution at 91',2024-09-30 05:42:44
12397,715348,0,43874516,45',Santiago Arias (Alianza Atlético) Substitution at 45',2024-09-29 05:45:29
12397,715348,1,43874634,56',Horacio Benincasa (Alianza Atlético) Penalty - Scored at 56',2024-09-29 05:45:29
12397,715348,2,43874653,56',Juan Gonzáles (ADT) Substitution at 56',2024-09-29 05:45:29
12397,715348,3,43874733,65',Renato Espinoza (Alianza Atlético) Substitution at 65',2024-09-29 05:45:29
12397,715348,4,43874734,65',Eric Tovo (Alianza Atlético) Substitution at 65',2024-09-29 05:45:29
12397,715348,5,43874794,73',Christian Vargas (ADT) Substitution at 73',2024-09-29 05:45:29
12397,715348,6,43874795,73',Christian Vásquez (Alianza Atlético) Substitution at 73',2024-09-29 05:45:29
12397,715348,7,43874796,74',Renato Espinoza (Alianza Atlético) Yellow Card at 74',2024-09-29 05:45:29
12397,715348,8,43874826,77',Edson Aubert (ADT) Yellow Card at 77',2024-09-29 05:45:29
12397,715348,9,43874898,80',Alessandro Milesi (Alianza Atlético) Substitution at 80',2024-09-29 05:45:29
12397,715348,10,43874943,82',Diego Melián (Alianza Atlético) Yellow Card at 82',2024-09-29 05:45:29
12397,715348,11,43874970,84',Jhojan Dominguez (ADT) Substitution at 84',2024-09-29 05:45:29
12397,715348,12,43874971,85',Alexander Hidalgo (ADT) Substitution at 85',2024-09-29 05:45:29
12397,715348,13,43875062,90'+1',Santiago Arias (Alianza Atlético) Yellow Card at 91',2024-09-29 05:45:29
12397,715349,0,43879285,31',Jean Pierre Archimbaud (Melgar) Goal at 31',2024-09-30 05:42:44
12397,715349,1,43879504,45',Juan Freytes (Alianza Lima) Yellow Card at 45',2024-09-30 05:42:44
12397,715349,2,43879815,45',Kenji Cabrera (Melgar) Substitution at 45',2024-09-30 05:42:44
12397,715349,3,43879816,45',Cristian Neira (Alianza Lima) Substitution at 45',2024-09-30 05:42:44
12397,715349,4,43879817,45',Jhamir D´Arrigo (Alianza Lima) Substitution at 45',2024-09-30 05:42:44
12397,715349,5,43879919,51',Matías Lazo (Melgar) Yellow Card at 51',2024-09-30 05:42:44
12397,715349,6,43879947,53',Jhamir D´Arrigo (Alianza Lima) Goal at 53',2024-09-30 05:42:44
12397,715349,7,43879964,55',Pablo Lavandeira (Melgar) Yellow Card at 55',2024-09-30 05:42:44
12397,715349,8,43880009,58',Carlos Zambrano (Alianza Lima) Yellow Card at 58',2024-09-30 05:42:44
12397,715349,9,43880069,65',Herná Barcos (Alianza Lima) Substitution at 65',2024-09-30 05:42:44
12397,715349,10,43880070,65',Matías Succar (Alianza Lima) Substitution at 65',2024-09-30 05:42:44
12397,715349,11,43880079,68',Jefferson Caceres (Melgar) Substitution at 68',2024-09-30 05:42:44
12397,715349,12,43880080,68',Alexis Arias (Melgar) Substitution at 68',2024-09-30 05:42:44
12397,715349,13,43880120,73',Adrián Arregui (Alianza Lima) Substitution at 73',2024-09-30 05:42:44
12397,715349,14,43880153,78',Kevin Quevedo (Alianza Lima) Yellow Card at 78',2024-09-30 05:42:44
12397,715349,15,43880185,79',Cristian Bordacahar (Melgar) Yellow Card at 79',2024-09-30 05:42:44
12397,715350,0,44011730,41',Renato Espinoza (Alianza Atlético) Goal at 41',2024-10-22 23:22:46
12397,715350,1,44011962,45',Jostin Alarcón (Sporting Cristal) Substitution at 45',2024-10-22 23:22:46
12397,715350,2,44012322,72',Luis Iberico (Sporting Cristal) Substitution at 72',2024-10-22 23:22:46
12397,715350,3,44012323,72',Fernando Pacheco (Sporting Cristal) Substitution at 72',2024-10-22 23:22:46
12397,715350,4,44012411,77',Stefano Fernández (Alianza Atlético) Substitution at 77',2024-10-22 23:22:46
12397,715350,5,44012412,77',Eric Tovo (Alianza Atlético) Substitution at 77',2024-10-22 23:22:46
12397,715350,6,44012559,84',Jeremy Canela (Alianza Atlético) Yellow Card at 84',2024-10-22 23:22:46
12397,715350,7,44012594,84',Guillermo Larios (Alianza Atlético) Substitution at 84',2024-10-22 23:22:46
12397,715350,8,44012595,84',Carlos Lora (Sporting Cristal) Substitution at 84',2024-10-22 23:22:46
12397,715350,9,44012618,84',Irven Ávila (Sporting Cristal) Substitution at 84',2024-10-22 23:22:46
12397,715350,10,44012827,84',José De La Cruz (Alianza Atlético) Substitution at 84',2024-10-22 23:22:46
12397,715350,11,44012734,90',Aldair Perleche (Alianza Atlético) Substitution at 90',2024-10-22 23:22:46
12397,715350,12,44012783,90'+5',Alessandro Milesi (Alianza Atlético) Yellow Card at 95',2024-10-22 23:22:46
12397,715351,0,44017399,29',Alex Valera (Universitario) Penalty - Scored at 29',2024-10-25 05:18:47
12397,715351,1,44017485,41',Jhon Narváez (ADT) Yellow Card at 41',2024-10-25 05:18:47
12397,715351,2,44018120,53',Alex Valera (Universitario) Goal at 53',2024-10-25 05:18:47
12397,715351,3,44018196,56',Angel Quiñonez (ADT) Substitution at 56',2024-10-25 05:18:47
12397,715351,4,44018230,57',Matías Di Bennedetto (Universitario) Own Goal at 57',2024-10-25 05:18:47
12397,715351,5,44018308,61',Segundo Portocarrero (Universitario) Substitution at 61',2024-10-25 05:18:47
12397,715351,6,44018309,62',Jairo Concha (Universitario) Substitution at 62',2024-10-25 05:18:47
12397,715351,7,44018396,66',Alex Valera (Universitario) Yellow Card at 66',2024-10-25 05:18:47
12397,715351,8,44018438,67',Gabriel Costa (Universitario) Substitution at 67',2024-10-25 05:18:47
12397,715351,9,44018439,68',Jorge Murrugarra (Universitario) Substitution at 68',2024-10-25 05:18:47
12397,715351,10,44018494,70',Luiz Da Silva (ADT) Substitution at 70',2024-10-25 05:18:47
12397,715351,11,44018586,76',José Rivera (Universitario) Substitution at 76',2024-10-25 05:18:47
12397,715351,12,44018613,78',Aldo Corzo (Universitario) Yellow Card at 78',2024-10-25 05:18:47
12397,715351,13,44018628,82',José Rivera (Universitario) Yellow Card at 82',2024-10-25 05:18:47
12397,715351,14,44018664,88',Juan Gonzáles (ADT) Substitution at 88',2024-10-25 05:18:47
12397,715351,15,44018675,90',Andy Polo (Universitario) Yellow Card at 90',2024-10-25 05:18:47
12397,715352,0,43999456,36',Paolo Guerrero (Alianza Lima) Substitution at 36',2024-10-19 05:15:42
12397,715352,1,43999653,60',Paolo Guerrero (Alianza Lima) Penalty - Scored at 60',2024-10-19 05:15:42
12397,715352,2,43999678,65',Carlos Fernandez (UTC) Substitution at 65',2024-10-19 05:15:42
12397,715352,3,43999679,65',Jimmy Pérez (UTC) Substitution at 65',2024-10-19 05:15:42
12397,715352,4,43999695,72',Neil Marcos (UTC) Substitution at 72',2024-10-19 05:15:42
12397,715352,5,43999698,75',Gonzalo Aguirre (Alianza Lima) Substitution at 75',2024-10-19 05:15:42
12397,715352,6,43999717,81',Kevin Ruíz (UTC) Substitution at 81',2024-10-19 05:15:42
12397,715352,7,43999718,81',Mario Otazú (UTC) Substitution at 81',2024-10-19 05:15:42
12397,715352,8,43999750,90',Pablo Sabbag (Alianza Lima) Substitution at 90',2024-10-19 05:15:42
12397,715352,9,43999751,90',Aldair Fuentes (Alianza Lima) Substitution at 90',2024-10-19 05:15:42
12397,715353,0,43997274,35',Tomás Sandoval (Atlético Grau) Yellow Card at 35',2024-10-19 05:15:42
12397,715353,1,43997310,41',Tomás Sandoval (Atlético Grau) Goal at 41',2024-10-19 05:15:42
12397,715353,2,43997339,45'+1',Jherson Reyes (Atlético Grau) Yellow Card at 46',2024-10-19 05:15:42
12397,715353,3,43997387,45',Ronal Huacca (Sport Huancayo) Substitution at 45',2024-10-19 05:15:42
12397,715353,4,43997399,45',Jeremy Rostaing (Atlético Grau) Substitution at 45',2024-10-19 05:15:42
12397,715353,5,43997427,50',Mauro Da Luz (Atlético Grau) Goal at 50',2024-10-19 05:15:42
12397,715353,6,43997463,56',Mauro Da Luz (Atlético Grau) Goal at 56',2024-10-19 05:15:42
12397,715353,7,43997554,65',Luis Benites (Sport Huancayo) Substitution at 65',2024-10-19 05:15:42
12397,715353,8,43997555,65',Luis Garro (Sport Huancayo) Substitution at 65',2024-10-19 05:15:42
12397,715353,9,43997556,66',Daniel Franco (Atlético Grau) Substitution at 66',2024-10-19 05:15:42
12397,715353,10,43997557,66',Freddy Oncoy (Atlético Grau) Substitution at 66',2024-10-19 05:15:42
12397,715353,11,43997638,72',Javier Núñez (Sport Huancayo) Substitution at 72',2024-10-20 11:07:54
12397,715353,12,43997658,78',Cesar Vasquez (Atlético Grau) Substitution at 78',2024-10-19 05:15:42
