seasonType,eventId,commentaryOrder,playId,clockDisplayValue,commentaryText,updateDateTime
12722,709389,15,44051853,81',Antonio Pacheco Ruiz (Albacete) Substitution at 81',2024-10-25 05:18:47
12722,709389,16,44051882,84',Marko Milovanovic (Almería) Substitution at 84',2024-10-25 05:18:47
12722,709389,17,44051883,84',Kaiky (Almería) Substitution at 84',2024-10-25 05:18:47
12722,709390,0,44052699,28',Rober Correa (Racing Ferrol) Yellow Card at 28',2024-10-25 05:18:47
12722,709390,1,44052742,30',Borja Sánchez (Burgos) Goal at 30',2024-10-25 05:18:47
12722,709390,2,44053053,39',Naldo (Racing Ferrol) Yellow Card at 39',2024-10-25 05:18:47
12722,709390,3,44053253,45'+1',Aitor Gelardo (Racing Ferrol) Goal at 46',2024-10-25 05:18:47
12722,709390,4,44053433,45',Buñuel (Racing Ferrol) Substitution at 45',2024-10-25 05:18:47
12722,709390,5,44053434,45',Julián Delmás (Racing Ferrol) Substitution at 45',2024-10-25 05:18:47
12722,709390,6,44053798,57',Fernando Niño (Burgos) Substitution at 57',2024-10-25 05:18:47
12722,709390,7,44053926,60',Manu Vallejo (Racing Ferrol) Substitution at 60',2024-10-25 05:18:47
12722,709390,8,44054087,66',Christian Borrego (Racing Ferrol) Substitution at 66',2024-10-25 05:18:47
12722,709390,9,44054326,71',Florian Miguel (Burgos) Substitution at 71',2024-10-25 05:18:47
12722,709390,10,44054327,71',Pipa (Burgos) Substitution at 71',2024-10-25 05:18:47
12722,709390,11,44054576,79',David Castro (Racing Ferrol) Substitution at 79',2024-10-25 05:18:47
12722,709390,12,44054627,81',Edu Espiau (Burgos) Substitution at 81',2024-10-25 05:18:47
12722,709390,13,44054628,81',Thomas Rodriguez (Burgos) Substitution at 81',2024-10-25 05:18:47
12722,709391,0,44035353,26',Reiner (Granada) Goal at 26',2024-10-22 23:22:46
12722,709391,1,44035521,31',Miguel Ángel Brau (Granada) Substitution at 31',2024-10-24 01:17:06
12722,709391,2,44035556,33',Israel Suero (Castellón) Goal at 33',2024-10-24 01:17:06
12722,709391,3,44035619,35',Israel Suero (Castellón) Goal at 35',2024-10-24 01:17:06
12722,709391,4,44038889,42',Reiner (Granada) Yellow Card at 42',2024-10-24 01:17:06
12722,709391,5,44035870,45'+3',Miguel Ángel Brau (Granada) Yellow Card at 48',2024-10-24 01:17:06
12722,709391,6,44036476,49',Miguel Ángel Brau (Granada) Goal at 49',2024-10-24 01:17:06
12722,709391,7,44036790,57',Ignasi Miquel (Granada) Yellow Card at 57',2024-10-24 01:17:06
12722,709391,8,44036791,57',Raúl Sánchez (Castellón) Yellow Card at 57',2024-10-24 01:17:06
12722,709391,9,44036890,61',Douglas Aurélio (Castellón) Substitution at 61',2024-10-24 01:17:06
12722,709391,10,44036891,61',Salvador Ruiz (Castellón) Substitution at 61',2024-10-24 01:17:06
12722,709391,11,44037015,65',Giorgi Tsitaishvili (Granada) Substitution at 65',2024-10-24 01:17:06
12722,709391,12,44037060,65',Pablo Sáenz (Granada) Substitution at 65',2024-10-24 01:17:06
12722,709391,13,44037151,68',Cala (Castellón) Yellow Card at 68',2024-10-24 01:17:06
12722,709391,14,44037838,80',Ricard Sánchez (Granada) Substitution at 80',2024-10-25 05:18:47
12722,709391,15,44037839,80',Shon Weissman (Granada) Substitution at 80',2024-10-25 05:18:47
12722,709391,16,44037930,84',Jesús De Miguel (Castellón) Substitution at 84',2024-10-24 01:17:06
12722,709391,17,44038226,90'+1',Loic Williams (Granada) Yellow Card at 91',2024-10-24 01:17:06
12722,709391,18,44038227,90'+1',Miguel Rubio (Granada) Yellow Card at 91',2024-10-24 01:17:06
12722,709391,19,44038328,90'+3',Myrto Uzuni (Granada) Penalty - Scored at 93',2024-10-24 01:17:06
12722,709391,20,44038348,90'+4',David Flakus Bosilj (Castellón) Substitution at 94',2024-10-24 01:17:06
12722,709391,21,44038784,90'+4',Josep Calavera (Castellón) Substitution at 94',2024-10-24 01:17:06
12722,709391,22,44038785,90'+6',Ignasi Miquel (Granada) Red Card at 96',2024-10-24 01:17:06
12722,709392,0,44042342,15',José Antonio De La Rosa (Cádiz) Yellow Card at 15',2024-10-24 01:17:06
12722,709392,1,44042351,19',Alvaro Carrillo (Eibar) Yellow Card at 19',2024-10-24 01:17:06
12722,709392,2,44042404,31',José Corpas (Eibar) Goal at 31',2024-10-24 01:17:06
12722,709392,3,44042433,45',Iván Alejo (Cádiz) Yellow Card at 45',2024-10-24 01:17:06
12722,709392,4,44042547,51',Antonio Puertas (Eibar) Yellow Card at 51',2024-10-24 01:17:06
12722,709392,5,44042562,56',Jorge Pascual Medina (Eibar) Substitution at 56',2024-10-24 01:17:06
12722,709392,6,44042571,57',Carlos Fernández (Cádiz) Substitution at 57',2024-10-24 01:17:06
12722,709392,7,44042572,57',Javi Ontiveros (Cádiz) Substitution at 57',2024-10-25 05:18:47
12722,709392,8,44042573,58',Brian Ocampo (Cádiz) Substitution at 58',2024-10-24 01:17:06
12722,709392,9,44042585,60',Fali (Cádiz) Yellow Card at 60',2024-10-24 01:17:06
12722,709392,10,44042605,64',Javi Ontiveros (Cádiz) Yellow Card at 64',2024-10-24 01:17:06
12722,709392,11,44042606,64',Toni Villa (Eibar) Yellow Card at 64',2024-10-25 05:18:47
12722,709392,12,44042845,68',Rominigue Kouame (Cádiz) Substitution at 68',2024-10-24 01:17:06
12722,709392,13,44042846,68',Xeber Alkain (Eibar) Substitution at 68',2024-10-24 01:17:06
12722,709392,14,44042847,68',Ander Madariaga (Eibar) Substitution at 68',2024-10-24 01:17:06
12722,709392,15,44042848,69',Chema (Eibar) Yellow Card at 69',2024-10-24 01:17:06
12722,709392,16,44042858,76',Óscar Melendo (Cádiz) Substitution at 76',2024-10-24 01:17:06
12722,709392,17,44042868,78',Rominigue Kouame (Cádiz) Yellow Card at 78',2024-10-24 01:17:06
12722,709392,18,44042901,82',Peru Nolaskoain (Eibar) Substitution at 82',2024-10-24 01:17:06
12722,709393,0,44042305,11',Juanto (Eldense) Goal at 11',2024-10-24 01:17:06
12722,709393,1,44042410,34',Samed Bazdar (Real Zaragoza) Goal at 34',2024-10-24 01:17:06
12722,709393,2,44042450,45'+3',Víctor García (Eldense) Yellow Card at 48',2024-10-24 01:17:06
12722,709393,3,44042451,45'+4',Ivan Azón (Real Zaragoza) Goal at 49',2024-10-24 01:17:06
12722,709393,4,44042586,60',Francisco Geraldes (Eldense) Substitution at 60',2024-10-24 01:17:06
12722,709393,5,44042587,60',Álex Bernal (Eldense) Substitution at 60',2024-10-24 01:17:06
12722,709393,6,44042887,65',Keidi Bare (Real Zaragoza) Yellow Card at 65',2024-10-24 01:17:06
12722,709393,7,44042888,67',Alberto Marí (Real Zaragoza) Substitution at 67',2024-10-24 01:17:06
12722,709393,8,44042889,68',Marcos Luna Marcos Ruiz (Real Zaragoza) Substitution at 68',2024-10-24 01:17:06
12722,709393,9,44042890,68',Adrián Liso (Real Zaragoza) Substitution at 68',2024-10-24 01:17:06
12722,709393,10,44042891,72',Youness Lachhab (Eldense) Goal at 72',2024-10-24 01:17:06
12722,709393,11,44042892,75',Iván Calero Ruiz (Real Zaragoza) Yellow Card at 75',2024-10-24 01:17:06
12722,709393,12,44042893,79',Unai Ropero (Eldense) Substitution at 79',2024-10-24 01:17:06
12722,709393,13,44042894,79',Simo (Eldense) Substitution at 79',2024-10-24 01:17:06
12722,709393,14,44042895,80',Sergio Bermejo Lillo (Real Zaragoza) Substitution at 80',2024-10-24 01:17:06
12722,709393,15,44042896,80',Adrián Liso (Real Zaragoza) Goal at 80',2024-10-24 01:17:06
12722,709393,16,44042911,85',Antonio Moya (Real Zaragoza) Substitution at 85',2024-10-25 05:18:47
12722,709393,17,44042933,88',Sixtus Ogbuehi (Eldense) Substitution at 88',2024-10-24 01:17:06
12722,709393,18,44042949,90',Sebastián Kósa (Real Zaragoza) Yellow Card at 90',2024-10-24 01:17:06
12722,709394,0,44043333,13',Kiko (FC Cartagena) Yellow Card at 13',2024-10-24 01:17:06
12722,709394,1,44043512,22',Pedro Bigas (Elche) Substitution at 22',2024-10-24 01:17:06
12722,709394,2,44044209,45',Febas (Elche) Substitution at 45',2024-10-24 01:17:06
12722,709394,3,44044479,55',Agustín Álvarez Martínez (Elche) Substitution at 55',2024-10-24 01:17:06
12722,709394,4,44044480,56',Rodrigo Mendoza (Elche) Substitution at 56',2024-10-24 01:17:06
12722,709394,5,44044753,65',Andrija Vukcevic (FC Cartagena) Substitution at 65',2024-10-24 01:17:06
12722,709394,6,44045012,75',Andy (FC Cartagena) Substitution at 75',2024-10-24 01:17:06
12722,709394,7,44045013,75',Hugo Gonzalez (FC Cartagena) Substitution at 75',2024-10-24 01:17:06
12722,709394,8,44045180,81',Rafael Núñez (Elche) Substitution at 81',2024-10-24 01:17:06
12722,709394,9,44045181,82',Alfredo Ortuño (FC Cartagena) Substitution at 82',2024-10-24 01:17:06
12722,709395,0,44048750,7',Iván Romero (Levante) Goal at 7',2024-10-25 05:18:47
12722,709395,1,44049780,28',Iván Romero (Levante) Goal at 28',2024-10-25 05:18:47
12722,709395,2,44050028,43',Rafael Obrador (Deportivo La Coruña) Yellow Card at 43',2024-10-25 05:18:47
12722,709395,3,44050505,45',Mohamed Bouldini (Deportivo La Coruña) Substitution at 45',2024-10-25 05:18:47
12722,709395,4,44050596,47',Alex Petxarromán (Deportivo La Coruña) Yellow Card at 47',2024-10-25 05:18:47
12722,709395,5,44051140,63',Cristian Herrera (Deportivo La Coruña) Substitution at 63',2024-10-25 05:18:47
12722,709395,6,44051141,63',Ximo Navarro (Deportivo La Coruña) Substitution at 63',2024-10-25 05:18:47
12722,709395,7,44051512,72',Óscar Clemente (Levante) Substitution at 72',2024-10-25 05:18:47
12722,709395,8,44051513,72',Fabrício Santos (Levante) Substitution at 72',2024-10-25 05:18:47
12722,709395,9,44051650,76',Sergio Escudero (Deportivo La Coruña) Substitution at 76',2024-10-25 05:18:47
12722,709395,10,44051719,79',Carlos Espí (Levante) Substitution at 79',2024-10-25 05:18:47
12722,709395,11,44051795,82',Iván Martínez (Deportivo La Coruña) Substitution at 82',2024-10-25 05:18:47
12722,709395,12,44051885,86',Xavi Grande (Levante) Substitution at 86',2024-10-25 05:18:47
12722,709395,13,44051889,88',Iván Martínez (Deportivo La Coruña) Goal at 88',2024-10-26 13:53:28
12722,709395,14,44051910,90'+5',Óscar Clemente (Levante) Yellow Card at 95',2024-10-25 05:18:47
12722,709395,15,44051911,90'+8',Giorgi Kochorashvili (Levante) Yellow Card at 98',2024-10-25 05:18:47
12722,709396,0,44043521,23',Alex Sala (Córdoba) Yellow Card at 23',2024-10-24 01:17:06
12722,709396,1,44043992,45'+1',Carlos Albarrán (Córdoba) Yellow Card at 46',2024-10-24 01:17:06
12722,709396,2,44044138,45',Theo Zidane (Córdoba) Substitution at 45',2024-10-24 01:17:06
12722,709396,3,44044155,46',Jon Karrikaburu (Racing Santander) Yellow Card at 46',2024-10-24 01:17:06
12722,709396,4,44044200,49',Adrián Lapeña Ruíz (Córdoba) Yellow Card at 49',2024-10-24 01:17:06
12722,709396,5,44044381,57',Antonio Casas (Córdoba) Yellow Card at 57',2024-10-24 01:17:06
12722,709396,6,44044417,58',Juan Carlos Arana (Racing Santander) Substitution at 58',2024-10-24 01:17:06
12722,709396,7,44044418,58',Andrés Martín (Racing Santander) Substitution at 58',2024-10-24 01:17:06
12722,709396,8,44044535,63',Maguette Gueye (Racing Santander) Substitution at 63',2024-10-24 01:17:06
12722,709396,9,44044597,65',Ander Yoldi (Córdoba) Substitution at 65',2024-10-24 01:17:06
12722,709396,10,44044715,70',Marvel (Córdoba) Yellow Card at 70',2024-10-24 01:17:06
12722,709396,11,44044716,70',Unai Vencedor (Racing Santander) Yellow Card at 70',2024-10-24 01:17:06
12722,709396,12,44044783,73',Lago Junior (Racing Santander) Goal at 73',2024-10-24 01:17:06
12722,709396,13,44044934,77',Carlos Muñoz (Córdoba) Substitution at 77',2024-10-24 01:17:06
12722,709396,14,44044951,77',Jacobo González (Córdoba) Red Card at 77',2024-10-24 01:17:06
12722,709396,15,44045132,81',Genaro Serrano Rodriguez (Córdoba) Substitution at 81',2024-10-24 01:17:06
12722,709396,16,44045133,81',Nikolai Óbolo (Córdoba) Substitution at 81',2024-10-24 01:17:06
12722,709396,17,44045134,84',Pablo Rodriguez (Racing Santander) Substitution at 84',2024-10-24 01:17:06
12722,709396,18,44045135,84',Ekain Zenitagoia (Racing Santander) Substitution at 84',2024-10-24 01:17:06
12722,709396,19,44045169,87',Ekain Zenitagoia (Racing Santander) Goal at 87',2024-10-24 01:17:06
12722,709397,0,44033889,33',Jaime Vázquez (Real Oviedo) Substitution at 33',2024-10-22 23:22:46
12722,709397,1,44033890,34',Unai Egiluz (Mirandés) Substitution at 34',2024-10-22 23:22:46
12722,709397,2,44033903,36',Raúl Fernández (Mirandés) Yellow Card at 36',2024-10-22 23:22:46
12722,709397,3,44033931,41',Alexandre Alemão (Real Oviedo) Goal at 41',2024-10-22 23:22:46
12722,709397,4,44033944,45'+3',Haissem Hassan (Real Oviedo) Goal at 48',2024-10-22 23:22:46
12722,709397,5,44034064,45',Hugo Rincón (Mirandés) Substitution at 45',2024-10-22 23:22:46
12722,709397,6,44034068,45',Casals (Mirandés) Substitution at 45',2024-10-22 23:22:46
12722,709397,7,44034143,61',Sebas Moyano (Real Oviedo) Substitution at 61',2024-10-22 23:22:46
12722,709397,8,44034144,61',Alberto Del Moral (Real Oviedo) Substitution at 61',2024-10-22 23:22:46
12722,709397,9,44034168,69',Daniel Paraschiv (Real Oviedo) Substitution at 69',2024-10-22 23:22:46
12722,709397,10,44034169,70',Álex Suárez (Real Oviedo) Substitution at 70',2024-10-22 23:22:46
12722,709397,11,44034189,73',Álex Suárez (Real Oviedo) Goal at 73',2024-10-22 23:22:46
12722,709397,12,44034228,81',Mathis Lachuer (Mirandés) Substitution at 81',2024-10-22 23:22:46
12722,709397,13,44034229,81',Urko Izeta (Mirandés) Substitution at 81',2024-10-22 23:22:46
12722,709397,14,44034230,82',Daniel Paraschiv (Real Oviedo) Goal at 82',2024-10-22 23:22:46
12722,709397,15,44034250,86',Pablo Tomeo (Mirandés) Goal at 86',2024-10-22 23:22:46
12722,709397,16,44034299,89',Julio Alonso (Mirandés) Yellow Card at 89',2024-10-22 23:22:46
12722,709397,17,44034359,90'+5',Casals (Mirandés) Yellow Card at 95',2024-10-22 23:22:46
12722,709397,18,44034360,90'+5',Haissem Hassan (Real Oviedo) Yellow Card at 95',2024-10-22 23:22:46
12722,709398,0,44052027,5',Jordy Caicedo (Sporting Gijón) Goal at 5',2024-10-25 05:18:47
12722,709398,1,44052944,35',Javier Mier (Huesca) Yellow Card at 35',2024-10-25 05:18:47
12722,709398,2,44053179,43',Jordi Martín (Huesca) Yellow Card at 43',2024-10-25 05:18:47
12722,709398,3,44053439,45',Javi Pérez (Huesca) Substitution at 45',2024-10-25 05:18:47
12722,709398,4,44053888,58',Gaspar Campos (Sporting Gijón) Substitution at 58',2024-10-25 05:18:47
12722,709398,5,44053889,58',Juan Otero (Sporting Gijón) Substitution at 58',2024-10-25 05:18:47
12722,709398,6,44054109,66',Serge Patrick Njoh (Huesca) Yellow Card at 66',2024-10-25 05:18:47
12722,709398,7,44054218,68',Diego González (Huesca) Substitution at 68',2024-10-25 05:18:47
12722,709398,8,44054219,68',Iker Unzueta (Huesca) Substitution at 68',2024-10-25 05:18:47
12722,709398,9,44054220,68',José Antonio Abad (Huesca) Substitution at 68',2024-10-25 05:18:47
12722,709398,10,44054398,73',César Gelabert (Sporting Gijón) Substitution at 73',2024-10-25 05:18:47
12722,709398,11,44054462,75',Axel Bejarano Fernandez (Huesca) Substitution at 75',2024-10-25 05:18:47
12722,709398,12,44054553,79',Gaspar Campos (Sporting Gijón) Goal at 79',2024-10-25 05:18:47
12722,709398,13,44054729,82',Kevin Vázquez (Sporting Gijón) Substitution at 82',2024-10-25 05:18:47
12722,709398,14,44054730,82',Víctor Campuzano (Sporting Gijón) Substitution at 82',2024-10-25 05:18:47
12722,709398,15,44054832,87',Róber (Sporting Gijón) Own Goal at 87',2024-10-25 05:18:47
12722,709399,0,44052494,21',Enric Gallego (Tenerife) Shot Off Target at 21',2024-10-25 05:18:47
12722,709399,1,44052711,28',Sergio González (Tenerife) Yellow Card at 28',2024-10-25 05:18:47
12722,709399,2,44052727,29',Fernando Medrano Gastanaga (Tenerife) Yellow Card at 29',2024-10-25 05:18:47
12722,709399,3,44052925,34',Enric Gallego (Tenerife) Yellow Card at 34',2024-10-25 05:18:47
12722,709399,4,44053456,45',Manuel Antonio Molina Valero (Málaga) Substitution at 45',2024-10-25 05:18:47
12722,709399,5,44053758,54',Josep Gaya (Tenerife) Yellow Card at 54',2024-10-25 05:18:47
12722,709399,6,44053820,57',Kevin Villodres (Málaga) Substitution at 57',2024-10-25 05:18:47
12722,709399,7,44053900,58',Jeremy Mellot (Tenerife) Yellow Card at 58',2024-10-25 05:18:47
12722,709399,8,44053901,59',Marlos Moreno (Tenerife) Substitution at 59',2024-10-25 05:18:47
12722,709399,9,44053902,59',Ángel Rodríguez (Tenerife) Substitution at 59',2024-10-25 05:18:47
12722,709399,10,44053985,60',Carlos Puga (Málaga) Yellow Card at 60',2024-10-25 05:18:47
12722,709399,11,44054221,68',Yann Bodiger (Tenerife) Substitution at 68',2024-10-25 05:18:47
12722,709399,12,44054440,73',Dioni (Málaga) Substitution at 73',2024-10-25 05:18:47
12722,709399,13,44054441,73',Yanis Rahmani (Málaga) Substitution at 73',2024-10-25 05:18:47
12722,709399,14,44054668,79',Daniel Fernández (Tenerife) Substitution at 79',2024-10-25 05:18:47
12722,709399,15,44054669,79',David Rodríguez Ramos (Tenerife) Substitution at 79',2024-10-26 13:53:28
12722,709399,16,44054670,81',Manuel Antonio Molina Valero (Málaga) Yellow Card at 81',2024-10-25 05:18:47
12722,709399,17,44054780,82',Daniel Lorenzo (Málaga) Substitution at 82',2024-10-25 05:18:47
12722,709399,18,44055061,90'+1',Víctor García (Málaga) Yellow Card at 91',2024-10-25 05:18:47
12722,709400,0,44081959,6',Víctor Campuzano (Sporting Gijón) Goal at 6',2024-10-28 05:21:06
12722,709400,1,44082003,9',Juan Otero (Sporting Gijón) Goal at 9',2024-10-28 05:21:06
12722,709400,2,44082386,36',Rai (Albacete) Yellow Card at 36',2024-10-28 05:21:06
12722,709400,3,44082465,42',Alberto Quiles Piosa (Albacete) Goal at 42',2024-10-28 05:21:06
12722,709400,4,44082507,45',Juan Otero (Sporting Gijón) Yellow Card at 45',2024-10-28 05:21:06
12722,709400,5,44082981,59',Guillermo Rosas (Sporting Gijón) Substitution at 59',2024-10-28 05:21:06
12722,709400,6,44082982,59',Jonathan Dubasin (Sporting Gijón) Substitution at 59',2024-10-28 05:21:06
12722,709400,7,44082983,59',Gaspar Campos (Sporting Gijón) Yellow Card at 59',2024-10-28 05:21:06
12722,709400,8,44082998,59',Róber (Sporting Gijón) Substitution at 59',2024-10-28 05:21:06
12722,709400,9,44083027,66',Fidel (Albacete) Yellow Card at 66',2024-10-28 05:21:06
12722,709400,10,44083105,74',Daniel Queipo (Sporting Gijón) Substitution at 74',2024-10-28 05:21:06
12722,709400,11,44083148,76',Riki Rodríguez (Albacete) Substitution at 76',2024-10-28 05:21:06
12722,709400,12,44083149,76',Fidel (Albacete) Substitution at 76',2024-10-28 05:21:06
12722,709400,13,44083195,79',Riki Rodríguez (Albacete) Goal at 79',2024-10-28 05:21:06
12722,709400,14,44083243,82',Jordy Caicedo (Sporting Gijón) Substitution at 82',2024-10-28 05:21:06
12722,709400,15,44083285,85',Jon García (Albacete) Own Goal at 85',2024-10-28 05:21:06
12722,709400,16,44083327,89',Marcos Moreno (Albacete) Substitution at 89',2024-10-28 05:21:06
12722,709400,17,44083328,89',Gonzalo Aguilar (Albacete) Substitution at 89',2024-10-28 05:21:06
12722,709400,18,44083333,90',Fidel (Albacete) Goal at 90',2024-10-28 05:21:06
12722,709400,19,44083408,90'+6',Daniel Queipo (Sporting Gijón) Yellow Card at 96',2024-10-28 05:21:06
12722,709401,0,44069213,1',Alberto (Castellón) Goal at 1',2024-10-27 05:19:50
12722,709401,1,44069258,4',Óscar Gil (Castellón) Yellow Card at 4',2024-10-27 05:19:50
12722,709401,2,44069293,8',Adrián Liso (Real Zaragoza) Goal at 8',2024-10-27 05:19:50
12722,709401,3,44069478,26',Ivan Azón (Real Zaragoza) Yellow Card at 26',2024-10-27 05:19:50
12722,709401,4,44069648,40',Alberto (Castellón) Yellow Card at 40',2024-10-27 05:19:50
12722,709401,5,44069700,45'+1',Jetro Willems (Castellón) Yellow Card at 46',2024-10-27 05:19:50
12722,709401,6,44069901,45',Salvador Ruiz (Castellón) Substitution at 45',2024-10-27 05:19:50
12722,709401,7,44069951,45',Jesús De Miguel (Castellón) Substitution at 45',2024-10-27 05:19:50
12722,709401,8,44070017,53',Enrique Clemente (Real Zaragoza) Yellow Card at 53',2024-10-27 05:19:50
12722,709401,9,44070113,61',Francho Serrano (Real Zaragoza) Substitution at 61',2024-10-27 05:19:50
12722,709401,10,44070114,61',Israel Suero (Castellón) Substitution at 61',2024-10-27 05:19:50
12722,709401,11,44070193,66',Alberto Marí (Real Zaragoza) Substitution at 66',2024-10-27 05:19:50
12722,709401,12,44070194,67',Pau Sans (Real Zaragoza) Substitution at 67',2024-10-27 05:19:50
12722,709401,13,44070220,71',Lluis López (Real Zaragoza) Yellow Card at 71',2024-10-27 05:19:50
12722,709401,14,44070313,76',Israel Suero (Castellón) Goal at 76',2024-10-27 05:19:50
12722,709401,15,44070384,80',Malcom Adu Ares (Real Zaragoza) Substitution at 80',2024-10-27 05:19:50
12722,709401,16,44070385,80',Iván Calero Ruiz (Real Zaragoza) Substitution at 80',2024-10-27 05:19:50
12722,709401,17,44070459,85',Israel Suero (Castellón) Yellow Card at 85',2024-10-27 05:19:50
12722,709402,0,44079954,25',Rodrigo Mendoza (Elche) Goal at 25',2024-10-28 05:21:06
12722,709402,1,44080637,45',Iñigo Córdoba (Burgos) Substitution at 45',2024-10-28 05:21:06
12722,709402,2,44080669,45',Borja Sánchez (Burgos) Substitution at 45',2024-10-28 05:21:06
12722,709402,3,44080728,45',Álex Sancris (Burgos) Substitution at 45',2024-10-28 05:21:06
12722,709402,4,44080729,50',Miguel Atienza (Burgos) Yellow Card at 50',2024-10-28 05:21:06
12722,709402,5,44080870,59',Ivan Ruiz Morante (Burgos) Substitution at 59',2024-10-28 05:21:06
12722,709402,6,44081017,67',Mourad El Ghezouani (Elche) Substitution at 67',2024-10-28 05:21:06
12722,709402,7,44081032,67',Mario (Elche) Substitution at 67',2024-10-28 05:21:06
12722,709402,8,44081159,72',Elbasan Rashani (Elche) Substitution at 72',2024-10-28 05:21:06
12722,709402,9,44081160,73',Fernando Niño (Burgos) Substitution at 73',2024-10-28 05:21:06
12722,709402,10,44081256,78',Rodrigo Mendoza (Elche) Yellow Card at 78',2024-10-28 05:21:06
12722,709402,11,44081257,79',Raúl Guti (Elche) Substitution at 79',2024-10-28 05:21:06
12722,709402,12,44081258,79',Matia Barzic (Elche) Substitution at 79',2024-10-28 05:21:06
12722,709402,13,44081259,80',Ivan Ruiz Morante (Burgos) Yellow Card at 80',2024-10-28 05:21:06
12722,709402,14,44081357,87',Matia Barzic (Elche) Yellow Card at 87',2024-10-31 05:23:49
12722,709403,0,44079693,9',Dani Barcia (Deportivo La Coruña) Yellow Card at 9',2024-10-28 05:21:06
12722,709403,1,44079847,18',Pablo Rodriguez (Racing Santander) Goal at 18',2024-10-28 05:21:06
12722,709403,2,44079962,23',Juan Carlos Arana (Racing Santander) Goal at 23',2024-10-28 05:21:06
12722,709403,3,44080824,50',Ximo Navarro (Deportivo La Coruña) Yellow Card at 50',2024-10-28 05:21:06
12722,709403,4,44081066,59',Jon Karrikaburu (Racing Santander) Substitution at 59',2024-10-28 05:21:06
12722,709403,5,44081067,59',Rafael Obrador (Deportivo La Coruña) Substitution at 59',2024-10-29 05:21:26
12722,709403,6,44081069,59',Mohamed Bouldini (Deportivo La Coruña) Substitution at 59',2024-10-29 05:21:26
12722,709403,7,44081068,60',Peke (Deportivo La Coruña) Substitution at 60',2024-10-29 05:21:26
12722,709403,8,44081101,65',Peke (Deportivo La Coruña) Goal at 65',2024-10-28 05:21:06
12722,709403,9,44081245,70',Lago Junior (Racing Santander) Substitution at 70',2024-10-29 05:21:26
12722,709403,10,44081243,71',Suleiman Camara (Racing Santander) Substitution at 71',2024-10-29 05:21:26
12722,709403,11,44081244,71',Marco Sangalli (Racing Santander) Substitution at 71',2024-10-29 05:21:26
12722,709403,12,44081290,73',David Alvarez (Deportivo La Coruña) Substitution at 73',2024-10-28 05:21:06
12722,709403,13,44081475,88',Manu (Racing Santander) Substitution at 88',2024-10-28 05:21:06
12722,709404,0,44069636,35',Youness Lachhab (Eldense) Substitution at 35',2024-10-27 05:19:50
12722,709404,1,44069637,36',Genaro Serrano Rodriguez (Córdoba) Yellow Card at 36',2024-10-27 05:19:50
12722,709404,2,44069710,45'+2',Antonio Casas (Córdoba) Goal at 47',2024-10-27 05:19:50
12722,709404,3,44069761,45'+2',Álex Bernal (Eldense) Yellow Card at 47',2024-10-27 05:19:50
12722,709404,4,44069902,45',Juanto (Eldense) Substitution at 45',2024-10-27 05:19:50
12722,709404,5,44070153,64',Iván Chapela (Eldense) Substitution at 64',2024-10-27 05:19:50
12722,709404,6,44070154,65',Víctor García (Eldense) Substitution at 65',2024-10-27 05:19:50
12722,709404,7,44070242,70',Kuki Zalazar (Córdoba) Substitution at 70',2024-10-27 05:19:50
12722,709404,8,44070243,70',Xavier Sintes (Córdoba) Substitution at 70',2024-10-27 05:19:50
12722,709404,9,44070401,80',Marvel (Córdoba) Substitution at 80',2024-10-27 05:19:50
12722,709404,10,44070402,80',Nikolai Óbolo (Córdoba) Substitution at 80',2024-10-27 05:19:50
12722,709404,11,44070472,86',Nacho Monsalve (Eldense) Yellow Card at 86',2024-10-27 05:19:50
12722,709404,12,44070509,88',Carlos Albarrán (Córdoba) Substitution at 88',2024-10-27 05:19:50
12722,709404,13,44070528,90',Sixtus Ogbuehi (Eldense) Substitution at 90',2024-10-27 05:19:50
12722,709404,14,44070584,90'+4',Nacho Monsalve (Eldense) Red Card at 94',2024-10-27 05:19:50
12722,709404,15,44070585,90'+5',Cristian Carracedo (Córdoba) Penalty - Scored at 95',2024-10-27 05:19:50
12722,709405,0,44088934,8',Fernando Medrano Gastanaga (Tenerife) Yellow Card at 8',2024-10-29 05:21:26
12722,709405,1,44088942,13',Enric Gallego (Tenerife) Goal at 13',2024-10-29 05:21:26
12722,709405,2,44088945,15',Eneko Jauregui (Racing Ferrol) Goal at 15',2024-10-29 05:21:26
12722,709405,3,44089049,45',David Rodríguez Ramos (Tenerife) Substitution at 45',2024-10-29 05:21:26
12722,709405,4,44089050,45',Nacho Sánchez (Racing Ferrol) Substitution at 45',2024-10-29 05:21:26
12722,709405,5,44089089,58',Aleksa Puric (Racing Ferrol) Yellow Card at 58',2024-10-29 05:21:26
12722,709405,6,44089122,64',Christian Borrego (Racing Ferrol) Substitution at 64',2024-10-29 05:21:26
12722,709405,7,44089137,69',Álex López (Racing Ferrol) Substitution at 69',2024-10-29 05:21:26
12722,709405,8,44089148,72',Julián Delmás (Racing Ferrol) Substitution at 72',2024-10-29 05:21:26
12722,709405,9,44089159,75',Moisés Delgado López (Racing Ferrol) Yellow Card at 75',2024-10-29 05:21:26
12722,709405,10,44089182,81',David Rodríguez Ramos (Tenerife) Yellow Card at 81',2024-10-29 05:21:26
12722,709405,11,44089199,85',Aleksa Puric (Racing Ferrol) Red Card at 85',2024-10-29 05:21:26
