seasonType,eventId,commentaryOrder,playId,clockDisplayValue,commentaryText,updateDateTime
12397,715300,11,43589907,84',Yimy Gamero (ADT) Yellow Card at 84',2024-08-21 05:41:51
12397,715300,12,43589947,87',Victor Perlaza (UTC) Yellow Card at 87',2024-08-21 05:41:51
12397,715301,0,43590787,24',Christopher Olivares (Universitario) Substitution at 24',2024-08-21 05:41:51
12397,715301,1,43590794,34',Segundo Portocarrero (Universitario) Yellow Card at 34',2024-08-21 05:41:51
12397,715301,2,43590816,37',Segundo Portocarrero (Universitario) Goal at 37',2024-08-21 05:41:51
12397,715301,3,43591054,52',Martín Guedes (Universitario) Yellow Card at 52',2024-08-21 05:41:51
12397,715301,4,43591084,60',Relly Fernández (Cusco FC) Substitution at 60',2024-08-21 05:41:51
12397,715301,5,43591127,71',Juan Manuel Tévez (Cusco FC) Substitution at 71',2024-08-21 05:41:51
12397,715301,6,43591139,72',Juan Manuel Tévez (Cusco FC) Goal at 72',2024-08-21 05:41:51
12397,715301,7,43591141,75',Edison Flores (Universitario) Substitution at 75',2024-08-21 05:41:51
12397,715301,8,43591151,76',Oswaldo Valenzuela (Cusco FC) Yellow Card at 76',2024-08-21 05:41:51
12397,715301,9,43591154,78',Relly Fernández (Cusco FC) Yellow Card at 78',2024-08-21 05:41:51
12397,715301,10,43591162,78',Christopher Olivares (Universitario) Yellow Card at 78',2024-08-21 05:41:51
12397,715301,11,43591163,78',Pablo Cárdenas (Cusco FC) Substitution at 78',2024-08-21 05:41:51
12397,715301,12,43591181,83',Hugo Ancajima (Universitario) Substitution at 83',2024-08-21 05:41:51
12397,715301,13,43591182,83',Alvaro Rojas (Universitario) Substitution at 83',2024-08-21 05:41:51
12397,715302,0,43592420,43',Oshiro Takeuchi (Los Chankas) Goal at 43',2024-08-22 05:41:00
12397,715302,1,43592540,53',Neri Bandiera (Atlético Grau) Goal at 53',2024-08-22 05:41:00
12397,715302,2,43592731,76',Cesar Vasquez (Atlético Grau) Substitution at 76',2024-08-22 05:41:00
12397,715302,3,43592732,76',Ademar Robles (Los Chankas) Substitution at 76',2024-08-22 05:41:00
12397,715302,4,43592733,76',Gonzalo Sánchez (Los Chankas) Substitution at 76',2024-08-22 05:41:00
12397,715302,5,43592756,80',Diego Soto (Atlético Grau) Yellow Card at 80',2024-08-22 05:41:00
12397,715302,6,43592835,85',Gonzalo Sánchez (Los Chankas) Yellow Card at 85',2024-08-22 05:41:00
12397,715302,7,43592847,88',Ayrthon Quintana (Los Chankas) Substitution at 88',2024-08-22 05:41:00
12397,715302,8,43592852,90'+1',Nicolás Figueroa (Atlético Grau) Substitution at 91',2024-08-22 05:41:00
12397,715302,9,43592858,90'+3',Daniel Franco (Atlético Grau) Yellow Card at 93',2024-08-22 05:41:00
12397,715302,10,43592859,90'+4',Diego Temoche (Los Chankas) Substitution at 94',2024-08-22 05:41:00
12397,715302,11,43592860,90'+4',Rotceh Aguilar (Los Chankas) Substitution at 94',2024-08-22 05:41:00
12397,715303,0,43592005,21',Catriel Cabellos (Alianza Lima) Substitution at 21',2024-08-21 05:41:51
12397,715303,1,43592024,25',Ricardo Lagos (Alianza Lima) Yellow Card at 25',2024-08-21 05:41:51
12397,715303,2,43592244,45'+3',Catriel Cabellos (Alianza Lima) Goal at 48',2024-08-21 05:41:51
12397,715303,3,43592339,45',Jesús Castillo (Alianza Lima) Substitution at 45',2024-08-22 05:41:00
12397,715303,4,43592344,57',Alejandro Ramirez Zarate (Cienciano del Cusco) Substitution at 57',2024-08-22 05:41:00
12397,715303,5,43592345,57',Gonzalo Ritacco (Cienciano del Cusco) Substitution at 57',2024-08-22 05:41:00
12397,715303,6,43592346,70',Catriel Cabellos (Alianza Lima) Goal at 70',2024-08-22 05:41:00
12397,715303,7,43592347,74',Didier La Torre (Cienciano del Cusco) Substitution at 74',2024-08-22 05:41:00
12397,715303,8,43592348,77',Aldair Fuentes (Alianza Lima) Substitution at 77',2024-08-22 05:41:00
12397,715303,9,43592349,77',Jhamir D´Arrigo (Alianza Lima) Substitution at 77',2024-08-22 05:41:00
12397,715303,10,43592350,85',Pablo Sabbag (Alianza Lima) Goal at 85',2024-08-22 05:41:00
12397,715303,11,43592351,85',Pablo Sabbag (Alianza Lima) Yellow Card at 85',2024-08-22 05:41:00
12397,715303,12,43592352,87',Leonardo Mifflin (Cienciano del Cusco) Substitution at 87',2024-08-22 05:41:00
12397,715303,13,43592353,87',Antonio Huamán (Alianza Lima) Substitution at 87',2024-08-22 05:41:00
12397,715304,0,43587527,42',Stefano Fernández (Alianza Atlético) Yellow Card at 42',2024-08-21 05:41:51
12397,715304,1,43587600,45',Rodrigo Castro (Alianza Atlético) Substitution at 45',2024-08-21 05:41:51
12397,715304,2,43587601,45',Osnar Noronha (César Vallejo) Substitution at 45',2024-08-21 05:41:51
12397,715304,3,43587613,51',Johan Madrid (César Vallejo) Yellow Card at 51',2024-08-21 05:41:51
12397,715304,4,43587624,55',Pierre Da Silva (César Vallejo) Yellow Card at 55',2024-08-21 05:41:51
12397,715304,5,43587662,57',Renato Espinoza (Alianza Atlético) Substitution at 57',2024-08-21 05:41:51
12397,715304,6,43587663,57',Alessandro Milesi (Alianza Atlético) Substitution at 57',2024-08-21 05:41:51
12397,715304,7,43587702,65',Gullermo Grández (César Vallejo) Substitution at 65',2024-08-21 05:41:51
12397,715304,8,43587969,77',José De La Cruz (Alianza Atlético) Substitution at 77',2024-08-21 05:41:51
12397,715304,9,43587970,78',Angelo Valiente (César Vallejo) Substitution at 78',2024-08-21 05:41:51
12397,715304,10,43587971,78',Nicolás Amasifuen (César Vallejo) Substitution at 78',2024-08-21 05:41:51
12397,715304,11,43587972,79',Alec Deneumostier (César Vallejo) Yellow Card at 79',2024-08-21 05:41:51
12397,715304,12,43588015,85',Frank Ysique (César Vallejo) Yellow Card at 85',2024-08-21 05:41:51
12397,715304,13,43588016,85',Santiago Arias (Alianza Atlético) Yellow Card at 85',2024-08-21 05:41:51
12397,715304,14,43588051,90'+1',Aldair Perleche (Alianza Atlético) Substitution at 91',2024-08-21 05:41:51
12397,715305,0,43730238,5',Adrián Ugarriza (Deportivo Garcilaso) Goal at 5',2024-09-15 05:36:38
12397,715305,1,43730490,39',Juan Lojas (Deportivo Garcilaso) Yellow Card at 39',2024-09-15 05:36:38
12397,715305,2,43730571,45',Hernan Rengifo (ADT) Substitution at 45',2024-09-15 05:36:38
12397,715305,3,43730578,50',Freddy Yovera (Deportivo Garcilaso) Substitution at 50',2024-09-15 05:36:38
12397,715305,4,43730607,59',Jorge Palomino (ADT) Substitution at 59',2024-09-15 05:36:38
12397,715305,5,43730633,62',Jhon Narváez (ADT) Yellow Card at 62',2024-09-15 05:36:38
12397,715305,6,43730646,64',Alexander Hidalgo (ADT) Substitution at 64',2024-09-15 05:36:38
12397,715305,7,43730656,67',Mauricio Cuero (Deportivo Garcilaso) Substitution at 67',2024-09-15 05:36:38
12397,715305,8,43730719,77',Freddy Yovera (Deportivo Garcilaso) Yellow Card at 77',2024-09-15 05:36:38
12397,715305,9,43730736,80',Erick Gonzales (Deportivo Garcilaso) Substitution at 80',2024-09-15 05:36:38
12397,715305,10,43730737,80',Erick Perleche (Deportivo Garcilaso) Substitution at 80',2024-09-15 05:36:38
12397,715305,11,43730756,80',Jose Luis Bazan (Deportivo Garcilaso) Yellow Card at 80',2024-09-15 05:36:38
12397,715305,12,43730784,88',Adrián Ugarriza (Deportivo Garcilaso) Yellow Card at 88',2024-09-15 05:36:38
12397,715306,0,43613392,15',Ángel Ledesma (Los Chankas) Yellow Card at 15',2024-08-25 05:40:01
12397,715306,1,43614452,45',Jesús Castillo (Alianza Lima) Substitution at 45',2024-08-25 05:40:01
12397,715306,2,43614515,47',Carlos Zambrano (Alianza Lima) Yellow Card at 47',2024-08-25 05:40:01
12397,715306,3,43614731,70',Gonzalo Sánchez (Los Chankas) Substitution at 70',2024-08-25 05:40:01
12397,715306,4,43614786,76',Jhamir D´Arrigo (Alianza Lima) Substitution at 76',2024-08-25 05:40:01
12397,715306,5,43614787,77',Gonzalo Sánchez (Los Chankas) Yellow Card at 77',2024-08-25 05:40:01
12397,715306,6,43614820,81',Pablo Sabbag (Alianza Lima) Goal at 81',2024-08-25 05:40:01
12397,715306,7,43614850,83',Aldair Fuentes (Alianza Lima) Substitution at 83',2024-08-25 05:40:01
12397,715306,8,43614851,86',Alán Murialdo (Los Chankas) Substitution at 86',2024-08-25 05:40:01
12397,715306,9,43615010,86',Pablo Sabbag (Alianza Lima) Yellow Card at 86',2024-08-25 05:40:01
12397,715306,10,43614897,89',Diego Temoche (Los Chankas) Substitution at 89',2024-08-25 05:40:01
12397,715306,11,43614898,90'+2',Diego Carabaño (Los Chankas) Red Card at 92',2024-08-25 05:40:01
12397,715306,12,43614930,90'+7',Catriel Cabellos (Alianza Lima) Yellow Card at 97',2024-08-25 05:40:01
12397,715307,0,43764396,20',Kevin Becerra (Los Chankas) Own Goal at 20',2024-09-16 05:26:57
12397,715307,1,43766626,45',Oshiro Takeuchi (Los Chankas) Substitution at 45',2024-09-16 05:26:57
12397,715307,2,43767088,59',Walter Tandazo (Melgar) Substitution at 59',2024-09-16 05:26:57
12397,715307,3,43767089,59',Jefferson Caceres (Melgar) Substitution at 59',2024-09-16 05:26:57
12397,715307,4,43767204,61',Kenji Cabrera (Melgar) Goal at 61',2024-09-16 05:26:57
12397,715307,5,43767532,68',Ayrthon Quintana (Los Chankas) Substitution at 68',2024-09-16 05:26:57
12397,715307,6,43767572,68',Matías Noble (Melgar) Substitution at 68',2024-09-16 05:26:57
12397,715307,7,43767674,72',Ademar Robles (Los Chankas) Substitution at 72',2024-09-16 05:26:57
12397,715307,8,43767675,72',Rodrigo Salinas (Los Chankas) Substitution at 72',2024-09-16 05:26:57
12397,715307,9,43768145,79',Pablo Lavandeira (Melgar) Substitution at 79',2024-09-16 05:26:57
12397,715307,10,43768146,80',Kevin Sandoval (Melgar) Substitution at 80',2024-09-16 05:26:57
12397,715307,11,43768479,86',Gonzalo Sánchez (Los Chankas) Substitution at 86',2024-09-16 05:26:57
12397,715308,0,43745601,45',Pablo Bueno (Sport Boys) Substitution at 45',2024-09-16 05:26:57
12397,715308,1,43745602,45',Jesús Barco (Sport Boys) Substitution at 45',2024-09-16 05:26:57
12397,715308,2,43745603,45',Edison Chávez (Sport Boys) Substitution at 45',2024-09-16 05:26:57
12397,715308,3,43745858,63',Piero Vivanco (Atlético Grau) Substitution at 63',2024-09-16 05:26:57
12397,715308,4,43745859,64',Jesús Barco (Sport Boys) Yellow Card at 64',2024-09-16 05:26:57
12397,715308,5,43745881,66',Rodrigo Tapia (Atlético Grau) Yellow Card at 66',2024-09-16 05:26:57
12397,715308,6,43745903,68',Kevin Peña (Sport Boys) Substitution at 68',2024-09-16 05:26:57
12397,715308,7,43745938,73',Carlos Correa (Sport Boys) Substitution at 73',2024-09-16 05:26:57
12397,715308,8,43745980,77',Freddy Oncoy (Atlético Grau) Substitution at 77',2024-09-16 05:26:57
12397,715308,9,43746017,80',Rafael Guarderas (Atlético Grau) Yellow Card at 80',2024-09-16 05:26:57
12397,715308,10,43746076,85',José Rosell (Atlético Grau) Substitution at 85',2024-09-16 05:26:57
12397,715308,11,43746181,90'+5',Piero Vivanco (Atlético Grau) Yellow Card at 95',2024-09-16 05:26:57
12397,715309,0,43745039,17',Jean Deza (Sport Huancayo) Goal at 17',2024-09-16 05:26:57
12397,715309,1,43745705,45',Christofer Gonzáles (Sporting Cristal) Substitution at 45',2024-09-16 05:26:57
12397,715309,2,43745774,45',Jostin Alarcón (Sporting Cristal) Substitution at 45',2024-09-16 05:26:57
12397,715309,3,43745775,45',Gerald Távara (Sporting Cristal) Substitution at 45',2024-09-16 05:26:57
12397,715309,4,43745912,62',Luis Garro (Sport Huancayo) Yellow Card at 62',2024-09-16 05:26:57
12397,715309,5,43745928,62',Alejandro Posito (Sporting Cristal) Substitution at 62',2024-09-16 05:26:57
12397,715309,6,43745979,67',Irven Ávila (Sporting Cristal) Substitution at 67',2024-09-16 05:26:57
12397,715309,7,43745981,68',Jostin Alarcón (Sporting Cristal) Goal at 68',2024-09-16 05:26:57
12397,715309,8,43745993,69',Ángel Pérez (Sport Huancayo) Substitution at 69',2024-09-16 05:26:57
12397,715309,9,43746041,71',Christofer Gonzáles (Sporting Cristal) Yellow Card at 71',2024-09-16 05:26:57
12397,715309,10,43746047,73',Irven Ávila (Sporting Cristal) Goal at 73',2024-09-16 05:26:57
12397,715309,11,43746078,76',Ronal Huacca (Sport Huancayo) Substitution at 76',2024-09-16 05:26:57
12397,715309,12,43746079,76',Matías Pérez García (Sport Huancayo) Substitution at 76',2024-09-16 05:26:57
12397,715309,13,43746235,90'+2',Guti  (Sport Huancayo) Yellow Card at 92',2024-09-16 05:26:57
12397,715310,0,43623418,38',Leandro Sosa (Sporting Cristal) Goal at 38',2024-08-26 05:34:12
12397,715310,1,43623934,45',José Adalberto Cuero (UTC) Substitution at 45',2024-08-26 05:34:12
12397,715310,2,43624069,54',Jonathan Segura (UTC) Yellow Card at 54',2024-08-26 05:34:12
12397,715310,3,43624114,57',Santiago González (Sporting Cristal) Goal at 57',2024-08-26 05:34:12
12397,715310,4,43624256,66',Jostin Alarcón (Sporting Cristal) Substitution at 66',2024-08-26 05:34:12
12397,715310,5,43624257,67',Maxloren Castro (Sporting Cristal) Goal at 67',2024-08-26 05:34:12
12397,715310,6,43624313,72',Santiago González (Sporting Cristal) Goal at 72',2024-08-26 05:34:12
12397,715310,7,43624369,73',Gerald Távara (Sporting Cristal) Substitution at 73',2024-08-26 05:34:12
12397,715310,8,43624370,73',Alejandro Hohberg (Sporting Cristal) Substitution at 73',2024-08-26 05:34:12
12397,715310,9,43624368,74',Jefferson Portales (UTC) Substitution at 74',2024-08-26 05:34:12
12397,715310,10,43624481,80',Irven Ávila (Sporting Cristal) Substitution at 80',2024-08-26 05:34:12
12397,715310,11,43624482,80',Rafael Lutiger (Sporting Cristal) Substitution at 80',2024-08-26 05:34:12
12397,715310,12,43624593,84',Tiago Cantoro (UTC) Substitution at 84',2024-08-26 05:34:12
12397,715310,13,43624711,90'+2',Maycol Infante (UTC) Substitution at 92',2024-08-26 05:34:12
12397,715311,0,43729048,37',Alfredo Ramua (Cienciano del Cusco) Yellow Card at 37',2024-09-15 05:36:38
12397,715311,1,43729091,45',Pedro Requena (UTC) Yellow Card at 45',2024-09-15 05:36:38
12397,715311,2,43729455,61',Rudy Palomino (Cienciano del Cusco) Substitution at 61',2024-09-15 05:36:38
12397,715311,3,43729484,65',Cristian Ojeda (UTC) Substitution at 65',2024-09-15 05:36:38
12397,715311,4,43729518,65',José Adalberto Cuero (UTC) Substitution at 65',2024-09-15 05:36:38
12397,715311,5,43729567,69',Christian Cueva (Cienciano del Cusco) Substitution at 69',2024-09-15 05:36:38
12397,715311,6,43729605,72',Claudio Torrejón Tineo (Cienciano del Cusco) Yellow Card at 72',2024-09-15 05:36:38
12397,715311,7,43729664,75',Marco Rodríguez (Cienciano del Cusco) Substitution at 75',2024-09-15 05:36:38
12397,715311,8,43729665,75',Didier La Torre (Cienciano del Cusco) Substitution at 75',2024-09-15 05:36:38
12397,715311,9,43729708,78',Joel Sánchez (UTC) Substitution at 78',2024-09-15 05:36:38
12397,715311,10,43729835,85',Marcelo Benítez (Cienciano del Cusco) Yellow Card at 85',2024-09-15 05:36:38
12397,715311,11,43729848,86',Didier La Torre (Cienciano del Cusco) Goal at 86',2024-09-15 05:36:38
12397,715311,12,43729889,86',Angel Ojeda (UTC) Substitution at 86',2024-09-15 05:36:38
12397,715311,13,43730019,87',Carlos Fernandez (UTC) Substitution at 87',2024-09-15 05:36:38
12397,715311,14,43729888,89',Koichi Aparicio (UTC) Goal at 89',2024-09-15 05:36:38
12397,715311,15,43729966,90'+4',Carlos Garcés (Cienciano del Cusco) Goal at 94',2024-09-15 05:36:38
12397,715312,0,43617963,9',Williams Riveros (Universitario) Goal at 9',2024-08-25 05:40:01
12397,715312,1,43618357,36',Alec Deneumostier (César Vallejo) Yellow Card at 36',2024-08-25 05:40:01
12397,715312,2,43618951,57',Segundo Portocarrero (Universitario) Substitution at 57',2024-08-25 05:40:01
12397,715312,3,43618972,57',Edison Flores (Universitario) Substitution at 57',2024-08-25 05:40:01
12397,715312,4,43619073,64',Edgar Benítez (César Vallejo) Substitution at 64',2024-08-25 05:40:01
12397,715312,5,43619133,69',Hugo Ancajima (Universitario) Substitution at 69',2024-08-25 05:40:01
12397,715312,6,43619186,73',Yorleys Mena (César Vallejo) Yellow Card at 73',2024-08-25 05:40:01
12397,715312,7,43619275,78',Alvaro Rojas (Universitario) Substitution at 78',2024-08-25 05:40:01
12397,715312,8,43619276,78',Gullermo Grández (César Vallejo) Substitution at 78',2024-08-25 05:40:01
12397,715312,9,43619353,87',Gerson Barreto (César Vallejo) Substitution at 87',2024-08-25 05:40:01
12397,715313,0,43731377,21',Jairo Vélez (César Vallejo) Goal at 21',2024-09-15 05:36:38
12397,715313,1,43731512,41',Pierre Da Silva (César Vallejo) Yellow Card at 41',2024-09-15 05:36:38
12397,715313,2,43731513,42',Josue Torres (Unión Comercio) Yellow Card at 42',2024-09-15 05:36:38
12397,715313,3,43731744,56',Kelvin Sánchez (Unión Comercio) Yellow Card at 56',2024-09-15 05:36:38
12397,715313,4,43731745,58',Osama Jiménez (Unión Comercio) Substitution at 58',2024-09-15 05:36:38
12397,715313,5,43731775,63',Osnar Noronha (César Vallejo) Substitution at 63',2024-09-15 05:36:38
12397,715313,6,43732006,78',Yorleys Mena (César Vallejo) Yellow Card at 78',2024-09-15 05:36:38
12397,715313,7,43732007,78',Diether Vásquez (César Vallejo) Substitution at 78',2024-09-15 05:36:38
12397,715313,8,43732131,86',Hector Zeta (Unión Comercio) Substitution at 86',2024-09-15 05:36:38
12397,715313,9,43732132,86',Dennis Perez (César Vallejo) Substitution at 86',2024-09-15 05:36:38
12397,715313,10,43732133,87',Roberto Villamarín (Unión Comercio) Yellow Card at 87',2024-09-15 05:36:38
12397,715313,11,43732288,90'+7',Diether Vásquez (César Vallejo) Yellow Card at 97',2024-09-15 05:36:38
12397,715313,12,43778755,90'+8',Denilson Vargas (Unión Comercio) Red Card at 98',2024-09-17 05:40:48
12397,715314,0,43742772,9',Piero Guzmán (Cusco FC) Goal at 9',2024-09-17 05:40:48
12397,715314,1,43742939,18',Piero Magallanes (Comerciantes Unidos) Yellow Card at 18',2024-09-16 05:26:57
12397,715314,2,43743005,22',Miguel Aucca (Cusco FC) Goal at 22',2024-09-16 05:26:57
12397,715314,3,43743029,25',Matías Sen (Comerciantes Unidos) Goal at 25',2024-09-16 05:26:57
12397,715314,4,43743104,29',Sebastián Gonzáles Zela (Comerciantes Unidos) Yellow Card at 29',2024-09-16 05:26:57
12397,715314,5,43743129,30',Luis Ramos (Cusco FC) Yellow Card at 30',2024-09-16 05:26:57
12397,715314,6,43778751,30',Matías Sen (Comerciantes Unidos) Yellow Card at 30',2024-09-17 05:40:48
12397,715314,7,43743272,41',Gabriel Alfaro (Comerciantes Unidos) Substitution at 41',2024-09-17 05:40:48
12397,715314,8,43743882,63',Iván Colman (Cusco FC) Shot Off Target at 63',2024-09-17 05:40:48
12397,715314,9,43743956,68',Pablo Cárdenas (Cusco FC) Substitution at 68',2024-09-17 05:40:48
12397,715314,10,43743958,68',Juan Manuel Tévez (Cusco FC) Substitution at 68',2024-09-17 05:40:48
12397,715314,11,43743957,69',Óscar Pinto (Comerciantes Unidos) Substitution at 69',2024-09-17 05:40:48
12397,715314,12,43743990,69',Chase Villanueva (Comerciantes Unidos) Substitution at 69',2024-09-17 05:40:48
12397,715314,13,43744300,83',Relly Fernández (Cusco FC) Substitution at 83',2024-09-17 05:40:48
12397,715314,14,43744301,84',José Caballero (Comerciantes Unidos) Substitution at 84',2024-09-17 05:40:48
12397,715314,15,43744302,84',José Parodi (Comerciantes Unidos) Substitution at 84',2024-09-17 05:40:48
12397,715314,16,43744403,90'+4',Franz Schmidt (Cusco FC) Substitution at 94',2024-09-17 05:40:48
12397,715314,17,43744404,90'+4',Rubén Ramírez (Cusco FC) Substitution at 94',2024-09-17 05:40:48
12397,715315,0,43628490,30',Sebastián Gonzáles Zela (Comerciantes Unidos) Goal at 30',2024-08-26 05:34:12
12397,715315,1,43628869,45',Luis Chicaiza (Deportivo Garcilaso) Substitution at 45',2024-08-26 05:34:12
12397,715315,2,43628961,53',Matías Sen (Comerciantes Unidos) Goal at 53',2024-08-26 05:34:12
12397,715315,3,43629135,67',Miguel Cornejo (Deportivo Garcilaso) Substitution at 67',2024-08-26 05:34:12
12397,715315,4,43629136,67',Freddy Yovera (Deportivo Garcilaso) Substitution at 67',2024-08-26 05:34:12
12397,715315,5,43629189,69',Sebastián Gonzáles Zela (Comerciantes Unidos) Yellow Card at 69',2024-08-26 05:34:12
12397,715315,6,43629190,70',Italo Regalado (Comerciantes Unidos) Substitution at 70',2024-08-26 05:34:12
12397,715315,7,43629191,71',José Parodi (Comerciantes Unidos) Substitution at 71',2024-08-26 05:34:12
12397,715315,8,43629192,71',Piero Magallanes (Comerciantes Unidos) Substitution at 71',2024-08-26 05:34:12
12397,715315,9,43629210,72',Matías Sen (Comerciantes Unidos) Yellow Card at 72',2024-08-26 05:34:12
12397,715315,10,43629282,78',Mauricio Cuero (Deportivo Garcilaso) Substitution at 78',2024-08-26 05:34:12
12397,715315,11,43634716,82',Diego Campos (Comerciantes Unidos) Yellow Card at 82',2024-08-29 05:45:04
12397,715315,12,43629432,89',Kenyi Barrios (Comerciantes Unidos) Substitution at 89',2024-08-29 05:45:04
12397,715315,13,43629469,89',Jose Luis Bazan (Deportivo Garcilaso) Substitution at 89',2024-08-29 05:45:04
12397,715315,14,43629470,90'+3',Juan Lojas (Deportivo Garcilaso) Goal at 93',2024-08-29 05:45:04
12397,715316,0,43631200,15',Alejandro Ramirez Zarate (Cienciano del Cusco) Goal at 15',2024-08-27 05:40:14
12397,715316,1,43631256,20',Cristian Bordacahar (Melgar) Goal at 20',2024-08-27 05:40:14
12397,715316,2,43631380,34',Alfredo Ramua (Cienciano del Cusco) Yellow Card at 34',2024-08-27 05:40:14
12397,715316,3,43631548,57',Leonel Galeano (Melgar) Yellow Card at 57',2024-08-27 05:40:14
12397,715316,4,43631591,70',Leonel González (Melgar) Shot Off Target at 70',2024-08-27 05:40:14
12397,715316,5,43631597,71',Rudy Palomino (Cienciano del Cusco) Substitution at 71',2024-08-27 05:40:14
12397,715316,6,43631598,72',Marco Rodríguez (Cienciano del Cusco) Substitution at 72',2024-08-27 05:40:14
12397,715316,7,43631604,73',Horacio Orzan (Melgar) Yellow Card at 73',2024-08-27 05:40:14
12397,715316,8,43631605,74',Rudy Palomino (Cienciano del Cusco) Goal at 74',2024-08-27 05:40:14
12397,715316,9,43631623,75',Matías Noble (Melgar) Substitution at 75',2024-08-27 05:40:14
12397,715316,10,43631630,78',Claudio Torrejón Tineo (Cienciano del Cusco) Yellow Card at 78',2024-08-27 05:40:14
12397,715316,11,43631636,80',Marcelo Benítez (Cienciano del Cusco) Yellow Card at 80',2024-08-27 05:40:14
12397,715316,12,43631650,85',Jimmy Valoyes (Cienciano del Cusco) Substitution at 85',2024-08-27 05:40:14
12397,715316,13,43631651,86',Ítalo Espinoza (Cienciano del Cusco) Yellow Card at 86',2024-08-27 05:40:14
12397,715316,14,43631653,89',Leonel Galeano (Melgar) Red Card at 89',2024-08-27 05:40:14
12397,715316,15,43631655,90'+1',Carlos Garcés (Cienciano del Cusco) Penalty - Scored at 91',2024-08-27 05:40:14
12397,715316,16,43631659,90'+3',Jordan Guivin (Cienciano del Cusco) Substitution at 93',2024-08-27 05:40:14
12397,715316,17,43631660,90'+4',Marco Rodríguez (Cienciano del Cusco) Yellow Card at 94',2024-08-27 05:40:14
12397,715317,0,43632295,14',Marlon de Jesús (Unión Comercio) Goal at 14',2024-08-27 05:40:14
12397,715317,1,43632333,26',Nicolás Silva (Cusco FC) Goal at 26',2024-08-27 05:40:14
12397,715317,2,43632347,34',Lucas Colitto (Cusco FC) Own Goal at 34',2024-08-27 05:40:14
12397,715317,3,43632368,44',Lucas Colitto (Cusco FC) Goal at 44',2024-08-27 05:40:14
12397,715317,4,43632422,45',André Vásquez (Cusco FC) Substitution at 45',2024-08-27 05:40:14
12397,715317,5,43632495,54',Luis Ramos (Cusco FC) Goal at 54',2024-08-27 05:40:14
12397,715317,6,43632514,59',Luis Navea (Unión Comercio) Substitution at 59',2024-08-27 05:40:14
12397,715317,7,43632547,64',Juan Manuel Tévez (Cusco FC) Substitution at 64',2024-08-27 05:40:14
12397,715317,8,43632548,65',Marlon de Jesús (Unión Comercio) Penalty - Scored at 65',2024-08-27 05:40:14
12397,715317,9,43632564,67',Joaquín Aguirre (Unión Comercio) Substitution at 67',2024-08-27 05:40:14
12397,715317,10,43632565,68',Denilson Vargas (Unión Comercio) Substitution at 68',2024-08-27 05:40:14
12397,715317,11,43632586,73',Pablo Cárdenas (Cusco FC) Substitution at 73',2024-08-27 05:40:14
12397,715317,12,43632600,74',Teodoro Paredes (Unión Comercio) Yellow Card at 74',2024-08-27 05:40:14
12397,715317,13,43632642,80',Josue Torres (Unión Comercio) Substitution at 80',2024-08-27 05:40:14
12397,715317,14,43632643,80',Jorge Jimenez (Unión Comercio) Substitution at 80',2024-08-27 05:40:14
12397,715317,15,43632709,90',Teodoro Paredes (Unión Comercio) Red Card at 90',2024-08-27 05:40:14
12397,715318,0,43747871,24',Herná Barcos (Alianza Lima) Goal at 24',2024-09-16 05:26:57
12397,715318,1,43749290,62',Ricardo Lagos (Alianza Lima) Substitution at 62',2024-09-16 05:26:57
12397,715318,2,43749343,62',Pablo Sabbag (Alianza Lima) Substitution at 62',2024-09-16 05:26:57
12397,715318,3,43749388,62',Carlos Liza (Carlos A. Mannucci) Substitution at 62',2024-09-16 05:26:57
12397,715318,4,43749448,68',Erick Noriega (Alianza Lima) Yellow Card at 68',2024-09-16 05:26:57
12397,715318,5,43749554,70',Paolo Hurtado (Carlos A. Mannucci) Yellow Card at 70',2024-09-16 05:26:57
12397,715318,6,43749555,71',Paolo Guerrero (Alianza Lima) Substitution at 71',2024-09-16 05:26:57
12397,715318,7,43749556,71',Jiovany Ramos (Alianza Lima) Substitution at 71',2024-09-16 05:26:57
12397,715318,8,43749557,72',Gustavo Viera (Carlos A. Mannucci) Substitution at 72',2024-09-16 05:26:57
12397,715318,9,43749703,80',Sebastian Rodriguez (Alianza Lima) Yellow Card at 80',2024-09-16 05:26:57
12397,715318,10,43749763,83',Juan Freytes (Alianza Lima) Yellow Card at 83',2024-09-16 05:26:57
12397,715318,11,43749764,84',Ángel Benítez (Carlos A. Mannucci) Yellow Card at 84',2024-09-16 05:26:57
12397,715318,12,43749832,87',José Cortés (Carlos A. Mannucci) Substitution at 87',2024-09-16 05:26:57
12397,715318,13,43749833,87',Alexis Cossio (Carlos A. Mannucci) Substitution at 87',2024-09-16 05:26:57
12397,715318,14,43749869,90'+1',Jesús Castillo (Alianza Lima) Substitution at 91',2024-09-16 05:26:57
12397,715319,0,43757417,8',Martín Guedes (Universitario) Goal at 8',2024-09-16 05:26:57
12397,715319,1,43757641,20',Eric Tovo (Alianza Atlético) Yellow Card at 20',2024-09-16 05:26:57
12397,715319,2,43760051,41',Christian Vásquez (Alianza Atlético) Yellow Card at 41',2024-09-16 05:26:57
12397,715319,3,43759007,44',Williams Riveros (Universitario) Yellow Card at 44',2024-09-16 05:26:57
12397,715319,4,43759205,45'+3',Edison Flores (Universitario) Yellow Card at 48',2024-09-16 05:26:57
