seasonType,eventId,commentaryOrder,playId,clockDisplayValue,commentaryText,updateDateTime
12678,705649,3,44172216,45',Jordy Bawuah (Jong PSV) Substitution at 45',2024-11-09 06:18:45
12678,705649,4,44172228,52',Bryant Nieling (SC Cambuur) Yellow Card at 52',2024-11-09 06:18:45
12678,705649,5,44172341,60',Jevon Simons (Jong PSV) Substitution at 60',2024-11-09 06:18:45
12678,705649,6,44172691,69',Marcus Younis (Jong PSV) Substitution at 69',2024-11-09 06:18:45
12678,705649,7,44172504,70',Fedde de Jong (SC Cambuur) Substitution at 70',2024-11-09 06:18:45
12678,705649,8,44172627,76',Jonathan Afolabi (SC Cambuur) Substitution at 76',2024-11-09 06:18:45
12678,705649,9,44172657,78',Jesper Uneken (Jong PSV) Yellow Card at 78',2024-11-09 06:18:45
12678,705649,10,44172783,86',Sturla Ottesen (SC Cambuur) Substitution at 86',2024-11-09 06:18:45
12678,705650,0,44171916,23',Seydou Fini (Excelsior) Yellow Card at 23',2024-11-09 06:18:45
12678,705650,1,44171923,25',Kik Pierie (Excelsior) Yellow Card at 25',2024-11-09 06:18:45
12678,705650,2,44171996,38',Lennard Hartjes (Excelsior) Goal at 38',2024-11-20 18:34:51
12678,705650,3,44172051,45'+1',Sanches Fernandes (Excelsior) Goal at 46',2024-11-09 06:18:45
12678,705650,4,44173579,53',Arthur Zagre (Excelsior) Yellow Card at 53',2024-11-09 06:18:45
12678,705650,5,44172308,56',Kik Pierie (Excelsior) Red Card at 56',2024-11-09 06:18:45
12678,705650,6,44172445,64',Jacky Donkor (Excelsior) Substitution at 64',2024-11-09 06:18:45
12678,705650,7,44172446,64',Siem De Moes (Excelsior) Substitution at 64',2024-11-09 06:18:45
12678,705650,8,44172447,64',Serano Seymor (Excelsior) Substitution at 64',2024-11-09 06:18:45
12678,705650,9,44172660,75',Tyrese Simons (FC Eindhoven) Substitution at 75',2024-11-20 18:34:51
12678,705650,10,44172687,78',Luuk Verheij (FC Eindhoven) Substitution at 78',2024-11-09 06:18:45
12678,705650,11,44172688,78',Mike van Duinen (Excelsior) Substitution at 78',2024-11-09 06:18:45
12678,705650,12,44172758,81',Collin Seedorf (FC Eindhoven) Yellow Card at 81',2024-11-09 06:18:45
12678,705650,13,44172788,84',Matteo Vandendaele (FC Eindhoven) Substitution at 84',2024-11-09 06:18:45
12678,705651,0,44178157,17',Cain Seedorf (Roda JC Kerkrade) Goal at 17',2024-11-10 06:23:00
12678,705651,1,44178995,44',Nils Rossen (Telstar) Yellow Card at 44',2024-11-10 06:23:00
12678,705651,2,44179753,45',Jayden Turfkruier (Telstar) Substitution at 45',2024-11-10 06:23:00
12678,705651,3,44180540,62',Tyrone Owusu (Telstar) Substitution at 62',2024-11-10 06:23:00
12678,705651,4,44180808,77',Tom Overtoom (Telstar) Substitution at 77',2024-11-10 06:23:00
12678,705651,5,44180809,77',Mohamed Hamdaoui (Telstar) Substitution at 77',2024-11-10 06:23:00
12678,705651,6,44180993,87',Enrique Peña Zauner (Roda JC Kerkrade) Substitution at 87',2024-11-10 06:23:00
12678,705651,7,44181067,90',Soufiane Hetli (Telstar) Substitution at 90',2024-11-10 06:23:00
12678,705652,0,44192426,17',Jaden Slory (FC Dordrecht) Goal at 17',2024-11-10 16:35:27
12678,705652,1,44193318,45',Axl Van Himbeeck (Helmond Sport) Substitution at 45',2024-11-11 06:21:07
12678,705652,2,44193343,46',Enrik Ostrc (Helmond Sport) Own Goal at 46',2024-11-11 06:21:07
12678,705652,3,44193573,58',Justin Ogenia (Helmond Sport) Substitution at 58',2024-11-11 06:21:07
12678,705652,4,44193574,58',Sam Bisselink (Helmond Sport) Substitution at 58',2024-11-11 06:21:07
12678,705652,5,44193606,58',Anthony van der Hurk (Helmond Sport) Substitution at 58',2024-11-11 06:21:07
12678,705652,6,44193701,65',Oluwakorede Osundina (FC Dordrecht) Goal at 65',2024-11-11 06:21:07
12678,705652,7,44193802,69',Joep van der Sluijs (FC Dordrecht) Substitution at 69',2024-11-11 06:21:07
12678,705652,8,44193903,73',Rocco Robert Shein (FC Dordrecht) Goal at 73',2024-11-11 06:21:07
12678,705652,9,44193946,76',Dean Zandbergen (FC Dordrecht) Substitution at 76',2024-11-11 06:21:07
12678,705652,10,44194029,76',Reda Akmum (FC Dordrecht) Substitution at 76',2024-11-11 06:21:07
12678,705652,11,44194030,79',Tarik Essakkati (Helmond Sport) Substitution at 79',2024-11-11 06:21:07
12678,705652,12,44194118,84',Joseph Amuzu (FC Dordrecht) Substitution at 84',2024-11-11 06:21:07
12678,705652,13,44194139,87',Lorenzo Codutti (FC Dordrecht) Substitution at 87',2024-11-11 06:21:07
12678,705652,14,44194140,87',Jop van den Avert (FC Dordrecht) Substitution at 87',2024-11-11 06:21:07
12678,705653,0,44213870,2',Youssef El Kachati (Telstar) Goal at 2',2024-11-16 06:07:33
12678,705653,1,44213929,23',Naïm Matoug (VVV-Venlo) Yellow Card at 23',2024-11-17 06:06:55
12678,705653,2,44213927,25',Zakaria Eddahchouri (Telstar) Penalty - Scored at 25',2024-11-16 06:07:33
12678,705653,3,44214404,53',Emmanuel Gyamfi (VVV-Venlo) Substitution at 53',2024-11-16 06:07:33
12678,705653,4,44214758,72',Youssef El Kachati (Telstar) Goal at 72',2024-11-16 06:07:33
12678,705653,5,44214786,73',Yahcuroo Roemer (VVV-Venlo) Substitution at 73',2024-11-16 06:07:33
12678,705653,6,44214829,73',Pepijn Doesburg (VVV-Venlo) Substitution at 73',2024-11-16 06:07:33
12678,705653,7,44214886,73',Mees Kaandorp (Telstar) Substitution at 73',2024-11-16 06:07:33
12678,705653,8,44214830,74',Lasse Wehmeyer (VVV-Venlo) Substitution at 74',2024-11-16 06:07:33
12678,705653,9,44214831,74',Paul Pöpperl (VVV-Venlo) Substitution at 74',2024-11-16 06:07:33
12678,705653,10,44214906,78',Tyrone Owusu (Telstar) Substitution at 78',2024-11-16 06:07:33
12678,705653,11,44214907,78',Tom Overtoom (Telstar) Substitution at 78',2024-11-16 06:07:33
12678,705653,12,44214940,84',Danny Bakker (Telstar) Goal at 84',2024-11-16 06:07:33
12678,705653,13,44214956,86',Paul Pöpperl (VVV-Venlo) Yellow Card at 86',2024-11-16 06:07:33
12678,705653,14,44214981,89',Abdelraffie Benzzine (Telstar) Substitution at 89',2024-11-16 06:07:33
12678,705653,15,44214982,89',Soufiane Hetli (Telstar) Substitution at 89',2024-11-16 06:07:33
12678,705654,0,44224089,26',Farouq Limouri (FC Eindhoven) Yellow Card at 26',2024-11-18 06:05:44
12678,705654,1,44224135,34',Daan Huisman (FC Eindhoven) Yellow Card at 34',2024-11-18 06:05:44
12678,705654,2,44224415,56',Rayan Buifrahi (MVV Maastricht) Goal at 56',2024-11-18 06:05:44
12678,705654,3,44224434,59',Evan Rottier (FC Eindhoven) Substitution at 59',2024-11-18 06:05:44
12678,705654,4,44224452,75',Camil Mmaee (MVV Maastricht) Substitution at 75',2024-11-18 06:05:44
12678,705654,5,44224453,75',Saul Penders (MVV Maastricht) Substitution at 75',2024-11-18 06:05:44
12678,705654,6,44224454,75',Nabil El Basri (MVV Maastricht) Substitution at 75',2024-11-18 06:05:44
12678,705654,7,44224455,76',Nabil El Basri (MVV Maastricht) Yellow Card at 76',2024-11-18 06:05:44
12678,705654,8,44224470,78',Julian Kwaaitaal (FC Eindhoven) Substitution at 78',2024-11-18 06:05:44
12678,705654,9,44224517,85',Luuk Verheij (FC Eindhoven) Substitution at 85',2024-11-18 06:05:44
12678,705654,10,44224518,85',Hugo Deenen (FC Eindhoven) Substitution at 85',2024-11-18 06:05:44
12678,705654,11,44224530,89',Daan Huisman (FC Eindhoven) Goal at 89',2024-11-20 18:34:51
12678,705654,12,44224556,90',Robyn Esajas (MVV Maastricht) Substitution at 90',2024-11-18 06:05:44
12678,705655,0,44245149,37',Ralf Seuntjens (De Graafschap) Penalty - Scored at 37',2024-11-23 06:05:07
12678,705655,1,44245164,39',Ralf Seuntjens (De Graafschap) Goal at 39',2024-11-23 06:05:07
12678,705655,2,44245179,42',Ibrahim El Kadiri (De Graafschap) Goal at 42',2024-11-23 06:05:07
12678,705655,3,44245186,43',Mitchell Van Rooijen (TOP Oss) Yellow Card at 43',2024-11-23 06:05:07
12678,705655,4,44245202,45',Xander Lambrix (TOP Oss) Yellow Card at 45',2024-11-23 06:05:07
12678,705655,5,44245203,45',Ralf Seuntjens (De Graafschap) Penalty - Scored at 45',2024-11-23 06:05:07
12678,705655,6,44245326,45',Mimoun Mahi (De Graafschap) Substitution at 45',2024-11-23 06:05:07
12678,705655,7,44245427,55',Youssef El Jebli (De Graafschap) Substitution at 55',2024-11-23 06:05:07
12678,705655,8,44245443,55',Philip Brittijn (De Graafschap) Substitution at 55',2024-11-23 06:05:07
12678,705655,9,44245444,57',Sven Zitman (TOP Oss) Substitution at 57',2024-11-23 06:05:07
12678,705655,10,44245445,57',Thomas Cox (TOP Oss) Substitution at 57',2024-11-23 06:05:07
12678,705655,11,44245454,59',Julian Kuijpers (TOP Oss) Yellow Card at 59',2024-11-23 06:05:07
12678,705655,12,44245500,63',Philip Brittijn (De Graafschap) Yellow Card at 63',2024-11-23 06:05:07
12678,705655,13,44245564,69',Anis Yadir (De Graafschap) Substitution at 69',2024-11-23 06:05:07
12678,705655,14,44245565,69',Giovanni Korte (TOP Oss) Substitution at 69',2024-11-23 06:05:07
12678,705655,15,44245580,69',Tom Van Der Werff (TOP Oss) Substitution at 69',2024-11-23 06:05:07
12678,705655,16,44245636,76',Lion Kaak (De Graafschap) Substitution at 76',2024-11-27 06:06:31
12678,705655,17,44245657,76',Jonathan Mulder (TOP Oss) Substitution at 76',2024-11-27 06:06:31
12678,705655,18,44245921,90'+2',Sven Zitman (TOP Oss) Yellow Card at 92',2024-11-23 06:05:07
12678,705656,0,44245041,12',Stan Maas (FC Den Bosch) Substitution at 12',2024-11-23 06:05:07
12678,705656,1,44245139,34',Arthur Zagre (Excelsior) Goal at 34',2024-11-23 06:05:07
12678,705656,2,44245184,42',Noah Naujoks (Excelsior) Goal at 42',2024-11-23 06:05:07
12678,705656,3,44245541,61',Kévin Monzialo (FC Den Bosch) Substitution at 61',2024-11-23 06:05:07
12678,705656,4,44245542,61',Hicham Acheffay (FC Den Bosch) Substitution at 61',2024-11-23 06:05:07
12678,705656,5,44245543,61',Danzell Gravenberch (FC Den Bosch) Substitution at 61',2024-11-23 06:05:07
12678,705656,6,44245557,61',Lance Duijvestijn (Excelsior) Substitution at 61',2024-11-23 06:05:07
12678,705656,7,44245608,68',Jacky Donkor (Excelsior) Goal at 68',2024-11-23 06:05:07
12678,705656,8,44245647,72',Teun van Grunsven (FC Den Bosch) Substitution at 72',2024-11-23 06:05:07
12678,705656,9,44245678,75',Mike van Duinen (Excelsior) Substitution at 75',2024-11-23 06:05:07
12678,705656,10,44245679,75',Seydou Fini (Excelsior) Substitution at 75',2024-11-23 06:05:07
12678,705656,11,44245808,81',Joshua Eijgenraam (Excelsior) Substitution at 81',2024-11-23 06:05:07
12678,705656,12,44245984,90',Thijs van Leeuwen (FC Den Bosch) Yellow Card at 90',2024-11-23 06:05:07
12678,705657,0,44245019,5',Sven Blummel (FC Eindhoven) Goal at 5',2024-11-23 06:05:07
12678,705657,1,44245091,24',Sven Blummel (FC Eindhoven) Goal at 24',2024-11-23 06:05:07
12678,705657,2,44245101,26',Sam Bisselink (Helmond Sport) Yellow Card at 26',2024-11-23 06:05:07
12678,705657,3,44245352,45',Helgi Ingason (Helmond Sport) Substitution at 45',2024-11-23 06:05:07
12678,705657,4,44245364,45',Tobias Pachonik (Helmond Sport) Substitution at 45',2024-11-23 06:05:07
12678,705657,5,44245353,47',Helgi Ingason (Helmond Sport) Goal at 47',2024-11-23 06:05:07
12678,705657,6,44245365,49',Joey Sleegers (FC Eindhoven) Goal at 49',2024-11-23 06:05:07
12678,705657,7,44245390,50',Bryan Van Hove (Helmond Sport) Yellow Card at 50',2024-11-23 06:05:07
12678,705657,8,44245391,50',Tibo Persyn (FC Eindhoven) Yellow Card at 50',2024-11-23 06:05:07
12678,705657,9,44245421,54',Anthony van der Hurk (Helmond Sport) Goal at 54',2024-11-23 06:05:07
12678,705657,10,44245504,61',Mohammed Mallahi (Helmond Sport) Substitution at 61',2024-11-23 06:05:07
12678,705657,11,44245641,77',Anthony van der Hurk (Helmond Sport) Penalty - Scored at 77',2024-11-23 06:05:07
12678,705657,12,44245789,85',Evan Rottier (FC Eindhoven) Substitution at 85',2024-11-23 06:05:07
12678,705657,13,44245839,88',Evan Rottier (FC Eindhoven) Goal at 88',2024-11-23 06:05:07
12678,705657,14,44245915,89',Tarik Essakkati (Helmond Sport) Substitution at 89',2024-11-23 06:05:07
12678,705657,15,44245916,89',Axl Van Himbeeck (Helmond Sport) Substitution at 89',2024-11-23 06:05:07
12678,705657,16,44245977,90'+2',Luuk Verheij (FC Eindhoven) Substitution at 92',2024-11-23 06:05:07
12678,705657,17,44245995,90'+5',Hugo Deenen (FC Eindhoven) Substitution at 95',2024-11-23 06:05:07
12678,705658,0,44245080,19',Diogo Tomas (ADO Den Haag) Yellow Card at 19',2024-11-23 06:05:07
12678,705658,1,44245113,28',Alex Schalk (ADO Den Haag) Goal at 28',2024-11-23 06:05:07
12678,705658,2,44245141,34',Lee Bonis (ADO Den Haag) Goal at 34',2024-11-23 06:05:07
12678,705658,3,44245181,40',Jeremiah Esajas (Jong AZ) Yellow Card at 40',2024-11-23 06:05:07
12678,705658,4,44245183,41',Alex Schalk (ADO Den Haag) Goal at 41',2024-11-23 06:05:07
12678,705658,5,44247962,41',Job Kalisvaart (Jong AZ) Yellow Card at 41',2024-11-23 06:05:07
12678,705658,6,44245369,45',Anthony Smits (Jong AZ) Substitution at 45',2024-11-23 06:05:07
12678,705658,7,44245396,47',Anthony Smits (Jong AZ) Goal at 47',2024-11-23 06:05:07
12678,705658,8,44245503,59',Rio Robbemond (Jong AZ) Goal at 59',2024-11-23 06:05:07
12678,705658,9,44245554,63',Billy Van Duijl (Jong AZ) Substitution at 63',2024-11-23 06:05:07
12678,705658,10,44245716,74',Kilian Nikiema (ADO Den Haag) Red Card at 74',2024-11-27 06:06:31
12678,705658,11,44245717,75',Mathijs Menu (Jong AZ) Substitution at 75',2024-11-27 06:06:31
12678,705658,12,44245722,76',Tim Coremans (ADO Den Haag) Substitution at 76',2024-11-23 06:05:07
12678,705658,13,44245993,89',Jayen Gerold (Jong AZ) Substitution at 89',2024-11-23 06:05:07
12678,705658,14,44246034,90'+3',Daniel Granli (ADO Den Haag) Substitution at 93',2024-11-23 06:05:07
12678,705658,15,44246064,90'+5',Jayden Addai (Jong AZ) Goal at 95',2024-11-23 06:05:07
12678,705658,16,44246134,90'+6',Lasse Vigen Christensen (ADO Den Haag) Substitution at 96',2024-11-23 06:05:07
12678,705658,17,44246135,90'+7',Jayden Addai (Jong AZ) Yellow Card at 97',2024-11-23 06:05:07
12678,705658,18,44246170,90'+7',Misha Engel (Jong AZ) Yellow Card at 97',2024-11-23 06:05:07
12678,705659,0,44245074,20',Don-Angelo Konadu (Jong Ajax) Goal at 20',2024-11-23 06:05:07
12678,705659,1,44245096,24',Sem Dirks (Telstar) Yellow Card at 24',2024-11-23 06:05:07
12678,705659,2,44245367,45',Julian Rijkhoff (Jong Ajax) Substitution at 45',2024-11-23 06:05:07
12678,705659,3,44245368,45',Jorthy Mokio (Jong Ajax) Substitution at 45',2024-11-23 06:05:07
12678,705659,4,44245393,45',Mohamed Hamdaoui (Telstar) Substitution at 45',2024-11-23 06:05:07
12678,705659,5,44245416,45',Tyrone Owusu (Telstar) Substitution at 45',2024-11-23 06:05:07
12678,705659,6,44245531,61',Jan Faberski (Jong Ajax) Yellow Card at 61',2024-11-23 06:05:07
12678,705659,7,44245567,64',Jan Faberski (Jong Ajax) Goal at 64',2024-11-23 06:05:07
12678,705659,8,44245588,65',Jaydon Banel (Jong Ajax) Substitution at 65',2024-11-23 06:05:07
12678,705659,9,44245607,65',Gerald Alders (Jong Ajax) Substitution at 65',2024-11-23 06:05:07
12678,705659,10,44245660,73',Reda Kharchouch (Telstar) Substitution at 73',2024-11-23 06:05:07
12678,705659,11,44245661,73',Tom Overtoom (Telstar) Substitution at 73',2024-11-23 06:05:07
12678,705659,12,44245700,77',Jorthy Mokio (Jong Ajax) Yellow Card at 77',2024-11-23 06:05:07
12678,705659,13,44247821,77',Youssef El Kachati (Telstar) Yellow Card at 77',2024-11-23 06:05:07
12678,705659,14,44245741,79',Soufiane Hetli (Telstar) Substitution at 79',2024-11-23 06:05:07
12678,705659,15,44245805,82',Ryan Van De Pavert (Jong Ajax) Substitution at 82',2024-11-23 06:05:07
12678,705659,16,44245823,83',Mitch Apau (Telstar) Yellow Card at 83',2024-11-23 06:05:07
12678,705659,17,44246002,90'+2',Jaydon Banel (Jong Ajax) Goal at 92',2024-11-23 06:05:07
12678,705660,0,44245135,32',Sil Van Der Wegen (Jong FC Utrecht) Goal at 32',2024-11-23 06:05:07
12678,705660,1,44245349,45',Joshua Schwirten (Roda JC Kerkrade) Substitution at 45',2024-11-23 06:05:07
12678,705660,2,44245472,59',Ryan Lejten (Roda JC Kerkrade) Substitution at 59',2024-11-23 06:05:07
12678,705660,3,44245509,63',Thomas Oude Kotte (Roda JC Kerkrade) Penalty - Scored at 63',2024-11-23 06:05:07
12678,705660,4,44245529,64',Silas Andersen (Jong FC Utrecht) Red Card at 64',2024-11-23 06:05:07
12678,705660,5,44245545,67',Tijn Den Boggende (Jong FC Utrecht) Substitution at 67',2024-11-27 06:06:31
12678,705660,6,44245546,67',Lynden Edhart (Jong FC Utrecht) Substitution at 67',2024-11-23 06:05:07
12678,705660,7,44245547,67',Noa Dundas (Jong FC Utrecht) Substitution at 67',2024-11-23 06:05:07
12678,705660,8,44245670,77',Enrique Peña Zauner (Roda JC Kerkrade) Substitution at 77',2024-11-23 06:05:07
12678,705660,9,44245713,81',Achraf Boumenjal (Jong FC Utrecht) Substitution at 81',2024-11-23 06:05:07
12678,705660,10,44245812,85',Saydou Bangura (Roda JC Kerkrade) Substitution at 85',2024-11-23 06:05:07
12678,705660,11,44245817,86',Cain Seedorf (Roda JC Kerkrade) Goal at 86',2024-11-23 06:05:07
12678,705660,12,44245870,89',Thomas Oude Kotte (Roda JC Kerkrade) Penalty - Scored at 89',2024-11-23 06:05:07
12678,705660,13,44245991,89',Sofiane Dris (Jong FC Utrecht) Substitution at 89',2024-11-23 06:05:07
12678,705661,0,44245017,4',Robert Mühren (FC Volendam) Goal at 4',2024-11-23 06:05:07
12678,705661,1,44245062,20',Robert Mühren (FC Volendam) Goal at 20',2024-11-23 06:05:07
12678,705661,2,44245102,27',Robert Mühren (FC Volendam) Goal at 27',2024-11-23 06:05:07
12678,705661,3,44245159,37',Xavier Mbuyamba (FC Volendam) Yellow Card at 37',2024-11-23 06:05:07
12678,705661,4,44245180,42',Jamie Jacobs (FC Volendam) Goal at 42',2024-11-23 06:05:07
12678,705661,5,44245338,45',Wessel Kuhn (Jong PSV) Substitution at 45',2024-11-23 06:05:07
12678,705661,6,44245339,45',Iggy Houben (Jong PSV) Substitution at 45',2024-11-23 06:05:07
12678,705661,7,44245340,45',Jordy Bawuah (Jong PSV) Substitution at 45',2024-11-23 06:05:07
12678,705661,8,44245449,58',Tai Abed (Jong PSV) Goal at 58',2024-11-23 06:05:07
12678,705661,9,44245473,60',Muhlis Dagasan (Jong PSV) Substitution at 60',2024-11-23 06:05:07
12678,705661,10,44245474,60',Aurelio Oehlers (FC Volendam) Substitution at 60',2024-11-23 06:05:07
12678,705661,11,44245475,60',Nordin Bukala (FC Volendam) Substitution at 60',2024-11-23 06:05:07
12678,705661,12,44245587,70',Caner Demircioglu (FC Volendam) Substitution at 70',2024-11-23 06:05:07
12678,705661,13,44245614,73',Jordy Bawuah (Jong PSV) Red Card at 73',2024-11-23 06:05:07
12678,705661,14,44245815,86',Luca Blondeau (FC Volendam) Substitution at 86',2024-11-23 06:05:07
12678,705661,15,44245816,86',Quincy Hoeve (FC Volendam) Substitution at 86',2024-11-23 06:05:07
12678,705662,0,44245032,6',Oluwakorede Osundina (FC Dordrecht) Goal at 6',2024-11-23 06:05:07
12678,705662,1,44245455,54',Wout Coomans (MVV Maastricht) Goal at 54',2024-11-23 06:05:07
12678,705662,2,44245517,60',Rayan Buifrahi (MVV Maastricht) Yellow Card at 60',2024-11-23 06:05:07
12678,705662,3,44245586,64',Sven Braken (MVV Maastricht) Yellow Card at 64',2024-11-23 06:05:07
12678,705662,4,44245613,65',Dean Zandbergen (FC Dordrecht) Substitution at 65',2024-11-23 06:05:07
12678,705662,5,44245664,73',Bryan Smeets (MVV Maastricht) Goal at 73',2024-11-23 06:05:07
12678,705662,6,44245829,79',Jop van den Avert (FC Dordrecht) Substitution at 79',2024-11-23 06:05:07
12678,705662,7,44245830,79',Gabriele Parlanti (FC Dordrecht) Substitution at 79',2024-11-23 06:05:07
12678,705662,8,44245908,84',Camil Mmaee (MVV Maastricht) Substitution at 84',2024-11-23 06:05:07
12678,705662,9,44246011,87',Joseph Amuzu (FC Dordrecht) Substitution at 87',2024-11-23 06:05:07
12678,705662,10,44246012,87',Igor (FC Dordrecht) Substitution at 87',2024-11-23 06:05:07
12678,705662,11,44246063,90'+3',Robyn Esajas (MVV Maastricht) Substitution at 93',2024-11-23 06:05:07
12678,705663,0,44245025,4',Gabin Blancquart (VVV-Venlo) Yellow Card at 4',2024-11-23 06:05:07
12678,705663,1,44245085,20',Jalen Hawkins (FC Emmen) Goal at 20',2024-11-23 06:05:07
12678,705663,2,44245357,45',Lasse Wehmeyer (VVV-Venlo) Substitution at 45',2024-11-23 06:05:07
12678,705663,3,44245532,61',Roel Janssen (VVV-Venlo) Yellow Card at 61',2024-11-30 06:05:44
12678,705663,4,44245553,64',Franck Evina (FC Emmen) Goal at 64',2024-11-23 06:05:07
12678,705663,5,44245579,66',Pepijn Doesburg (VVV-Venlo) Substitution at 66',2024-11-23 06:05:07
12678,705663,6,44245715,77',Paul Pöpperl (VVV-Venlo) Substitution at 77',2024-11-30 06:05:44
12678,705663,7,44245964,79',Mike te Wierik (FC Emmen) Yellow Card at 79',2024-11-23 06:05:07
12678,705663,8,44245753,80',Agon Sadiku (FC Emmen) Substitution at 80',2024-11-23 06:05:07
12678,705663,9,44245796,82',Michael Martin (FC Emmen) Substitution at 82',2024-11-23 06:05:07
12678,705663,10,44245965,83',Yousri El Anbri (VVV-Venlo) Substitution at 83',2024-11-23 06:05:07
12678,705663,11,44245966,84',Max de Waal (VVV-Venlo) Substitution at 84',2024-11-23 06:05:07
12678,705663,12,44245967,88',Faris Hammouti (FC Emmen) Substitution at 88',2024-11-23 06:05:07
12678,705663,13,44245996,88',Freddy Quispel (FC Emmen) Substitution at 88',2024-11-23 06:05:07
12678,705664,0,44245040,14',Remco Balk (SC Cambuur) Goal at 14',2024-11-23 06:05:07
12678,705664,1,44245048,15',Ilias Alhaft (SC Cambuur) Goal at 15',2024-11-23 06:05:07
12678,705664,2,44245051,17',Alexander Büttner (Vitesse) Yellow Card at 17',2024-11-23 06:05:07
12678,705664,3,44245123,31',Benjamin Pauwels (SC Cambuur) Yellow Card at 31',2024-11-23 06:05:07
12678,705664,4,44245147,37',Thomas Poll (SC Cambuur) Goal at 37',2024-11-23 06:05:07
12678,705664,5,44245177,42',Benjamin Pauwels (SC Cambuur) Goal at 42',2024-11-23 06:05:07
12678,705664,6,44245314,45',Nino Zonneveld (Vitesse) Substitution at 45',2024-11-28 06:10:04
12678,705664,7,44245315,45',Andy Visser (Vitesse) Substitution at 45',2024-11-23 06:05:07
12678,705664,8,44245328,45',Sturla Ottesen (SC Cambuur) Substitution at 45',2024-11-23 06:05:07
12678,705664,9,44245394,45',Mats Egbring (Vitesse) Substitution at 45',2024-11-23 06:05:07
12678,705664,10,44245410,45',Angelos Tsigaras (Vitesse) Substitution at 45',2024-11-23 06:05:07
12678,705664,11,44245329,47',Enzo Cornelisse (Vitesse) Yellow Card at 47',2024-11-23 06:05:07
12678,705664,12,44245450,58',Arnau Casas (SC Cambuur) Substitution at 58',2024-11-23 06:05:07
12678,705664,13,44245555,68',Michael de Leeuw (SC Cambuur) Substitution at 68',2024-11-23 06:05:07
12678,705664,14,44245556,68',Fedde de Jong (SC Cambuur) Substitution at 68',2024-11-23 06:05:07
12678,705664,15,44245619,74',Anass Zarrouk (Vitesse) Substitution at 74',2024-11-23 06:05:07
12678,705664,16,44245637,77',Tony Rölke (SC Cambuur) Substitution at 77',2024-11-23 06:05:07
12678,705664,17,44245695,82',Anass Zarrouk (Vitesse) Own Goal at 82',2024-12-04 06:04:46
12678,705664,18,44245706,83',Mats Egbring (Vitesse) Yellow Card at 83',2024-11-23 06:05:07
12678,705664,19,44245950,90'+3',Tony Rölke (SC Cambuur) Goal at 93',2024-11-23 06:05:07
12678,705665,0,44278292,45'+1',Jules Van Bost (TOP Oss) Yellow Card at 46',2024-11-27 06:06:31
12678,705665,1,44278295,45'+2',Devin Haen (FC Dordrecht) Penalty - Scored at 47',2024-11-27 06:06:31
12678,705665,2,44279073,47',Mauresmo Hinoke (TOP Oss) Yellow Card at 47',2024-11-27 06:06:31
12678,705665,3,44279164,59',Giovanni Korte (TOP Oss) Substitution at 59',2024-11-27 06:06:31
12678,705665,4,44279191,64',Oluwakorede Osundina (FC Dordrecht) Goal at 64',2024-11-27 06:06:31
12678,705665,5,44279222,70',Sven Zitman (TOP Oss) Substitution at 70',2024-11-27 06:06:31
12678,705665,6,44279229,70',Calvin Mac-Intosch (TOP Oss) Substitution at 70',2024-11-27 06:06:31
12678,705665,7,44279230,70',Tom Van Der Werff (TOP Oss) Substitution at 70',2024-11-27 06:06:31
12678,705665,8,44279227,72',Abel Stensrud (TOP Oss) Goal at 72',2024-11-27 06:06:31
12678,705665,9,44279237,75',Lorenzo Codutti (FC Dordrecht) Substitution at 75',2024-11-27 06:06:31
12678,705665,10,44279251,76',Joshua Zimmerman (TOP Oss) Goal at 76',2024-11-27 06:06:31
12678,705665,11,44279278,81',Joshua Zimmerman (TOP Oss) Yellow Card at 81',2024-11-27 06:06:31
12678,705665,12,44279279,83',Joep van der Sluijs (FC Dordrecht) Substitution at 83',2024-11-27 06:06:31
12678,705665,13,44279280,83',Dean Zandbergen (FC Dordrecht) Substitution at 83',2024-11-27 06:06:31
12678,705665,14,44279288,86',Oluwakorede Osundina (FC Dordrecht) Yellow Card at 86',2024-11-27 06:06:31
12678,705665,15,44279306,90',Giovanni Korte (TOP Oss) Yellow Card at 90',2024-11-27 06:06:31
12678,705665,16,44279308,90',Jaden Slory (FC Dordrecht) Yellow Card at 90',2024-11-27 06:06:31
12678,705665,17,44279309,90',Yannis M'Bemba (FC Dordrecht) Yellow Card at 90',2024-11-27 06:06:31
12678,705665,18,44279316,90'+1',Joseph Amuzu (FC Dordrecht) Substitution at 91',2024-11-27 06:06:31
12678,705665,19,44279317,90'+1',Jop van den Avert (FC Dordrecht) Substitution at 91',2024-11-27 06:06:31
12678,705665,20,44279322,90'+3',Mike Havekotte (TOP Oss) Yellow Card at 93',2024-11-30 06:05:44
12678,705666,0,44278134,5',Jalen Hawkins (FC Emmen) Goal at 5',2024-11-27 06:06:31
12678,705666,1,44278139,7',Dennis Vos (FC Emmen) Yellow Card at 7',2024-11-27 06:06:31
12678,705666,2,44278148,9',Franck Evina (FC Emmen) Goal at 9',2024-11-27 06:06:31
12678,705666,3,44279621,9',Rowan Besselink (De Graafschap) Yellow Card at 9',2024-11-27 06:06:31
12678,705666,4,44278249,34',Pascal Mulder (FC Emmen) Yellow Card at 34',2024-11-27 06:06:31
12678,705666,5,44279068,45',Agon Sadiku (FC Emmen) Substitution at 45',2024-11-27 06:06:31
12678,705666,6,44279069,47',Julius Kade (FC Emmen) Goal at 47',2024-11-27 06:06:31
12678,705666,7,44279083,50',Agon Sadiku (FC Emmen) Yellow Card at 50',2024-11-27 06:06:31
12678,705666,8,44279099,51',Levi Schoppema (De Graafschap) Yellow Card at 51',2024-11-27 06:06:31
12678,705666,9,44279100,51',Ibrahim El Kadiri (De Graafschap) Yellow Card at 51',2024-11-27 06:06:31
12678,705666,10,44279144,58',Maas Willemsen (De Graafschap) Substitution at 58',2024-11-27 06:06:31
12678,705666,11,44279145,59',Youssef El Jebli (De Graafschap) Substitution at 59',2024-11-27 06:06:31
12678,705666,12,44279203,70',Torben Rhein (FC Emmen) Yellow Card at 70',2024-11-27 06:06:31
12678,705666,13,44279245,75',Tygo Grotenhuis (De Graafschap) Substitution at 75',2024-11-27 06:06:31
12678,705666,14,44279246,75',Kyano Kwint (De Graafschap) Substitution at 75',2024-11-27 06:06:31
