seasonType,eventId,commentaryOrder,playId,clockDisplayValue,commentaryText,updateDateTime
12678,705614,4,43998188,28',Diego Van Zutphen (VVV-Venlo) Substitution at 28',2024-10-19 05:15:42
12678,705614,5,43998232,39',Thijme Verheijen (VVV-Venlo) Goal at 39',2024-10-19 05:15:42
12678,705614,6,43998539,56',Jaden Slory (FC Dordrecht) Goal at 56',2024-10-19 05:15:42
12678,705614,7,43998582,58',Jari Schuurman (FC Dordrecht) Substitution at 58',2024-10-19 05:15:42
12678,705614,8,43998583,58',Dean Zandbergen (FC Dordrecht) Substitution at 58',2024-10-19 05:15:42
12678,705614,9,43998649,63',Martijn Berden (VVV-Venlo) Substitution at 63',2024-10-19 05:15:42
12678,705614,10,43998650,64',Yousri El Anbri (VVV-Venlo) Substitution at 64',2024-10-19 05:15:42
12678,705614,11,43998651,64',Lasse Wehmeyer (VVV-Venlo) Substitution at 64',2024-10-19 05:15:42
12678,705614,12,43998743,70',Gabriele Parlanti (FC Dordrecht) Substitution at 70',2024-10-19 05:15:42
12678,705614,13,43998865,82',Pepijn Doesburg (VVV-Venlo) Substitution at 82',2024-10-19 05:15:42
12678,705614,14,43998914,85',Lorenzo Codutti (FC Dordrecht) Substitution at 85',2024-10-19 05:15:42
12678,705614,15,43998915,85',Igor (FC Dordrecht) Substitution at 85',2024-10-19 05:15:42
12678,705614,16,43998916,86',Jaden Slory (FC Dordrecht) Goal at 86',2024-10-19 05:15:42
12678,705615,0,44034219,38',Mathijs Tielemans (Vitesse) Substitution at 38',2024-10-22 23:22:46
12678,705615,1,44034789,48',Theodosis Macheras (Vitesse) Goal at 48',2024-10-22 23:22:46
12678,705615,2,44035158,58',Jari Schuurman (FC Dordrecht) Substitution at 58',2024-10-22 23:22:46
12678,705615,3,44035159,58',Dean Zandbergen (FC Dordrecht) Substitution at 58',2024-10-22 23:22:46
12678,705615,4,44035358,67',Jari Schuurman (FC Dordrecht) Goal at 67',2024-10-24 01:17:06
12678,705615,5,44035429,68',Bas Huisman (Vitesse) Substitution at 68',2024-10-24 01:17:06
12678,705615,6,44035570,73',Marcus Steffen (Vitesse) Substitution at 73',2024-10-24 01:17:06
12678,705615,7,44035571,73',Gyan De Regt (Vitesse) Substitution at 73',2024-10-24 01:17:06
12678,705615,8,44035763,81',Lorenzo Codutti (FC Dordrecht) Substitution at 81',2024-11-19 18:40:05
12678,705615,9,44035734,82',Joseph Amuzu (FC Dordrecht) Substitution at 82',2024-11-19 18:40:05
12678,705615,10,44035829,87',Jop van den Avert (FC Dordrecht) Substitution at 87',2024-10-24 01:17:06
12678,705615,11,44035830,88',Miliano Jonathans (Vitesse) Goal at 88',2024-10-24 01:17:06
12678,705615,12,44035953,90'+4',Angelos Tsigaras (Vitesse) Yellow Card at 94',2024-10-24 01:17:06
12678,705615,13,44036003,90'+5',Alexander Büttner (Vitesse) Yellow Card at 95',2024-10-24 01:17:06
12678,705615,14,44035966,90'+6',Jari Schuurman (FC Dordrecht) Yellow Card at 96',2024-10-24 01:17:06
12678,705615,15,44035967,90'+6',Loek Postma (Vitesse) Yellow Card at 96',2024-10-24 01:17:06
12678,705615,16,44036004,90'+7',Gyan De Regt (Vitesse) Yellow Card at 97',2024-10-24 01:17:06
12678,705615,17,44036005,90'+7',Bas Huisman (Vitesse) Yellow Card at 97',2024-10-24 01:17:06
12678,705615,18,44036016,90'+8',Lorenzo Codutti (FC Dordrecht) Goal at 98',2024-10-24 01:17:06
12678,705616,0,44034151,23',Djenahro Nunumete (FC Emmen) Goal at 23',2024-10-22 23:22:46
12678,705616,1,44034187,31',Thomas Cox (TOP Oss) Substitution at 31',2024-11-19 18:40:05
12678,705616,2,44034211,38',Julian Kuijpers (TOP Oss) Yellow Card at 38',2024-11-19 18:40:05
12678,705616,3,44034218,40',Joshua Zimmerman (TOP Oss) Yellow Card at 40',2024-10-22 23:22:46
12678,705616,4,44034220,41',Jalen Hawkins (FC Emmen) Yellow Card at 41',2024-10-22 23:22:46
12678,705616,5,44034254,45',Thomas Cox (TOP Oss) Yellow Card at 45',2024-10-22 23:22:46
12678,705616,6,44034593,47',Tom Van Der Werff (TOP Oss) Yellow Card at 47',2024-10-22 23:22:46
12678,705616,7,44035174,60',Robin Schouten (FC Emmen) Substitution at 60',2024-11-19 18:40:05
12678,705616,8,44035197,61',Tim Geypens (FC Emmen) Substitution at 61',2024-10-22 23:22:46
12678,705616,9,44035198,61',Freddy Quispel (FC Emmen) Substitution at 61',2024-10-22 23:22:46
12678,705616,10,44035322,64',Mauresmo Hinoke (TOP Oss) Substitution at 64',2024-10-22 23:22:46
12678,705616,11,44035323,64',Jonathan Mulder (TOP Oss) Substitution at 64',2024-10-22 23:22:46
12678,705616,12,44035324,64',Sven Zitman (TOP Oss) Substitution at 64',2024-10-22 23:22:46
12678,705616,13,44035325,65',Joshua Zimmerman (TOP Oss) Red Card at 65',2024-10-22 23:22:46
12678,705616,14,44035564,73',Michael Martin (FC Emmen) Substitution at 73',2024-10-24 01:17:06
12678,705616,15,44035753,83',Abel Stensrud (TOP Oss) Substitution at 83',2024-10-24 01:17:06
12678,705616,16,44035760,85',Kelian Nsona Wa Saka (FC Emmen) Penalty - Scored at 85',2024-10-24 01:17:06
12678,705616,17,44035821,86',Dennis Vos (FC Emmen) Substitution at 86',2024-10-24 01:17:06
12678,705617,0,44034057,5',Byron Burgering (FC Den Bosch) Goal at 5',2024-10-22 23:22:46
12678,705617,1,44034063,7',Brandley Kuwas (FC Volendam) Goal at 7',2024-10-22 23:22:46
12678,705617,2,44034173,35',Nick De Groot (FC Den Bosch) Goal at 35',2024-10-22 23:22:46
12678,705617,3,44035004,59',Xavier Mbuyamba (FC Volendam) Goal at 59',2024-10-22 23:22:46
12678,705617,4,44035162,64',Hicham Acheffay (FC Den Bosch) Substitution at 64',2024-10-22 23:22:46
12678,705617,5,44035462,73',Danny Verbeek (FC Den Bosch) Substitution at 73',2024-10-24 01:17:06
12678,705617,6,44035463,73',Sheddy Barglan (FC Den Bosch) Substitution at 73',2024-10-24 01:17:06
12678,705617,7,44035563,76',Aurelio Oehlers (FC Volendam) Substitution at 76',2024-10-24 01:17:06
12678,705617,8,44035657,81',Elvis Manu (FC Volendam) Substitution at 81',2024-10-24 01:17:06
12678,705617,9,44035710,84',Elvis Manu (FC Volendam) Goal at 84',2024-10-24 01:17:06
12678,705617,10,44035818,88',Rein Van Hedel (FC Den Bosch) Substitution at 88',2024-10-24 01:17:06
12678,705617,11,44035863,88',Ilias Boumassaoudi (FC Den Bosch) Substitution at 88',2024-10-24 01:17:06
12678,705617,12,44035819,89',Nordin Bukala (FC Volendam) Substitution at 89',2024-10-24 01:17:06
12678,705618,0,44030855,22',Axl Van Himbeeck (Helmond Sport) Yellow Card at 22',2024-10-22 23:22:46
12678,705618,1,44030929,45',Lennerd Daneels (Helmond Sport) Goal at 45',2024-10-22 23:22:46
12678,705618,2,44030987,45',Bryan Van Hove (Helmond Sport) Substitution at 45',2024-10-22 23:22:46
12678,705618,3,44031078,54',Patriot Sejdiu (Roda JC Kerkrade) Goal at 54',2024-10-22 23:22:46
12678,705618,4,44031132,59',Thibo Baeten (Roda JC Kerkrade) Yellow Card at 59',2024-10-22 23:22:46
12678,705618,5,44031156,61',Dario Sits (Helmond Sport) Substitution at 61',2024-10-22 23:22:46
12678,705618,6,44031157,61',Justin Ogenia (Helmond Sport) Substitution at 61',2024-10-22 23:22:46
12678,705618,7,44031173,63',Joshua Schwirten (Roda JC Kerkrade) Substitution at 63',2024-10-22 23:22:46
12678,705618,8,44031252,71',Justin Ogenia (Helmond Sport) Goal at 71',2024-10-22 23:22:46
12678,705618,9,44031268,72',Helgi Ingason (Helmond Sport) Substitution at 72',2024-10-22 23:22:46
12678,705618,10,44031329,80',Saydou Bangura (Roda JC Kerkrade) Substitution at 80',2024-10-22 23:22:46
12678,705618,11,44031379,85',Enrique Peña Zauner (Roda JC Kerkrade) Substitution at 85',2024-10-22 23:22:46
12678,705618,12,44031419,90',Mohammed Mallahi (Helmond Sport) Substitution at 90',2024-10-22 23:22:46
12678,705619,0,44030791,8',Gerald Alders (Jong Ajax) Yellow Card at 8',2024-10-22 23:22:46
12678,705619,1,44030814,10',Jari Vlak (ADO Den Haag) Yellow Card at 10',2024-10-22 23:22:46
12678,705619,2,44030880,31',Steven van der Sloot (ADO Den Haag) Red Card at 31',2024-10-22 23:22:46
12678,705619,3,44031013,45',Diyae-Edinne Jermoumi (Jong Ajax) Substitution at 45',2024-10-22 23:22:46
12678,705619,4,44031043,45',David Kalokoh (Jong Ajax) Substitution at 45',2024-10-22 23:22:46
12678,705619,5,44031134,56',Ronny Boakye (ADO Den Haag) Substitution at 56',2024-10-22 23:22:46
12678,705619,6,44031223,64',Kayden Wolff (Jong Ajax) Substitution at 64',2024-10-22 23:22:46
12678,705619,7,44031312,72',Rico Speksnijder (Jong Ajax) Substitution at 72',2024-10-22 23:22:46
12678,705619,8,44031313,74',Finn De Bruin (ADO Den Haag) Substitution at 74',2024-10-22 23:22:46
12678,705619,9,44031381,82',Nick Verschuren (Jong Ajax) Substitution at 82',2024-10-22 23:22:46
12678,705619,10,44031407,85',Kilian Nikiema (ADO Den Haag) Yellow Card at 85',2024-10-22 23:22:46
12678,705619,11,44031417,87',Diogo Tomas (ADO Den Haag) Yellow Card at 87',2024-10-22 23:22:46
12678,705619,12,44031418,88',Dies Janse (Jong Ajax) Yellow Card at 88',2024-10-22 23:22:46
12678,705619,13,44031455,90'+4',Kürsad Sürmeli (ADO Den Haag) Substitution at 94',2024-10-22 23:22:46
12678,705620,0,44034081,9',Elijah Dijkstra (Jong AZ) Goal at 9',2024-10-22 23:22:46
12678,705620,1,44034562,45',Sofiane Dris (Jong FC Utrecht) Substitution at 45',2024-10-22 23:22:46
12678,705620,2,44035234,64',Mathijs Menu (Jong AZ) Substitution at 64',2024-10-22 23:22:46
12678,705620,3,44035235,64',Adam Ait Ali Oulhaj (Jong AZ) Substitution at 64',2024-10-22 23:22:46
12678,705620,4,44035285,66',Neal Viereck (Jong FC Utrecht) Yellow Card at 66',2024-10-22 23:22:46
12678,705620,5,44035518,74',Anthony Smits (Jong AZ) Substitution at 74',2024-10-24 01:17:06
12678,705620,6,44035519,74',Emil Schlichting (Jong FC Utrecht) Substitution at 74',2024-10-24 01:17:06
12678,705620,7,44035673,81',Jurre Van Aken (Jong AZ) Substitution at 81',2024-10-24 01:17:06
12678,705620,8,44035767,86',Mees Akkerman (Jong FC Utrecht) Substitution at 86',2024-10-24 01:17:06
12678,705620,9,44035768,87',Georgios Charalampoglou (Jong FC Utrecht) Substitution at 87',2024-10-24 01:17:06
12678,705620,10,44035869,87',Noa Dundas (Jong FC Utrecht) Substitution at 87',2024-10-24 01:17:06
12678,705621,0,44030790,9',Noah Naujoks (Excelsior) Goal at 9',2024-10-22 23:22:46
12678,705621,1,44030820,13',Noah Naujoks (Excelsior) Goal at 13',2024-10-22 23:22:46
12678,705621,2,44030849,23',Seydou Fini (Excelsior) Goal at 23',2024-10-22 23:22:46
12678,705621,3,44030993,45',Jordy Bawuah (Jong PSV) Substitution at 45',2024-10-22 23:22:46
12678,705621,4,44030994,45',Muhlis Dagasan (Jong PSV) Substitution at 45',2024-10-22 23:22:46
12678,705621,5,44031074,56',Calvin Raatsie (Excelsior) Yellow Card at 56',2024-10-22 23:22:46
12678,705621,6,44031106,58',Madi Monamay (Jong PSV) Yellow Card at 58',2024-10-22 23:22:46
12678,705621,7,44031146,60',Mike van Duinen (Excelsior) Substitution at 60',2024-10-22 23:22:46
12678,705621,8,44031147,61',Jamal Gonzaga (Jong PSV) Substitution at 61',2024-10-22 23:22:46
12678,705621,9,44031148,61',Ilias Bronkhorst (Excelsior) Substitution at 61',2024-10-22 23:22:46
12678,705621,10,44031149,61',Dantaye Gilbert (Jong PSV) Substitution at 61',2024-10-22 23:22:46
12678,705621,11,44031208,69',Wessel Kuhn (Jong PSV) Yellow Card at 69',2024-10-22 23:22:46
12678,705621,12,44031222,69',Jacky Donkor (Excelsior) Substitution at 69',2024-10-22 23:22:46
12678,705621,13,44031248,69',Joshua Eijgenraam (Excelsior) Substitution at 69',2024-10-22 23:22:46
12678,705621,14,44031303,77',Seb Loeffen (Excelsior) Substitution at 77',2024-10-22 23:22:46
12678,705621,15,44031307,80',Jesper Uneken (Jong PSV) Goal at 80',2024-10-22 23:22:46
12678,705621,16,44031346,81',Nicolas Verkooijen (Jong PSV) Substitution at 81',2024-10-22 23:22:46
12678,705621,17,44031347,83',Joel Ndala (Jong PSV) Yellow Card at 83',2024-10-22 23:22:46
12678,705621,18,44031373,83',Casper Widell (Excelsior) Yellow Card at 83',2024-10-22 23:22:46
12678,705621,19,44041991,88',Jamal Gonzaga (Jong PSV) Yellow Card at 88',2024-10-25 05:18:47
12678,705621,20,44031433,90'+3',Seb Loeffen (Excelsior) Yellow Card at 93',2024-10-22 23:22:46
12678,705622,0,44030796,11',Remco Balk (SC Cambuur) Goal at 11',2024-10-22 23:22:46
12678,705622,1,44030851,24',Michael de Leeuw (SC Cambuur) Yellow Card at 24',2024-10-22 23:22:46
12678,705622,2,44031025,52',Michael de Leeuw (SC Cambuur) Penalty - Scored at 52',2024-10-22 23:22:46
12678,705622,3,44031079,56',Evan Rottier (FC Eindhoven) Substitution at 56',2024-10-22 23:22:46
12678,705622,4,44031080,56',Achraf El Bouchataoui (FC Eindhoven) Substitution at 56',2024-10-22 23:22:46
12678,705622,5,44031081,57',Joey Sleegers (FC Eindhoven) Substitution at 57',2024-10-22 23:22:46
12678,705622,6,44031180,66',Nicky Souren (SC Cambuur) Substitution at 66',2024-10-22 23:22:46
12678,705622,7,44031181,66',Jonathan Afolabi (SC Cambuur) Substitution at 66',2024-10-22 23:22:46
12678,705622,8,44033934,68',Achraf El Bouchataoui (FC Eindhoven) Yellow Card at 68',2024-10-24 01:17:06
12678,705622,9,44031225,71',Fedde de Jong (SC Cambuur) Substitution at 71',2024-10-24 01:17:06
12678,705622,10,44031276,78',Remco Balk (SC Cambuur) Yellow Card at 78',2024-10-24 01:17:06
12678,705622,11,44031292,80',Tibo Persyn (FC Eindhoven) Substitution at 80',2024-10-24 01:17:06
12678,705622,12,44031333,82',Sturla Ottesen (SC Cambuur) Substitution at 82',2024-10-24 01:17:06
12678,705622,13,44031334,82',Maikel Kieftenbeld (SC Cambuur) Substitution at 82',2024-10-24 01:17:06
12678,705622,14,44031378,87',Hugo Deenen (FC Eindhoven) Substitution at 87',2024-10-24 01:17:06
12678,705622,15,44031404,90'+2',Daan Huisman (FC Eindhoven) Yellow Card at 92',2024-10-24 01:17:06
12678,705623,0,44057736,10',Ronny Boakye (ADO Den Haag) Yellow Card at 10',2024-10-26 13:53:28
12678,705623,1,44057737,12',Rio Hillen (De Graafschap) Goal at 12',2024-10-26 13:53:28
12678,705623,2,44057864,23',Lee Bonis (ADO Den Haag) Penalty - Scored at 23',2024-10-26 13:53:28
12678,705623,3,44058019,23',Jesse Van De Haar (De Graafschap) Yellow Card at 23',2024-10-26 13:53:28
12678,705623,4,44057952,31',Rowan Besselink (De Graafschap) Yellow Card at 31',2024-10-26 13:53:28
12678,705623,5,44058418,45',Silvinho Esajas (ADO Den Haag) Substitution at 45',2024-10-26 13:53:28
12678,705623,6,44058919,62',Joel Ideho (ADO Den Haag) Yellow Card at 62',2024-10-26 13:53:28
12678,705623,7,44059025,66',Lasse Vigen Christensen (ADO Den Haag) Substitution at 66',2024-10-26 13:53:28
12678,705623,8,44059170,71',Mimoun Mahi (De Graafschap) Substitution at 71',2024-10-26 13:53:28
12678,705623,9,44059194,73',Jesse Van De Haar (De Graafschap) Goal at 73',2024-10-26 13:53:28
12678,705623,10,44059326,74',Lorenzo Maasland (ADO Den Haag) Substitution at 74',2024-10-26 13:53:28
12678,705623,11,44059550,86',Youssef El Jebli (De Graafschap) Substitution at 86',2024-10-26 13:53:28
12678,705623,12,44059605,86',Denzel Eijken (De Graafschap) Substitution at 86',2024-10-26 13:53:28
12678,705623,13,44059551,87',Dano Lourens (ADO Den Haag) Substitution at 87',2024-10-26 13:53:28
12678,705623,14,44059658,90'+1',Jeffry Fortes (De Graafschap) Substitution at 91',2024-10-26 13:53:28
12678,705624,0,44057915,28',Törles Knöll (FC Den Bosch) Yellow Card at 28',2024-10-26 13:53:28
12678,705624,1,44058012,36',Stan Hendrikx (FC Den Bosch) Yellow Card at 36',2024-10-26 13:53:28
12678,705624,2,44058064,41',Mikulás Bakala (FC Den Bosch) Goal at 41',2024-10-26 13:53:28
12678,705624,3,44058595,51',Tim Braem (VVV-Venlo) Yellow Card at 51',2024-10-26 13:53:28
12678,705624,4,44058870,61',Danzell Gravenberch (FC Den Bosch) Substitution at 61',2024-10-26 13:53:28
12678,705624,5,44058876,63',Rik Mulders (FC Den Bosch) Goal at 63',2024-10-26 13:53:28
12678,705624,6,44059058,67',Pepijn Doesburg (VVV-Venlo) Substitution at 67',2024-10-26 13:53:28
12678,705624,7,44059059,67',Martijn Berden (VVV-Venlo) Substitution at 67',2024-10-26 13:53:28
12678,705624,8,44059092,70',Diego Van Zutphen (VVV-Venlo) Yellow Card at 70',2024-10-26 13:53:28
12678,705624,9,44059143,71',Yahcuroo Roemer (VVV-Venlo) Substitution at 71',2024-10-26 13:53:28
12678,705624,10,44059213,73',Mikulás Bakala (FC Den Bosch) Yellow Card at 73',2024-10-26 13:53:28
12678,705624,11,44059214,74',Danny Verbeek (FC Den Bosch) Substitution at 74',2024-10-26 13:53:28
12678,705624,12,44059215,74',Rein Van Hedel (FC Den Bosch) Substitution at 74',2024-10-26 13:53:28
12678,705624,13,44059282,76',Paul Pöpperl (VVV-Venlo) Substitution at 76',2024-10-26 13:53:28
12678,705624,14,44059283,76',Yousri El Anbri (VVV-Venlo) Substitution at 76',2024-10-26 13:53:28
12678,705624,15,44059417,83',Gabin Blancquart (VVV-Venlo) Goal at 83',2024-10-26 13:53:28
12678,705624,16,44059493,85',Sheddy Barglan (FC Den Bosch) Substitution at 85',2024-10-26 13:53:28
12678,705624,17,44059620,90'+2',Danny Verbeek (FC Den Bosch) Yellow Card at 92',2024-10-26 13:53:28
12678,705625,0,44057662,7',Tai Abed (Jong PSV) Goal at 7',2024-10-26 13:53:28
12678,705625,1,44057903,29',Emmanuel Van De Blaak (Jong PSV) Substitution at 29',2024-10-26 13:53:28
12678,705625,2,44058068,42',Joel Ndala (Jong PSV) Yellow Card at 42',2024-10-26 13:53:28
12678,705625,3,44058069,43',Joel Ndala (Jong PSV) Goal at 43',2024-10-26 13:53:28
12678,705625,4,44058102,45',Miliano Jonathans (Vitesse) Goal at 45',2024-10-26 13:53:28
12678,705625,5,44058397,45',Andy Visser (Vitesse) Substitution at 45',2024-10-26 13:53:28
12678,705625,6,44058543,53',Theodosis Macheras (Vitesse) Yellow Card at 53',2024-10-26 13:53:28
12678,705625,7,44058597,54',Gyan De Regt (Vitesse) Substitution at 54',2024-10-26 13:53:28
12678,705625,8,44058598,54',Irakli Yegoian (Vitesse) Substitution at 54',2024-10-26 13:53:28
12678,705625,9,44058908,64',Justin Bakker (Vitesse) Yellow Card at 64',2024-10-26 13:53:28
12678,705625,10,44058933,66',Dantaye Gilbert (Jong PSV) Substitution at 66',2024-10-26 13:53:28
12678,705625,11,44058934,66',Tim Van Den Heuvel (Jong PSV) Substitution at 66',2024-10-26 13:53:28
12678,705625,12,44059168,73',Mats Egbring (Vitesse) Yellow Card at 73',2024-10-26 13:53:28
12678,705625,13,44059201,76',Dantaye Gilbert (Jong PSV) Goal at 76',2024-10-26 13:53:28
12678,705625,14,44062900,77',Irakli Yegoian (Vitesse) Yellow Card at 77',2024-10-27 05:19:50
12678,705625,15,44062901,77',Dantaye Gilbert (Jong PSV) Yellow Card at 77',2024-10-27 05:19:50
12678,705625,16,44059306,80',Enzo Cornelisse (Vitesse) Substitution at 80',2024-10-27 05:19:50
12678,705625,17,44059307,80',Bas Huisman (Vitesse) Substitution at 80',2024-10-27 05:19:50
12678,705625,18,44059659,87',Jevon Simons (Jong PSV) Substitution at 87',2024-10-27 05:19:50
12678,705625,19,44059523,89',Emmanuel Van De Blaak (Jong PSV) Yellow Card at 89',2024-10-27 05:19:50
12678,705625,20,44059704,90'+6',Jesper Uneken (Jong PSV) Yellow Card at 96',2024-10-27 05:19:50
12678,705626,0,44058030,37',Jaden Slory (FC Dordrecht) Goal at 37',2024-10-26 13:53:28
12678,705626,1,44058372,46',Rocco Robert Shein (FC Dordrecht) Goal at 46',2024-10-29 05:21:26
12678,705626,2,44058664,58',Rocco Robert Shein (FC Dordrecht) Goal at 58',2024-10-26 13:53:28
12678,705626,3,44058781,59',Joseph Amuzu (FC Dordrecht) Substitution at 59',2024-10-26 13:53:28
12678,705626,4,44058782,60',Gabriele Parlanti (FC Dordrecht) Substitution at 60',2024-10-26 13:53:28
12678,705626,5,44058873,64',Lynden Edhart (Jong FC Utrecht) Substitution at 64',2024-10-26 13:53:28
12678,705626,6,44058874,64',Noa Dundas (Jong FC Utrecht) Substitution at 64',2024-10-26 13:53:28
12678,705626,7,44058900,64',Sofiane Dris (Jong FC Utrecht) Substitution at 64',2024-10-26 13:53:28
12678,705626,8,44058956,68',Mees Akkerman (Jong FC Utrecht) Yellow Card at 68',2024-10-26 13:53:28
12678,705626,9,44059064,69',Georgios Charalampoglou (Jong FC Utrecht) Substitution at 69',2024-10-26 13:53:28
12678,705626,10,44059065,69',Reda Akmum (FC Dordrecht) Substitution at 69',2024-10-26 13:53:28
12678,705626,11,44059066,70',Jayson Ezeb (FC Dordrecht) Substitution at 70',2024-10-26 13:53:28
12678,705626,12,44059246,78',Igor (FC Dordrecht) Substitution at 78',2024-10-26 13:53:28
12678,705626,13,44059351,84',Lynden Edhart (Jong FC Utrecht) Penalty - Scored at 84',2024-10-26 13:53:28
12678,705627,0,44077658,43',Tyrese Noslin (Telstar) Goal at 43',2024-10-28 05:21:06
12678,705627,1,44077705,45',Remi Van Ekeris (Telstar) Substitution at 45',2024-10-28 05:21:06
12678,705627,2,44077718,58',Dennis Vos (FC Emmen) Yellow Card at 58',2024-10-28 05:21:06
12678,705627,3,44077758,65',Freddy Quispel (FC Emmen) Substitution at 65',2024-10-28 05:21:06
12678,705627,4,44077759,65',Agon Sadiku (FC Emmen) Substitution at 65',2024-10-28 05:21:06
12678,705627,5,44077829,75',Tyrone Owusu (Telstar) Substitution at 75',2024-10-28 05:21:06
12678,705627,6,44077841,78',Tim Geypens (FC Emmen) Substitution at 78',2024-10-28 05:21:06
12678,705627,7,44077860,83',Franck Evina (FC Emmen) Substitution at 83',2024-10-28 05:21:06
12678,705627,8,44077875,84',Fridolin Wagner (FC Emmen) Yellow Card at 84',2024-10-28 05:21:06
12678,705627,9,44077891,86',Jayden Turfkruier (Telstar) Substitution at 86',2024-10-28 05:21:06
12678,705627,10,44077892,86',Jayden Turfkruier (Telstar) Yellow Card at 86',2024-10-28 05:21:06
12678,705627,11,44077921,89',Torben Rhein (FC Emmen) Yellow Card at 89',2024-10-28 05:21:06
12678,705627,12,44077954,90'+4',Sebastiaan Hagedoorn (Telstar) Substitution at 94',2024-11-20 18:34:51
12678,705627,13,44079259,90'+5',Adrian Rogulj (FC Emmen) Substitution at 95',2024-10-28 05:21:06
12678,705628,0,44057641,3',Xavier Mbuyamba (FC Volendam) Goal at 3',2024-10-26 13:53:28
12678,705628,1,44057733,12',Alex Plat (FC Volendam) Goal at 12',2024-10-26 13:53:28
12678,705628,2,44057750,14',Sven Simons (FC Eindhoven) Goal at 14',2024-10-26 13:53:28
12678,705628,3,44057884,26',Henk Veerman (FC Volendam) Goal at 26',2024-10-26 13:53:28
12678,705628,4,44058536,53',Deron Payne (FC Volendam) Goal at 53',2024-10-26 13:53:28
12678,705628,5,44058729,58',Tibo Persyn (FC Eindhoven) Substitution at 58',2024-10-26 13:53:28
12678,705628,6,44058730,58',Julian Kwaaitaal (FC Eindhoven) Substitution at 58',2024-10-26 13:53:28
12678,705628,7,44058731,58',Joey Sleegers (FC Eindhoven) Substitution at 58',2024-10-26 13:53:28
12678,705628,8,44058931,65',Nordin Bukala (FC Volendam) Substitution at 65',2024-10-26 13:53:28
12678,705628,9,44058932,65',Achraf El Bouchataoui (FC Eindhoven) Substitution at 65',2024-10-26 13:53:28
12678,705628,10,44059235,76',Elvis Manu (FC Volendam) Substitution at 76',2024-11-20 18:34:51
12678,705628,11,44059383,83',Luca Blondeau (FC Volendam) Substitution at 83',2024-10-26 13:53:28
12678,705628,12,44059384,83',Aurelio Oehlers (FC Volendam) Substitution at 83',2024-10-26 13:53:28
12678,705628,13,44059452,84',Farouq Limouri (FC Eindhoven) Yellow Card at 84',2024-10-26 13:53:28
12678,705628,14,44059484,87',Hugo Deenen (FC Eindhoven) Substitution at 87',2024-10-26 13:53:28
12678,705629,0,44057793,14',Orhan Džepar (Roda JC Kerkrade) Goal at 14',2024-10-26 13:53:28
12678,705629,1,44058462,49',Aaron Bouwman (Jong Ajax) Own Goal at 49',2024-10-26 13:53:28
12678,705629,2,44058851,60',Precious Ugwu (Jong Ajax) Substitution at 60',2024-10-26 13:53:28
12678,705629,3,44058852,60',Diyae-Edinne Jermoumi (Jong Ajax) Substitution at 60',2024-10-26 13:53:28
12678,705629,4,44058853,60',David Kalokoh (Jong Ajax) Substitution at 60',2024-10-26 13:53:28
12678,705629,5,44058910,63',Nassef Chourak (Jong Ajax) Goal at 63',2024-10-26 13:53:28
12678,705629,6,44058918,64',Joshua Schwirten (Roda JC Kerkrade) Substitution at 64',2024-10-26 13:53:28
12678,705629,7,44058955,64',Enrique Peña Zauner (Roda JC Kerkrade) Substitution at 64',2024-10-26 13:53:28
12678,705629,8,44059114,70',Iman Griffith (Roda JC Kerkrade) Substitution at 70',2024-10-26 13:53:28
12678,705629,9,44059115,70',Julian Brandes (Jong Ajax) Substitution at 70',2024-10-26 13:53:28
12678,705629,10,44059361,81',Tiago Cukur (Roda JC Kerkrade) Penalty - Saved at 81',2024-11-20 18:34:51
12678,705629,11,44059456,83',Rida Chahid (Jong Ajax) Substitution at 83',2024-10-26 13:53:28
12678,705630,0,44058080,41',Karim Loukili (TOP Oss) Yellow Card at 41',2024-10-26 13:53:28
12678,705630,1,44058075,43',Ro-Zangelo Daal (Jong AZ) Penalty - Scored at 43',2024-10-26 13:53:28
12678,705630,2,44058667,57',Thomas Cox (TOP Oss) Yellow Card at 57',2024-10-26 13:53:28
12678,705630,3,44058793,60',Adam Ait Ali Oulhaj (Jong AZ) Substitution at 60',2024-10-26 13:53:28
12678,705630,4,44058794,60',Misha Engel (Jong AZ) Substitution at 60',2024-10-26 13:53:28
12678,705630,5,44058802,60',Joeri Oud (Jong AZ) Substitution at 60',2024-10-26 13:53:28
12678,705630,6,44058795,61',Abel Stensrud (TOP Oss) Goal at 61',2024-10-26 13:53:28
12678,705630,7,44058862,62',Tijmen Wildeboer (TOP Oss) Substitution at 62',2024-10-26 13:53:28
12678,705630,8,44058896,62',Sven Zitman (TOP Oss) Substitution at 62',2024-10-26 13:53:28
12678,705630,9,44059049,68',Ilias Splinter (Jong AZ) Substitution at 68',2024-10-26 13:53:28
12678,705630,10,44059078,71',Marcelencio Esajas (TOP Oss) Yellow Card at 71',2024-10-26 13:53:28
12678,705630,11,44059162,73',Sem Dekkers (Jong AZ) Substitution at 73',2024-10-26 13:53:28
12678,705630,12,44059342,79',Tom Van Der Werff (TOP Oss) Substitution at 79',2024-10-26 13:53:28
12678,705630,13,44059343,82',Jeremiah Esajas (Jong AZ) Substitution at 82',2024-10-26 13:53:28
12678,705630,14,44059344,83',Tijmen Wildeboer (TOP Oss) Goal at 83',2024-10-26 13:53:28
12678,705630,15,44059509,86',Jules Van Bost (TOP Oss) Substitution at 86',2024-10-26 13:53:28
12678,705630,16,44059618,90'+1',Calvin Mac-Intosch (TOP Oss) Substitution at 91',2024-10-26 13:53:28
12678,705631,0,44066506,35',Remco Balk (SC Cambuur) Goal at 35',2024-10-27 05:19:50
12678,705631,1,44067821,45',Jonathan Afolabi (SC Cambuur) Substitution at 45',2024-10-27 05:19:50
12678,705631,2,44068414,56',Maikel Kieftenbeld (SC Cambuur) Substitution at 56',2024-11-20 18:34:51
12678,705631,3,44068415,57',Casper Widell (Excelsior) Yellow Card at 57',2024-10-27 05:19:50
12678,705631,4,44068664,61',Serano Seymor (Excelsior) Substitution at 61',2024-10-27 05:19:50
12678,705631,5,44068793,64',Nicky Souren (SC Cambuur) Substitution at 64',2024-11-20 18:34:51
12678,705631,6,44068794,65',Ilias Bronkhorst (Excelsior) Yellow Card at 65',2024-10-27 05:19:50
12678,705631,7,44068917,70',Jacky Donkor (Excelsior) Substitution at 70',2024-10-27 05:19:50
