seasonType,eventId,playOrder,playId,typeId,text,shortText,period,clockValue,clockDisplayValue,teamId,scoringPlay,shootout,wallclock,goalPositionX,goalPositionY,fieldpositionX,fieldPositionY,fieldPosition2X,fieldPosition2Y,athleteId,participant,updateDateTime
12880,719977,8,44319534,70,Sunil Chhetri (Bengaluru FC) Goal at 52',Sunil Chhetri Goal,2,3120,52',18851,0,0,1980-01-01,0.0,0.0,0.0,0.0,0.0,0.0,111682.0,Sunil Chhetri,2024-12-03 06:02:17
12880,719977,9,44319699,70,Diego Maurício (Odisha FC) Goal at 60',Diego Maurício Goal,2,3600,60',17998,0,0,1980-01-01,0.0,0.0,0.0,0.0,0.0,0.0,148126.0,Diego Maurício,2024-12-03 06:02:17
12880,719977,10,44319824,76,Rahim Ali (Odisha FC) Substitution at 64',Rahim Ali Substitution,2,3840,64',17998,0,0,1980-01-01,0.0,0.0,0.0,0.0,0.0,0.0,266618.0,Rahim Ali,2024-12-03 06:02:17
12880,719977,11,44319825,76,Saviour Gama (Odisha FC) Substitution at 64',Saviour Gama Substitution,2,3840,64',17998,0,0,1980-01-01,0.0,0.0,0.0,0.0,0.0,0.0,281347.0,Saviour Gama,2024-12-03 06:02:17
12880,719977,10,44319824,76,Rahim Ali (Odisha FC) Substitution at 64',Rahim Ali Substitution,2,3840,64',17998,0,0,1980-01-01,0.0,0.0,0.0,0.0,0.0,0.0,245816.0,Jerry Mawihmingthanga,2024-12-03 06:02:17
12880,719977,11,44319825,76,Saviour Gama (Odisha FC) Substitution at 64',Saviour Gama Substitution,2,3840,64',17998,0,0,1980-01-01,0.0,0.0,0.0,0.0,0.0,0.0,245250.0,Jerry Lalrinzuala,2024-12-03 06:02:17
12880,719977,12,44319965,76,Carlos Delgado (Odisha FC) Substitution at 70',Carlos Delgado Substitution,2,4200,70',17998,0,0,1980-01-01,0.0,0.0,0.0,0.0,0.0,0.0,155725.0,Carlos Delgado,2024-12-03 06:02:17
12880,719977,12,44319965,76,Carlos Delgado (Odisha FC) Substitution at 70',Carlos Delgado Substitution,2,4200,70',17998,0,0,1980-01-01,0.0,0.0,0.0,0.0,0.0,0.0,212550.0,Hugo Boumous,2024-12-03 06:02:17
12880,719977,13,44320139,76,Harsh Patre (Bengaluru FC) Substitution at 81',Harsh Patre Substitution,2,4860,81',18851,0,0,1980-01-01,0.0,0.0,0.0,0.0,0.0,0.0,311670.0,Harsh Patre,2024-12-03 06:02:17
12880,719977,13,44320139,76,Harsh Patre (Bengaluru FC) Substitution at 81',Harsh Patre Substitution,2,4860,81',18851,0,0,1980-01-01,0.0,0.0,0.0,0.0,0.0,0.0,157709.0,Alberto Noguera,2024-12-03 06:02:17
12880,719977,14,44320265,70,Édgar Méndez (Bengaluru FC) Goal at 88',Édgar Méndez Goal,2,5280,88',18851,0,0,1980-01-01,0.0,0.0,0.0,0.0,0.0,0.0,180751.0,Édgar Méndez,2024-12-03 06:02:17
12880,719977,15,44320300,76,Raynier Fernandes (Odisha FC) Substitution at 90',Raynier Fernandes Substitution,2,5400,90',17998,0,0,1980-01-01,0.0,0.0,0.0,0.0,0.0,0.0,268285.0,Raynier Fernandes,2024-12-03 06:02:17
12880,719977,16,44320301,76,Ashangbam Aphaoba Singh (Odisha FC) Substitution at 90',Ashangbam Aphaoba Singh Substitu,2,5400,90',17998,0,0,1980-01-01,0.0,0.0,0.0,0.0,0.0,0.0,311728.0,Ashangbam Aphaoba Singh,2024-12-03 06:02:17
12880,719977,15,44320300,76,Raynier Fernandes (Odisha FC) Substitution at 90',Raynier Fernandes Substitution,2,5400,90',17998,0,0,1980-01-01,0.0,0.0,0.0,0.0,0.0,0.0,268517.0,Puitea,2024-12-03 06:02:17
12880,719977,16,44320301,76,Ashangbam Aphaoba Singh (Odisha FC) Substitution at 90',Ashangbam Aphaoba Singh Substitu,2,5400,90',17998,0,0,1980-01-01,0.0,0.0,0.0,0.0,0.0,0.0,282487.0,Isak Vanlalruatfela,2024-12-03 06:02:17
12880,719978,1,44326645,94,Kiyam Amarjit Singh (Mohammedan SC) Yellow Card at 11',Kiyam Amarjit Singh Yellow Card,1,660,11',20842,0,0,1980-01-01,0.0,0.0,0.0,0.0,0.0,0.0,266619.0,Kiyam Amarjit Singh,2024-12-03 06:02:17
12880,719978,2,44326708,76,Joseph Adjei (Mohammedan SC) Substitution at 38',Joseph Adjei Substitution,1,2280,38',20842,0,0,1980-01-01,0.0,0.0,0.0,0.0,0.0,0.0,219311.0,Joseph Adjei,2024-12-03 06:02:17
12880,719978,2,44326708,76,Joseph Adjei (Mohammedan SC) Substitution at 38',Joseph Adjei Substitution,1,2280,38',20842,0,0,1980-01-01,0.0,0.0,0.0,0.0,0.0,0.0,268382.0,Gaurav Bora,2024-12-03 06:02:17
12880,719978,3,44326739,94,Ashutosh Mehta (Jamshedpur FC) Yellow Card at 47',Ashutosh Mehta Yellow Card,2,2820,47',18850,0,0,1980-01-01,0.0,0.0,0.0,0.0,0.0,0.0,227953.0,Ashutosh Mehta,2024-12-03 06:02:17
12880,719978,4,44326745,76,Shubham Sarangi (Jamshedpur FC) Substitution at 52',Shubham Sarangi Substitution,2,3120,52',18850,0,0,1980-01-01,0.0,0.0,0.0,0.0,0.0,0.0,269338.0,Shubham Sarangi,2024-12-03 06:02:17
12880,719978,4,44326745,76,Shubham Sarangi (Jamshedpur FC) Substitution at 52',Shubham Sarangi Substitution,2,3120,52',18850,0,0,1980-01-01,0.0,0.0,0.0,0.0,0.0,0.0,227953.0,Ashutosh Mehta,2024-12-03 06:02:17
12880,719978,5,44326746,70,Mohammed Sanan K (Jamshedpur FC) Goal at 53',Mohammed Sanan K Goal,2,3180,53',18850,0,0,1980-01-01,0.0,0.0,0.0,0.0,0.0,0.0,370233.0,Mohammed Sanan K,2024-12-03 06:02:17
12880,719978,6,44326747,94,Florent Ogier (Mohammedan SC) Yellow Card at 54',Florent Ogier Yellow Card,2,3240,54',20842,0,0,1980-01-01,0.0,0.0,0.0,0.0,0.0,0.0,150292.0,Florent Ogier,2024-12-03 06:02:17
12880,719978,7,44326760,70,Javier Siverio (Jamshedpur FC) Goal at 61',Javier Siverio Goal,2,3660,61',18850,0,0,1980-01-01,0.0,0.0,0.0,0.0,0.0,0.0,301693.0,Javier Siverio,2024-12-03 06:02:17
12880,719978,8,44326767,76,Sagolsem Bikash Singh (Mohammedan SC) Substitution at 64',Sagolsem Bikash Singh Substituti,2,3840,64',20842,0,0,1980-01-01,0.0,0.0,0.0,0.0,0.0,0.0,299705.0,Sagolsem Bikash Singh,2024-12-03 06:02:17
12880,719978,9,44326768,76,Wahengbam Angousana Luwang (Mohammedan SC) Substitution at 64',Wahengbam Angousana Luwang Subst,2,3840,64',20842,0,0,1980-01-01,0.0,0.0,0.0,0.0,0.0,0.0,299734.0,Wahengbam Angousana Luwang,2024-12-03 06:02:17
12880,719978,8,44326767,76,Sagolsem Bikash Singh (Mohammedan SC) Substitution at 64',Sagolsem Bikash Singh Substituti,2,3840,64',20842,0,0,1980-01-01,0.0,0.0,0.0,0.0,0.0,0.0,268495.0,Makan Chote,2024-12-03 06:02:17
12880,719978,9,44326768,76,Wahengbam Angousana Luwang (Mohammedan SC) Substitution at 64',Wahengbam Angousana Luwang Subst,2,3840,64',20842,0,0,1980-01-01,0.0,0.0,0.0,0.0,0.0,0.0,266619.0,Kiyam Amarjit Singh,2024-12-03 06:02:17
12880,719978,10,44326777,76,Seminlen Doungel (Jamshedpur FC) Substitution at 68',Seminlen Doungel Substitution,2,4080,68',18850,0,0,1980-01-01,0.0,0.0,0.0,0.0,0.0,0.0,227912.0,Seminlen Doungel,2024-12-03 06:02:17
12880,719978,11,44326778,76,Lazar Cirkovic (Jamshedpur FC) Substitution at 68',Lazar Cirkovic Substitution,2,4080,68',18850,0,0,1980-01-01,0.0,0.0,0.0,0.0,0.0,0.0,195219.0,Lazar Cirkovic,2024-12-03 06:02:17
12880,719978,10,44326777,76,Seminlen Doungel (Jamshedpur FC) Substitution at 68',Seminlen Doungel Substitution,2,4080,68',18850,0,0,1980-01-01,0.0,0.0,0.0,0.0,0.0,0.0,281348.0,Imran Khan,2024-12-03 06:02:17
12880,719978,11,44326778,76,Lazar Cirkovic (Jamshedpur FC) Substitution at 68',Lazar Cirkovic Substitution,2,4080,68',18850,0,0,1980-01-01,0.0,0.0,0.0,0.0,0.0,0.0,259451.0,Javi Hernández,2024-12-03 06:02:17
12880,719978,12,44326794,70,Stephen Eze (Jamshedpur FC) Goal at 79',Stephen Eze Goal,2,4740,79',18850,0,0,1980-01-01,0.0,0.0,0.0,0.0,0.0,0.0,232717.0,Stephen Eze,2024-12-03 06:02:17
12880,719978,13,44326795,94,Vanlalzuidika Chhakchhuak (Mohammedan SC) Yellow Card at 81',Vanlalzuidika Chhakchhuak Yellow,2,4860,81',20842,0,0,1980-01-01,0.0,0.0,0.0,0.0,0.0,0.0,311376.0,Vanlalzuidika Chhakchhuak,2024-12-03 06:02:17
12880,719978,14,44326814,76,Jordan Murray (Jamshedpur FC) Substitution at 82',Jordan Murray Substitution,2,4920,82',18850,0,0,1980-01-01,0.0,0.0,0.0,0.0,0.0,0.0,179992.0,Jordan Murray,2024-12-03 06:02:17
12880,719978,15,44326815,76,Nikhil Barla (Jamshedpur FC) Substitution at 82',Nikhil Barla Substitution,2,4920,82',18850,0,0,1980-01-01,0.0,0.0,0.0,0.0,0.0,0.0,351976.0,Nikhil Barla,2024-12-03 06:02:17
12880,719978,14,44326814,76,Jordan Murray (Jamshedpur FC) Substitution at 82',Jordan Murray Substitution,2,4920,82',18850,0,0,1980-01-01,0.0,0.0,0.0,0.0,0.0,0.0,301693.0,Javier Siverio,2024-12-03 06:02:17
12880,719978,15,44326815,76,Nikhil Barla (Jamshedpur FC) Substitution at 82',Nikhil Barla Substitution,2,4920,82',18850,0,0,1980-01-01,0.0,0.0,0.0,0.0,0.0,0.0,370233.0,Mohammed Sanan K,2024-12-03 06:02:17
12880,719978,16,44326816,94,Wahengbam Angousana Luwang (Mohammedan SC) Yellow Card at 84',Wahengbam Angousana Luwang Yello,2,5040,84',20842,0,0,1980-01-01,0.0,0.0,0.0,0.0,0.0,0.0,299734.0,Wahengbam Angousana Luwang,2024-12-03 06:02:17
12880,719978,17,44326818,76,Samad Mallick (Mohammedan SC) Substitution at 86',Samad Mallick Substitution,2,5160,86',20842,0,0,1980-01-01,0.0,0.0,0.0,0.0,0.0,0.0,268358.0,Samad Mallick,2024-12-03 06:02:17
12880,719978,17,44326818,76,Samad Mallick (Mohammedan SC) Substitution at 86',Samad Mallick Substitution,2,5160,86',20842,0,0,1980-01-01,0.0,0.0,0.0,0.0,0.0,0.0,150292.0,Florent Ogier,2024-12-03 06:02:17
12880,719978,18,44326819,70,Mohammed Irshad (Mohammedan SC) Goal at 88',Mohammed Irshad Goal,2,5280,88',20842,0,0,1980-01-01,0.0,0.0,0.0,0.0,0.0,0.0,268409.0,Mohammed Irshad,2024-12-03 06:02:17
12880,719978,19,44326823,94,Joseph Adjei (Mohammedan SC) Yellow Card at 89',Joseph Adjei Yellow Card,2,5340,89',20842,0,0,1980-01-01,0.0,0.0,0.0,0.0,0.0,0.0,219311.0,Joseph Adjei,2024-12-03 06:02:17
12880,719978,22,44326837,174,Carlos Henrique França Freires (Mohammedan SC) Penalty - Saved at 97',Carlos Henrique França Freires P,2,5400,90'+7',20842,0,0,1980-01-01,0.0,0.0,0.0,0.0,0.0,0.0,270589.0,Carlos Henrique França Freires,2024-12-03 06:02:17
12880,719978,20,44326838,94,Pratik Chowdhary (Jamshedpur FC) Yellow Card at 96',Pratik Chowdhary Yellow Card,2,5400,90'+6',18850,0,0,1980-01-01,0.0,0.0,0.0,0.0,0.0,0.0,245814.0,Pratik Chowdhary,2024-12-03 06:02:17
12880,719978,21,44327135,94,Albino Gomes (Jamshedpur FC) Yellow Card at 96',Albino Gomes Yellow Card,2,5400,90'+6',18850,0,0,1980-01-01,0.0,0.0,0.0,0.0,0.0,0.0,227949.0,Albino Gomes,2024-12-03 06:02:17
12880,719979,1,44337133,76,Sourav (Hyderabad) Substitution at 28',Sourav Substitution,1,1680,28',20174,0,0,1980-01-01,0.0,0.0,0.0,0.0,0.0,0.0,332475.0,Sourav,2024-12-05 06:01:43
12880,719979,1,44337133,76,Sourav (Hyderabad) Substitution at 28',Sourav Substitution,1,1680,28',20174,0,0,1980-01-01,0.0,0.0,0.0,0.0,0.0,0.0,309613.0,Leander D'Cunha,2024-12-05 06:01:43
12880,719979,2,44337135,70,Udanta Singh (FC Goa) Goal at 33',Udanta Singh Goal,1,1980,33',18003,0,0,1980-01-01,0.0,0.0,0.0,0.0,0.0,0.0,235238.0,Udanta Singh,2024-12-05 06:01:43
12880,719979,3,44337138,70,Iker Guarrotxena (FC Goa) Goal at 44',Iker Guarrotxena Goal,1,2640,44',18003,0,0,1980-01-01,0.0,0.0,0.0,0.0,0.0,0.0,207732.0,Iker Guarrotxena,2024-12-05 06:01:43
12880,719979,4,44337139,94,Parag Satish Srivas (Hyderabad) Yellow Card at 45',Parag Satish Srivas Yellow Card,1,2700,45',20174,0,0,1980-01-01,0.0,0.0,0.0,0.0,0.0,0.0,285299.0,Parag Satish Srivas,2024-12-05 06:01:43
12880,719979,5,44337143,76,Soyal Joshy (Hyderabad) Substitution at 45',Soyal Joshy Substitution,2,2700,45',20174,0,0,1980-01-01,0.0,0.0,0.0,0.0,0.0,0.0,351130.0,Soyal Joshy,2024-12-05 06:01:43
12880,719979,5,44337143,76,Soyal Joshy (Hyderabad) Substitution at 45',Soyal Joshy Substitution,2,2700,45',20174,0,0,1980-01-01,0.0,0.0,0.0,0.0,0.0,0.0,301241.0,Ramhlunchhunga,2024-12-05 06:01:43
12880,719979,6,44337152,76,Dejan Drazic (FC Goa) Substitution at 62',Dejan Drazic Substitution,2,3720,62',18003,0,0,1980-01-01,0.0,0.0,0.0,0.0,0.0,0.0,224421.0,Dejan Drazic,2024-12-05 06:01:43
12880,719979,7,44337153,76,Brison Fernandes (FC Goa) Substitution at 62',Brison Fernandes Substitution,2,3720,62',18003,0,0,1980-01-01,0.0,0.0,0.0,0.0,0.0,0.0,329978.0,Brison Fernandes,2024-12-05 06:01:43
12880,719979,8,44337154,76,Allan Paulista (Hyderabad) Substitution at 62',Allan Paulista Substitution,2,3720,62',20174,0,0,1980-01-01,0.0,0.0,0.0,0.0,0.0,0.0,392341.0,Allan Paulista,2024-12-05 06:01:43
12880,719979,9,44337155,76,Sahil Tavora (FC Goa) Substitution at 62',Sahil Tavora Substitution,2,3720,62',18003,0,0,1980-01-01,0.0,0.0,0.0,0.0,0.0,0.0,245257.0,Sahil Tavora,2024-12-05 06:01:43
12880,719979,6,44337152,76,Dejan Drazic (FC Goa) Substitution at 62',Dejan Drazic Substitution,2,3720,62',18003,0,0,1980-01-01,0.0,0.0,0.0,0.0,0.0,0.0,268051.0,Mohammad Yasir,2024-12-05 06:01:43
12880,719979,7,44337153,76,Brison Fernandes (FC Goa) Substitution at 62',Brison Fernandes Substitution,2,3720,62',18003,0,0,1980-01-01,0.0,0.0,0.0,0.0,0.0,0.0,173659.0,Armando Sadiku,2024-12-05 06:01:43
12880,719979,8,44337154,76,Allan Paulista (Hyderabad) Substitution at 62',Allan Paulista Substitution,2,3720,62',20174,0,0,1980-01-01,0.0,0.0,0.0,0.0,0.0,0.0,236188.0,Andrei Alba,2024-12-05 06:01:43
12880,719979,9,44337155,76,Sahil Tavora (FC Goa) Substitution at 62',Sahil Tavora Substitution,2,3720,62',18003,0,0,1980-01-01,0.0,0.0,0.0,0.0,0.0,0.0,235238.0,Udanta Singh,2024-12-05 06:01:43
12880,719979,10,44337161,76,Borja Herrera (FC Goa) Substitution at 79',Borja Herrera Substitution,2,4740,79',18003,0,0,1980-01-01,0.0,0.0,0.0,0.0,0.0,0.0,259852.0,Borja Herrera,2024-12-05 06:01:43
12880,719979,11,44337162,76,Seriton Fernandes (FC Goa) Substitution at 79',Seriton Fernandes Substitution,2,4740,79',18003,0,0,1980-01-01,0.0,0.0,0.0,0.0,0.0,0.0,268043.0,Seriton Fernandes,2024-12-05 06:01:43
12880,719979,10,44337161,76,Borja Herrera (FC Goa) Substitution at 79',Borja Herrera Substitution,2,4740,79',18003,0,0,1980-01-01,0.0,0.0,0.0,0.0,0.0,0.0,166491.0,Carl McHugh,2024-12-05 06:01:43
12880,719979,11,44337162,76,Seriton Fernandes (FC Goa) Substitution at 79',Seriton Fernandes Substitution,2,4740,79',18003,0,0,1980-01-01,0.0,0.0,0.0,0.0,0.0,0.0,266713.0,Boris Thangjam,2024-12-05 06:01:43
12880,719979,12,44337172,76,Isaac Vanmalsawma (Hyderabad) Substitution at 86',Isaac Vanmalsawma Substitution,2,5160,86',20174,0,0,1980-01-01,0.0,0.0,0.0,0.0,0.0,0.0,243309.0,Isaac Vanmalsawma,2024-12-05 06:01:43
12880,719979,12,44337172,76,Isaac Vanmalsawma (Hyderabad) Substitution at 86',Isaac Vanmalsawma Substitution,2,5160,86',20174,0,0,1980-01-01,0.0,0.0,0.0,0.0,0.0,0.0,300988.0,Ayush Adhikari,2024-12-05 06:01:43
12880,719979,13,44337173,94,Edmilson Correia (Hyderabad) Yellow Card at 88',Edmilson Correia Yellow Card,2,5280,88',20174,0,0,1980-01-01,0.0,0.0,0.0,0.0,0.0,0.0,299474.0,Edmilson Correia,2024-12-05 06:01:43
12880,719980,1,44344345,94,Tiri  (Mumbai City FC) Yellow Card at 34',Tiri  Yellow Card,1,2040,34',18002,0,0,1980-01-01,0.0,0.0,0.0,0.0,0.0,0.0,160127.0,Tiri ,2024-12-06 05:59:18
12880,719980,2,44344349,94,Jerry Mawihmingthanga (Odisha FC) Yellow Card at 40',Jerry Mawihmingthanga Yellow Car,1,2400,40',17998,0,0,1980-01-01,0.0,0.0,0.0,0.0,0.0,0.0,245816.0,Jerry Mawihmingthanga,2024-12-06 05:59:18
12880,719980,3,44344350,94,Jayesh Rane (Mumbai City FC) Yellow Card at 46',Jayesh Rane Yellow Card,1,2700,45'+1',18002,0,0,1980-01-01,0.0,0.0,0.0,0.0,0.0,0.0,227846.0,Jayesh Rane,2024-12-06 05:59:18
12880,719980,4,44344352,94,Ahmed Jahouh (Odisha FC) Yellow Card at 49',Ahmed Jahouh Yellow Card,1,2700,45'+4',17998,0,0,1980-01-01,0.0,0.0,0.0,0.0,0.0,0.0,214486.0,Ahmed Jahouh,2024-12-06 05:59:18
12880,719980,5,44344358,94,Mourtada Fall (Odisha FC) Yellow Card at 50',Mourtada Fall Yellow Card,2,3000,50',17998,0,0,1980-01-01,0.0,0.0,0.0,0.0,0.0,0.0,214497.0,Mourtada Fall,2024-12-06 05:59:18
12880,719980,6,44344366,76,Rahim Ali (Odisha FC) Substitution at 60',Rahim Ali Substitution,2,3600,60',17998,0,0,1980-01-01,0.0,0.0,0.0,0.0,0.0,0.0,266618.0,Rahim Ali,2024-12-06 05:59:18
12880,719980,6,44344366,76,Rahim Ali (Odisha FC) Substitution at 60',Rahim Ali Substitution,2,3600,60',17998,0,0,1980-01-01,0.0,0.0,0.0,0.0,0.0,0.0,245816.0,Jerry Mawihmingthanga,2024-12-06 05:59:18
12880,719980,7,44344367,76,Carlos Delgado (Odisha FC) Substitution at 61',Carlos Delgado Substitution,2,3660,61',17998,0,0,1980-01-01,0.0,0.0,0.0,0.0,0.0,0.0,155725.0,Carlos Delgado,2024-12-06 05:59:18
12880,719980,7,44344367,76,Carlos Delgado (Odisha FC) Substitution at 61',Carlos Delgado Substitution,2,3660,61',17998,0,0,1980-01-01,0.0,0.0,0.0,0.0,0.0,0.0,212550.0,Hugo Boumous,2024-12-06 05:59:18
12880,719980,8,44344368,76,Raynier Fernandes (Odisha FC) Substitution at 73',Raynier Fernandes Substitution,2,4380,73',17998,0,0,1980-01-01,0.0,0.0,0.0,0.0,0.0,0.0,268285.0,Raynier Fernandes,2024-12-06 05:59:18
12880,719980,8,44344368,76,Raynier Fernandes (Odisha FC) Substitution at 73',Raynier Fernandes Substitution,2,4380,73',17998,0,0,1980-01-01,0.0,0.0,0.0,0.0,0.0,0.0,268052.0,Amey Ranawade,2024-12-06 05:59:18
12880,719980,9,44344372,76,Noufal Noufal (Mumbai City FC) Substitution at 81',Noufal Noufal Substitution,2,4860,81',18002,0,0,1980-01-01,0.0,0.0,0.0,0.0,0.0,0.0,353486.0,Noufal,2024-12-06 05:59:18
12880,719980,9,44344372,76,Noufal Noufal (Mumbai City FC) Substitution at 81',Noufal Noufal Substitution,2,4860,81',18002,0,0,1980-01-01,0.0,0.0,0.0,0.0,0.0,0.0,282523.0,Vikram Partap Singh,2024-12-06 05:59:18
12880,719980,10,44344376,76,Saviour Gama (Odisha FC) Substitution at 87',Saviour Gama Substitution,2,5220,87',17998,0,0,1980-01-01,0.0,0.0,0.0,0.0,0.0,0.0,281347.0,Saviour Gama,2024-12-06 05:59:18
12880,719980,11,44344377,76,Rohit Kumar (Odisha FC) Substitution at 87',Rohit Kumar Substitution,2,5220,87',17998,0,0,1980-01-01,0.0,0.0,0.0,0.0,0.0,0.0,268084.0,Rohit Kumar,2024-12-06 05:59:18
12880,719980,10,44344376,76,Saviour Gama (Odisha FC) Substitution at 87',Saviour Gama Substitution,2,5220,87',17998,0,0,1980-01-01,0.0,0.0,0.0,0.0,0.0,0.0,268517.0,Puitea,2024-12-06 05:59:18
12880,719980,11,44344377,76,Rohit Kumar (Odisha FC) Substitution at 87',Rohit Kumar Substitution,2,5220,87',17998,0,0,1980-01-01,0.0,0.0,0.0,0.0,0.0,0.0,282487.0,Isak Vanlalruatfela,2024-12-06 05:59:18
12880,719980,12,44344379,94,Yoell van Nieff (Mumbai City FC) Yellow Card at 90',Yoell van Nieff Yellow Card,2,5400,90',18002,0,0,1980-01-01,0.0,0.0,0.0,0.0,0.0,0.0,172874.0,Yoell van Nieff,2024-12-06 05:59:18
12880,719980,13,44344382,76,Daniel Lalhlimpuia (Mumbai City FC) Substitution at 94',Daniel Lalhlimpuia Substitution,2,5400,90'+4',18002,0,0,1980-01-01,0.0,0.0,0.0,0.0,0.0,0.0,245249.0,Daniel Lalhlimpuia,2024-12-06 05:59:18
12880,719980,13,44344382,76,Daniel Lalhlimpuia (Mumbai City FC) Substitution at 94',Daniel Lalhlimpuia Substitution,2,5400,90'+4',18002,0,0,1980-01-01,0.0,0.0,0.0,0.0,0.0,0.0,204838.0,Nikolaos Karelis,2024-12-06 05:59:18
12880,719981,1,44348619,94,Nihal Sudeesh (Punjab FC) Yellow Card at 32',Nihal Sudeesh Yellow Card,1,1920,32',18894,0,0,1980-01-01,0.0,0.0,0.0,0.0,0.0,0.0,351185.0,Nihal Sudeesh,2024-12-07 06:08:38
12880,719981,2,44348620,94,Samad Mallick (Mohammedan SC) Yellow Card at 35',Samad Mallick Yellow Card,1,2100,35',20842,0,0,1980-01-01,0.0,0.0,0.0,0.0,0.0,0.0,268358.0,Samad Mallick,2024-12-07 06:08:38
12880,719981,3,44348621,94,Nongmeikapam Suresh Meitei (Punjab FC) Yellow Card at 42',Nongmeikapam Suresh Meitei Yello,1,2520,42',18894,0,0,1980-01-01,0.0,0.0,0.0,0.0,0.0,0.0,299753.0,Nongmeikapam Suresh Meitei,2024-12-07 06:08:38
12880,719981,4,44348623,70,Luka Majcen (Punjab FC) Goal at 58',Luka Majcen Goal,2,3480,58',18894,0,0,1980-01-01,0.0,0.0,0.0,0.0,0.0,0.0,206384.0,Luka Majcen,2024-12-07 06:08:38
12880,719981,5,44348625,76,Likmabam Rakesh (Punjab FC) Substitution at 63',Likmabam Rakesh Substitution,2,3780,63',18894,0,0,1980-01-01,0.0,0.0,0.0,0.0,0.0,0.0,353509.0,Likmabam Rakesh,2024-12-07 06:08:38
12880,719981,5,44348625,76,Likmabam Rakesh (Punjab FC) Substitution at 63',Likmabam Rakesh Substitution,2,3780,63',18894,0,0,1980-01-01,0.0,0.0,0.0,0.0,0.0,0.0,266622.0,Ninthoinganba Meetei,2024-12-07 06:08:38
12880,719981,6,44348626,70,Filip Mrzljak (Punjab FC) Goal at 66',Filip Mrzljak Goal,2,3960,66',18894,0,0,1980-01-01,0.0,0.0,0.0,0.0,0.0,0.0,187947.0,Filip Mrzljak,2024-12-07 06:08:38
12880,719981,7,44348628,76,Melroy Assisi (Punjab FC) Substitution at 69',Melroy Assisi Substitution,2,4140,69',18894,0,0,1980-01-01,0.0,0.0,0.0,0.0,0.0,0.0,330262.0,Melroy Assisi,2024-12-07 06:08:38
12880,719981,8,44348629,76,Makan Chote (Mohammedan SC) Substitution at 69',Makan Chote Substitution,2,4140,69',20842,0,0,1980-01-01,0.0,0.0,0.0,0.0,0.0,0.0,268495.0,Makan Chote,2024-12-07 06:08:38
12880,719981,7,44348628,76,Melroy Assisi (Punjab FC) Substitution at 69',Melroy Assisi Substitution,2,4140,69',18894,0,0,1980-01-01,0.0,0.0,0.0,0.0,0.0,0.0,299753.0,Nongmeikapam Suresh Meitei,2024-12-07 06:08:38
12880,719981,8,44348629,76,Makan Chote (Mohammedan SC) Substitution at 69',Makan Chote Substitution,2,4140,69',20842,0,0,1980-01-01,0.0,0.0,0.0,0.0,0.0,0.0,266619.0,Kiyam Amarjit Singh,2024-12-07 06:08:38
12880,719981,9,44348634,76,Sagolsem Bikash Singh (Mohammedan SC) Substitution at 75',Sagolsem Bikash Singh Substituti,2,4500,75',20842,0,0,1980-01-01,0.0,0.0,0.0,0.0,0.0,0.0,299705.0,Sagolsem Bikash Singh,2024-12-07 06:08:38
12880,719981,9,44348634,76,Sagolsem Bikash Singh (Mohammedan SC) Substitution at 75',Sagolsem Bikash Singh Substituti,2,4500,75',20842,0,0,1980-01-01,0.0,0.0,0.0,0.0,0.0,0.0,270288.0,Lalremsanga Fanai,2024-12-07 06:08:38
12880,719981,10,44348635,76,Almir Suljic (Punjab FC) Substitution at 80',Almir Suljic Substitution,2,4800,80',18894,0,0,1980-01-01,0.0,0.0,0.0,0.0,0.0,0.0,237421.0,Almir Suljic,2024-12-07 06:08:38
12880,719981,11,44348636,76,Vinit Rai (Punjab FC) Substitution at 80',Vinit Rai Substitution,2,4800,80',18894,0,0,1980-01-01,0.0,0.0,0.0,0.0,0.0,0.0,243307.0,Vinit Rai,2024-12-07 06:08:38
12880,719981,10,44348635,76,Almir Suljic (Punjab FC) Substitution at 80',Almir Suljic Substitution,2,4800,80',18894,0,0,1980-01-01,0.0,0.0,0.0,0.0,0.0,0.0,128086.0,Ezequiel Vidal,2024-12-07 06:08:38
12880,719981,11,44348636,76,Vinit Rai (Punjab FC) Substitution at 80',Vinit Rai Substitution,2,4800,80',18894,0,0,1980-01-01,0.0,0.0,0.0,0.0,0.0,0.0,351185.0,Nihal Sudeesh,2024-12-07 06:08:38
12880,719981,12,44348637,94,Mirjalol Kosimov (Mohammedan SC) Yellow Card at 84',Mirjalol Kosimov Yellow Card,2,5040,84',20842,0,0,1980-01-01,0.0,0.0,0.0,0.0,0.0,0.0,202265.0,Mirjalol Kosimov,2024-12-07 06:08:38
12880,719981,13,44348638,94,Ricky John Shabong (Punjab FC) Yellow Card at 89',Ricky John Shabong Yellow Card,2,5340,89',18894,0,0,1980-01-01,0.0,0.0,0.0,0.0,0.0,0.0,299715.0,Ricky John Shabong,2024-12-07 06:08:38
12880,719981,14,44348639,94,Zodingliana Ralte (Mohammedan SC) Yellow Card at 92',Zodingliana Ralte Yellow Card,2,5400,90'+2',20842,0,0,1980-01-01,0.0,0.0,0.0,0.0,0.0,0.0,227893.0,Zodingliana Ralte,2024-12-07 06:08:38
12880,719981,15,44348641,76,Wahengbam Angousana Luwang (Mohammedan SC) Substitution at 95',Wahengbam Angousana Luwang Subst,2,5400,90'+5',20842,0,0,1980-01-01,0.0,0.0,0.0,0.0,0.0,0.0,299734.0,Wahengbam Angousana Luwang,2024-12-07 06:08:38
12880,719981,15,44348641,76,Wahengbam Angousana Luwang (Mohammedan SC) Substitution at 95',Wahengbam Angousana Luwang Subst,2,5400,90'+5',20842,0,0,1980-01-01,0.0,0.0,0.0,0.0,0.0,0.0,202265.0,Mirjalol Kosimov,2024-12-07 06:08:38
12880,719982,1,44351438,76,Cleiton Silva (SC East Bengal) Substitution at 49',Cleiton Silva Substitution,2,2940,49',8897,0,0,1980-01-01,0.0,0.0,0.0,0.0,0.0,0.0,218380.0,Cleiton Silva,2024-12-10 05:58:05
12880,719982,1,44351438,76,Cleiton Silva (SC East Bengal) Substitution at 49',Cleiton Silva Substitution,2,2940,49',8897,0,0,1980-01-01,0.0,0.0,0.0,0.0,0.0,0.0,187890.0,Dimitrios Diamantakos,2024-12-10 05:58:05
12880,719982,2,44351460,70,Vishnu PV (SC East Bengal) Goal at 54',Vishnu PV Goal,2,3240,54',8897,0,0,1980-01-01,0.0,0.0,0.0,0.0,0.0,0.0,373655.0,Vishnu PV,2024-12-10 05:58:05
12880,719982,3,44351514,76,Jeakson Singh (SC East Bengal) Substitution at 59',Jeakson Singh Substitution,2,3540,59',8897,0,0,1980-01-01,0.0,0.0,0.0,0.0,0.0,0.0,266615.0,Jeakson Singh,2024-12-10 05:58:05
12880,719982,3,44351514,76,Jeakson Singh (SC East Bengal) Substitution at 59',Jeakson Singh Substitution,2,3540,59',8897,0,0,1980-01-01,0.0,0.0,0.0,0.0,0.0,0.0,264194.0,Saul Crespo,2024-12-10 05:58:05
12880,719982,4,44351533,76,Jordán (Chennaiyin FC) Substitution at 62',Jordán Substitution,2,3720,62',18000,0,0,1980-01-01,0.0,0.0,0.0,0.0,0.0,0.0,98237.0,Jordán ,2024-12-10 05:58:05
12880,719982,5,44351534,76,Vincy Barretto (Chennaiyin FC) Substitution at 62',Vincy Barretto Substitution,2,3720,62',18000,0,0,1980-01-01,0.0,0.0,0.0,0.0,0.0,0.0,311500.0,Vincy Barretto,2024-12-10 05:58:05
12880,719982,4,44351533,76,Jordán (Chennaiyin FC) Substitution at 62',Jordán Substitution,2,3720,62',18000,0,0,1980-01-01,0.0,0.0,0.0,0.0,0.0,0.0,205635.0,Daniel Chukwu Chima,2024-12-10 05:58:05
12880,719982,5,44351534,76,Vincy Barretto (Chennaiyin FC) Substitution at 62',Vincy Barretto Substitution,2,3720,62',18000,0,0,1980-01-01,0.0,0.0,0.0,0.0,0.0,0.0,369847.0,Irfan Yadwad,2024-12-10 05:58:05
12880,719982,6,44351563,76,Gurkirat Singh (Chennaiyin FC) Substitution at 68',Gurkirat Singh Substitution,2,4080,68',18000,0,0,1980-01-01,0.0,0.0,0.0,0.0,0.0,0.0,282472.0,Gurkirat Singh,2024-12-10 05:58:05
12880,719982,6,44351563,76,Gurkirat Singh (Chennaiyin FC) Substitution at 68',Gurkirat Singh Substitution,2,4080,68',18000,0,0,1980-01-01,0.0,0.0,0.0,0.0,0.0,0.0,245810.0,Farukh Choudhary,2024-12-10 05:58:05
12880,719982,7,44351580,94,Laldinliana Renthlei (Chennaiyin FC) Yellow Card at 71',Laldinliana Renthlei Yellow Card,2,4260,71',18000,0,0,1980-01-01,0.0,0.0,0.0,0.0,0.0,0.0,268255.0,Laldinliana Renthlei,2024-12-10 05:58:05
12880,719982,8,44351601,76,Nandha Kumar Sekar (SC East Bengal) Substitution at 73',Nandha Kumar Sekar Substitution,2,4380,73',8897,0,0,1980-01-01,0.0,0.0,0.0,0.0,0.0,0.0,268650.0,Nandha Kumar Sekar,2024-12-10 05:58:05
12880,719982,9,44351602,76,Elsinho (Chennaiyin FC) Substitution at 73',Elsinho Substitution,2,4380,73',18000,0,0,1980-01-01,0.0,0.0,0.0,0.0,0.0,0.0,219170.0,Elsinho,2024-12-10 05:58:05
12880,719982,10,44351603,76,Kiyan Nassiri (Chennaiyin FC) Substitution at 73',Kiyan Nassiri Substitution,2,4380,73',18000,0,0,1980-01-01,0.0,0.0,0.0,0.0,0.0,0.0,299738.0,Kiyan Nassiri,2024-12-10 05:58:05
12880,719982,8,44351601,76,Nandha Kumar Sekar (SC East Bengal) Substitution at 73',Nandha Kumar Sekar Substitution,2,4380,73',8897,0,0,1980-01-01,0.0,0.0,0.0,0.0,0.0,0.0,373655.0,Vishnu PV,2024-12-10 05:58:05
