seasonType,eventId,playOrder,playId,typeId,text,shortText,period,clockValue,clockDisplayValue,teamId,scoringPlay,shootout,wallclock,goalPositionX,goalPositionY,fieldpositionX,fieldPositionY,fieldPosition2X,fieldPosition2Y,athleteId,participant,updateDateTime
12725,710209,4,44444175,76,Leighton Mcintosh (Queen of the South) Substitution at 71',Leighton Mcintosh Substitution,2,4260,71',406,0,0,1980-01-01,0.0,0.0,0.0,0.0,0.0,0.0,332860.0,Lewis O'Donnell,2024-12-22 05:56:06
12725,710209,5,44444176,76,Fraser Bryden (Queen of the South) Substitution at 71',Fraser Bryden Substitution,2,4260,71',406,0,0,1980-01-01,0.0,0.0,0.0,0.0,0.0,0.0,177341.0,Brennan Dickenson,2024-12-22 05:56:06
12725,710209,6,44444490,94,Thomas O'Ware (Kelty Hearts) Yellow Card at 80',Thomas O'Ware Yellow Card,2,4800,80',18018,0,0,1980-01-01,0.0,0.0,0.0,0.0,0.0,0.0,168949.0,Thomas O'Ware,2024-12-22 05:56:06
12725,710209,7,44444561,76,Scott Allan (Kelty Hearts) Substitution at 81',Scott Allan Substitution,2,4860,81',18018,0,0,1980-01-01,0.0,0.0,0.0,0.0,0.0,0.0,150988.0,Scott Allan,2024-12-22 05:56:06
12725,710209,7,44444561,76,Scott Allan (Kelty Hearts) Substitution at 81',Scott Allan Substitution,2,4860,81',18018,0,0,1980-01-01,0.0,0.0,0.0,0.0,0.0,0.0,217339.0,Lewis Moore,2024-12-22 05:56:06
12725,710209,8,44444751,98,Ross Cunningham (Kelty Hearts) Penalty - Scored at 87',Ross Cunningham Penalty - Scored,2,5220,87',18018,0,0,1980-01-01,0.0,0.0,0.0,0.0,0.0,0.0,207487.0,Ross Cunningham,2024-12-22 05:56:06
12725,710210,1,44464976,70,Aaron Steele (Stenhousemuir) Goal at 34',Aaron Steele Goal,1,2040,34',405,0,0,1980-01-01,0.0,0.0,0.0,0.0,0.0,0.0,61878.0,Aaron Steele,2024-12-29 14:45:35
12725,710210,2,44465186,76,Stefan Scougall (Alloa Athletic) Substitution at 45',Stefan Scougall Substitution,2,2700,45',403,0,0,1980-01-01,0.0,0.0,0.0,0.0,0.0,0.0,153015.0,Stefan Scougall,2024-12-29 14:45:35
12725,710210,2,44465186,76,Stefan Scougall (Alloa Athletic) Substitution at 45',Stefan Scougall Substitution,2,2700,45',403,0,0,1980-01-01,0.0,0.0,0.0,0.0,0.0,0.0,382810.0,Kane Thomson,2024-12-29 14:45:35
12725,710210,3,44465227,70,Michael Anderson (Stenhousemuir) Goal at 59',Michael Anderson Goal,2,3540,59',405,0,0,1980-01-01,0.0,0.0,0.0,0.0,0.0,0.0,13199.0,Michael Anderson,2024-12-29 14:45:35
12725,710210,4,44465241,76,Steven Buchanan (Alloa Athletic) Substitution at 59',Steven Buchanan Substitution,2,3540,59',403,0,0,1980-01-01,0.0,0.0,0.0,0.0,0.0,0.0,345183.0,Steven Buchanan,2024-12-29 14:45:35
12725,710210,4,44465241,76,Steven Buchanan (Alloa Athletic) Substitution at 59',Steven Buchanan Substitution,2,3540,59',403,0,0,1980-01-01,0.0,0.0,0.0,0.0,0.0,0.0,347015.0,Scott Honeyman,2024-12-29 14:45:35
12725,710210,5,44465254,76,Conor Sammon (Alloa Athletic) Substitution at 66',Conor Sammon Substitution,2,3960,66',403,0,0,1980-01-01,0.0,0.0,0.0,0.0,0.0,0.0,121832.0,Conor Sammon,2024-12-29 14:45:35
12725,710210,5,44465254,76,Conor Sammon (Alloa Athletic) Substitution at 66',Conor Sammon Substitution,2,3960,66',403,0,0,1980-01-01,0.0,0.0,0.0,0.0,0.0,0.0,384258.0,Tyrece Mcdonnell,2024-12-29 14:45:35
12725,710210,6,44465276,70,Conor Sammon (Alloa Athletic) Goal at 75',Conor Sammon Goal,2,4500,75',403,0,0,1980-01-01,0.0,0.0,0.0,0.0,0.0,0.0,121832.0,Conor Sammon,2024-12-29 14:45:35
12725,710210,7,44465296,70,Corey O' Donnell (Stenhousemuir) Goal at 80',Corey O' Donnell Goal,2,4800,80',405,0,0,1980-01-01,0.0,0.0,0.0,0.0,0.0,0.0,322900.0,Corey O' Donnell,2024-12-29 14:45:35
12725,710210,8,44465311,76,James Berry (Stenhousemuir) Substitution at 82',James Berry Substitution,2,4920,82',405,0,0,1980-01-01,0.0,0.0,0.0,0.0,0.0,0.0,303677.0,James Berry,2024-12-29 14:45:35
12725,710210,8,44465311,76,James Berry (Stenhousemuir) Substitution at 82',James Berry Substitution,2,4920,82',405,0,0,1980-01-01,0.0,0.0,0.0,0.0,0.0,0.0,227236.0,Matt Yates,2024-12-29 14:45:35
12725,710210,9,44465337,76,Kyle Jacobs (Stenhousemuir) Substitution at 86',Kyle Jacobs Substitution,2,5160,86',405,0,0,1980-01-01,0.0,0.0,0.0,0.0,0.0,0.0,42871.0,Kyle Jacobs,2024-12-29 14:45:35
12725,710210,10,44465338,94,Stefan Scougall (Alloa Athletic) Yellow Card at 86',Stefan Scougall Yellow Card,2,5160,86',403,0,0,1980-01-01,0.0,0.0,0.0,0.0,0.0,0.0,153015.0,Stefan Scougall,2024-12-29 14:45:35
12725,710210,9,44465337,76,Kyle Jacobs (Stenhousemuir) Substitution at 86',Kyle Jacobs Substitution,2,5160,86',405,0,0,1980-01-01,0.0,0.0,0.0,0.0,0.0,0.0,322774.0,Kinlay Bilham,2024-12-29 14:45:35
12725,710210,11,44465385,76,Ewan O'Reilly (Stenhousemuir) Substitution at 92',Ewan O'Reilly Substitution,2,5400,90'+2',405,0,0,1980-01-01,0.0,0.0,0.0,0.0,0.0,0.0,240728.0,Ewan O'Reilly,2024-12-29 14:45:35
12725,710210,12,44465386,76,Euan Cameron (Stenhousemuir) Substitution at 92',Euan Cameron Substitution,2,5400,90'+2',405,0,0,1980-01-01,0.0,0.0,0.0,0.0,0.0,0.0,344859.0,Euan Cameron,2024-12-29 14:45:35
12725,710210,11,44465385,76,Ewan O'Reilly (Stenhousemuir) Substitution at 92',Ewan O'Reilly Substitution,2,5400,90'+2',405,0,0,1980-01-01,0.0,0.0,0.0,0.0,0.0,0.0,143467.0,Blair Alston,2024-12-29 14:45:35
12725,710210,12,44465386,76,Euan Cameron (Stenhousemuir) Substitution at 92',Euan Cameron Substitution,2,5400,90'+2',405,0,0,1980-01-01,0.0,0.0,0.0,0.0,0.0,0.0,322900.0,Corey O' Donnell,2024-12-29 14:45:35
12725,710211,1,44464898,70,Alasdair Spalding (Arbroath) Goal at 21',Alasdair Spalding Goal,1,1260,21',252,0,0,1980-01-01,0.0,0.0,0.0,0.0,0.0,0.0,345411.0,Alasdair Spalding,2024-12-29 14:45:35
12725,710211,2,44465005,76,Matheus Machado (Montrose) Substitution at 35',Matheus Machado Substitution,1,2100,35',414,0,0,1980-01-01,0.0,0.0,0.0,0.0,0.0,0.0,287071.0,Matheus Machado,2024-12-29 14:45:35
12725,710211,2,44465005,76,Matheus Machado (Montrose) Substitution at 35',Matheus Machado Substitution,1,2100,35',414,0,0,1980-01-01,0.0,0.0,0.0,0.0,0.0,0.0,197370.0,Michael Gardyne,2024-12-29 14:45:35
12725,710211,3,44465207,76,Craig Slater (Arbroath) Substitution at 45',Craig Slater Substitution,2,2700,45',252,0,0,1980-01-01,0.0,0.0,0.0,0.0,0.0,0.0,142368.0,Craig Slater,2024-12-29 14:45:35
12725,710211,3,44465207,76,Craig Slater (Arbroath) Substitution at 45',Craig Slater Substitution,2,2700,45',252,0,0,1980-01-01,0.0,0.0,0.0,0.0,0.0,0.0,113120.0,Ryan Flynn,2024-12-29 14:45:35
12725,710211,4,44465240,94,Jack Wilkie (Arbroath) Yellow Card at 57',Jack Wilkie Yellow Card,2,3420,57',252,0,0,1980-01-01,0.0,0.0,0.0,0.0,0.0,0.0,310143.0,Jack Wilkie,2024-12-29 14:45:35
12725,710211,5,44465265,70,Thomas O'Brien (Arbroath) Goal at 65',Thomas O'Brien Goal,2,3900,65',252,0,0,1980-01-01,0.0,0.0,0.0,0.0,0.0,0.0,126266.0,Thomas O'Brien,2024-12-29 14:45:35
12725,710211,6,44465286,76,Paul Watson (Montrose) Substitution at 71',Paul Watson Substitution,2,4260,71',414,0,0,1980-01-01,0.0,0.0,0.0,0.0,0.0,0.0,223409.0,Paul Watson,2024-12-29 14:45:35
12725,710211,7,44465287,76,Ben Maciver-Redwood (Montrose) Substitution at 71',Ben Maciver-Redwood Substitution,2,4260,71',414,0,0,1980-01-01,0.0,0.0,0.0,0.0,0.0,0.0,350198.0,Ben Maciver-Redwood,2024-12-29 14:45:35
12725,710211,6,44465286,76,Paul Watson (Montrose) Substitution at 71',Paul Watson Substitution,2,4260,71',414,0,0,1980-01-01,0.0,0.0,0.0,0.0,0.0,0.0,6213.0,Craig Brown,2024-12-29 14:45:35
12725,710211,7,44465287,76,Ben Maciver-Redwood (Montrose) Substitution at 71',Ben Maciver-Redwood Substitution,2,4260,71',414,0,0,1980-01-01,0.0,0.0,0.0,0.0,0.0,0.0,364997.0,Ali Shrive,2024-12-29 14:45:35
12725,710211,8,44465299,76,Calum Gallagher (Arbroath) Substitution at 75',Calum Gallagher Substitution,2,4500,75',252,0,0,1980-01-01,0.0,0.0,0.0,0.0,0.0,0.0,223318.0,Calum Gallagher,2024-12-29 14:45:35
12725,710211,8,44465299,76,Calum Gallagher (Arbroath) Substitution at 75',Calum Gallagher Substitution,2,4500,75',252,0,0,1980-01-01,0.0,0.0,0.0,0.0,0.0,0.0,149780.0,Gavin Reilly,2024-12-29 14:45:35
12725,710211,9,44465320,94,David Gold (Arbroath) Yellow Card at 78',David Gold Yellow Card,2,4680,78',252,0,0,1980-01-01,0.0,0.0,0.0,0.0,0.0,0.0,223262.0,David Gold,2024-12-29 14:45:35
12725,710211,10,44465339,76,Liam Callaghan (Arbroath) Substitution at 81',Liam Callaghan Substitution,2,4860,81',252,0,0,1980-01-01,0.0,0.0,0.0,0.0,0.0,0.0,163021.0,Liam Callaghan,2024-12-29 14:45:35
12725,710211,10,44465339,76,Liam Callaghan (Arbroath) Substitution at 81',Liam Callaghan Substitution,2,4860,81',252,0,0,1980-01-01,0.0,0.0,0.0,0.0,0.0,0.0,345411.0,Alasdair Spalding,2024-12-29 14:45:35
12725,710211,11,44465355,76,Keir Bertie (Montrose) Substitution at 84',Keir Bertie Substitution,2,5040,84',414,0,0,1980-01-01,0.0,0.0,0.0,0.0,0.0,0.0,346441.0,Keir Bertie,2024-12-29 14:45:35
12725,710211,12,44465356,70,Fraser Taylor (Arbroath) Goal at 84',Fraser Taylor Goal,2,5040,84',252,0,0,1980-01-01,0.0,0.0,0.0,0.0,0.0,0.0,324844.0,Fraser Taylor,2024-12-29 14:45:35
12725,710211,11,44465355,76,Keir Bertie (Montrose) Substitution at 84',Keir Bertie Substitution,2,5040,84',414,0,0,1980-01-01,0.0,0.0,0.0,0.0,0.0,0.0,153853.0,Andrew Steeves,2024-12-29 14:45:35
12725,710211,13,44465387,76,Quinn Coulson (Arbroath) Substitution at 87',Quinn Coulson Substitution,2,5220,87',252,0,0,1980-01-01,0.0,0.0,0.0,0.0,0.0,0.0,306143.0,Quinn Coulson,2024-12-29 14:45:35
12725,710211,13,44465387,76,Quinn Coulson (Arbroath) Substitution at 87',Quinn Coulson Substitution,2,5220,87',252,0,0,1980-01-01,0.0,0.0,0.0,0.0,0.0,0.0,239235.0,Innes Murray,2024-12-29 14:45:35
12725,710211,14,44465399,94,Blair Mackenzie (Montrose) Yellow Card at 91',Blair Mackenzie Yellow Card,2,5400,90'+1',414,0,0,1980-01-01,0.0,0.0,0.0,0.0,0.0,0.0,324732.0,Blair Mackenzie,2024-12-29 14:45:35
12725,710212,1,44464830,70,Declan Glass (Cove Rangers) Goal at 5',Declan Glass Goal,1,300,5',2613,0,0,1980-01-01,0.0,0.0,0.0,0.0,0.0,0.0,260284.0,Declan Glass,2024-12-29 14:45:35
12725,710212,2,44464891,70,Mitchel Megginson (Cove Rangers) Goal at 18',Mitchel Megginson Goal,1,1080,18',2613,0,0,1980-01-01,0.0,0.0,0.0,0.0,0.0,0.0,137801.0,Mitchel Megginson,2024-12-29 14:45:35
12725,710212,3,44465017,70,Remi Savage (Inverness Caledonian Thistle) Goal at 37',Remi Savage Goal,1,2220,37',253,0,0,1980-01-01,0.0,0.0,0.0,0.0,0.0,0.0,291632.0,Remi Savage,2024-12-29 14:45:35
12725,710212,4,44465193,76,Ethan Cairns (Inverness Caledonian Thistle) Substitution at 45',Ethan Cairns Substitution,2,2700,45',253,0,0,1980-01-01,0.0,0.0,0.0,0.0,0.0,0.0,323081.0,Ethan Cairns,2024-12-29 14:45:35
12725,710212,4,44465193,76,Ethan Cairns (Inverness Caledonian Thistle) Substitution at 45',Ethan Cairns Substitution,2,2700,45',253,0,0,1980-01-01,0.0,0.0,0.0,0.0,0.0,0.0,341080.0,Matthew Strachan,2024-12-29 14:45:35
12725,710212,5,44465202,70,Arron Darge (Cove Rangers) Goal at 49',Arron Darge Goal,2,2940,49',2613,0,0,1980-01-01,0.0,0.0,0.0,0.0,0.0,0.0,290709.0,Arron Darge,2024-12-29 14:45:35
12725,710212,6,44465257,94,Daniel Devine (Inverness Caledonian Thistle) Yellow Card at 65',Daniel Devine Yellow Card,2,3900,65',253,0,0,1980-01-01,0.0,0.0,0.0,0.0,0.0,0.0,157563.0,Daniel Devine,2024-12-29 14:45:35
12725,710212,7,44465325,94,Ryan Harrington (Cove Rangers) Yellow Card at 81',Ryan Harrington Yellow Card,2,4860,81',2613,0,0,1980-01-01,0.0,0.0,0.0,0.0,0.0,0.0,261460.0,Ryan Harrington,2024-12-29 14:45:35
12725,710212,8,44465326,76,Miles Gaffney (Cove Rangers) Substitution at 81',Miles Gaffney Substitution,2,4860,81',2613,0,0,1980-01-01,0.0,0.0,0.0,0.0,0.0,0.0,321821.0,Miles Gaffney,2024-12-29 14:45:35
12725,710212,8,44465326,76,Miles Gaffney (Cove Rangers) Substitution at 81',Miles Gaffney Substitution,2,4860,81',2613,0,0,1980-01-01,0.0,0.0,0.0,0.0,0.0,0.0,137801.0,Mitchel Megginson,2024-12-29 14:45:35
12725,710212,9,44465349,76,Robbie Thompson (Inverness Caledonian Thistle) Substitution at 85',Robbie Thompson Substitution,2,5100,85',253,0,0,1980-01-01,0.0,0.0,0.0,0.0,0.0,0.0,176966.0,Robbie Thompson,2024-12-29 14:45:35
12725,710212,9,44465349,76,Robbie Thompson (Inverness Caledonian Thistle) Substitution at 85',Robbie Thompson Substitution,2,5100,85',253,0,0,1980-01-01,0.0,0.0,0.0,0.0,0.0,0.0,358177.0,James Nolan,2024-12-29 14:45:35
12725,710212,10,44465393,70,Adam Emslie (Cove Rangers) Goal at 92',Adam Emslie Goal,2,5400,90'+2',2613,0,0,1980-01-01,0.0,0.0,0.0,0.0,0.0,0.0,324736.0,Adam Emslie,2024-12-29 14:45:35
12725,710213,1,44464897,94,Thomas O'Ware (Kelty Hearts) Yellow Card at 20',Thomas O'Ware Yellow Card,1,1200,20',18018,0,0,1980-01-01,0.0,0.0,0.0,0.0,0.0,0.0,168949.0,Thomas O'Ware,2024-12-29 14:45:35
12725,710213,2,44465245,76,Scott Williamson (Kelty Hearts) Substitution at 63',Scott Williamson Substitution,2,3780,63',18018,0,0,1980-01-01,0.0,0.0,0.0,0.0,0.0,0.0,344858.0,Scott Williamson,2024-12-29 14:45:35
12725,710213,3,44465246,76,Scott Allan (Kelty Hearts) Substitution at 63',Scott Allan Substitution,2,3780,63',18018,0,0,1980-01-01,0.0,0.0,0.0,0.0,0.0,0.0,150988.0,Scott Allan,2024-12-29 14:45:35
12725,710213,4,44465247,76,Callum Flatman (Kelty Hearts) Substitution at 63',Callum Flatman Substitution,2,3780,63',18018,0,0,1980-01-01,0.0,0.0,0.0,0.0,0.0,0.0,325991.0,Callum Flatman,2024-12-29 14:45:35
12725,710213,2,44465245,76,Scott Williamson (Kelty Hearts) Substitution at 63',Scott Williamson Substitution,2,3780,63',18018,0,0,1980-01-01,0.0,0.0,0.0,0.0,0.0,0.0,179655.0,Scott Mercer,2024-12-29 14:45:35
12725,710213,3,44465246,76,Scott Allan (Kelty Hearts) Substitution at 63',Scott Allan Substitution,2,3780,63',18018,0,0,1980-01-01,0.0,0.0,0.0,0.0,0.0,0.0,347064.0,J. MacIntyre,2024-12-29 14:45:35
12725,710213,4,44465247,76,Callum Flatman (Kelty Hearts) Substitution at 63',Callum Flatman Substitution,2,3780,63',18018,0,0,1980-01-01,0.0,0.0,0.0,0.0,0.0,0.0,266967.0,Murray Thomas,2024-12-29 14:45:35
12725,710213,5,44465259,93,Scott Allan (Kelty Hearts) Red Card at 68',Scott Allan Red Card,2,4080,68',18018,0,0,1980-01-01,0.0,0.0,0.0,0.0,0.0,0.0,150988.0,Scott Allan,2024-12-29 14:45:35
12725,710213,6,44465260,70,Kalvin Orsi (Dumbarton) Goal at 70',Kalvin Orsi Goal,2,4200,70',415,0,0,1980-01-01,0.0,0.0,0.0,0.0,0.0,0.0,207443.0,Kalvin Orsi,2024-12-29 14:45:35
12725,710213,7,44465269,94,Ross Cunningham (Kelty Hearts) Yellow Card at 72',Ross Cunningham Yellow Card,2,4320,72',18018,0,0,1980-01-01,0.0,0.0,0.0,0.0,0.0,0.0,207487.0,Ross Cunningham,2024-12-29 14:45:35
12725,710213,8,44465295,76,Craig McGuffie (Dumbarton) Substitution at 79',Craig McGuffie Substitution,2,4740,79',415,0,0,1980-01-01,0.0,0.0,0.0,0.0,0.0,0.0,206454.0,Craig McGuffie,2024-12-29 14:45:35
12725,710213,8,44465295,76,Craig McGuffie (Dumbarton) Substitution at 79',Craig McGuffie Substitution,2,4740,79',415,0,0,1980-01-01,0.0,0.0,0.0,0.0,0.0,0.0,197374.0,David Wilson,2024-12-29 14:45:35
12725,710213,9,44465332,94,Mouhamed Niang (Dumbarton) Yellow Card at 84',Mouhamed Niang Yellow Card,2,5040,84',415,0,0,1980-01-01,0.0,0.0,0.0,0.0,0.0,0.0,289987.0,Mouhamed Niang,2024-12-29 14:45:35
12725,710213,10,44465350,76,Robbie Cole (Kelty Hearts) Substitution at 88',Robbie Cole Substitution,2,5280,88',18018,0,0,1980-01-01,0.0,0.0,0.0,0.0,0.0,0.0,327817.0,Robbie Cole,2024-12-29 14:45:35
12725,710213,10,44465350,76,Robbie Cole (Kelty Hearts) Substitution at 88',Robbie Cole Substitution,2,5280,88',18018,0,0,1980-01-01,0.0,0.0,0.0,0.0,0.0,0.0,217339.0,Lewis Moore,2024-12-29 14:45:35
12725,710213,11,44465353,70,Kalvin Orsi (Dumbarton) Goal at 89',Kalvin Orsi Goal,2,5340,89',415,0,0,1980-01-01,0.0,0.0,0.0,0.0,0.0,0.0,207443.0,Kalvin Orsi,2024-12-29 14:45:35
12725,710213,12,44465367,94,Kalvin Orsi (Dumbarton) Yellow Card at 90',Kalvin Orsi Yellow Card,2,5400,90',415,0,0,1980-01-01,0.0,0.0,0.0,0.0,0.0,0.0,207443.0,Kalvin Orsi,2024-12-29 14:45:35
12725,710213,13,44465381,76,Joel Mumbongo (Dumbarton) Substitution at 92',Joel Mumbongo Substitution,2,5400,90'+2',415,0,0,1980-01-01,0.0,0.0,0.0,0.0,0.0,0.0,259706.0,Joel Mumbongo,2024-12-29 14:45:35
12725,710213,14,44465382,76,Tony Wallace (Dumbarton) Substitution at 92',Tony Wallace Substitution,2,5400,90'+2',415,0,0,1980-01-01,0.0,0.0,0.0,0.0,0.0,0.0,123714.0,Tony Wallace,2024-12-29 14:45:35
12725,710213,15,44465383,76,Murray Nicol (Dumbarton) Substitution at 92',Murray Nicol Substitution,2,5400,90'+2',415,0,0,1980-01-01,0.0,0.0,0.0,0.0,0.0,0.0,398117.0,Murray Nicol,2024-12-29 14:45:35
12725,710213,13,44465381,76,Joel Mumbongo (Dumbarton) Substitution at 92',Joel Mumbongo Substitution,2,5400,90'+2',415,0,0,1980-01-01,0.0,0.0,0.0,0.0,0.0,0.0,291515.0,Findlay Gray,2024-12-29 14:45:35
12725,710213,14,44465382,76,Tony Wallace (Dumbarton) Substitution at 92',Tony Wallace Substitution,2,5400,90'+2',415,0,0,1980-01-01,0.0,0.0,0.0,0.0,0.0,0.0,207443.0,Kalvin Orsi,2024-12-29 14:45:35
12725,710213,15,44465383,76,Murray Nicol (Dumbarton) Substitution at 92',Murray Nicol Substitution,2,5400,90'+2',415,0,0,1980-01-01,0.0,0.0,0.0,0.0,0.0,0.0,190465.0,Ryan Blair,2024-12-29 14:45:35
12725,710214,1,44464849,94,Tommy Muir (Annan Athletic) Yellow Card at 7',Tommy Muir Yellow Card,1,420,7',7166,0,0,1980-01-01,0.0,0.0,0.0,0.0,0.0,0.0,231464.0,Tommy Muir,2024-12-29 14:45:35
12725,710214,2,44464889,70,Adam Brooks (Queen of the South) Goal at 17',Adam Brooks Goal,1,1020,17',406,0,0,1980-01-01,0.0,0.0,0.0,0.0,0.0,0.0,324214.0,Adam Brooks,2024-12-29 14:45:35
12725,710214,3,44465060,94,Benjamin Luissint (Queen of the South) Yellow Card at 42',Benjamin Luissint Yellow Card,1,2520,42',406,0,0,1980-01-01,0.0,0.0,0.0,0.0,0.0,0.0,292911.0,Benjamin Luissint,2024-12-29 14:45:35
12725,710214,4,44465218,94,Paul Smith (Annan Athletic) Yellow Card at 53',Paul Smith Yellow Card,2,3180,53',7166,0,0,1980-01-01,0.0,0.0,0.0,0.0,0.0,0.0,302704.0,Paul Smith,2024-12-29 14:45:35
12725,710214,5,44465249,76,Oscar Macintyre (Queen of the South) Substitution at 59',Oscar Macintyre Substitution,2,3540,59',406,0,0,1980-01-01,0.0,0.0,0.0,0.0,0.0,0.0,324795.0,Oscar Macintyre,2024-12-29 14:45:35
12725,710214,5,44465249,76,Oscar Macintyre (Queen of the South) Substitution at 59',Oscar Macintyre Substitution,2,3540,59',406,0,0,1980-01-01,0.0,0.0,0.0,0.0,0.0,0.0,332860.0,Lewis O'Donnell,2024-12-29 14:45:35
12725,710214,6,44465275,94,Aidan Smith (Annan Athletic) Yellow Card at 68',Aidan Smith Yellow Card,2,4080,68',7166,0,0,1980-01-01,0.0,0.0,0.0,0.0,0.0,0.0,190469.0,Aidan Smith,2024-12-29 14:45:35
12725,710214,7,44465321,76,Fraser Bryden (Queen of the South) Substitution at 78',Fraser Bryden Substitution,2,4680,78',406,0,0,1980-01-01,0.0,0.0,0.0,0.0,0.0,0.0,333424.0,Fraser Bryden,2024-12-29 14:45:35
12725,710214,8,44465322,76,Harry Cochrane (Queen of the South) Substitution at 78',Harry Cochrane Substitution,2,4680,78',406,0,0,1980-01-01,0.0,0.0,0.0,0.0,0.0,0.0,261409.0,Harry Cochrane,2024-12-29 14:45:35
12725,710214,7,44465321,76,Fraser Bryden (Queen of the South) Substitution at 78',Fraser Bryden Substitution,2,4680,78',406,0,0,1980-01-01,0.0,0.0,0.0,0.0,0.0,0.0,177341.0,Brennan Dickenson,2024-12-29 14:45:35
12725,710214,8,44465322,76,Harry Cochrane (Queen of the South) Substitution at 78',Harry Cochrane Substitution,2,4680,78',406,0,0,1980-01-01,0.0,0.0,0.0,0.0,0.0,0.0,316544.0,Jack Brydon,2024-12-29 14:45:35
12725,710214,9,44465378,98,William Gibson (Annan Athletic) Penalty - Scored at 87',William Gibson Penalty - Scored,2,5220,87',7166,0,0,1980-01-01,0.0,0.0,0.0,0.0,0.0,0.0,7191.0,William Gibson,2024-12-29 14:45:35
12725,710215,1,44479944,70,Gavin Reilly (Arbroath) Goal at 13',Gavin Reilly Goal,1,780,13',252,0,0,1980-01-01,0.0,0.0,0.0,0.0,0.0,0.0,149780.0,Gavin Reilly,2025-01-05 05:44:58
12725,710215,2,44480186,70,Stefan Scougall (Alloa Athletic) Goal at 21',Stefan Scougall Goal,1,1260,21',403,0,0,1980-01-01,0.0,0.0,0.0,0.0,0.0,0.0,153015.0,Stefan Scougall,2025-01-05 05:44:58
12725,710215,3,44480227,94,Steven Hetherington (Alloa Athletic) Yellow Card at 23',Steven Hetherington Yellow Card,1,1380,23',403,0,0,1980-01-01,0.0,0.0,0.0,0.0,0.0,0.0,162858.0,Steven Hetherington,2025-01-05 05:44:58
12725,710215,4,44480706,70,Luke Rankin (Alloa Athletic) Goal at 40',Luke Rankin Goal,1,2400,40',403,0,0,1980-01-01,0.0,0.0,0.0,0.0,0.0,0.0,347933.0,Luke Rankin,2025-01-05 05:44:58
12725,710215,5,44481159,76,Calum Gallagher (Arbroath) Substitution at 45',Calum Gallagher Substitution,2,2700,45',252,0,0,1980-01-01,0.0,0.0,0.0,0.0,0.0,0.0,223318.0,Calum Gallagher,2025-01-05 05:44:58
12725,710215,5,44481159,76,Calum Gallagher (Arbroath) Substitution at 45',Calum Gallagher Substitution,2,2700,45',252,0,0,1980-01-01,0.0,0.0,0.0,0.0,0.0,0.0,223262.0,David Gold,2025-01-05 05:44:58
12725,710215,6,44481218,76,Miko Virtanen (Alloa Athletic) Substitution at 49',Miko Virtanen Substitution,2,2940,49',403,0,0,1980-01-01,0.0,0.0,0.0,0.0,0.0,0.0,271172.0,Miko Virtanen,2025-01-05 05:44:58
12725,710215,6,44481218,76,Miko Virtanen (Alloa Athletic) Substitution at 49',Miko Virtanen Substitution,2,2940,49',403,0,0,1980-01-01,0.0,0.0,0.0,0.0,0.0,0.0,162858.0,Steven Hetherington,2025-01-05 05:44:58
12725,710215,7,44481457,70,David Mckay (Alloa Athletic) Goal at 56',David Mckay Goal,2,3360,56',403,0,0,1980-01-01,0.0,0.0,0.0,0.0,0.0,0.0,6857.0,David Mckay,2025-01-05 05:44:58
12725,710215,8,44481552,94,Cameron O'Donnel (Alloa Athletic) Yellow Card at 58',Cameron O'Donnel Yellow Card,2,3480,58',403,0,0,1980-01-01,0.0,0.0,0.0,0.0,0.0,0.0,290169.0,Cameron O'Donnel,2025-01-05 05:44:58
12725,710215,9,44481766,76,Innes Murray (Arbroath) Substitution at 64',Innes Murray Substitution,2,3840,64',252,0,0,1980-01-01,0.0,0.0,0.0,0.0,0.0,0.0,239235.0,Innes Murray,2025-01-05 05:44:58
12725,710215,9,44481766,76,Innes Murray (Arbroath) Substitution at 64',Innes Murray Substitution,2,3840,64',252,0,0,1980-01-01,0.0,0.0,0.0,0.0,0.0,0.0,345411.0,Alasdair Spalding,2025-01-05 05:44:58
12725,710215,10,44482062,76,Kevin Cawley (Alloa Athletic) Substitution at 72',Kevin Cawley Substitution,2,4320,72',403,0,0,1980-01-01,0.0,0.0,0.0,0.0,0.0,0.0,137451.0,Kevin Cawley,2025-01-05 05:44:58
12725,710215,11,44482063,76,Scott Honeyman (Alloa Athletic) Substitution at 72',Scott Honeyman Substitution,2,4320,72',403,0,0,1980-01-01,0.0,0.0,0.0,0.0,0.0,0.0,347015.0,Scott Honeyman,2025-01-05 05:44:58
12725,710215,10,44482062,76,Kevin Cawley (Alloa Athletic) Substitution at 72',Kevin Cawley Substitution,2,4320,72',403,0,0,1980-01-01,0.0,0.0,0.0,0.0,0.0,0.0,153015.0,Stefan Scougall,2025-01-05 05:44:58
12725,710215,11,44482063,76,Scott Honeyman (Alloa Athletic) Substitution at 72',Scott Honeyman Substitution,2,4320,72',403,0,0,1980-01-01,0.0,0.0,0.0,0.0,0.0,0.0,121832.0,Conor Sammon,2025-01-05 05:44:58
12725,710215,12,44482064,94,Thomas O'Brien (Arbroath) Yellow Card at 73',Thomas O'Brien Yellow Card,2,4380,73',252,0,0,1980-01-01,0.0,0.0,0.0,0.0,0.0,0.0,126266.0,Thomas O'Brien,2025-01-05 05:44:58
12725,710215,13,44482289,94,Luke Rankin (Alloa Athletic) Yellow Card at 79',Luke Rankin Yellow Card,2,4740,79',403,0,0,1980-01-01,0.0,0.0,0.0,0.0,0.0,0.0,347933.0,Luke Rankin,2025-01-05 05:44:58
12725,710215,14,44482454,76,Craig Slater (Arbroath) Substitution at 83',Craig Slater Substitution,2,4980,83',252,0,0,1980-01-01,0.0,0.0,0.0,0.0,0.0,0.0,142368.0,Craig Slater,2025-01-05 05:44:58
12725,710215,14,44482454,76,Craig Slater (Arbroath) Substitution at 83',Craig Slater Substitution,2,4980,83',252,0,0,1980-01-01,0.0,0.0,0.0,0.0,0.0,0.0,134842.0,Ryan Dow,2025-01-05 05:44:58
12725,710215,15,44482542,94,Ryan Flynn (Arbroath) Yellow Card at 85',Ryan Flynn Yellow Card,2,5100,85',252,0,0,1980-01-01,0.0,0.0,0.0,0.0,0.0,0.0,113120.0,Ryan Flynn,2025-01-05 05:44:58
12725,710215,16,44482677,76,Steven Buchanan (Alloa Athletic) Substitution at 88',Steven Buchanan Substitution,2,5280,88',403,0,0,1980-01-01,0.0,0.0,0.0,0.0,0.0,0.0,345183.0,Steven Buchanan,2025-01-05 05:44:58
12725,710215,16,44482677,76,Steven Buchanan (Alloa Athletic) Substitution at 88',Steven Buchanan Substitution,2,5280,88',403,0,0,1980-01-01,0.0,0.0,0.0,0.0,0.0,0.0,347933.0,Luke Rankin,2025-01-05 05:44:58
12725,710216,1,44480032,70,Alfie Bavidge (Inverness Caledonian Thistle) Goal at 15',Alfie Bavidge Goal,1,900,15',253,0,0,1980-01-01,0.0,0.0,0.0,0.0,0.0,0.0,324735.0,Alfie Bavidge,2025-01-05 05:44:58
12725,710216,2,44480644,76,Patrick O'Neil (Dumbarton) Substitution at 37',Patrick O'Neil Substitution,1,2220,37',415,0,0,1980-01-01,0.0,0.0,0.0,0.0,0.0,0.0,209560.0,Patrick O'Neil,2025-01-05 05:44:58
12725,710216,2,44480644,76,Patrick O'Neil (Dumbarton) Substitution at 37',Patrick O'Neil Substitution,1,2220,37',415,0,0,1980-01-01,0.0,0.0,0.0,0.0,0.0,0.0,169965.0,Brett Long,2025-01-05 05:44:58
12725,710216,3,44481707,94,Matthew Shiels (Dumbarton) Yellow Card at 60',Matthew Shiels Yellow Card,2,3600,60',415,0,0,1980-01-01,0.0,0.0,0.0,0.0,0.0,0.0,239319.0,Matthew Shiels,2025-01-05 05:44:58
12725,710216,4,44481935,70,Charlie Gilmour (Inverness Caledonian Thistle) Goal at 68',Charlie Gilmour Goal,2,4080,68',253,0,0,1980-01-01,0.0,0.0,0.0,0.0,0.0,0.0,227783.0,Charlie Gilmour,2025-01-05 05:44:58
12725,710216,5,44482050,76,Mark Durnan (Dumbarton) Substitution at 68',Mark Durnan Substitution,2,4080,68',415,0,0,1980-01-01,0.0,0.0,0.0,0.0,0.0,0.0,141011.0,Mark Durnan,2025-01-05 05:44:58
12725,710216,6,44482051,76,James Hilton (Dumbarton) Substitution at 68',James Hilton Substitution,2,4080,68',415,0,0,1980-01-01,0.0,0.0,0.0,0.0,0.0,0.0,250928.0,James Hilton,2025-01-05 05:44:58
12725,710216,5,44482050,76,Mark Durnan (Dumbarton) Substitution at 68',Mark Durnan Substitution,2,4080,68',415,0,0,1980-01-01,0.0,0.0,0.0,0.0,0.0,0.0,179626.0,Aron Lynas,2025-01-05 05:44:58
12725,710216,6,44482051,76,James Hilton (Dumbarton) Substitution at 68',James Hilton Substitution,2,4080,68',415,0,0,1980-01-01,0.0,0.0,0.0,0.0,0.0,0.0,197374.0,David Wilson,2025-01-05 05:44:58
12725,710216,7,44482269,76,Alfie Stewart (Inverness Caledonian Thistle) Substitution at 75',Alfie Stewart Substitution,2,4500,75',253,0,0,1980-01-01,0.0,0.0,0.0,0.0,0.0,0.0,26027.0,Alfie Stewart,2025-01-05 05:44:58
12725,710216,7,44482269,76,Alfie Stewart (Inverness Caledonian Thistle) Substitution at 75',Alfie Stewart Substitution,2,4500,75',253,0,0,1980-01-01,0.0,0.0,0.0,0.0,0.0,0.0,291645.0,Luis Longstaff,2025-01-05 05:44:58
