seasonType,eventId,playOrder,playId,typeId,text,shortText,period,clockValue,clockDisplayValue,teamId,scoringPlay,shootout,wallclock,goalPositionX,goalPositionY,fieldpositionX,fieldPositionY,fieldPosition2X,fieldPosition2Y,athleteId,participant,updateDateTime
12657,705086,16,43659147,76,Theo Ndicka Matam (Grasshoppers) Substitution at 92',Theo Ndicka Matam Substitution,2,5400,90'+2',492,0,0,1980-01-01,0.0,0.0,0.0,0.0,0.0,0.0,290127.0,Theo Ndicka Matam,2024-09-01 05:45:08
12657,705086,16,43659147,76,Theo Ndicka Matam (Grasshoppers) Substitution at 92',Theo Ndicka Matam Substitution,2,5400,90'+2',492,0,0,1980-01-01,0.0,0.0,0.0,0.0,0.0,0.0,191017.0,Benno Schmitz,2024-09-01 05:45:08
12657,705087,1,43657688,70,Albian Ajeti (FC Basel) Goal at 5',Albian Ajeti Goal,1,300,5',989,0,0,1980-01-01,0.0,0.0,0.0,0.0,0.0,0.0,202100.0,Albian Ajeti,2024-09-01 05:45:08
12657,705087,2,43657876,70,Ylyas Chouaref (FC Sion) Goal at 26',Ylyas Chouaref Goal,1,1560,26',3076,0,0,1980-01-01,0.0,0.0,0.0,0.0,0.0,0.0,283802.0,Ylyas Chouaref,2024-09-01 05:45:08
12657,705087,3,43658086,94,Nias Hefti (FC Sion) Yellow Card at 44',Nias Hefti Yellow Card,1,2640,44',3076,0,0,1980-01-01,0.0,0.0,0.0,0.0,0.0,0.0,275009.0,Nias Hefti,2024-09-01 05:45:08
12657,705087,4,43658128,94,Leon Avdullahu (FC Basel) Yellow Card at 47',Leon Avdullahu Yellow Card,1,2700,45'+2',989,0,0,1980-01-01,0.0,0.0,0.0,0.0,0.0,0.0,362590.0,Leon Avdullahu,2024-09-01 05:45:08
12657,705087,5,43658321,76,Marin Soticek (FC Basel) Substitution at 45',Marin Soticek Substitution,2,2700,45',989,0,0,1980-01-01,0.0,0.0,0.0,0.0,0.0,0.0,345481.0,Marin Soticek,2024-09-01 05:45:08
12657,705087,5,43658321,76,Marin Soticek (FC Basel) Substitution at 45',Marin Soticek Substitution,2,2700,45',989,0,0,1980-01-01,0.0,0.0,0.0,0.0,0.0,0.0,202100.0,Albian Ajeti,2024-09-01 05:45:08
12657,705087,6,43658644,76,Kevin Omoruyi (FC Basel) Substitution at 62',Kevin Omoruyi Substitution,2,3720,62',989,0,0,1980-01-01,0.0,0.0,0.0,0.0,0.0,0.0,304151.0,Kevin Omoruyi,2024-09-01 05:45:08
12657,705087,6,43658644,76,Kevin Omoruyi (FC Basel) Substitution at 62',Kevin Omoruyi Substitution,2,3720,62',989,0,0,1980-01-01,0.0,0.0,0.0,0.0,0.0,0.0,340465.0,Bradley Fink,2024-09-01 05:45:08
12657,705087,7,43658738,76,Cristian Souza (FC Sion) Substitution at 67',Cristian Souza Substitution,2,4020,67',3076,0,0,1980-01-01,0.0,0.0,0.0,0.0,0.0,0.0,284859.0,Cristian Souza,2024-09-01 05:45:08
12657,705087,7,43658738,76,Cristian Souza (FC Sion) Substitution at 67',Cristian Souza Substitution,2,4020,67',3076,0,0,1980-01-01,0.0,0.0,0.0,0.0,0.0,0.0,356272.0,Théo Bouchlarhem,2024-09-01 05:45:08
12657,705087,8,43658780,76,Xherdan Shaqiri (FC Basel) Substitution at 71',Xherdan Shaqiri Substitution,2,4260,71',989,0,0,1980-01-01,0.0,0.0,0.0,0.0,0.0,0.0,136775.0,Xherdan Shaqiri,2024-09-01 05:45:08
12657,705087,9,43658791,76,Benjamin Kololli (FC Basel) Substitution at 71',Benjamin Kololli Substitution,2,4260,71',989,0,0,1980-01-01,0.0,0.0,0.0,0.0,0.0,0.0,202179.0,Benjamin Kololli,2024-09-01 05:45:08
12657,705087,8,43658780,76,Xherdan Shaqiri (FC Basel) Substitution at 71',Xherdan Shaqiri Substitution,2,4260,71',989,0,0,1980-01-01,0.0,0.0,0.0,0.0,0.0,0.0,312850.0,Bénie Traoré,2024-09-01 05:45:08
12657,705087,9,43658791,76,Benjamin Kololli (FC Basel) Substitution at 71',Benjamin Kololli Substitution,2,4260,71',989,0,0,1980-01-01,0.0,0.0,0.0,0.0,0.0,0.0,333837.0,Anton Kade,2024-09-01 05:45:08
12657,705087,10,43658842,76,Dejan Sorgic (FC Sion) Substitution at 74',Dejan Sorgic Substitution,2,4440,74',3076,0,0,1980-01-01,0.0,0.0,0.0,0.0,0.0,0.0,100518.0,Dejan Sorgic,2024-09-01 05:45:08
12657,705087,11,43658843,76,Théo Berdayes (FC Sion) Substitution at 74',Théo Berdayes Substitution,2,4440,74',3076,0,0,1980-01-01,0.0,0.0,0.0,0.0,0.0,0.0,313093.0,Théo Berdayes,2024-09-05 05:45:25
12657,705087,10,43658842,76,Dejan Sorgic (FC Sion) Substitution at 74',Dejan Sorgic Substitution,2,4440,74',3076,0,0,1980-01-01,0.0,0.0,0.0,0.0,0.0,0.0,304810.0,Dejan Djokic,2024-09-01 05:45:08
12657,705087,11,43658843,76,Théo Berdayes (FC Sion) Substitution at 74',Théo Berdayes Substitution,2,4440,74',3076,0,0,1980-01-01,0.0,0.0,0.0,0.0,0.0,0.0,283802.0,Ylyas Chouaref,2024-09-05 05:45:25
12657,705087,12,43658867,76,Fabian Frei (FC Basel) Substitution at 75',Fabian Frei Substitution,2,4500,75',989,0,0,1980-01-01,0.0,0.0,0.0,0.0,0.0,0.0,105140.0,Fabian Frei,2024-09-01 05:45:08
12657,705087,12,43658867,76,Fabian Frei (FC Basel) Substitution at 75',Fabian Frei Substitution,2,4500,75',989,0,0,1980-01-01,0.0,0.0,0.0,0.0,0.0,0.0,136597.0,Dominik Schmid,2024-09-01 05:45:08
12657,705087,13,43658925,94,Kevin Omoruyi (FC Basel) Yellow Card at 81',Kevin Omoruyi Yellow Card,2,4860,81',989,0,0,1980-01-01,0.0,0.0,0.0,0.0,0.0,0.0,304151.0,Kevin Omoruyi,2024-09-01 05:45:08
12657,705087,14,43659035,94,Dejan Sorgic (FC Sion) Yellow Card at 87',Dejan Sorgic Yellow Card,2,5220,87',3076,0,0,1980-01-01,0.0,0.0,0.0,0.0,0.0,0.0,100518.0,Dejan Sorgic,2024-09-01 05:45:08
12657,705087,15,43659075,93,Leon Avdullahu (FC Basel) Red Card at 89',Leon Avdullahu Red Card,2,5340,89',989,0,0,1980-01-01,0.0,0.0,0.0,0.0,0.0,0.0,362590.0,Leon Avdullahu,2024-09-01 05:45:08
12657,705088,1,43660795,94,Sandro Lauper (Young Boys) Yellow Card at 42',Sandro Lauper Yellow Card,1,2520,42',2722,0,0,1980-01-01,0.0,0.0,0.0,0.0,0.0,0.0,223256.0,Sandro Lauper,2024-09-01 05:45:08
12657,705088,2,43660880,70,Filip Ugrinic (Young Boys) Goal at 48',Filip Ugrinic Goal,1,2700,45'+3',2722,0,0,1980-01-01,0.0,0.0,0.0,0.0,0.0,0.0,248681.0,Filip Ugrinic,2024-09-01 05:45:08
12657,705088,4,43661145,76,Miguel Chaiwa (Young Boys) Substitution at 45',Miguel Chaiwa Substitution,2,2700,45',2722,0,0,1980-01-01,0.0,0.0,0.0,0.0,0.0,0.0,330824.0,Miguel Chaiwa,2024-09-03 05:46:12
12657,705088,5,43661146,76,Darian Males (Young Boys) Substitution at 45',Darian Males Substitution,2,2700,45',2722,0,0,1980-01-01,0.0,0.0,0.0,0.0,0.0,0.0,290139.0,Darian Males,2024-09-03 05:46:12
12657,705088,6,43661147,76,Alan Virginius (Young Boys) Substitution at 45',Alan Virginius Substitution,2,2700,45',2722,0,0,1980-01-01,0.0,0.0,0.0,0.0,0.0,0.0,304743.0,Alan Virginius,2024-09-03 05:46:12
12657,705088,3,43691107,94,Mamadou Kaly Sene (Lausanne Sports) Yellow Card at 48',Mamadou Kaly Sene Yellow Card,1,2700,45'+3',11551,0,0,1980-01-01,0.0,0.0,0.0,0.0,0.0,0.0,306297.0,Mamadou Kaly Sene,2024-09-03 05:46:12
12657,705088,4,43661145,76,Miguel Chaiwa (Young Boys) Substitution at 45',Miguel Chaiwa Substitution,2,2700,45',2722,0,0,1980-01-01,0.0,0.0,0.0,0.0,0.0,0.0,319399.0,Anel Hasic,2024-09-03 05:46:12
12657,705088,5,43661146,76,Darian Males (Young Boys) Substitution at 45',Darian Males Substitution,2,2700,45',2722,0,0,1980-01-01,0.0,0.0,0.0,0.0,0.0,0.0,223256.0,Sandro Lauper,2024-09-03 05:46:12
12657,705088,6,43661147,76,Alan Virginius (Young Boys) Substitution at 45',Alan Virginius Substitution,2,2700,45',2722,0,0,1980-01-01,0.0,0.0,0.0,0.0,0.0,0.0,307893.0,Joel Monteiro,2024-09-03 05:46:12
12657,705088,7,43661338,94,Ebrima Colley (Young Boys) Yellow Card at 57',Ebrima Colley Yellow Card,2,3420,57',2722,0,0,1980-01-01,0.0,0.0,0.0,0.0,0.0,0.0,287077.0,Ebrima Colley,2024-09-03 05:46:12
12657,705088,8,43661371,94,Jaouen Hadjam (Young Boys) Yellow Card at 58',Jaouen Hadjam Yellow Card,2,3480,58',2722,0,0,1980-01-01,0.0,0.0,0.0,0.0,0.0,0.0,306033.0,Jaouen Hadjam,2024-09-03 05:46:12
12657,705088,9,43661424,76,Fabricio Oviedo (Lausanne Sports) Substitution at 60',Fabricio Oviedo Substitution,2,3600,60',11551,0,0,1980-01-01,0.0,0.0,0.0,0.0,0.0,0.0,342003.0,Fabricio Oviedo,2024-09-05 05:45:25
12657,705088,10,43661425,76,Konrad De La Fuente (Lausanne Sports) Substitution at 60',Konrad De La Fuente Substitution,2,3600,60',11551,0,0,1980-01-01,0.0,0.0,0.0,0.0,0.0,0.0,287498.0,Konrad De La Fuente,2024-09-05 05:45:25
12657,705088,9,43661424,76,Fabricio Oviedo (Lausanne Sports) Substitution at 60',Fabricio Oviedo Substitution,2,3600,60',11551,0,0,1980-01-01,0.0,0.0,0.0,0.0,0.0,0.0,306297.0,Mamadou Kaly Sene,2024-09-05 05:45:25
12657,705088,10,43661425,76,Konrad De La Fuente (Lausanne Sports) Substitution at 60',Konrad De La Fuente Substitution,2,3600,60',11551,0,0,1980-01-01,0.0,0.0,0.0,0.0,0.0,0.0,255773.0,Teddy Okou,2024-09-05 05:45:25
12657,705088,11,43661423,76,Diogo Mendes (Lausanne Sports) Substitution at 61',Diogo Mendes Substitution,2,3660,61',11551,0,0,1980-01-01,0.0,0.0,0.0,0.0,0.0,0.0,339896.0,Diogo Mendes,2024-09-05 05:45:25
12657,705088,11,43661423,76,Diogo Mendes (Lausanne Sports) Substitution at 61',Diogo Mendes Substitution,2,3660,61',11551,0,0,1980-01-01,0.0,0.0,0.0,0.0,0.0,0.0,259820.0,Antoine Bernede,2024-09-05 05:45:25
12657,705088,12,43661554,70,Karim Sow (Lausanne Sports) Goal at 70',Karim Sow Goal,2,4200,70',11551,0,0,1980-01-01,0.0,0.0,0.0,0.0,0.0,0.0,324712.0,Karim Sow,2024-09-03 05:46:12
12657,705088,13,43661591,76,Noah Persson (Young Boys) Substitution at 72',Noah Persson Substitution,2,4320,72',2722,0,0,1980-01-01,0.0,0.0,0.0,0.0,0.0,0.0,318778.0,Noah Persson,2024-09-03 05:46:12
12657,705088,13,43661591,76,Noah Persson (Young Boys) Substitution at 72',Noah Persson Substitution,2,4320,72',2722,0,0,1980-01-01,0.0,0.0,0.0,0.0,0.0,0.0,306033.0,Jaouen Hadjam,2024-09-03 05:46:12
12657,705088,14,43661661,93,Tanguy Zoukrou (Young Boys) Red Card at 75',Tanguy Zoukrou Red Card,2,4500,75',2722,0,0,1980-01-01,0.0,0.0,0.0,0.0,0.0,0.0,324657.0,Tanguy Zoukrou,2024-09-05 05:45:25
12657,705088,15,43661729,76,Zachary Athekame (Young Boys) Substitution at 79',Zachary Athekame Substitution,2,4740,79',2722,0,0,1980-01-01,0.0,0.0,0.0,0.0,0.0,0.0,370758.0,Zachary Athekame,2024-09-03 05:46:12
12657,705088,15,43661729,76,Zachary Athekame (Young Boys) Substitution at 79',Zachary Athekame Substitution,2,4740,79',2722,0,0,1980-01-01,0.0,0.0,0.0,0.0,0.0,0.0,234153.0,Cedric Itten,2024-09-03 05:46:12
12657,705088,16,43661769,76,Manuel Polster (Lausanne Sports) Substitution at 81',Manuel Polster Substitution,2,4860,81',11551,0,0,1980-01-01,0.0,0.0,0.0,0.0,0.0,0.0,324318.0,Manuel Polster,2024-09-03 05:46:12
12657,705088,16,43661769,76,Manuel Polster (Lausanne Sports) Substitution at 81',Manuel Polster Substitution,2,4860,81',11551,0,0,1980-01-01,0.0,0.0,0.0,0.0,0.0,0.0,240260.0,Morgan Poaty,2024-09-03 05:46:12
12657,705088,17,43661851,76,Kevin Mouanga (Lausanne Sports) Substitution at 84',Kevin Mouanga Substitution,2,5040,84',11551,0,0,1980-01-01,0.0,0.0,0.0,0.0,0.0,0.0,282674.0,Kevin Mouanga,2024-09-03 05:46:12
12657,705088,17,43661851,76,Kevin Mouanga (Lausanne Sports) Substitution at 84',Kevin Mouanga Substitution,2,5040,84',11551,0,0,1980-01-01,0.0,0.0,0.0,0.0,0.0,0.0,324712.0,Karim Sow,2024-09-03 05:46:12
12657,705089,1,43669044,94,Souleymane Diaby (Winterthur) Yellow Card at 19',Souleymane Diaby Yellow Card,1,1140,19',20996,0,0,1980-01-01,0.0,0.0,0.0,0.0,0.0,0.0,175739.0,Souleymane Diaby,2024-09-02 05:43:13
12657,705089,2,43669049,98,Enzo Crivelli (Servette) Penalty - Scored at 21',Enzo Crivelli Penalty - Scored,1,1260,21',20032,0,0,1980-01-01,0.0,0.0,0.0,0.0,0.0,0.0,199645.0,Enzo Crivelli,2024-09-02 05:43:13
12657,705089,3,43669415,76,Albin Krasniqi (Winterthur) Substitution at 45',Albin Krasniqi Substitution,2,2700,45',20996,0,0,1980-01-01,0.0,0.0,0.0,0.0,0.0,0.0,274666.0,Albin Krasniqi,2024-09-02 05:43:13
12657,705089,3,43669415,76,Albin Krasniqi (Winterthur) Substitution at 45',Albin Krasniqi Substitution,2,2700,45',20996,0,0,1980-01-01,0.0,0.0,0.0,0.0,0.0,0.0,240584.0,Silvan Sidler,2024-09-02 05:43:13
12657,705089,4,43669494,76,Jeremy Guillemenot (Servette) Substitution at 60',Jeremy Guillemenot Substitution,2,3600,60',20032,0,0,1980-01-01,0.0,0.0,0.0,0.0,0.0,0.0,261466.0,Jeremy Guillemenot,2024-09-02 05:43:13
12657,705089,5,43669495,76,Dereck Kutesa (Servette) Substitution at 60',Dereck Kutesa Substitution,2,3600,60',20032,0,0,1980-01-01,0.0,0.0,0.0,0.0,0.0,0.0,238490.0,Dereck Kutesa,2024-09-02 05:43:13
12657,705089,4,43669494,76,Jeremy Guillemenot (Servette) Substitution at 60',Jeremy Guillemenot Substitution,2,3600,60',20032,0,0,1980-01-01,0.0,0.0,0.0,0.0,0.0,0.0,199645.0,Enzo Crivelli,2024-09-02 05:43:13
12657,705089,5,43669495,76,Dereck Kutesa (Servette) Substitution at 60',Dereck Kutesa Substitution,2,3600,60',20032,0,0,1980-01-01,0.0,0.0,0.0,0.0,0.0,0.0,275426.0,Julian von Moos,2024-09-02 05:43:13
12657,705089,6,43669509,76,Elias Maluvunu (Winterthur) Substitution at 61',Elias Maluvunu Substitution,2,3660,61',20996,0,0,1980-01-01,0.0,0.0,0.0,0.0,0.0,0.0,386245.0,Elias Maluvunu,2024-09-02 05:43:13
12657,705089,7,43669510,76,Adrian Durrer (Winterthur) Substitution at 61',Adrian Durrer Substitution,2,3660,61',20996,0,0,1980-01-01,0.0,0.0,0.0,0.0,0.0,0.0,314373.0,Adrian Durrer,2024-09-02 05:43:13
12657,705089,6,43669509,76,Elias Maluvunu (Winterthur) Substitution at 61',Elias Maluvunu Substitution,2,3660,61',20996,0,0,1980-01-01,0.0,0.0,0.0,0.0,0.0,0.0,310705.0,Carmine Chiappetta,2024-09-02 05:43:13
12657,705089,7,43669510,76,Adrian Durrer (Winterthur) Substitution at 61',Adrian Durrer Substitution,2,3660,61',20996,0,0,1980-01-01,0.0,0.0,0.0,0.0,0.0,0.0,320854.0,Randy Schneider,2024-09-02 05:43:13
12657,705089,8,43669553,94,Bradley Mazikou (Servette) Yellow Card at 66',Bradley Mazikou Yellow Card,2,3960,66',20032,0,0,1980-01-01,0.0,0.0,0.0,0.0,0.0,0.0,236311.0,Bradley Mazikou,2024-09-02 05:43:13
12657,705089,9,43669615,76,Malik Sawadogo (Servette) Substitution at 70',Malik Sawadogo Substitution,2,4200,70',20032,0,0,1980-01-01,0.0,0.0,0.0,0.0,0.0,0.0,323755.0,Malik Sawadogo,2024-09-02 05:43:13
12657,705089,9,43669615,76,Malik Sawadogo (Servette) Substitution at 70',Malik Sawadogo Substitution,2,4200,70',20032,0,0,1980-01-01,0.0,0.0,0.0,0.0,0.0,0.0,236311.0,Bradley Mazikou,2024-09-02 05:43:13
12657,705089,10,43669749,76,Christian Gomis (Winterthur) Substitution at 84',Christian Gomis Substitution,2,5040,84',20996,0,0,1980-01-01,0.0,0.0,0.0,0.0,0.0,0.0,322156.0,Christian Gomis,2024-09-02 05:43:13
12657,705089,10,43669749,76,Christian Gomis (Winterthur) Substitution at 84',Christian Gomis Substitution,2,5040,84',20996,0,0,1980-01-01,0.0,0.0,0.0,0.0,0.0,0.0,200150.0,Musa Araz,2024-09-02 05:43:13
12657,705089,11,43669778,76,David Douline (Servette) Substitution at 86',David Douline Substitution,2,5160,86',20032,0,0,1980-01-01,0.0,0.0,0.0,0.0,0.0,0.0,181789.0,David Douline,2024-09-02 05:43:13
12657,705089,11,43669778,76,David Douline (Servette) Substitution at 86',David Douline Substitution,2,5160,86',20032,0,0,1980-01-01,0.0,0.0,0.0,0.0,0.0,0.0,290184.0,Alexis Antunes,2024-09-02 05:43:13
12657,705090,1,43670365,94,Donat Rrudhani (FC Luzern) Yellow Card at 12',Donat Rrudhani Yellow Card,1,720,12',7640,0,0,1980-01-01,0.0,0.0,0.0,0.0,0.0,0.0,320006.0,Donat Rrudhani,2024-09-02 05:43:13
12657,705090,2,43670437,94,Jonathan Okita (FC Zürich) Yellow Card at 16',Jonathan Okita Yellow Card,1,960,16',3019,0,0,1980-01-01,0.0,0.0,0.0,0.0,0.0,0.0,235722.0,Jonathan Okita,2024-09-02 05:43:13
12657,705090,3,43670494,70,Andrej Ciganiks (FC Luzern) Goal at 21',Andrej Ciganiks Goal,1,1260,21',7640,0,0,1980-01-01,0.0,0.0,0.0,0.0,0.0,0.0,238590.0,Andrej Ciganiks,2024-09-02 05:43:13
12657,705090,4,43670584,94,Stefan Knezevic (FC Luzern) Yellow Card at 28',Stefan Knezevic Yellow Card,1,1680,28',7640,0,0,1980-01-01,0.0,0.0,0.0,0.0,0.0,0.0,238492.0,Stefan Knezevic,2024-09-02 05:43:13
12657,705090,5,43670829,94,Daniel Denoon (FC Zürich) Yellow Card at 40',Daniel Denoon Yellow Card,1,2400,40',3019,0,0,1980-01-01,0.0,0.0,0.0,0.0,0.0,0.0,390613.0,Daniel Denoon,2024-09-02 05:43:13
12657,705090,6,43671428,76,Kevin Spadanuda (FC Luzern) Substitution at 45',Kevin Spadanuda Substitution,2,2700,45',7640,0,0,1980-01-01,0.0,0.0,0.0,0.0,0.0,0.0,343952.0,Kevin Spadanuda,2024-09-02 05:43:13
12657,705090,7,43671457,76,Mirlind Kryeziu (FC Zürich) Substitution at 45',Mirlind Kryeziu Substitution,2,2700,45',3019,0,0,1980-01-01,0.0,0.0,0.0,0.0,0.0,0.0,260065.0,Mirlind Kryeziu,2024-09-02 05:43:13
12657,705090,8,43671458,76,Joseph Sabobo (FC Zürich) Substitution at 45',Joseph Sabobo Substitution,2,2700,45',3019,0,0,1980-01-01,0.0,0.0,0.0,0.0,0.0,0.0,379264.0,Joseph Sabobo,2024-09-02 05:43:13
12657,705090,9,43671525,76,Ifeanyi Mathew (FC Zürich) Substitution at 45',Ifeanyi Mathew Substitution,2,2700,45',3019,0,0,1980-01-01,0.0,0.0,0.0,0.0,0.0,0.0,219503.0,Ifeanyi Mathew,2024-09-02 05:43:13
12657,705090,10,43671526,76,Doron Leidner (FC Zürich) Substitution at 45',Doron Leidner Substitution,2,2700,45',3019,0,0,1980-01-01,0.0,0.0,0.0,0.0,0.0,0.0,326640.0,Doron Leidner,2024-09-02 05:43:13
12657,705090,6,43671428,76,Kevin Spadanuda (FC Luzern) Substitution at 45',Kevin Spadanuda Substitution,2,2700,45',7640,0,0,1980-01-01,0.0,0.0,0.0,0.0,0.0,0.0,320006.0,Donat Rrudhani,2024-09-02 05:43:13
12657,705090,7,43671457,76,Mirlind Kryeziu (FC Zürich) Substitution at 45',Mirlind Kryeziu Substitution,2,2700,45',3019,0,0,1980-01-01,0.0,0.0,0.0,0.0,0.0,0.0,390613.0,Daniel Denoon,2024-09-02 05:43:13
12657,705090,8,43671458,76,Joseph Sabobo (FC Zürich) Substitution at 45',Joseph Sabobo Substitution,2,2700,45',3019,0,0,1980-01-01,0.0,0.0,0.0,0.0,0.0,0.0,235722.0,Jonathan Okita,2024-09-02 05:43:13
12657,705090,9,43671525,76,Ifeanyi Mathew (FC Zürich) Substitution at 45',Ifeanyi Mathew Substitution,2,2700,45',3019,0,0,1980-01-01,0.0,0.0,0.0,0.0,0.0,0.0,357418.0,Calixte Ligue,2024-09-02 05:43:13
12657,705090,10,43671526,76,Doron Leidner (FC Zürich) Substitution at 45',Doron Leidner Substitution,2,2700,45',3019,0,0,1980-01-01,0.0,0.0,0.0,0.0,0.0,0.0,322056.0,Nemanja Tosic,2024-09-02 05:43:13
12657,705090,11,43671590,94,Joseph Sabobo (FC Zürich) Yellow Card at 52',Joseph Sabobo Yellow Card,2,3120,52',3019,0,0,1980-01-01,0.0,0.0,0.0,0.0,0.0,0.0,379264.0,Joseph Sabobo,2024-09-02 05:43:13
12657,705090,12,43671669,94,Doron Leidner (FC Zürich) Yellow Card at 55',Doron Leidner Yellow Card,2,3300,55',3019,0,0,1980-01-01,0.0,0.0,0.0,0.0,0.0,0.0,326640.0,Doron Leidner,2024-09-02 05:43:13
12657,705090,13,43671721,70,Juan Perea (FC Zürich) Goal at 56',Juan Perea Goal,2,3360,56',3019,0,0,1980-01-01,0.0,0.0,0.0,0.0,0.0,0.0,293915.0,Juan Perea,2024-09-02 05:43:13
12657,705090,14,43672037,76,Aleksandar Stankovic (FC Luzern) Substitution at 75',Aleksandar Stankovic Substitutio,2,4500,75',7640,0,0,1980-01-01,0.0,0.0,0.0,0.0,0.0,0.0,240109.0,Aleksandar Stankovic,2024-09-02 05:43:13
12657,705090,15,43672038,76,Armstrong Okoflex (FC Zürich) Substitution at 75',Armstrong Okoflex Substitution,2,4500,75',3019,0,0,1980-01-01,0.0,0.0,0.0,0.0,0.0,0.0,286180.0,Armstrong Okoflex,2024-09-02 05:43:13
12657,705090,16,43672039,76,Jakub Kadak (FC Luzern) Substitution at 75',Jakub Kadak Substitution,2,4500,75',7640,0,0,1980-01-01,0.0,0.0,0.0,0.0,0.0,0.0,274682.0,Jakub Kadak,2024-09-02 05:43:13
12657,705090,14,43672037,76,Aleksandar Stankovic (FC Luzern) Substitution at 75',Aleksandar Stankovic Substitutio,2,4500,75',7640,0,0,1980-01-01,0.0,0.0,0.0,0.0,0.0,0.0,272137.0,Thibault Klidje,2024-09-02 05:43:13
12657,705090,15,43672038,76,Armstrong Okoflex (FC Zürich) Substitution at 75',Armstrong Okoflex Substitution,2,4500,75',3019,0,0,1980-01-01,0.0,0.0,0.0,0.0,0.0,0.0,240368.0,Mounir Chouiar,2024-09-02 05:43:13
12657,705090,16,43672039,76,Jakub Kadak (FC Luzern) Substitution at 75',Jakub Kadak Substitution,2,4500,75',7640,0,0,1980-01-01,0.0,0.0,0.0,0.0,0.0,0.0,304259.0,Tyron Owusu,2024-09-02 05:43:13
12657,705090,17,43672433,94,Pascal Loretz (FC Luzern) Yellow Card at 95',Pascal Loretz Yellow Card,2,5400,90'+5',7640,0,0,1980-01-01,0.0,0.0,0.0,0.0,0.0,0.0,321208.0,Pascal Loretz,2024-09-02 05:43:13
12657,705091,1,43670438,70,Lukas Görtler (St. Gallen) Goal at 19',Lukas Görtler Goal,1,1140,19',557,0,0,1980-01-01,0.0,0.0,0.0,0.0,0.0,0.0,218836.0,Lukas Görtler,2024-09-02 05:43:13
12657,705091,2,43670683,94,Mattia Bottani (FC Lugano) Yellow Card at 34',Mattia Bottani Yellow Card,1,2040,34',7672,0,0,1980-01-01,0.0,0.0,0.0,0.0,0.0,0.0,162156.0,Mattia Bottani,2024-09-02 05:43:13
12657,705091,3,43670897,76,Uran Bislimi (FC Lugano) Substitution at 44',Uran Bislimi Substitution,1,2640,44',7672,0,0,1980-01-01,0.0,0.0,0.0,0.0,0.0,0.0,341382.0,Uran Bislimi,2024-09-02 05:43:13
12657,705091,3,43670897,76,Uran Bislimi (FC Lugano) Substitution at 44',Uran Bislimi Substitution,1,2640,44',7672,0,0,1980-01-01,0.0,0.0,0.0,0.0,0.0,0.0,308847.0,Ousmane Doumbia,2024-09-02 05:43:13
12657,705091,4,43670997,70,Kacper Przybylko (FC Lugano) Goal at 47',Kacper Przybylko Goal,1,2700,45'+2',7672,0,0,1980-01-01,0.0,0.0,0.0,0.0,0.0,0.0,167387.0,Kacper Przybylko,2024-09-02 05:43:13
12657,705091,5,43671592,94,Martim Marques (FC Lugano) Yellow Card at 53',Martim Marques Yellow Card,2,3180,53',7672,0,0,1980-01-01,0.0,0.0,0.0,0.0,0.0,0.0,364127.0,Martim Marques,2024-09-02 05:43:13
12657,705091,6,43671695,76,Kevin Csoboth (St. Gallen) Substitution at 56',Kevin Csoboth Substitution,2,3360,56',557,0,0,1980-01-01,0.0,0.0,0.0,0.0,0.0,0.0,328290.0,Kevin Csoboth,2024-09-02 05:43:13
12657,705091,7,43671697,76,Bastien Toma (St. Gallen) Substitution at 56',Bastien Toma Substitution,2,3360,56',557,0,0,1980-01-01,0.0,0.0,0.0,0.0,0.0,0.0,259901.0,Bastien Toma,2024-09-07 05:43:16
12657,705091,6,43671695,76,Kevin Csoboth (St. Gallen) Substitution at 56',Kevin Csoboth Substitution,2,3360,56',557,0,0,1980-01-01,0.0,0.0,0.0,0.0,0.0,0.0,320983.0,Christian Witzig,2024-09-02 05:43:13
12657,705091,7,43671697,76,Bastien Toma (St. Gallen) Substitution at 56',Bastien Toma Substitution,2,3360,56',557,0,0,1980-01-01,0.0,0.0,0.0,0.0,0.0,0.0,284245.0,Victor Ruiz,2024-09-07 05:43:16
12657,705091,8,43671696,76,Jovan Milosevic (St. Gallen) Substitution at 57',Jovan Milosevic Substitution,2,3420,57',557,0,0,1980-01-01,0.0,0.0,0.0,0.0,0.0,0.0,364204.0,Jovan Milosevic,2024-09-07 05:43:16
12657,705091,8,43671696,76,Jovan Milosevic (St. Gallen) Substitution at 57',Jovan Milosevic Substitution,2,3420,57',557,0,0,1980-01-01,0.0,0.0,0.0,0.0,0.0,0.0,218836.0,Lukas Görtler,2024-09-07 05:43:16
12657,705091,9,43671771,76,Ignacio Aliseda (FC Lugano) Substitution at 60',Ignacio Aliseda Substitution,2,3600,60',7672,0,0,1980-01-01,0.0,0.0,0.0,0.0,0.0,0.0,276055.0,Ignacio Aliseda,2024-09-02 05:43:13
12657,705091,10,43671772,76,Renato Steffen (FC Lugano) Substitution at 60',Renato Steffen Substitution,2,3600,60',7672,0,0,1980-01-01,0.0,0.0,0.0,0.0,0.0,0.0,193462.0,Renato Steffen,2024-09-02 05:43:13
12657,705091,9,43671771,76,Ignacio Aliseda (FC Lugano) Substitution at 60',Ignacio Aliseda Substitution,2,3600,60',7672,0,0,1980-01-01,0.0,0.0,0.0,0.0,0.0,0.0,319631.0,Daniel Correia,2024-09-02 05:43:13
12657,705091,10,43671772,76,Renato Steffen (FC Lugano) Substitution at 60',Renato Steffen Substitution,2,3600,60',7672,0,0,1980-01-01,0.0,0.0,0.0,0.0,0.0,0.0,162156.0,Mattia Bottani,2024-09-02 05:43:13
12657,705091,11,43671797,76,Chadrac Akolo (St. Gallen) Substitution at 63',Chadrac Akolo Substitution,2,3780,63',557,0,0,1980-01-01,0.0,0.0,0.0,0.0,0.0,0.0,217526.0,Chadrac Akolo,2024-09-02 05:43:13
12657,705091,11,43671797,76,Chadrac Akolo (St. Gallen) Substitution at 63',Chadrac Akolo Substitution,2,3780,63',557,0,0,1980-01-01,0.0,0.0,0.0,0.0,0.0,0.0,337127.0,Moustapha Cissé,2024-09-02 05:43:13
12657,705091,12,43671911,94,Abdoulaye Diaby (St. Gallen) Yellow Card at 71',Abdoulaye Diaby Yellow Card,2,4260,71',557,0,0,1980-01-01,0.0,0.0,0.0,0.0,0.0,0.0,266637.0,Abdoulaye Diaby,2024-09-02 05:43:13
12657,705091,13,43672034,76,Stephen Ambrosius (St. Gallen) Substitution at 77',Stephen Ambrosius Substitution,2,4620,77',557,0,0,1980-01-01,0.0,0.0,0.0,0.0,0.0,0.0,270860.0,Stephen Ambrosius,2024-09-07 05:43:16
12657,705091,13,43672034,76,Stephen Ambrosius (St. Gallen) Substitution at 77',Stephen Ambrosius Substitution,2,4620,77',557,0,0,1980-01-01,0.0,0.0,0.0,0.0,0.0,0.0,379820.0,Corsin Konietzke,2024-09-07 05:43:16
12657,705091,14,43672093,76,Shkelqim Vladi (FC Lugano) Substitution at 80',Shkelqim Vladi Substitution,2,4800,80',7672,0,0,1980-01-01,0.0,0.0,0.0,0.0,0.0,0.0,350782.0,Shkelqim Vladi,2024-09-02 05:43:13
12657,705091,15,43672094,76,Roman Macek (FC Lugano) Substitution at 80',Roman Macek Substitution,2,4800,80',7672,0,0,1980-01-01,0.0,0.0,0.0,0.0,0.0,0.0,223222.0,Roman Macek,2024-09-02 05:43:13
12657,705091,14,43672093,76,Shkelqim Vladi (FC Lugano) Substitution at 80',Shkelqim Vladi Substitution,2,4800,80',7672,0,0,1980-01-01,0.0,0.0,0.0,0.0,0.0,0.0,167387.0,Kacper Przybylko,2024-09-02 05:43:13
12657,705091,15,43672094,76,Roman Macek (FC Lugano) Substitution at 80',Roman Macek Substitution,2,4800,80',7672,0,0,1980-01-01,0.0,0.0,0.0,0.0,0.0,0.0,305659.0,Yanis Cimignani,2024-09-02 05:43:13
12657,705091,16,43672152,94,Uran Bislimi (FC Lugano) Yellow Card at 84',Uran Bislimi Yellow Card,2,5040,84',7672,0,0,1980-01-01,0.0,0.0,0.0,0.0,0.0,0.0,341382.0,Uran Bislimi,2024-09-02 05:43:13
12657,705091,17,43672153,94,Bastien Toma (St. Gallen) Yellow Card at 84',Bastien Toma Yellow Card,2,5040,84',557,0,0,1980-01-01,0.0,0.0,0.0,0.0,0.0,0.0,259901.0,Bastien Toma,2024-09-02 05:43:13
12657,705092,1,43808284,70,Albert Vallci (St. Gallen) Goal at 20',Albert Vallci Goal,1,1200,20',557,0,0,1980-01-01,0.0,0.0,0.0,0.0,0.0,0.0,274923.0,Albert Vallci,2024-09-23 05:36:01
12657,705092,2,43808476,70,Willem Geubbels (St. Gallen) Goal at 31',Willem Geubbels Goal,1,1860,31',557,0,0,1980-01-01,0.0,0.0,0.0,0.0,0.0,0.0,259744.0,Willem Geubbels,2024-09-23 05:36:01
12657,705092,3,43808640,94,Albert Vallci (St. Gallen) Yellow Card at 42',Albert Vallci Yellow Card,1,2520,42',557,0,0,1980-01-01,0.0,0.0,0.0,0.0,0.0,0.0,274923.0,Albert Vallci,2024-09-23 05:36:01
12657,705092,4,43808854,76,Stephen Ambrosius (St. Gallen) Substitution at 45',Stephen Ambrosius Substitution,2,2700,45',557,0,0,1980-01-01,0.0,0.0,0.0,0.0,0.0,0.0,270860.0,Stephen Ambrosius,2024-09-23 05:36:01
12657,705092,4,43808854,76,Stephen Ambrosius (St. Gallen) Substitution at 45',Stephen Ambrosius Substitution,2,2700,45',557,0,0,1980-01-01,0.0,0.0,0.0,0.0,0.0,0.0,274923.0,Albert Vallci,2024-09-23 05:36:01
