seasonType,eventId,playOrder,playId,typeId,text,shortText,period,clockValue,clockDisplayValue,teamId,scoringPlay,shootout,wallclock,goalPositionX,goalPositionY,fieldpositionX,fieldPositionY,fieldPosition2X,fieldPosition2Y,athleteId,participant,updateDateTime
12689,706119,11,43805221,94,Ilnur Alshin (Fakel Voronezh) Yellow Card at 61',Ilnur Alshin Yellow Card,2,3660,61',21539,0,0,1980-01-01,0.0,0.0,0.0,0.0,0.0,0.0,259005.0,Ilnur Alshin,2024-09-23 05:36:01
12689,706119,12,43805292,76,Ihor Kalinin (Fakel Voronezh) Substitution at 65',Ihor Kalinin Substitution,2,3900,65',21539,0,0,1980-01-01,0.0,0.0,0.0,0.0,0.0,0.0,223303.0,Ihor Kalinin,2024-09-23 05:36:01
12689,706119,13,43805293,76,Dylan Mertens (Fakel Voronezh) Substitution at 65',Dylan Mertens Substitution,2,3900,65',21539,0,0,1980-01-01,0.0,0.0,0.0,0.0,0.0,0.0,207421.0,Dylan Mertens,2024-09-23 05:36:01
12689,706119,12,43805292,76,Ihor Kalinin (Fakel Voronezh) Substitution at 65',Ihor Kalinin Substitution,2,3900,65',21539,0,0,1980-01-01,0.0,0.0,0.0,0.0,0.0,0.0,259005.0,Ilnur Alshin,2024-09-23 05:36:01
12689,706119,13,43805293,76,Dylan Mertens (Fakel Voronezh) Substitution at 65',Dylan Mertens Substitution,2,3900,65',21539,0,0,1980-01-01,0.0,0.0,0.0,0.0,0.0,0.0,342970.0,Mohamed Amine Brahimi,2024-09-23 05:36:01
12689,706119,14,43805328,70,Luciano Gondou (Zenit St Petersburg) Goal at 67',Luciano Gondou Goal,2,4020,67',2533,0,0,1980-01-01,0.0,0.0,0.0,0.0,0.0,0.0,312227.0,Luciano Gondou,2024-09-23 05:36:01
12689,706119,15,43805374,76,Aleksandr Erokhin (Zenit St Petersburg) Substitution at 68',Aleksandr Erokhin Substitution,2,4080,68',2533,0,0,1980-01-01,0.0,0.0,0.0,0.0,0.0,0.0,162263.0,Aleksandr Erokhin,2024-09-23 05:36:01
12689,706119,15,43805374,76,Aleksandr Erokhin (Zenit St Petersburg) Substitution at 68',Aleksandr Erokhin Substitution,2,4080,68',2533,0,0,1980-01-01,0.0,0.0,0.0,0.0,0.0,0.0,194048.0,Aleksandr Sobolev,2024-09-23 05:36:01
12689,706119,16,43805477,76,Thabo Cele (Fakel Voronezh) Substitution at 71',Thabo Cele Substitution,2,4260,71',21539,0,0,1980-01-01,0.0,0.0,0.0,0.0,0.0,0.0,256690.0,Thabo Cele,2024-09-23 05:36:01
12689,706119,16,43805477,76,Thabo Cele (Fakel Voronezh) Substitution at 71',Thabo Cele Substitution,2,4260,71',21539,0,0,1980-01-01,0.0,0.0,0.0,0.0,0.0,0.0,252775.0,Vladimir Iljin,2024-09-23 05:36:01
12689,706119,17,43805814,94,Gustavo Mantuan (Zenit St Petersburg) Yellow Card at 77',Gustavo Mantuan Yellow Card,2,4620,77',2533,0,0,1980-01-01,0.0,0.0,0.0,0.0,0.0,0.0,307716.0,Gustavo Mantuan,2024-09-23 05:36:01
12689,706119,17,43805815,76,Maksim Glushenkov (Zenit St Petersburg) Substitution at 78',Maksim Glushenkov Substitution,2,4680,78',2533,0,0,1980-01-01,0.0,0.0,0.0,0.0,0.0,0.0,286579.0,Maksim Glushenkov,2024-09-26 05:34:30
12689,706119,17,43805815,76,Maksim Glushenkov (Zenit St Petersburg) Substitution at 78',Maksim Glushenkov Substitution,2,4680,78',2533,0,0,1980-01-01,0.0,0.0,0.0,0.0,0.0,0.0,215934.0,Mateo Casierra,2024-09-26 05:34:30
12689,706119,18,43806091,94,Luciano Gondou (Zenit St Petersburg) Yellow Card at 83',Luciano Gondou Yellow Card,2,4980,83',2533,0,0,1980-01-01,0.0,0.0,0.0,0.0,0.0,0.0,312227.0,Luciano Gondou,2024-09-26 05:34:30
12689,706119,19,43806205,70,Aleksandr Erokhin (Zenit St Petersburg) Goal at 87',Aleksandr Erokhin Goal,2,5220,87',2533,0,0,1980-01-01,0.0,0.0,0.0,0.0,0.0,0.0,162263.0,Aleksandr Erokhin,2024-09-26 05:34:30
12689,706120,1,43801165,94,Aleksa Durasovic (Akron Tolyatti) Yellow Card at 22',Aleksa Durasovic Yellow Card,1,1320,22',22271,0,0,1980-01-01,0.0,0.0,0.0,0.0,0.0,0.0,338302.0,Aleksa Durasovic,2024-09-23 05:36:01
12689,706120,2,43801170,70,Jhon Córdoba (Krasnodar) Goal at 27',Jhon Córdoba Goal,1,1620,27',11336,0,0,1980-01-01,0.0,0.0,0.0,0.0,0.0,0.0,176058.0,Jhon Córdoba,2024-09-23 05:36:01
12689,706120,3,43801185,70,Eduard Spertsyan (Krasnodar) Goal at 29',Eduard Spertsyan Goal,1,1740,29',11336,0,0,1980-01-01,0.0,0.0,0.0,0.0,0.0,0.0,307806.0,Eduard Spertsyan,2024-09-23 05:36:01
12689,706120,4,43801264,94,Maksim Kuzmin (Akron Tolyatti) Yellow Card at 38',Maksim Kuzmin Yellow Card,1,2280,38',22271,0,0,1980-01-01,0.0,0.0,0.0,0.0,0.0,0.0,206846.0,Maksim Kuzmin,2024-09-23 05:36:01
12689,706120,5,43801301,94,Joao Victor (Krasnodar) Yellow Card at 42',Joao Victor Yellow Card,1,2520,42',11336,0,0,1980-01-01,0.0,0.0,0.0,0.0,0.0,0.0,259879.0,Joao Victor,2024-09-26 05:34:30
12689,706120,6,43801502,76,Vladimir Khubulov (Akron Tolyatti) Substitution at 45',Vladimir Khubulov Substitution,2,2700,45',22271,0,0,1980-01-01,0.0,0.0,0.0,0.0,0.0,0.0,345632.0,Vladimir Khubulov,2024-09-23 05:36:01
12689,706120,6,43801502,76,Vladimir Khubulov (Akron Tolyatti) Substitution at 45',Vladimir Khubulov Substitution,2,2700,45',22271,0,0,1980-01-01,0.0,0.0,0.0,0.0,0.0,0.0,264342.0,Soltmurad Bakaev,2024-09-23 05:36:01
12689,706120,7,43801583,70,Stefan Loncar (Akron Tolyatti) Goal at 54',Stefan Loncar Goal,2,3240,54',22271,0,0,1980-01-01,0.0,0.0,0.0,0.0,0.0,0.0,221140.0,Stefan Loncar,2024-09-23 05:36:01
12689,706120,8,43801654,70,Eduard Spertsyan (Krasnodar) Goal at 59',Eduard Spertsyan Goal,2,3540,59',11336,0,0,1980-01-01,0.0,0.0,0.0,0.0,0.0,0.0,307806.0,Eduard Spertsyan,2024-09-23 05:36:01
12689,706120,9,43801672,76,Maxim Palienko (Akron Tolyatti) Substitution at 62',Maxim Palienko Substitution,2,3720,62',22271,0,0,1980-01-01,0.0,0.0,0.0,0.0,0.0,0.0,172157.0,Maxim Palienko,2024-09-23 05:36:01
12689,706120,9,43801672,76,Maxim Palienko (Akron Tolyatti) Substitution at 62',Maxim Palienko Substitution,2,3720,62',22271,0,0,1980-01-01,0.0,0.0,0.0,0.0,0.0,0.0,206846.0,Maksim Kuzmin,2024-09-23 05:36:01
12689,706120,10,43802048,76,Benchimol (Akron Tolyatti) Substitution at 72',Benchimol Substitution,2,4320,72',22271,0,0,1980-01-01,0.0,0.0,0.0,0.0,0.0,0.0,310261.0,Benchimol,2024-09-26 05:34:30
12689,706120,10,43802048,76,Benchimol (Akron Tolyatti) Substitution at 72',Benchimol Substitution,2,4320,72',22271,0,0,1980-01-01,0.0,0.0,0.0,0.0,0.0,0.0,384713.0,Kirill Danilin,2024-09-26 05:34:30
12689,706120,11,43802067,70,Jhon Córdoba (Krasnodar) Goal at 76',Jhon Córdoba Goal,2,4560,76',11336,0,0,1980-01-01,0.0,0.0,0.0,0.0,0.0,0.0,176058.0,Jhon Córdoba,2024-09-23 05:36:01
12689,706120,12,43802096,76,Artur Galoyan (Akron Tolyatti) Substitution at 77',Artur Galoyan Substitution,2,4620,77',22271,0,0,1980-01-01,0.0,0.0,0.0,0.0,0.0,0.0,354902.0,Artur Galoyan,2024-09-23 05:36:01
12689,706120,12,43802096,76,Artur Galoyan (Akron Tolyatti) Substitution at 77',Artur Galoyan Substitution,2,4620,77',22271,0,0,1980-01-01,0.0,0.0,0.0,0.0,0.0,0.0,338302.0,Aleksa Durasovic,2024-09-23 05:36:01
12689,706120,13,43802117,76,Fedor Smolov (Krasnodar) Substitution at 78',Fedor Smolov Substitution,2,4680,78',11336,0,0,1980-01-01,0.0,0.0,0.0,0.0,0.0,0.0,150204.0,Fedor Smolov,2024-09-23 05:36:01
12689,706120,13,43802117,76,Fedor Smolov (Krasnodar) Substitution at 78',Fedor Smolov Substitution,2,4680,78',11336,0,0,1980-01-01,0.0,0.0,0.0,0.0,0.0,0.0,176058.0,Jhon Córdoba,2024-09-23 05:36:01
12689,706120,14,43802118,76,Moses Cobnan (Krasnodar) Substitution at 79',Moses Cobnan Substitution,2,4740,79',11336,0,0,1980-01-01,0.0,0.0,0.0,0.0,0.0,0.0,358191.0,Moses Cobnan,2024-09-23 05:36:01
12689,706120,14,43802118,76,Moses Cobnan (Krasnodar) Substitution at 79',Moses Cobnan Substitution,2,4740,79',11336,0,0,1980-01-01,0.0,0.0,0.0,0.0,0.0,0.0,340901.0,Batxi,2024-09-23 05:36:01
12689,706120,15,43802156,76,Kevin Castaño (Krasnodar) Substitution at 82',Kevin Castaño Substitution,2,4920,82',11336,0,0,1980-01-01,0.0,0.0,0.0,0.0,0.0,0.0,307756.0,Kevin Castaño,2024-09-23 05:36:01
12689,706120,15,43802156,76,Kevin Castaño (Krasnodar) Substitution at 82',Kevin Castaño Substitution,2,4920,82',11336,0,0,1980-01-01,0.0,0.0,0.0,0.0,0.0,0.0,259879.0,Joao Victor,2024-09-23 05:36:01
12689,706120,16,43802157,76,Danila Kozlov (Krasnodar) Substitution at 83',Danila Kozlov Substitution,2,4980,83',11336,0,0,1980-01-01,0.0,0.0,0.0,0.0,0.0,0.0,359735.0,Danila Kozlov,2024-09-23 05:36:01
12689,706120,17,43802158,76,Nikita Krivtsov (Krasnodar) Substitution at 83',Nikita Krivtsov Substitution,2,4980,83',11336,0,0,1980-01-01,0.0,0.0,0.0,0.0,0.0,0.0,325053.0,Nikita Krivtsov,2024-09-23 05:36:01
12689,706120,16,43802157,76,Danila Kozlov (Krasnodar) Substitution at 83',Danila Kozlov Substitution,2,4980,83',11336,0,0,1980-01-01,0.0,0.0,0.0,0.0,0.0,0.0,307806.0,Eduard Spertsyan,2024-09-23 05:36:01
12689,706120,17,43802158,76,Nikita Krivtsov (Krasnodar) Substitution at 83',Nikita Krivtsov Substitution,2,4980,83',11336,0,0,1980-01-01,0.0,0.0,0.0,0.0,0.0,0.0,276232.0,Aleksandr Chernikov,2024-09-23 05:36:01
12689,706120,18,43802199,70,Vladimir Khubulov (Akron Tolyatti) Goal at 86',Vladimir Khubulov Goal,2,5160,86',22271,0,0,1980-01-01,0.0,0.0,0.0,0.0,0.0,0.0,345632.0,Vladimir Khubulov,2024-09-23 05:36:01
12689,706120,19,43802230,70,Nikita Krivtsov (Krasnodar) Goal at 88',Nikita Krivtsov Goal,2,5280,88',11336,0,0,1980-01-01,0.0,0.0,0.0,0.0,0.0,0.0,325053.0,Nikita Krivtsov,2024-09-23 05:36:01
12689,706121,1,43830943,94,Felippe Cardoso (Akhmat Grozny) Yellow Card at 28',Felippe Cardoso Yellow Card,1,1680,28',2991,0,0,1980-01-01,0.0,0.0,0.0,0.0,0.0,0.0,269498.0,Felippe Cardoso,2024-09-24 05:41:18
12689,706121,2,43830945,94,Camilo (Akhmat Grozny) Yellow Card at 29',Camilo Yellow Card,1,1740,29',2991,0,0,1980-01-01,0.0,0.0,0.0,0.0,0.0,0.0,285089.0,Camilo,2024-09-25 05:39:11
12689,706121,3,43830967,76,Svetoslav Kovachev (Akhmat Grozny) Substitution at 45',Svetoslav Kovachev Substitution,2,2700,45',2991,0,0,1980-01-01,0.0,0.0,0.0,0.0,0.0,0.0,239427.0,Svetoslav Kovachev,2024-09-24 05:41:18
12689,706121,3,43830967,76,Svetoslav Kovachev (Akhmat Grozny) Substitution at 45',Svetoslav Kovachev Substitution,2,2700,45',2991,0,0,1980-01-01,0.0,0.0,0.0,0.0,0.0,0.0,260270.0,Amine Talal,2024-09-24 05:41:18
12689,706121,4,43830968,94,Roman Ezhov (Krylia Sovetov) Yellow Card at 49',Roman Ezhov Yellow Card,2,2940,49',3850,0,0,1980-01-01,0.0,0.0,0.0,0.0,0.0,0.0,320366.0,Roman Ezhov,2024-09-24 05:41:18
12689,706121,5,43830978,94,Ivan Oleynikov (Krylia Sovetov) Yellow Card at 60',Ivan Oleynikov Yellow Card,2,3600,60',3850,0,0,1980-01-01,0.0,0.0,0.0,0.0,0.0,0.0,266071.0,Ivan Oleynikov,2024-09-24 05:41:18
12689,706121,6,43830987,97,Roman Evgeniev (Krylia Sovetov) Own Goal at 68',Roman Evgeniev Own Goal,2,4080,68',2991,0,0,1980-01-01,0.0,0.0,0.0,0.0,0.0,0.0,,Roman Evgeniev,2024-10-14 07:04:32
12689,706121,7,43830989,76,Igor Dmitriev (Krylia Sovetov) Substitution at 69',Igor Dmitriev Substitution,2,4140,69',3850,0,0,1980-01-01,0.0,0.0,0.0,0.0,0.0,0.0,365013.0,Igor Dmitriev,2024-09-24 05:41:18
12689,706121,7,43830989,76,Igor Dmitriev (Krylia Sovetov) Substitution at 69',Igor Dmitriev Substitution,2,4140,69',3850,0,0,1980-01-01,0.0,0.0,0.0,0.0,0.0,0.0,297054.0,Franco Orozco,2024-09-24 05:41:18
12689,706121,8,43830997,76,Vladislav Shitov (Krylia Sovetov) Substitution at 70',Vladislav Shitov Substitution,2,4200,70',3850,0,0,1980-01-01,0.0,0.0,0.0,0.0,0.0,0.0,331068.0,Vladislav Shitov,2024-09-24 05:41:18
12689,706121,9,43830998,76,Sergey Babkin (Krylia Sovetov) Substitution at 70',Sergey Babkin Substitution,2,4200,70',3850,0,0,1980-01-01,0.0,0.0,0.0,0.0,0.0,0.0,323208.0,Sergey Babkin,2024-09-24 05:41:18
12689,706121,8,43830997,76,Vladislav Shitov (Krylia Sovetov) Substitution at 70',Vladislav Shitov Substitution,2,4200,70',3850,0,0,1980-01-01,0.0,0.0,0.0,0.0,0.0,0.0,266071.0,Ivan Oleynikov,2024-09-24 05:41:18
12689,706121,9,43830998,76,Sergey Babkin (Krylia Sovetov) Substitution at 70',Sergey Babkin Substitution,2,4200,70',3850,0,0,1980-01-01,0.0,0.0,0.0,0.0,0.0,0.0,252594.0,Víctor Méndez,2024-09-24 05:41:18
12689,706121,10,43831006,76,Zaim Divanovic (Akhmat Grozny) Substitution at 81',Zaim Divanovic Substitution,2,4860,81',2991,0,0,1980-01-01,0.0,0.0,0.0,0.0,0.0,0.0,289579.0,Zaim Divanovic,2024-09-24 05:41:18
12689,706121,10,43831006,76,Zaim Divanovic (Akhmat Grozny) Substitution at 81',Zaim Divanovic Substitution,2,4860,81',2991,0,0,1980-01-01,0.0,0.0,0.0,0.0,0.0,0.0,316610.0,Maksim Samorodov,2024-09-24 05:41:18
12689,706121,11,43831011,76,Vladislav Kamilov (Akhmat Grozny) Substitution at 85',Vladislav Kamilov Substitution,2,5100,85',2991,0,0,1980-01-01,0.0,0.0,0.0,0.0,0.0,0.0,308101.0,Vladislav Kamilov,2024-09-24 05:41:18
12689,706121,11,43831011,76,Vladislav Kamilov (Akhmat Grozny) Substitution at 85',Vladislav Kamilov Substitution,2,5100,85',2991,0,0,1980-01-01,0.0,0.0,0.0,0.0,0.0,0.0,252199.0,Mauro Luna Diale,2024-09-24 05:41:18
12689,706121,12,43831013,76,Dmitri Tsypchenko (Krylia Sovetov) Substitution at 86',Dmitri Tsypchenko Substitution,2,5160,86',3850,0,0,1980-01-01,0.0,0.0,0.0,0.0,0.0,0.0,320363.0,Dmitri Tsypchenko,2024-09-24 05:41:18
12689,706121,12,43831013,76,Dmitri Tsypchenko (Krylia Sovetov) Substitution at 86',Dmitri Tsypchenko Substitution,2,5160,86',3850,0,0,1980-01-01,0.0,0.0,0.0,0.0,0.0,0.0,320366.0,Roman Ezhov,2024-09-24 05:41:18
12689,706121,13,43831014,94,Alois Oroz (Krylia Sovetov) Yellow Card at 87',Alois Oroz Yellow Card,2,5220,87',3850,0,0,1980-01-01,0.0,0.0,0.0,0.0,0.0,0.0,289923.0,Alois Oroz,2024-09-24 05:41:18
12689,706121,14,43831022,76,Kirill Pechenin (Krylia Sovetov) Substitution at 93',Kirill Pechenin Substitution,2,5400,90'+3',3850,0,0,1980-01-01,0.0,0.0,0.0,0.0,0.0,0.0,288910.0,Kirill Pechenin,2024-09-24 05:41:18
12689,706121,15,43831023,76,Nader Ghandri (Akhmat Grozny) Substitution at 93',Nader Ghandri Substitution,2,5400,90'+3',2991,0,0,1980-01-01,0.0,0.0,0.0,0.0,0.0,0.0,191104.0,Nader Ghandri,2024-09-24 05:41:18
12689,706121,16,43831024,94,Darko Todorovic (Akhmat Grozny) Yellow Card at 95',Darko Todorovic Yellow Card,2,5400,90'+5',2991,0,0,1980-01-01,0.0,0.0,0.0,0.0,0.0,0.0,237586.0,Darko Todorovic,2024-09-24 05:41:18
12689,706121,17,43831025,70,Alois Oroz (Krylia Sovetov) Goal at 96',Alois Oroz Goal,2,5400,90'+6',3850,0,0,1980-01-01,0.0,0.0,0.0,0.0,0.0,0.0,289923.0,Alois Oroz,2024-09-24 05:41:18
12689,706121,18,43831026,94,Thomas Galdámes (Krylia Sovetov) Yellow Card at 96',Thomas Galdámes Yellow Card,2,5400,90'+6',3850,0,0,1980-01-01,0.0,0.0,0.0,0.0,0.0,0.0,245881.0,Thomas Galdámes,2024-09-25 05:39:11
12689,706121,14,43831022,76,Kirill Pechenin (Krylia Sovetov) Substitution at 93',Kirill Pechenin Substitution,2,5400,90'+3',3850,0,0,1980-01-01,0.0,0.0,0.0,0.0,0.0,0.0,245881.0,Thomas Galdámes,2024-09-24 05:41:18
12689,706121,15,43831023,76,Nader Ghandri (Akhmat Grozny) Substitution at 93',Nader Ghandri Substitution,2,5400,90'+3',2991,0,0,1980-01-01,0.0,0.0,0.0,0.0,0.0,0.0,269498.0,Felippe Cardoso,2024-09-24 05:41:18
12689,706122,1,43822722,70,Dmitry Vorobyev (Lokomotiv Moscow) Goal at 20',Dmitry Vorobyev Goal,1,1200,20',442,0,0,1980-01-01,0.0,0.0,0.0,0.0,0.0,0.0,241161.0,Dmitry Vorobyev,2024-09-23 05:36:01
12689,706122,2,43822834,70,Boselli (Nizhny Novgorod) Goal at 26',Boselli Goal,1,1560,26',13150,0,0,1980-01-01,0.0,0.0,0.0,0.0,0.0,0.0,224196.0,Boselli,2024-09-26 05:34:30
12689,706122,3,43823077,94,Nikita Kakkoev (Nizhny Novgorod) Yellow Card at 38',Nikita Kakkoev Yellow Card,1,2280,38',13150,0,0,1980-01-01,0.0,0.0,0.0,0.0,0.0,0.0,272366.0,Nikita Kakkoev,2024-09-23 05:36:01
12689,706122,4,43823162,94,Dmitry Vorobyev (Lokomotiv Moscow) Yellow Card at 43',Dmitry Vorobyev Yellow Card,1,2580,43',442,0,0,1980-01-01,0.0,0.0,0.0,0.0,0.0,0.0,241161.0,Dmitry Vorobyev,2024-09-23 05:36:01
12689,706122,5,43823456,76,Edgar Sevikyan (Lokomotiv Moscow) Substitution at 45',Edgar Sevikyan Substitution,2,2700,45',442,0,0,1980-01-01,0.0,0.0,0.0,0.0,0.0,0.0,311104.0,Edgar Sevikyan,2024-09-23 05:36:01
12689,706122,5,43823456,76,Edgar Sevikyan (Lokomotiv Moscow) Substitution at 45',Edgar Sevikyan Substitution,2,2700,45',442,0,0,1980-01-01,0.0,0.0,0.0,0.0,0.0,0.0,302062.0,Maksim Nenakhov,2024-09-23 05:36:01
12689,706122,6,43823615,94,Edgar Sevikyan (Lokomotiv Moscow) Yellow Card at 54',Edgar Sevikyan Yellow Card,2,3240,54',442,0,0,1980-01-01,0.0,0.0,0.0,0.0,0.0,0.0,311104.0,Edgar Sevikyan,2024-09-23 05:36:01
12689,706122,7,43823677,76,Timur Suleymanov (Lokomotiv Moscow) Substitution at 57',Timur Suleymanov Substitution,2,3420,57',442,0,0,1980-01-01,0.0,0.0,0.0,0.0,0.0,0.0,291934.0,Timur Suleymanov,2024-09-26 05:34:30
12689,706122,7,43823677,76,Timur Suleymanov (Lokomotiv Moscow) Substitution at 57',Timur Suleymanov Substitution,2,3420,57',442,0,0,1980-01-01,0.0,0.0,0.0,0.0,0.0,0.0,241161.0,Dmitry Vorobyev,2024-09-26 05:34:30
12689,706122,8,43823678,76,Nayair Tiknizyan (Lokomotiv Moscow) Substitution at 58',Nayair Tiknizyan Substitution,2,3480,58',442,0,0,1980-01-01,0.0,0.0,0.0,0.0,0.0,0.0,266070.0,Nayair Tiknizyan,2024-09-23 05:36:01
12689,706122,8,43823678,76,Nayair Tiknizyan (Lokomotiv Moscow) Substitution at 58',Nayair Tiknizyan Substitution,2,3480,58',442,0,0,1980-01-01,0.0,0.0,0.0,0.0,0.0,0.0,324100.0,Sergei Pinyaev,2024-09-23 05:36:01
12689,706122,9,43823697,76,Nikita Ermakov (Nizhny Novgorod) Substitution at 60',Nikita Ermakov Substitution,2,3600,60',13150,0,0,1980-01-01,0.0,0.0,0.0,0.0,0.0,0.0,345623.0,Nikita Ermakov,2024-09-23 05:36:01
12689,706122,9,43823697,76,Nikita Ermakov (Nizhny Novgorod) Substitution at 60',Nikita Ermakov Substitution,2,3600,60',13150,0,0,1980-01-01,0.0,0.0,0.0,0.0,0.0,0.0,233561.0,Zé Turbo,2024-09-23 05:36:01
12689,706122,10,43823763,94,Boselli (Nizhny Novgorod) Yellow Card at 63',Boselli Yellow Card,2,3780,63',13150,0,0,1980-01-01,0.0,0.0,0.0,0.0,0.0,0.0,224196.0,Boselli,2024-09-26 05:34:30
12689,706122,11,43823777,70,Alexey Batrakov (Lokomotiv Moscow) Goal at 65',Alexey Batrakov Goal,2,3900,65',442,0,0,1980-01-01,0.0,0.0,0.0,0.0,0.0,0.0,355113.0,Alexey Batrakov,2024-09-23 05:36:01
12689,706122,12,43823831,76,Vladislav Sarveli (Lokomotiv Moscow) Substitution at 66',Vladislav Sarveli Substitution,2,3960,66',442,0,0,1980-01-01,0.0,0.0,0.0,0.0,0.0,0.0,320364.0,Vladislav Sarveli,2024-09-23 05:36:01
12689,706122,12,43823831,76,Vladislav Sarveli (Lokomotiv Moscow) Substitution at 66',Vladislav Sarveli Substitution,2,3960,66',442,0,0,1980-01-01,0.0,0.0,0.0,0.0,0.0,0.0,337895.0,Artem Karpukas,2024-09-23 05:36:01
12689,706122,13,43823895,76,Alexander Troshechkin (Nizhny Novgorod) Substitution at 71',Alexander Troshechkin Substituti,2,4260,71',13150,0,0,1980-01-01,0.0,0.0,0.0,0.0,0.0,0.0,205664.0,Alexander Troshechkin,2024-09-23 05:36:01
12689,706122,14,43823896,76,Valeri Tsarukyan (Nizhny Novgorod) Substitution at 71',Valeri Tsarukyan Substitution,2,4260,71',13150,0,0,1980-01-01,0.0,0.0,0.0,0.0,0.0,0.0,364704.0,Valeri Tsarukyan,2024-09-23 05:36:01
12689,706122,13,43823895,76,Alexander Troshechkin (Nizhny Novgorod) Substitution at 71',Alexander Troshechkin Substituti,2,4260,71',13150,0,0,1980-01-01,0.0,0.0,0.0,0.0,0.0,0.0,367464.0,Anton Mukhin,2024-09-23 05:36:01
12689,706122,14,43823896,76,Valeri Tsarukyan (Nizhny Novgorod) Substitution at 71',Valeri Tsarukyan Substitution,2,4260,71',13150,0,0,1980-01-01,0.0,0.0,0.0,0.0,0.0,0.0,224196.0,Boselli,2024-09-23 05:36:01
12689,706122,15,43823944,70,Alexey Batrakov (Lokomotiv Moscow) Goal at 73',Alexey Batrakov Goal,2,4380,73',442,0,0,1980-01-01,0.0,0.0,0.0,0.0,0.0,0.0,355113.0,Alexey Batrakov,2024-09-23 05:36:01
12689,706122,16,43824035,76,Maksim Shnaptsev (Nizhny Novgorod) Substitution at 78',Maksim Shnaptsev Substitution,2,4680,78',13150,0,0,1980-01-01,0.0,0.0,0.0,0.0,0.0,0.0,365947.0,Maksim Shnaptsev,2024-09-23 05:36:01
12689,706122,17,43824036,76,Dan Glazer (Nizhny Novgorod) Substitution at 78',Dan Glazer Substitution,2,4680,78',13150,0,0,1980-01-01,0.0,0.0,0.0,0.0,0.0,0.0,225494.0,Dan Glazer,2024-09-23 05:36:01
12689,706122,16,43824035,76,Maksim Shnaptsev (Nizhny Novgorod) Substitution at 78',Maksim Shnaptsev Substitution,2,4680,78',13150,0,0,1980-01-01,0.0,0.0,0.0,0.0,0.0,0.0,326763.0,Luka Ticic,2024-09-23 05:36:01
12689,706122,17,43824036,76,Dan Glazer (Nizhny Novgorod) Substitution at 78',Dan Glazer Substitution,2,4680,78',13150,0,0,1980-01-01,0.0,0.0,0.0,0.0,0.0,0.0,256809.0,Nikolay Kalinskiy,2024-09-23 05:36:01
12689,706122,18,43824092,94,Aleksandr Silyanov (Lokomotiv Moscow) Yellow Card at 81',Aleksandr Silyanov Yellow Card,2,4860,81',442,0,0,1980-01-01,0.0,0.0,0.0,0.0,0.0,0.0,304368.0,Aleksandr Silyanov,2024-09-23 05:36:01
12689,706122,19,43824154,76,Artem Timofeev (Lokomotiv Moscow) Substitution at 83',Artem Timofeev Substitution,2,4980,83',442,0,0,1980-01-01,0.0,0.0,0.0,0.0,0.0,0.0,189042.0,Artem Timofeev,2024-09-23 05:36:01
12689,706122,19,43824154,76,Artem Timofeev (Lokomotiv Moscow) Substitution at 83',Artem Timofeev Substitution,2,4980,83',442,0,0,1980-01-01,0.0,0.0,0.0,0.0,0.0,0.0,355113.0,Alexey Batrakov,2024-09-23 05:36:01
12689,706123,1,43819104,93,Cedric Gogoua (FC Khimki) Red Card at 24',Cedric Gogoua Red Card,1,1440,24',7424,0,0,1980-01-01,0.0,0.0,0.0,0.0,0.0,0.0,221029.0,Cedric Gogoua,2024-09-23 05:36:01
12689,706123,2,43819152,76,Nemanja Andjelkovic (FC Khimki) Substitution at 30',Nemanja Andjelkovic Substitution,1,1800,30',7424,0,0,1980-01-01,0.0,0.0,0.0,0.0,0.0,0.0,342822.0,Nemanja Andjelkovic,2024-09-23 05:36:01
12689,706123,2,43819152,76,Nemanja Andjelkovic (FC Khimki) Substitution at 30',Nemanja Andjelkovic Substitution,1,1800,30',7424,0,0,1980-01-01,0.0,0.0,0.0,0.0,0.0,0.0,227225.0,Zelimkhan Bakaev,2024-09-23 05:36:01
12689,706123,3,43819209,94,Reziuan Mirzov (FC Khimki) Yellow Card at 40',Reziuan Mirzov Yellow Card,1,2400,40',7424,0,0,1980-01-01,0.0,0.0,0.0,0.0,0.0,0.0,169035.0,Reziuan Mirzov,2024-09-23 05:36:01
12689,706123,4,43819372,76,Aleksandr Rudenko (FC Khimki) Substitution at 45',Aleksandr Rudenko Substitution,2,2700,45',7424,0,0,1980-01-01,0.0,0.0,0.0,0.0,0.0,0.0,240505.0,Aleksandr Rudenko,2024-09-23 05:36:01
12689,706123,4,43819372,76,Aleksandr Rudenko (FC Khimki) Substitution at 45',Aleksandr Rudenko Substitution,2,2700,45',7424,0,0,1980-01-01,0.0,0.0,0.0,0.0,0.0,0.0,169035.0,Reziuan Mirzov,2024-09-23 05:36:01
12689,706123,5,43819528,76,Jordhy Thompson (Gazovik Orenburg) Substitution at 64',Jordhy Thompson Substitution,2,3840,64',18285,0,0,1980-01-01,0.0,0.0,0.0,0.0,0.0,0.0,318600.0,Jordhy Thompson,2024-09-23 05:36:01
12689,706123,5,43819528,76,Jordhy Thompson (Gazovik Orenburg) Substitution at 64',Jordhy Thompson Substitution,2,3840,64',18285,0,0,1980-01-01,0.0,0.0,0.0,0.0,0.0,0.0,225239.0,Jimmy Marín,2024-09-23 05:36:01
12689,706123,6,43819685,76,Emircan Gürlük (Gazovik Orenburg) Substitution at 78',Emircan Gürlük Substitution,2,4680,78',18285,0,0,1980-01-01,0.0,0.0,0.0,0.0,0.0,0.0,364422.0,Emircan Gürlük,2024-09-23 05:36:01
12689,706123,6,43819685,76,Emircan Gürlük (Gazovik Orenburg) Substitution at 78',Emircan Gürlük Substitution,2,4680,78',18285,0,0,1980-01-01,0.0,0.0,0.0,0.0,0.0,0.0,376712.0,Saeid Saharkhizan,2024-09-23 05:36:01
12689,706123,7,43819707,76,Kirill Kaplenko (FC Khimki) Substitution at 81',Kirill Kaplenko Substitution,2,4860,81',7424,0,0,1980-01-01,0.0,0.0,0.0,0.0,0.0,0.0,262890.0,Kirill Kaplenko,2024-09-23 05:36:01
12689,706123,7,43819707,76,Kirill Kaplenko (FC Khimki) Substitution at 81',Kirill Kaplenko Substitution,2,4860,81',7424,0,0,1980-01-01,0.0,0.0,0.0,0.0,0.0,0.0,261615.0,Àlex Corredera,2024-09-23 05:36:01
12689,706123,8,43819708,94,Danila Prokhin (Gazovik Orenburg) Yellow Card at 82',Danila Prokhin Yellow Card,2,4920,82',18285,0,0,1980-01-01,0.0,0.0,0.0,0.0,0.0,0.0,289431.0,Danila Prokhin,2024-09-23 05:36:01
12689,706123,9,43819767,76,Tomás Muro (Gazovik Orenburg) Substitution at 86',Tomás Muro Substitution,2,5160,86',18285,0,0,1980-01-01,0.0,0.0,0.0,0.0,0.0,0.0,309441.0,Tomás Muro,2024-09-27 05:38:41
12689,706123,10,43819769,76,Dmitri Rybchinsky (Gazovik Orenburg) Substitution at 86',Dmitri Rybchinsky Substitution,2,5160,86',18285,0,0,1980-01-01,0.0,0.0,0.0,0.0,0.0,0.0,286536.0,Dmitri Rybchinsky,2024-09-27 05:38:41
12689,706123,9,43819767,76,Tomás Muro (Gazovik Orenburg) Substitution at 86',Tomás Muro Substitution,2,5160,86',18285,0,0,1980-01-01,0.0,0.0,0.0,0.0,0.0,0.0,306256.0,Ivan Basic,2024-09-27 05:38:41
12689,706123,10,43819769,76,Dmitri Rybchinsky (Gazovik Orenburg) Substitution at 86',Dmitri Rybchinsky Substitution,2,5160,86',18285,0,0,1980-01-01,0.0,0.0,0.0,0.0,0.0,0.0,336782.0,Aleksandr Kovalenko,2024-09-27 05:38:41
12689,706123,11,43819768,94,Sergei Terekhov (FC Khimki) Yellow Card at 87',Sergei Terekhov Yellow Card,2,5220,87',7424,0,0,1980-01-01,0.0,0.0,0.0,0.0,0.0,0.0,236432.0,Sergei Terekhov,2024-09-27 05:38:41
12689,706123,12,43819791,76,Kirill Panchenko (FC Khimki) Substitution at 89',Kirill Panchenko Substitution,2,5340,89',7424,0,0,1980-01-01,0.0,0.0,0.0,0.0,0.0,0.0,175894.0,Kirill Panchenko,2024-09-23 05:36:01
12689,706123,12,43819791,76,Kirill Panchenko (FC Khimki) Substitution at 89',Kirill Panchenko Substitution,2,5340,89',7424,0,0,1980-01-01,0.0,0.0,0.0,0.0,0.0,0.0,195667.0,Lucas Vera,2024-09-23 05:36:01
12689,706123,13,43819812,94,Brian Mansilla (Gazovik Orenburg) Yellow Card at 93',Brian Mansilla Yellow Card,2,5400,90'+3',18285,0,0,1980-01-01,0.0,0.0,0.0,0.0,0.0,0.0,217150.0,Brian Mansilla,2024-09-23 05:36:01
12689,706123,14,43822592,94,Ilya Sagygov (FC Khimki) Yellow Card at 96',Ilya Sagygov Yellow Card,2,5400,90'+6',7424,0,0,1980-01-01,0.0,0.0,0.0,0.0,0.0,0.0,322896.0,Ilya Sagygov,2024-09-23 05:36:01
12689,706124,1,43820251,94,Zalimkhan Yusupov (Dynamo Makhachkala) Yellow Card at 1',Zalimkhan Yusupov Yellow Card,1,60,1',22300,0,0,1980-01-01,0.0,0.0,0.0,0.0,0.0,0.0,385999.0,Zalimkhan Yusupov,2024-09-23 05:36:01
12689,706124,2,43821152,76,German Ignatov (Rostov) Substitution at 45',German Ignatov Substitution,2,2700,45',3852,0,0,1980-01-01,0.0,0.0,0.0,0.0,0.0,0.0,366080.0,German Ignatov,2024-09-23 05:36:01
12689,706124,2,43821152,76,German Ignatov (Rostov) Substitution at 45',German Ignatov Substitution,2,2700,45',3852,0,0,1980-01-01,0.0,0.0,0.0,0.0,0.0,0.0,322649.0,Ilya Vakhanla,2024-09-23 05:36:01
12689,706124,3,43821454,76,Khoren Bayramyan (Rostov) Substitution at 63',Khoren Bayramyan Substitution,2,3780,63',3852,0,0,1980-01-01,0.0,0.0,0.0,0.0,0.0,0.0,220727.0,Khoren Bayramyan,2024-09-23 05:36:01
