seasonType,eventId,playOrder,playId,typeId,text,shortText,period,clockValue,clockDisplayValue,teamId,scoringPlay,shootout,wallclock,goalPositionX,goalPositionY,fieldpositionX,fieldPositionY,fieldPosition2X,fieldPosition2Y,athleteId,participant,updateDateTime
12657,705040,1,43932368,94,Randy Schneider (Winterthur) Yellow Card at 22',Randy Schneider Yellow Card,1,1320,22',20996,0,0,1980-01-01,0.0,0.0,0.0,0.0,0.0,0.0,320854.0,Randy Schneider,2024-10-07 05:34:46
12657,705040,2,43933381,76,Tomás Verón Lupi (Grasshoppers) Substitution at 72',Tomás Verón Lupi Substitution,2,4320,72',492,0,0,1980-01-01,0.0,0.0,0.0,0.0,0.0,0.0,278517.0,Tomás Verón Lupi,2024-10-07 05:34:46
12657,705040,3,43933382,76,Nishan Burkart (Winterthur) Substitution at 72',Nishan Burkart Substitution,2,4320,72',20996,0,0,1980-01-01,0.0,0.0,0.0,0.0,0.0,0.0,312894.0,Nishan Burkart,2024-10-07 05:34:46
12657,705040,4,43933383,76,Adrian Durrer (Winterthur) Substitution at 72',Adrian Durrer Substitution,2,4320,72',20996,0,0,1980-01-01,0.0,0.0,0.0,0.0,0.0,0.0,314373.0,Adrian Durrer,2024-10-07 05:34:46
12657,705040,2,43933381,76,Tomás Verón Lupi (Grasshoppers) Substitution at 72',Tomás Verón Lupi Substitution,2,4320,72',492,0,0,1980-01-01,0.0,0.0,0.0,0.0,0.0,0.0,274296.0,Mathieu Choinière,2024-10-07 05:34:46
12657,705040,3,43933382,76,Nishan Burkart (Winterthur) Substitution at 72',Nishan Burkart Substitution,2,4320,72',20996,0,0,1980-01-01,0.0,0.0,0.0,0.0,0.0,0.0,307245.0,Josias Lukembila,2024-10-07 05:34:46
12657,705040,4,43933383,76,Adrian Durrer (Winterthur) Substitution at 72',Adrian Durrer Substitution,2,4320,72',20996,0,0,1980-01-01,0.0,0.0,0.0,0.0,0.0,0.0,320854.0,Randy Schneider,2024-10-07 05:34:46
12657,705040,5,43933545,76,Antoine Baroan (Winterthur) Substitution at 81',Antoine Baroan Substitution,2,4860,81',20996,0,0,1980-01-01,0.0,0.0,0.0,0.0,0.0,0.0,278645.0,Antoine Baroan,2024-10-07 05:34:46
12657,705040,6,43933546,76,Adama Bojang (Grasshoppers) Substitution at 81',Adama Bojang Substitution,2,4860,81',492,0,0,1980-01-01,0.0,0.0,0.0,0.0,0.0,0.0,362290.0,Adama Bojang,2024-10-07 05:34:46
12657,705040,7,43933547,76,Nikolas Muci (Grasshoppers) Substitution at 81',Nikolas Muci Substitution,2,4860,81',492,0,0,1980-01-01,0.0,0.0,0.0,0.0,0.0,0.0,317872.0,Nikolas Muci,2024-10-07 05:34:46
12657,705040,5,43933545,76,Antoine Baroan (Winterthur) Substitution at 81',Antoine Baroan Substitution,2,4860,81',20996,0,0,1980-01-01,0.0,0.0,0.0,0.0,0.0,0.0,346733.0,Labinot Bajrami,2024-10-07 05:34:46
12657,705040,6,43933546,76,Adama Bojang (Grasshoppers) Substitution at 81',Adama Bojang Substitution,2,4860,81',492,0,0,1980-01-01,0.0,0.0,0.0,0.0,0.0,0.0,362197.0,Lee Young-Jun,2024-10-07 05:34:46
12657,705040,7,43933547,76,Nikolas Muci (Grasshoppers) Substitution at 81',Nikolas Muci Substitution,2,4860,81',492,0,0,1980-01-01,0.0,0.0,0.0,0.0,0.0,0.0,149565.0,Sonny Kittel,2024-10-07 05:34:46
12657,705040,8,43933632,70,Antoine Baroan (Winterthur) Goal at 87',Antoine Baroan Goal,2,5220,87',20996,0,0,1980-01-01,0.0,0.0,0.0,0.0,0.0,0.0,278645.0,Antoine Baroan,2024-10-07 05:34:46
12657,705040,9,43933703,94,Antoine Baroan (Winterthur) Yellow Card at 88',Antoine Baroan Yellow Card,2,5280,88',20996,0,0,1980-01-01,0.0,0.0,0.0,0.0,0.0,0.0,278645.0,Antoine Baroan,2024-10-07 05:34:46
12657,705040,10,43933704,76,Pascal Schürpf (Grasshoppers) Substitution at 89',Pascal Schürpf Substitution,2,5340,89',492,0,0,1980-01-01,0.0,0.0,0.0,0.0,0.0,0.0,126518.0,Pascal Schürpf,2024-10-07 05:34:46
12657,705040,10,43933704,76,Pascal Schürpf (Grasshoppers) Substitution at 89',Pascal Schürpf Substitution,2,5340,89',492,0,0,1980-01-01,0.0,0.0,0.0,0.0,0.0,0.0,258270.0,Ayumu Seko,2024-10-07 05:34:46
12657,705040,11,43933772,94,Kristers Tobers (Grasshoppers) Yellow Card at 90',Kristers Tobers Yellow Card,2,5400,90',492,0,0,1980-01-01,0.0,0.0,0.0,0.0,0.0,0.0,274560.0,Kristers Tobers,2024-10-07 05:34:46
12657,705040,12,43933813,76,Musa Araz (Winterthur) Substitution at 93',Musa Araz Substitution,2,5400,90'+3',20996,0,0,1980-01-01,0.0,0.0,0.0,0.0,0.0,0.0,200150.0,Musa Araz,2024-10-07 05:34:46
12657,705040,12,43933813,76,Musa Araz (Winterthur) Substitution at 93',Musa Araz Substitution,2,5400,90'+3',20996,0,0,1980-01-01,0.0,0.0,0.0,0.0,0.0,0.0,179390.0,Luca Zuffi,2024-10-07 05:34:46
12657,705041,1,43942611,70,Ignacio Aliseda (FC Lugano) Goal at 26',Ignacio Aliseda Goal,1,1560,26',7672,0,0,1980-01-01,0.0,0.0,0.0,0.0,0.0,0.0,276055.0,Ignacio Aliseda,2024-10-07 05:34:46
12657,705041,2,43942660,70,Juan Perea (FC Zürich) Goal at 35',Juan Perea Goal,1,2100,35',3019,0,0,1980-01-01,0.0,0.0,0.0,0.0,0.0,0.0,293915.0,Juan Perea,2024-10-07 05:34:46
12657,705041,3,43943038,94,Ousmane Doumbia (FC Lugano) Yellow Card at 51',Ousmane Doumbia Yellow Card,2,3060,51',7672,0,0,1980-01-01,0.0,0.0,0.0,0.0,0.0,0.0,308847.0,Ousmane Doumbia,2024-10-07 05:34:46
12657,705041,4,43943143,76,Anto Grgic (FC Lugano) Substitution at 56',Anto Grgic Substitution,2,3360,56',7672,0,0,1980-01-01,0.0,0.0,0.0,0.0,0.0,0.0,223234.0,Anto Grgic,2024-10-07 05:34:46
12657,705041,5,43943144,76,Rodrigo Conceição (FC Zürich) Substitution at 56',Rodrigo Conceição Substitution,2,3360,56',3019,0,0,1980-01-01,0.0,0.0,0.0,0.0,0.0,0.0,323813.0,Rodrigo Conceição,2024-10-07 05:34:46
12657,705041,6,43943145,76,Umeh Emmanuel (FC Zürich) Substitution at 56',Umeh Emmanuel Substitution,2,3360,56',3019,0,0,1980-01-01,0.0,0.0,0.0,0.0,0.0,0.0,362660.0,Umeh Emmanuel,2024-10-07 05:34:46
12657,705041,4,43943143,76,Anto Grgic (FC Lugano) Substitution at 56',Anto Grgic Substitution,2,3360,56',7672,0,0,1980-01-01,0.0,0.0,0.0,0.0,0.0,0.0,299861.0,Hadj Mahmoud,2024-10-07 05:34:46
12657,705041,5,43943144,76,Rodrigo Conceição (FC Zürich) Substitution at 56',Rodrigo Conceição Substitution,2,3360,56',3019,0,0,1980-01-01,0.0,0.0,0.0,0.0,0.0,0.0,357418.0,Calixte Ligue,2024-10-07 05:34:46
12657,705041,6,43943145,76,Umeh Emmanuel (FC Zürich) Substitution at 56',Umeh Emmanuel Substitution,2,3360,56',3019,0,0,1980-01-01,0.0,0.0,0.0,0.0,0.0,0.0,240368.0,Mounir Chouiar,2024-10-07 05:34:46
12657,705041,7,43943373,94,Cheick Oumar Conde (FC Zürich) Yellow Card at 66',Cheick Oumar Conde Yellow Card,2,3960,66',3019,0,0,1980-01-01,0.0,0.0,0.0,0.0,0.0,0.0,338125.0,Cheick Oumar Conde,2024-10-07 05:34:46
12657,705041,8,43943374,76,Mattia Bottani (FC Lugano) Substitution at 68',Mattia Bottani Substitution,2,4080,68',7672,0,0,1980-01-01,0.0,0.0,0.0,0.0,0.0,0.0,162156.0,Mattia Bottani,2024-10-07 05:34:46
12657,705041,9,43943375,76,Hicham Mahou (FC Lugano) Substitution at 68',Hicham Mahou Substitution,2,4080,68',7672,0,0,1980-01-01,0.0,0.0,0.0,0.0,0.0,0.0,250856.0,Hicham Mahou,2024-10-07 05:34:46
12657,705041,8,43943374,76,Mattia Bottani (FC Lugano) Substitution at 68',Mattia Bottani Substitution,2,4080,68',7672,0,0,1980-01-01,0.0,0.0,0.0,0.0,0.0,0.0,341382.0,Uran Bislimi,2024-10-07 05:34:46
12657,705041,9,43943375,76,Hicham Mahou (FC Lugano) Substitution at 68',Hicham Mahou Substitution,2,4080,68',7672,0,0,1980-01-01,0.0,0.0,0.0,0.0,0.0,0.0,276055.0,Ignacio Aliseda,2024-10-07 05:34:46
12657,705041,10,43943579,76,Daniel Correia (FC Lugano) Substitution at 78',Daniel Correia Substitution,2,4680,78',7672,0,0,1980-01-01,0.0,0.0,0.0,0.0,0.0,0.0,319631.0,Daniel Correia,2024-10-07 05:34:46
12657,705041,11,43943580,76,Yanis Cimignani (FC Lugano) Substitution at 78',Yanis Cimignani Substitution,2,4680,78',7672,0,0,1980-01-01,0.0,0.0,0.0,0.0,0.0,0.0,305659.0,Yanis Cimignani,2024-10-07 05:34:46
12657,705041,10,43943579,76,Daniel Correia (FC Lugano) Substitution at 78',Daniel Correia Substitution,2,4680,78',7672,0,0,1980-01-01,0.0,0.0,0.0,0.0,0.0,0.0,308847.0,Ousmane Doumbia,2024-10-07 05:34:46
12657,705041,11,43943580,76,Yanis Cimignani (FC Lugano) Substitution at 78',Yanis Cimignani Substitution,2,4680,78',7672,0,0,1980-01-01,0.0,0.0,0.0,0.0,0.0,0.0,193462.0,Renato Steffen,2024-10-07 05:34:46
12657,705041,12,43943581,76,Ifeanyi Mathew (FC Zürich) Substitution at 79',Ifeanyi Mathew Substitution,2,4740,79',3019,0,0,1980-01-01,0.0,0.0,0.0,0.0,0.0,0.0,219503.0,Ifeanyi Mathew,2024-10-07 05:34:46
12657,705041,12,43943581,76,Ifeanyi Mathew (FC Zürich) Substitution at 79',Ifeanyi Mathew Substitution,2,4740,79',3019,0,0,1980-01-01,0.0,0.0,0.0,0.0,0.0,0.0,179389.0,Antonio Marchesano,2024-10-07 05:34:46
12657,705041,13,43943658,76,Lindrit Kamberi (FC Zürich) Substitution at 85',Lindrit Kamberi Substitution,2,5100,85',3019,0,0,1980-01-01,0.0,0.0,0.0,0.0,0.0,0.0,271902.0,Lindrit Kamberi,2024-10-07 05:34:46
12657,705041,14,43943659,76,Armstrong Okoflex (FC Zürich) Substitution at 85',Armstrong Okoflex Substitution,2,5100,85',3019,0,0,1980-01-01,0.0,0.0,0.0,0.0,0.0,0.0,286180.0,Armstrong Okoflex,2024-10-07 05:34:46
12657,705041,15,43943660,94,Mattia Zanotti (FC Lugano) Yellow Card at 85',Mattia Zanotti Yellow Card,2,5100,85',7672,0,0,1980-01-01,0.0,0.0,0.0,0.0,0.0,0.0,323117.0,Mattia Zanotti,2024-10-07 05:34:46
12657,705041,13,43943658,76,Lindrit Kamberi (FC Zürich) Substitution at 85',Lindrit Kamberi Substitution,2,5100,85',3019,0,0,1980-01-01,0.0,0.0,0.0,0.0,0.0,0.0,275016.0,Bledian Krasniqi,2024-10-07 05:34:46
12657,705041,14,43943659,76,Armstrong Okoflex (FC Zürich) Substitution at 85',Armstrong Okoflex Substitution,2,5100,85',3019,0,0,1980-01-01,0.0,0.0,0.0,0.0,0.0,0.0,296553.0,Samuel Ballet,2024-10-07 05:34:46
12657,705042,1,43944684,70,Lukas Görtler (St. Gallen) Goal at 21',Lukas Görtler Goal,1,1260,21',557,0,0,1980-01-01,0.0,0.0,0.0,0.0,0.0,0.0,218836.0,Lukas Görtler,2024-10-07 05:34:46
12657,705042,2,43945505,76,Abdoulaye Diaby (St. Gallen) Substitution at 45',Abdoulaye Diaby Substitution,2,2700,45',557,0,0,1980-01-01,0.0,0.0,0.0,0.0,0.0,0.0,266637.0,Abdoulaye Diaby,2024-10-07 05:34:46
12657,705042,3,43945506,76,Enzo Crivelli (Servette) Substitution at 45',Enzo Crivelli Substitution,2,2700,45',20032,0,0,1980-01-01,0.0,0.0,0.0,0.0,0.0,0.0,199645.0,Enzo Crivelli,2024-10-07 05:34:46
12657,705042,2,43945505,76,Abdoulaye Diaby (St. Gallen) Substitution at 45',Abdoulaye Diaby Substitution,2,2700,45',557,0,0,1980-01-01,0.0,0.0,0.0,0.0,0.0,0.0,277513.0,Jozo Stanic,2024-10-07 05:34:46
12657,705042,3,43945506,76,Enzo Crivelli (Servette) Substitution at 45',Enzo Crivelli Substitution,2,2700,45',20032,0,0,1980-01-01,0.0,0.0,0.0,0.0,0.0,0.0,261466.0,Jeremy Guillemenot,2024-10-07 05:34:46
12657,705042,4,43945521,70,Miroslav Stevanovic (Servette) Goal at 46',Miroslav Stevanovic Goal,2,2760,46',20032,0,0,1980-01-01,0.0,0.0,0.0,0.0,0.0,0.0,173665.0,Miroslav Stevanovic,2024-10-07 05:34:46
12657,705042,5,43945606,94,Stephen Ambrosius (St. Gallen) Yellow Card at 48',Stephen Ambrosius Yellow Card,2,2880,48',557,0,0,1980-01-01,0.0,0.0,0.0,0.0,0.0,0.0,270860.0,Stephen Ambrosius,2024-10-07 05:34:46
12657,705042,6,43945840,94,Hugo Vandermersch (St. Gallen) Yellow Card at 60',Hugo Vandermersch Yellow Card,2,3600,60',557,0,0,1980-01-01,0.0,0.0,0.0,0.0,0.0,0.0,290578.0,Hugo Vandermersch,2024-10-07 05:34:46
12657,705042,7,43945964,76,Kevin Csoboth (St. Gallen) Substitution at 66',Kevin Csoboth Substitution,2,3960,66',557,0,0,1980-01-01,0.0,0.0,0.0,0.0,0.0,0.0,328290.0,Kevin Csoboth,2024-10-07 05:34:46
12657,705042,8,43945965,76,Jovan Milosevic (St. Gallen) Substitution at 66',Jovan Milosevic Substitution,2,3960,66',557,0,0,1980-01-01,0.0,0.0,0.0,0.0,0.0,0.0,364204.0,Jovan Milosevic,2024-10-07 05:34:46
12657,705042,9,43945966,76,Mihailo Stevanovic (St. Gallen) Substitution at 66',Mihailo Stevanovic Substitution,2,3960,66',557,0,0,1980-01-01,0.0,0.0,0.0,0.0,0.0,0.0,304685.0,Mihailo Stevanovic,2024-10-07 05:34:46
12657,705042,7,43945964,76,Kevin Csoboth (St. Gallen) Substitution at 66',Kevin Csoboth Substitution,2,3960,66',557,0,0,1980-01-01,0.0,0.0,0.0,0.0,0.0,0.0,259901.0,Bastien Toma,2024-10-07 05:34:46
12657,705042,8,43945965,76,Jovan Milosevic (St. Gallen) Substitution at 66',Jovan Milosevic Substitution,2,3960,66',557,0,0,1980-01-01,0.0,0.0,0.0,0.0,0.0,0.0,285975.0,Felix Mambimbi,2024-10-07 05:34:46
12657,705042,9,43945966,76,Mihailo Stevanovic (St. Gallen) Substitution at 66',Mihailo Stevanovic Substitution,2,3960,66',557,0,0,1980-01-01,0.0,0.0,0.0,0.0,0.0,0.0,218836.0,Lukas Görtler,2024-10-07 05:34:46
12657,705042,10,43946103,76,Julian von Moos (Servette) Substitution at 71',Julian von Moos Substitution,2,4260,71',20032,0,0,1980-01-01,0.0,0.0,0.0,0.0,0.0,0.0,275426.0,Julian von Moos,2024-10-07 05:34:46
12657,705042,10,43946103,76,Julian von Moos (Servette) Substitution at 71',Julian von Moos Substitution,2,4260,71',20032,0,0,1980-01-01,0.0,0.0,0.0,0.0,0.0,0.0,173665.0,Miroslav Stevanovic,2024-10-07 05:34:46
12657,705042,11,43946104,76,Konrad Faber (St. Gallen) Substitution at 72',Konrad Faber Substitution,2,4320,72',557,0,0,1980-01-01,0.0,0.0,0.0,0.0,0.0,0.0,321205.0,Konrad Faber,2024-10-07 05:34:46
12657,705042,11,43946104,76,Konrad Faber (St. Gallen) Substitution at 72',Konrad Faber Substitution,2,4320,72',557,0,0,1980-01-01,0.0,0.0,0.0,0.0,0.0,0.0,354181.0,Yannick Noah,2024-10-07 05:34:46
12657,705042,12,43946121,94,Kevin Csoboth (St. Gallen) Yellow Card at 77',Kevin Csoboth Yellow Card,2,4620,77',557,0,0,1980-01-01,0.0,0.0,0.0,0.0,0.0,0.0,328290.0,Kevin Csoboth,2024-10-07 05:34:46
12657,705042,13,43946150,94,Keigo Tsunemoto (Servette) Yellow Card at 79',Keigo Tsunemoto Yellow Card,2,4740,79',20032,0,0,1980-01-01,0.0,0.0,0.0,0.0,0.0,0.0,308777.0,Keigo Tsunemoto,2024-10-07 05:34:46
12657,705042,14,43946182,93,Hugo Vandermersch (St. Gallen) Red Card at 81',Hugo Vandermersch Red Card,2,4860,81',557,0,0,1980-01-01,0.0,0.0,0.0,0.0,0.0,0.0,290578.0,Hugo Vandermersch,2024-10-07 05:34:46
12657,705042,15,43946356,76,Mamadou Simbakoli (Servette) Substitution at 89',Mamadou Simbakoli Substitution,2,5340,89',20032,0,0,1980-01-01,0.0,0.0,0.0,0.0,0.0,0.0,312399.0,Mamadou Simbakoli,2024-10-07 05:34:46
12657,705042,15,43946356,76,Mamadou Simbakoli (Servette) Substitution at 89',Mamadou Simbakoli Substitution,2,5340,89',20032,0,0,1980-01-01,0.0,0.0,0.0,0.0,0.0,0.0,290184.0,Alexis Antunes,2024-10-07 05:34:46
12657,705043,1,43944779,94,Cheikh Niasse (Young Boys) Yellow Card at 19',Cheikh Niasse Yellow Card,1,1140,19',2722,0,0,1980-01-01,0.0,0.0,0.0,0.0,0.0,0.0,284592.0,Cheikh Niasse,2024-10-07 05:34:46
12657,705043,2,43945081,94,Leo Leroy (FC Basel) Yellow Card at 35',Leo Leroy Yellow Card,1,2100,35',989,0,0,1980-01-01,0.0,0.0,0.0,0.0,0.0,0.0,286120.0,Leo Leroy,2024-10-07 05:34:46
12657,705043,3,43945235,94,Leon Avdullahu (FC Basel) Yellow Card at 36',Leon Avdullahu Yellow Card,1,2160,36',989,0,0,1980-01-01,0.0,0.0,0.0,0.0,0.0,0.0,362590.0,Leon Avdullahu,2024-10-08 05:37:39
12657,705043,4,43945202,93,Sandro Lauper (Young Boys) Red Card at 40',Sandro Lauper Red Card,1,2400,40',2722,0,0,1980-01-01,0.0,0.0,0.0,0.0,0.0,0.0,223256.0,Sandro Lauper,2024-10-08 05:37:39
12657,705043,5,43945651,94,Silvére Ganvoula (Young Boys) Yellow Card at 42',Silvére Ganvoula Yellow Card,1,2520,42',2722,0,0,1980-01-01,0.0,0.0,0.0,0.0,0.0,0.0,215358.0,Silvére Ganvoula,2024-10-07 05:34:46
12657,705043,6,43945596,76,Meschack Elia (Young Boys) Substitution at 45',Meschack Elia Substitution,2,2700,45',2722,0,0,1980-01-01,0.0,0.0,0.0,0.0,0.0,0.0,232492.0,Meschack Elia,2024-10-07 05:34:46
12657,705043,6,43945596,76,Meschack Elia (Young Boys) Substitution at 45',Meschack Elia Substitution,2,2700,45',2722,0,0,1980-01-01,0.0,0.0,0.0,0.0,0.0,0.0,289527.0,Kastiot Imeri,2024-10-07 05:34:46
12657,705043,7,43945710,70,Adrian Leon Barisic (FC Basel) Goal at 52',Adrian Leon Barisic Goal,2,3120,52',989,0,0,1980-01-01,0.0,0.0,0.0,0.0,0.0,0.0,322209.0,Adrian Leon Barisic,2024-10-07 05:34:46
12657,705043,8,43945913,94,Filip Ugrinic (Young Boys) Yellow Card at 59',Filip Ugrinic Yellow Card,2,3540,59',2722,0,0,1980-01-01,0.0,0.0,0.0,0.0,0.0,0.0,248681.0,Filip Ugrinic,2024-10-07 05:34:46
12657,705043,9,43946006,76,Marin Soticek (FC Basel) Substitution at 63',Marin Soticek Substitution,2,3780,63',989,0,0,1980-01-01,0.0,0.0,0.0,0.0,0.0,0.0,345481.0,Marin Soticek,2024-10-07 05:34:46
12657,705043,9,43946006,76,Marin Soticek (FC Basel) Substitution at 63',Marin Soticek Substitution,2,3780,63',989,0,0,1980-01-01,0.0,0.0,0.0,0.0,0.0,0.0,312850.0,Bénie Traoré,2024-10-07 05:34:46
12657,705043,10,43946043,76,Zachary Athekame (Young Boys) Substitution at 68',Zachary Athekame Substitution,2,4080,68',2722,0,0,1980-01-01,0.0,0.0,0.0,0.0,0.0,0.0,370758.0,Zachary Athekame,2024-10-07 05:34:46
12657,705043,11,43946044,76,Darian Males (Young Boys) Substitution at 68',Darian Males Substitution,2,4080,68',2722,0,0,1980-01-01,0.0,0.0,0.0,0.0,0.0,0.0,290139.0,Darian Males,2024-10-07 05:34:46
12657,705043,10,43946043,76,Zachary Athekame (Young Boys) Substitution at 68',Zachary Athekame Substitution,2,4080,68',2722,0,0,1980-01-01,0.0,0.0,0.0,0.0,0.0,0.0,333320.0,Lewin Blum,2024-10-07 05:34:46
12657,705043,11,43946044,76,Darian Males (Young Boys) Substitution at 68',Darian Males Substitution,2,4080,68',2722,0,0,1980-01-01,0.0,0.0,0.0,0.0,0.0,0.0,248681.0,Filip Ugrinic,2024-10-07 05:34:46
12657,705043,12,43946075,94,Jaouen Hadjam (Young Boys) Yellow Card at 70',Jaouen Hadjam Yellow Card,2,4200,70',2722,0,0,1980-01-01,0.0,0.0,0.0,0.0,0.0,0.0,306033.0,Jaouen Hadjam,2024-10-07 05:34:46
12657,705043,13,43946134,76,Anton Kade (FC Basel) Substitution at 72',Anton Kade Substitution,2,4320,72',989,0,0,1980-01-01,0.0,0.0,0.0,0.0,0.0,0.0,333837.0,Anton Kade,2024-10-07 05:34:46
12657,705043,14,43946135,76,Bradley Fink (FC Basel) Substitution at 72',Bradley Fink Substitution,2,4320,72',989,0,0,1980-01-01,0.0,0.0,0.0,0.0,0.0,0.0,340465.0,Bradley Fink,2024-10-07 05:34:46
12657,705043,13,43946134,76,Anton Kade (FC Basel) Substitution at 72',Anton Kade Substitution,2,4320,72',989,0,0,1980-01-01,0.0,0.0,0.0,0.0,0.0,0.0,136775.0,Xherdan Shaqiri,2024-10-07 05:34:46
12657,705043,14,43946135,76,Bradley Fink (FC Basel) Substitution at 72',Bradley Fink Substitution,2,4320,72',989,0,0,1980-01-01,0.0,0.0,0.0,0.0,0.0,0.0,304151.0,Kevin Omoruyi,2024-10-07 05:34:46
12657,705043,15,43946208,76,Ebrima Colley (Young Boys) Substitution at 75',Ebrima Colley Substitution,2,4500,75',2722,0,0,1980-01-01,0.0,0.0,0.0,0.0,0.0,0.0,287077.0,Ebrima Colley,2024-10-07 05:34:46
12657,705043,15,43946208,76,Ebrima Colley (Young Boys) Substitution at 75',Ebrima Colley Substitution,2,4500,75',2722,0,0,1980-01-01,0.0,0.0,0.0,0.0,0.0,0.0,215358.0,Silvére Ganvoula,2024-10-07 05:34:46
12657,705043,16,43946209,76,Taulant Xhaka (FC Basel) Substitution at 77',Taulant Xhaka Substitution,2,4620,77',989,0,0,1980-01-01,0.0,0.0,0.0,0.0,0.0,0.0,151553.0,Taulant Xhaka,2024-10-07 05:34:46
12657,705043,17,43946210,76,Moussa Cissé (FC Basel) Substitution at 77',Moussa Cissé Substitution,2,4620,77',989,0,0,1980-01-01,0.0,0.0,0.0,0.0,0.0,0.0,274027.0,Moussa Cissé,2024-10-07 05:34:46
12657,705043,16,43946209,76,Taulant Xhaka (FC Basel) Substitution at 77',Taulant Xhaka Substitution,2,4620,77',989,0,0,1980-01-01,0.0,0.0,0.0,0.0,0.0,0.0,288898.0,Romário Baró,2024-10-07 05:34:46
12657,705043,17,43946210,76,Moussa Cissé (FC Basel) Substitution at 77',Moussa Cissé Substitution,2,4620,77',989,0,0,1980-01-01,0.0,0.0,0.0,0.0,0.0,0.0,136597.0,Dominik Schmid,2024-10-07 05:34:46
12657,705043,18,43946283,94,Marin Soticek (FC Basel) Yellow Card at 79',Marin Soticek Yellow Card,2,4740,79',989,0,0,1980-01-01,0.0,0.0,0.0,0.0,0.0,0.0,345481.0,Marin Soticek,2024-10-07 05:34:46
12657,705043,19,43946359,76,Alan Virginius (Young Boys) Substitution at 85',Alan Virginius Substitution,2,5100,85',2722,0,0,1980-01-01,0.0,0.0,0.0,0.0,0.0,0.0,304743.0,Alan Virginius,2024-10-07 05:34:46
12657,705043,19,43946359,76,Alan Virginius (Young Boys) Substitution at 85',Alan Virginius Substitution,2,5100,85',2722,0,0,1980-01-01,0.0,0.0,0.0,0.0,0.0,0.0,284592.0,Cheikh Niasse,2024-10-07 05:34:46
12657,705043,20,43946506,94,Taulant Xhaka (FC Basel) Yellow Card at 93',Taulant Xhaka Yellow Card,2,5400,90'+3',989,0,0,1980-01-01,0.0,0.0,0.0,0.0,0.0,0.0,151553.0,Taulant Xhaka,2024-10-07 05:34:46
12657,705044,1,44010089,94,Loris Benito (Young Boys) Yellow Card at 18',Loris Benito Yellow Card,1,1080,18',2722,0,0,1980-01-01,0.0,0.0,0.0,0.0,0.0,0.0,136746.0,Loris Benito,2024-10-20 11:07:01
12657,705044,2,44010146,76,Levin Winkler (FC Luzern) Substitution at 23',Levin Winkler Substitution,1,1380,23',7640,0,0,1980-01-01,0.0,0.0,0.0,0.0,0.0,0.0,377836.0,Levin Winkler,2024-10-20 11:07:01
12657,705044,2,44010146,76,Levin Winkler (FC Luzern) Substitution at 23',Levin Winkler Substitution,1,1380,23',7640,0,0,1980-01-01,0.0,0.0,0.0,0.0,0.0,0.0,267619.0,Nicky Medja Beloko,2024-10-20 11:07:01
12657,705044,3,44010181,94,Pius Dorn (FC Luzern) Yellow Card at 26',Pius Dorn Yellow Card,1,1560,26',7640,0,0,1980-01-01,0.0,0.0,0.0,0.0,0.0,0.0,223993.0,Pius Dorn,2024-10-20 11:07:01
12657,705044,4,44010360,94,Cheikh Niasse (Young Boys) Yellow Card at 42',Cheikh Niasse Yellow Card,1,2520,42',2722,0,0,1980-01-01,0.0,0.0,0.0,0.0,0.0,0.0,284592.0,Cheikh Niasse,2024-10-20 11:07:01
12657,705044,5,44010403,94,Mohamed Ali Camara (Young Boys) Yellow Card at 44',Mohamed Ali Camara Yellow Card,1,2640,44',2722,0,0,1980-01-01,0.0,0.0,0.0,0.0,0.0,0.0,205137.0,Ali Mohamed,2024-10-20 11:07:01
12657,705044,6,44010431,94,Stefan Knezevic (FC Luzern) Yellow Card at 47',Stefan Knezevic Yellow Card,1,2700,45'+2',7640,0,0,1980-01-01,0.0,0.0,0.0,0.0,0.0,0.0,238492.0,Stefan Knezevic,2024-10-20 11:07:01
12657,705044,7,44010455,94,Filip Ugrinic (Young Boys) Yellow Card at 49',Filip Ugrinic Yellow Card,1,2700,45'+4',2722,0,0,1980-01-01,0.0,0.0,0.0,0.0,0.0,0.0,248681.0,Filip Ugrinic,2024-10-20 11:07:01
12657,705044,8,44010456,94,Luca Jaquez (FC Luzern) Yellow Card at 49',Luca Jaquez Yellow Card,1,2700,45'+4',7640,0,0,1980-01-01,0.0,0.0,0.0,0.0,0.0,0.0,332574.0,Luca Jaquez,2024-10-20 11:07:01
12657,705044,9,44010675,70,Joel Monteiro (Young Boys) Goal at 47',Joel Monteiro Goal,2,2820,47',2722,0,0,1980-01-01,0.0,0.0,0.0,0.0,0.0,0.0,307893.0,Joel Monteiro,2024-10-20 11:07:01
12657,705044,10,44010716,70,Cedric Itten (Young Boys) Goal at 50',Cedric Itten Goal,2,3000,50',2722,0,0,1980-01-01,0.0,0.0,0.0,0.0,0.0,0.0,234153.0,Cedric Itten,2024-10-20 11:07:01
12657,705044,11,44010843,76,Jakub Kadak (FC Luzern) Substitution at 55',Jakub Kadak Substitution,2,3300,55',7640,0,0,1980-01-01,0.0,0.0,0.0,0.0,0.0,0.0,274682.0,Jakub Kadak,2024-10-20 11:07:01
12657,705044,11,44010843,76,Jakub Kadak (FC Luzern) Substitution at 55',Jakub Kadak Substitution,2,3300,55',7640,0,0,1980-01-01,0.0,0.0,0.0,0.0,0.0,0.0,320006.0,Donat Rrudhani,2024-10-20 11:07:01
12657,705044,12,44010844,76,Severin Ottiger (FC Luzern) Substitution at 56',Severin Ottiger Substitution,2,3360,56',7640,0,0,1980-01-01,0.0,0.0,0.0,0.0,0.0,0.0,321207.0,Severin Ottiger,2024-10-20 11:07:01
12657,705044,13,44010845,76,Vars Villiger (FC Luzern) Substitution at 56',Vars Villiger Substitution,2,3360,56',7640,0,0,1980-01-01,0.0,0.0,0.0,0.0,0.0,0.0,361268.0,Vars Villiger,2024-10-20 11:07:01
12657,705044,12,44010844,76,Severin Ottiger (FC Luzern) Substitution at 56',Severin Ottiger Substitution,2,3360,56',7640,0,0,1980-01-01,0.0,0.0,0.0,0.0,0.0,0.0,304259.0,Tyron Owusu,2024-10-20 11:07:01
12657,705044,13,44010845,76,Vars Villiger (FC Luzern) Substitution at 56',Vars Villiger Substitution,2,3360,56',7640,0,0,1980-01-01,0.0,0.0,0.0,0.0,0.0,0.0,272137.0,Thibault Klidje,2024-10-20 11:07:01
12657,705044,14,44010863,76,Anel Hasic (Young Boys) Substitution at 59',Anel Hasic Substitution,2,3540,59',2722,0,0,1980-01-01,0.0,0.0,0.0,0.0,0.0,0.0,319399.0,Anel Hasic,2024-10-20 11:07:01
12657,705044,14,44010863,76,Anel Hasic (Young Boys) Substitution at 59',Anel Hasic Substitution,2,3540,59',2722,0,0,1980-01-01,0.0,0.0,0.0,0.0,0.0,0.0,136746.0,Loris Benito,2024-10-20 11:07:01
12657,705044,15,44010938,70,Luca Jaquez (FC Luzern) Goal at 70',Luca Jaquez Goal,2,4200,70',7640,0,0,1980-01-01,0.0,0.0,0.0,0.0,0.0,0.0,332574.0,Luca Jaquez,2024-10-20 11:07:01
12657,705044,16,44010973,76,Kastiot Imeri (Young Boys) Substitution at 72',Kastiot Imeri Substitution,2,4320,72',2722,0,0,1980-01-01,0.0,0.0,0.0,0.0,0.0,0.0,289527.0,Kastriot Imeri,2024-10-20 11:07:01
12657,705044,16,44010973,76,Kastiot Imeri (Young Boys) Substitution at 72',Kastiot Imeri Substitution,2,4320,72',2722,0,0,1980-01-01,0.0,0.0,0.0,0.0,0.0,0.0,290139.0,Darian Males,2024-10-20 11:07:01
12657,705044,17,44010974,76,Jaouen Hadjam (Young Boys) Substitution at 73',Jaouen Hadjam Substitution,2,4380,73',2722,0,0,1980-01-01,0.0,0.0,0.0,0.0,0.0,0.0,306033.0,Jaouen Hadjam,2024-10-20 11:07:01
12657,705044,18,44010975,76,Silvére Ganvoula (Young Boys) Substitution at 73',Silvére Ganvoula Substitution,2,4380,73',2722,0,0,1980-01-01,0.0,0.0,0.0,0.0,0.0,0.0,215358.0,Silvére Ganvoula,2024-10-20 11:07:01
12657,705044,17,44010974,76,Jaouen Hadjam (Young Boys) Substitution at 73',Jaouen Hadjam Substitution,2,4380,73',2722,0,0,1980-01-01,0.0,0.0,0.0,0.0,0.0,0.0,258918.0,Abdu Conté,2024-10-20 11:07:01
12657,705044,18,44010975,76,Silvére Ganvoula (Young Boys) Substitution at 73',Silvére Ganvoula Substitution,2,4380,73',2722,0,0,1980-01-01,0.0,0.0,0.0,0.0,0.0,0.0,234153.0,Cedric Itten,2024-10-20 11:07:01
12657,705044,19,44010999,76,Kevin Spadanuda (FC Luzern) Substitution at 76',Kevin Spadanuda Substitution,2,4560,76',7640,0,0,1980-01-01,0.0,0.0,0.0,0.0,0.0,0.0,343952.0,Kevin Spadanuda,2024-10-20 11:07:01
12657,705044,19,44010999,76,Kevin Spadanuda (FC Luzern) Substitution at 76',Kevin Spadanuda Substitution,2,4560,76',7640,0,0,1980-01-01,0.0,0.0,0.0,0.0,0.0,0.0,377836.0,Levin Winkler,2024-10-20 11:07:01
12657,705044,20,44011121,76,Lukasz Lakomy (Young Boys) Substitution at 84',Lukasz Lakomy Substitution,2,5040,84',2722,0,0,1980-01-01,0.0,0.0,0.0,0.0,0.0,0.0,341446.0,Lukasz Lakomy,2024-10-20 11:07:01
12657,705044,20,44011121,76,Lukasz Lakomy (Young Boys) Substitution at 84',Lukasz Lakomy Substitution,2,5040,84',2722,0,0,1980-01-01,0.0,0.0,0.0,0.0,0.0,0.0,284592.0,Cheikh Niasse,2024-10-20 11:07:01
