seasonType,eventId,playOrder,playId,typeId,text,shortText,period,clockValue,clockDisplayValue,teamId,scoringPlay,shootout,wallclock,goalPositionX,goalPositionY,fieldpositionX,fieldPositionY,fieldPosition2X,fieldPosition2Y,athleteId,participant,updateDateTime
12880,719938,4,43903678,76,Noufal Noufal (Mumbai City FC) Substitution at 45',Noufal Noufal Substitution,2,2700,45',18002,0,0,1980-01-01,0.0,0.0,0.0,0.0,0.0,0.0,282523.0,Vikram Partap Singh,2024-10-04 05:36:29
12880,719938,5,43903679,76,Jorge Pereyra Díaz (Bengaluru FC) Substitution at 45',Jorge Pereyra Díaz Substitution,2,2700,45',18851,0,0,1980-01-01,0.0,0.0,0.0,0.0,0.0,0.0,391474.0,Vinith Venkatesh,2024-10-04 05:36:29
12880,719938,6,43903680,76,Lalremtluanga Fanai (Bengaluru FC) Substitution at 45',Lalremtluanga Fanai Substitution,2,2700,45',18851,0,0,1980-01-01,0.0,0.0,0.0,0.0,0.0,0.0,157709.0,Alberto Noguera,2024-10-04 05:36:29
12880,719938,7,43903736,76,Jon Toral (Mumbai City FC) Substitution at 67',Jon Toral Substitution,2,4020,67',18002,0,0,1980-01-01,0.0,0.0,0.0,0.0,0.0,0.0,223823.0,Jon Toral,2024-10-04 05:36:29
12880,719938,7,43903736,76,Jon Toral (Mumbai City FC) Substitution at 67',Jon Toral Substitution,2,4020,67',18002,0,0,1980-01-01,0.0,0.0,0.0,0.0,0.0,0.0,158082.0,Jeremy Manzoro,2024-10-04 05:36:29
12880,719938,8,43903756,94,Roshan Singh (Bengaluru FC) Yellow Card at 76',Roshan Singh Yellow Card,2,4560,76',18851,0,0,1980-01-01,0.0,0.0,0.0,0.0,0.0,0.0,268567.0,Naorem Roshan Singh,2024-10-04 05:36:29
12880,719938,9,43903768,76,Sahil Panwar (Mumbai City FC) Substitution at 78',Sahil Panwar Substitution,2,4680,78',18002,0,0,1980-01-01,0.0,0.0,0.0,0.0,0.0,0.0,269081.0,Sahil Panwar,2024-10-04 05:36:29
12880,719938,9,43903768,76,Sahil Panwar (Mumbai City FC) Substitution at 78',Sahil Panwar Substitution,2,4680,78',18002,0,0,1980-01-01,0.0,0.0,0.0,0.0,0.0,0.0,369865.0,Nathan Rodrigues,2024-10-04 05:36:29
12880,719938,10,43903769,76,Sivasakthi Narayanan (Bengaluru FC) Substitution at 80',Sivasakthi Narayanan Substitutio,2,4800,80',18851,0,0,1980-01-01,0.0,0.0,0.0,0.0,0.0,0.0,325066.0,Sivasakthi Narayanan,2024-10-04 05:36:29
12880,719938,10,43903769,76,Sivasakthi Narayanan (Bengaluru FC) Substitution at 80',Sivasakthi Narayanan Substitutio,2,4800,80',18851,0,0,1980-01-01,0.0,0.0,0.0,0.0,0.0,0.0,180751.0,Édgar Méndez,2024-10-04 05:36:29
12880,719938,11,43903807,76,Thaer Krouma (Mumbai City FC) Substitution at 85',Thaer Krouma Substitution,2,5100,85',18002,0,0,1980-01-01,0.0,0.0,0.0,0.0,0.0,0.0,237150.0,Thaer Krouma,2024-10-04 05:36:29
12880,719938,12,43903808,76,Bipin Singh (Mumbai City FC) Substitution at 85',Bipin Singh Substitution,2,5100,85',18002,0,0,1980-01-01,0.0,0.0,0.0,0.0,0.0,0.0,268011.0,Bipin Singh,2024-10-04 05:36:29
12880,719938,11,43903807,76,Thaer Krouma (Mumbai City FC) Substitution at 85',Thaer Krouma Substitution,2,5100,85',18002,0,0,1980-01-01,0.0,0.0,0.0,0.0,0.0,0.0,160127.0,Tiri,2024-10-04 05:36:29
12880,719938,12,43903808,76,Bipin Singh (Mumbai City FC) Substitution at 85',Bipin Singh Substitution,2,5100,85',18002,0,0,1980-01-01,0.0,0.0,0.0,0.0,0.0,0.0,243306.0,Lallianzuala Chhangte,2024-10-04 05:36:29
12880,719939,1,43909948,70,Noah Wail (Kerala Blasters FC) Goal at 18',Noah Wail Goal,1,1080,18',17997,0,0,1980-01-01,0.0,0.0,0.0,0.0,0.0,0.0,312822.0,Noah Wail,2024-10-04 05:36:29
12880,719939,2,43909949,70,Jesús Jiménez (Kerala Blasters FC) Goal at 21',Jesús Jiménez Goal,1,1260,21',17997,0,0,1980-01-01,0.0,0.0,0.0,0.0,0.0,0.0,152732.0,Jesús Jiménez,2024-10-04 05:36:29
12880,719939,3,43910000,97,Alexandre Coeff (Kerala Blasters FC) Own Goal at 29',Alexandre Coeff Own Goal,1,1740,29',17998,0,0,1980-01-01,0.0,0.0,0.0,0.0,0.0,0.0,,Alexandre Coeff,2024-10-04 05:36:29
12880,719939,4,43910031,70,Diego Maurício (Odisha FC) Goal at 36',Diego Maurício Goal,1,2160,36',17998,0,0,1980-01-01,0.0,0.0,0.0,0.0,0.0,0.0,148126.0,Diego Maurício,2024-10-04 05:36:29
12880,719939,5,43910032,94,Puitea (Odisha FC) Yellow Card at 40',Puitea Yellow Card,1,2400,40',17998,0,0,1980-01-01,0.0,0.0,0.0,0.0,0.0,0.0,268517.0,Puitea,2024-10-09 05:33:10
12880,719939,6,43910033,94,Hugo Boumous (Odisha FC) Yellow Card at 47',Hugo Boumous Yellow Card,1,2700,45'+2',17998,0,0,1980-01-01,0.0,0.0,0.0,0.0,0.0,0.0,212550.0,Hugo Boumous,2024-10-04 05:36:29
12880,719939,7,43910036,76,Rahim Ali (Odisha FC) Substitution at 54',Rahim Ali Substitution,2,3240,54',17998,0,0,1980-01-01,0.0,0.0,0.0,0.0,0.0,0.0,266618.0,Rahim Ali,2024-10-04 05:36:29
12880,719939,7,43910036,76,Rahim Ali (Odisha FC) Substitution at 54',Rahim Ali Substitution,2,3240,54',17998,0,0,1980-01-01,0.0,0.0,0.0,0.0,0.0,0.0,245816.0,Jerry Mawihmingthanga,2024-10-04 05:36:29
12880,719939,8,43910037,76,Roy Krishna (Odisha FC) Substitution at 55',Roy Krishna Substitution,2,3300,55',17998,0,0,1980-01-01,0.0,0.0,0.0,0.0,0.0,0.0,197133.0,Roy Krishna,2024-10-04 05:36:29
12880,719939,8,43910037,76,Roy Krishna (Odisha FC) Substitution at 55',Roy Krishna Substitution,2,3300,55',17998,0,0,1980-01-01,0.0,0.0,0.0,0.0,0.0,0.0,148126.0,Diego Maurício,2024-10-04 05:36:29
12880,719939,9,43910040,76,Mohammed Aimen (Kerala Blasters FC) Substitution at 69',Mohammed Aimen Substitution,2,4140,69',17997,0,0,1980-01-01,0.0,0.0,0.0,0.0,0.0,0.0,370238.0,Mohammed Aimen,2024-10-04 05:36:29
12880,719939,9,43910040,76,Mohammed Aimen (Kerala Blasters FC) Substitution at 69',Mohammed Aimen Substitution,2,4140,69',17997,0,0,1980-01-01,0.0,0.0,0.0,0.0,0.0,0.0,282656.0,Danish Farooq Bhat,2024-10-04 05:36:29
12880,719939,10,43910041,76,Mohammed Azhar (Kerala Blasters FC) Substitution at 71',Mohammed Azhar Substitution,2,4260,71',17997,0,0,1980-01-01,0.0,0.0,0.0,0.0,0.0,0.0,370236.0,Mohammed Azhar,2024-10-04 05:36:29
12880,719939,11,43910042,76,Adrián Luna (Kerala Blasters FC) Substitution at 71',Adrián Luna Substitution,2,4260,71',17997,0,0,1980-01-01,0.0,0.0,0.0,0.0,0.0,0.0,144861.0,Adrián Luna,2024-10-04 05:36:29
12880,719939,10,43910041,76,Mohammed Azhar (Kerala Blasters FC) Substitution at 71',Mohammed Azhar Substitution,2,4260,71',17997,0,0,1980-01-01,0.0,0.0,0.0,0.0,0.0,0.0,266621.0,Rahul Kannoly,2024-10-04 05:36:29
12880,719939,11,43910042,76,Adrián Luna (Kerala Blasters FC) Substitution at 71',Adrián Luna Substitution,2,4260,71',17997,0,0,1980-01-01,0.0,0.0,0.0,0.0,0.0,0.0,149515.0,Alexandre Coeff,2024-10-04 05:36:29
12880,719939,12,43910044,76,Ruivah Hormipam (Kerala Blasters FC) Substitution at 84',Ruivah Hormipam Substitution,2,5040,84',17997,0,0,1980-01-01,0.0,0.0,0.0,0.0,0.0,0.0,300035.0,Ruivah Hormipam,2024-10-04 05:36:29
12880,719939,12,43910044,76,Ruivah Hormipam (Kerala Blasters FC) Substitution at 84',Ruivah Hormipam Substitution,2,5040,84',17997,0,0,1980-01-01,0.0,0.0,0.0,0.0,0.0,0.0,281338.0,Sandeep Singh,2024-10-04 05:36:29
12880,719939,13,43910045,76,Kwame Peprah (Kerala Blasters FC) Substitution at 85',Kwame Peprah Substitution,2,5100,85',17997,0,0,1980-01-01,0.0,0.0,0.0,0.0,0.0,0.0,319776.0,Kwame Peprah,2024-10-04 05:36:29
12880,719939,13,43910045,76,Kwame Peprah (Kerala Blasters FC) Substitution at 85',Kwame Peprah Substitution,2,5100,85',17997,0,0,1980-01-01,0.0,0.0,0.0,0.0,0.0,0.0,152732.0,Jesús Jiménez,2024-10-04 05:36:29
12880,719939,14,43910046,76,Rohit Kumar (Odisha FC) Substitution at 88',Rohit Kumar Substitution,2,5280,88',17998,0,0,1980-01-01,0.0,0.0,0.0,0.0,0.0,0.0,268084.0,Rohit Kumar,2024-10-04 05:36:29
12880,719939,14,43910046,76,Rohit Kumar (Odisha FC) Substitution at 88',Rohit Kumar Substitution,2,5280,88',17998,0,0,1980-01-01,0.0,0.0,0.0,0.0,0.0,0.0,268517.0,Puitea,2024-10-04 05:36:29
12880,719940,1,43918164,70,Nestor Albiach (NorthEast United FC) Goal at 6',Nestor Albiach Goal,1,360,6',18004,0,0,1980-01-01,0.0,0.0,0.0,0.0,0.0,0.0,253167.0,Nestor Albiach,2024-10-05 05:40:03
12880,719940,2,43918167,98,Armando Sadiku (FC Goa) Penalty - Scored at 47',Armando Sadiku Penalty - Scored,1,2700,45'+2',18003,0,0,1980-01-01,0.0,0.0,0.0,0.0,0.0,0.0,173659.0,Armando Sadiku,2024-10-05 05:40:03
12880,719940,3,43918168,70,Armando Sadiku (FC Goa) Goal at 47',Armando Sadiku Goal,2,2820,47',18003,0,0,1980-01-01,0.0,0.0,0.0,0.0,0.0,0.0,173659.0,Armando Sadiku,2024-10-05 05:40:03
12880,719940,4,43918170,70,Nestor Albiach (NorthEast United FC) Goal at 51',Nestor Albiach Goal,2,3060,51',18004,0,0,1980-01-01,0.0,0.0,0.0,0.0,0.0,0.0,253167.0,Nestor Albiach,2024-10-05 05:40:03
12880,719940,5,43918172,70,Alaeddine Ajaray (NorthEast United FC) Goal at 56',Alaeddine Ajaray Goal,2,3360,56',18004,0,0,1980-01-01,0.0,0.0,0.0,0.0,0.0,0.0,299628.0,Alaeddine Ajaray,2024-10-05 05:40:03
12880,719940,6,43918173,76,Jay Gupta (FC Goa) Substitution at 58',Jay Gupta Substitution,2,3480,58',18003,0,0,1980-01-01,0.0,0.0,0.0,0.0,0.0,0.0,369864.0,Jay Gupta,2024-10-05 05:40:03
12880,719940,7,43918174,76,Redeem Tlang (NorthEast United FC) Substitution at 58',Redeem Tlang Substitution,2,3480,58',18004,0,0,1980-01-01,0.0,0.0,0.0,0.0,0.0,0.0,268506.0,Redeem Tlang,2024-10-05 05:40:03
12880,719940,6,43918173,76,Jay Gupta (FC Goa) Substitution at 58',Jay Gupta Substitution,2,3480,58',18003,0,0,1980-01-01,0.0,0.0,0.0,0.0,0.0,0.0,281355.0,Nim Dorjee Tamang,2024-10-05 05:40:03
12880,719940,7,43918174,76,Redeem Tlang (NorthEast United FC) Substitution at 58',Redeem Tlang Substitution,2,3480,58',18004,0,0,1980-01-01,0.0,0.0,0.0,0.0,0.0,0.0,310367.0,Huidrom Thoi Singh,2024-10-05 05:40:03
12880,719940,8,43918178,76,Rowllin Borges (FC Goa) Substitution at 66',Rowllin Borges Substitution,2,3960,66',18003,0,0,1980-01-01,0.0,0.0,0.0,0.0,0.0,0.0,226916.0,Rowllin Borges,2024-10-05 05:40:03
12880,719940,8,43918178,76,Rowllin Borges (FC Goa) Substitution at 66',Rowllin Borges Substitution,2,3960,66',18003,0,0,1980-01-01,0.0,0.0,0.0,0.0,0.0,0.0,299749.0,Ayush Dev Chhetri,2024-10-05 05:40:03
12880,719940,9,43918182,76,Hamza Regragui (NorthEast United FC) Substitution at 77',Hamza Regragui Substitution,2,4620,77',18004,0,0,1980-01-01,0.0,0.0,0.0,0.0,0.0,0.0,273077.0,Hamza Regragui,2024-10-05 05:40:03
12880,719940,10,43918183,76,Parthib Gogoi (NorthEast United FC) Substitution at 77',Parthib Gogoi Substitution,2,4620,77',18004,0,0,1980-01-01,0.0,0.0,0.0,0.0,0.0,0.0,311671.0,Parthib Gogoi,2024-10-05 05:40:03
12880,719940,9,43918182,76,Hamza Regragui (NorthEast United FC) Substitution at 77',Hamza Regragui Substitution,2,4620,77',18004,0,0,1980-01-01,0.0,0.0,0.0,0.0,0.0,0.0,253167.0,Nestor Albiach,2024-10-05 05:40:03
12880,719940,10,43918183,76,Parthib Gogoi (NorthEast United FC) Substitution at 77',Parthib Gogoi Substitution,2,4620,77',18004,0,0,1980-01-01,0.0,0.0,0.0,0.0,0.0,0.0,299706.0,Jithin Ms,2024-10-05 05:40:03
12880,719940,11,43918187,76,Brison Fernandes (FC Goa) Substitution at 80',Brison Fernandes Substitution,2,4800,80',18003,0,0,1980-01-01,0.0,0.0,0.0,0.0,0.0,0.0,329978.0,Brison Fernandes,2024-10-05 05:40:03
12880,719940,11,43918187,76,Brison Fernandes (FC Goa) Substitution at 80',Brison Fernandes Substitution,2,4800,80',18003,0,0,1980-01-01,0.0,0.0,0.0,0.0,0.0,0.0,235238.0,Udanta Singh,2024-10-05 05:40:03
12880,719940,12,43918188,94,Robin Yadav (NorthEast United FC) Yellow Card at 82',Robin Yadav Yellow Card,2,4920,82',18004,0,0,1980-01-01,0.0,0.0,0.0,0.0,0.0,0.0,370218.0,Robin Yadav,2024-10-05 05:40:03
12880,719940,13,43918190,76,Bekey Oram (NorthEast United FC) Substitution at 85',Bekey Oram Substitution,2,5100,85',18004,0,0,1980-01-01,0.0,0.0,0.0,0.0,0.0,0.0,369918.0,Bekey Oram,2024-10-05 05:40:03
12880,719940,14,43918191,76,Guillermo Fernandez (NorthEast United FC) Substitution at 85',Guillermo Fernandez Substitution,2,5100,85',18004,0,0,1980-01-01,0.0,0.0,0.0,0.0,0.0,0.0,165183.0,Guillermo Fernandez,2024-10-05 05:40:03
12880,719940,13,43918190,76,Bekey Oram (NorthEast United FC) Substitution at 85',Bekey Oram Substitution,2,5100,85',18004,0,0,1980-01-01,0.0,0.0,0.0,0.0,0.0,0.0,332535.0,Buanthanglun Samte,2024-10-05 05:40:03
12880,719940,14,43918191,76,Guillermo Fernandez (NorthEast United FC) Substitution at 85',Guillermo Fernandez Substitution,2,5100,85',18004,0,0,1980-01-01,0.0,0.0,0.0,0.0,0.0,0.0,299628.0,Alaeddine Ajaray,2024-10-05 05:40:03
12880,719940,15,43918195,70,Borja Herrera (FC Goa) Goal at 94',Borja Herrera Goal,2,5400,90'+4',18003,0,0,1980-01-01,0.0,0.0,0.0,0.0,0.0,0.0,259852.0,Borja Herrera,2024-10-05 05:40:03
12880,719940,16,43918196,93,Robin Yadav (NorthEast United FC) Red Card at 98',Robin Yadav Red Card,2,5400,90'+8',18004,0,0,1980-01-01,0.0,0.0,0.0,0.0,0.0,0.0,370218.0,Robin Yadav,2024-10-05 05:40:03
12880,719941,1,43923659,94,Nandha Kumar Sekar (SC East Bengal) Yellow Card at 15',Nandha Kumar Sekar Yellow Card,1,900,15',8897,0,0,1980-01-01,0.0,0.0,0.0,0.0,0.0,0.0,268650.0,Nandha Kumar Sekar,2024-10-07 05:34:46
12880,719941,2,43923689,70,Rei Tachikawa (Jamshedpur FC) Goal at 21',Rei Tachikawa Goal,1,1260,21',18850,0,0,1980-01-01,0.0,0.0,0.0,0.0,0.0,0.0,369863.0,Rei Tachikawa,2024-10-07 05:34:46
12880,719941,3,43923768,94,Stephen Eze (Jamshedpur FC) Yellow Card at 30',Stephen Eze Yellow Card,1,1800,30',18850,0,0,1980-01-01,0.0,0.0,0.0,0.0,0.0,0.0,232717.0,Stephen Eze,2024-10-07 05:34:46
12880,719941,4,43923780,94,Cleiton Silva (SC East Bengal) Yellow Card at 30',Cleiton Silva Yellow Card,1,1800,30',8897,0,0,1980-01-01,0.0,0.0,0.0,0.0,0.0,0.0,218380.0,Cleiton Silva,2024-10-07 05:34:46
12880,719941,5,43923818,76,Javier Siverio (Jamshedpur FC) Substitution at 33',Javier Siverio Substitution,1,1980,33',18850,0,0,1980-01-01,0.0,0.0,0.0,0.0,0.0,0.0,301693.0,Javier Siverio,2024-10-07 05:34:46
12880,719941,5,43923818,76,Javier Siverio (Jamshedpur FC) Substitution at 33',Javier Siverio Substitution,1,1980,33',18850,0,0,1980-01-01,0.0,0.0,0.0,0.0,0.0,0.0,369863.0,Rei Tachikawa,2024-10-07 05:34:46
12880,719941,6,43929985,94,Hector Yuste (SC East Bengal) Yellow Card at 42',Hector Yuste Yellow Card,1,2520,42',8897,0,0,1980-01-01,0.0,0.0,0.0,0.0,0.0,0.0,140293.0,Hector Yuste,2024-10-07 05:34:46
12880,719941,7,43924245,76,Vishnu PV (SC East Bengal) Substitution at 60',Vishnu PV Substitution,2,3600,60',8897,0,0,1980-01-01,0.0,0.0,0.0,0.0,0.0,0.0,373655.0,Vishnu PV,2024-10-07 05:34:46
12880,719941,7,43924245,76,Vishnu PV (SC East Bengal) Substitution at 60',Vishnu PV Substitution,2,3600,60',8897,0,0,1980-01-01,0.0,0.0,0.0,0.0,0.0,0.0,282595.0,Naorem Mahesh Singh,2024-10-07 05:34:46
12880,719941,8,43924296,117,Saul Crespo (SC East Bengal) Shot Off Target at 64',Saul Crespo Shot Off Target,2,3840,64',8897,0,0,1980-01-01,0.0,0.0,0.0,0.0,0.0,0.0,264194.0,Saul Crespo,2024-10-07 05:34:46
12880,719941,9,43924356,76,Seminlen Doungel (Jamshedpur FC) Substitution at 68',Seminlen Doungel Substitution,2,4080,68',18850,0,0,1980-01-01,0.0,0.0,0.0,0.0,0.0,0.0,227912.0,Seminlen Doungel,2024-10-07 05:34:46
12880,719941,10,43924357,94,Madih Talal (SC East Bengal) Yellow Card at 68',Madih Talal Yellow Card,2,4080,68',8897,0,0,1980-01-01,0.0,0.0,0.0,0.0,0.0,0.0,259024.0,Madih Talal,2024-10-07 05:34:46
12880,719941,9,43924356,76,Seminlen Doungel (Jamshedpur FC) Substitution at 68',Seminlen Doungel Substitution,2,4080,68',18850,0,0,1980-01-01,0.0,0.0,0.0,0.0,0.0,0.0,370233.0,Mohammed Sanan K,2024-10-07 05:34:46
12880,719941,11,43924368,97,Lalchungnunga (SC East Bengal) Own Goal at 70',Lalchungnunga Own Goal,2,4200,70',18850,0,0,1980-01-01,0.0,0.0,0.0,0.0,0.0,0.0,,Lalchungnunga,2024-10-07 05:34:46
12880,719941,12,43924446,76,Aniket Jadhav (Jamshedpur FC) Substitution at 75',Aniket Jadhav Substitution,2,4500,75',18850,0,0,1980-01-01,0.0,0.0,0.0,0.0,0.0,0.0,266612.0,Aniket Jadhav,2024-10-07 05:34:46
12880,719941,12,43924446,76,Aniket Jadhav (Jamshedpur FC) Substitution at 75',Aniket Jadhav Substitution,2,4500,75',18850,0,0,1980-01-01,0.0,0.0,0.0,0.0,0.0,0.0,281348.0,Imran Khan,2024-10-07 05:34:46
12880,719941,13,43924447,76,Lazar Cirkovic (Jamshedpur FC) Substitution at 76',Lazar Cirkovic Substitution,2,4560,76',18850,0,0,1980-01-01,0.0,0.0,0.0,0.0,0.0,0.0,195219.0,Lazar Cirkovic,2024-10-07 05:34:46
12880,719941,14,43924448,76,Mobashir Rahman (Jamshedpur FC) Substitution at 76',Mobashir Rahman Substitution,2,4560,76',18850,0,0,1980-01-01,0.0,0.0,0.0,0.0,0.0,0.0,281349.0,Mobashir Rahman,2024-10-07 05:34:46
12880,719941,13,43924447,76,Lazar Cirkovic (Jamshedpur FC) Substitution at 76',Lazar Cirkovic Substitution,2,4560,76',18850,0,0,1980-01-01,0.0,0.0,0.0,0.0,0.0,0.0,179992.0,Jordan Murray,2024-10-07 05:34:46
12880,719941,14,43924448,76,Mobashir Rahman (Jamshedpur FC) Substitution at 76',Mobashir Rahman Substitution,2,4560,76',18850,0,0,1980-01-01,0.0,0.0,0.0,0.0,0.0,0.0,268287.0,Sourav Das,2024-10-07 05:34:46
12880,719941,15,43924505,76,David Lalhlansanga (SC East Bengal) Substitution at 80',David Lalhlansanga Substitution,2,4800,80',8897,0,0,1980-01-01,0.0,0.0,0.0,0.0,0.0,0.0,299747.0,David Lalhlansanga,2024-10-07 05:34:46
12880,719941,16,43924506,76,Aman C (SC East Bengal) Substitution at 80',Aman C Substitution,2,4800,80',8897,0,0,1980-01-01,0.0,0.0,0.0,0.0,0.0,0.0,370230.0,Aman C,2024-10-07 05:34:46
12880,719941,15,43924505,76,David Lalhlansanga (SC East Bengal) Substitution at 80',David Lalhlansanga Substitution,2,4800,80',8897,0,0,1980-01-01,0.0,0.0,0.0,0.0,0.0,0.0,299743.0,Lalchungnunga,2024-10-07 05:34:46
12880,719941,16,43924506,76,Aman C (SC East Bengal) Substitution at 80',Aman C Substitution,2,4800,80',8897,0,0,1980-01-01,0.0,0.0,0.0,0.0,0.0,0.0,268650.0,Nandha Kumar Sekar,2024-10-07 05:34:46
12880,719941,17,43924627,94,Aniket Jadhav (Jamshedpur FC) Yellow Card at 87',Aniket Jadhav Yellow Card,2,5220,87',18850,0,0,1980-01-01,0.0,0.0,0.0,0.0,0.0,0.0,266612.0,Aniket Jadhav,2024-10-07 05:34:46
12880,719942,1,43925449,70,Jamie Maclaren (Mohun Bagan Super Giant) Goal at 8',Jamie Maclaren Goal,1,480,8',20774,0,0,1980-01-01,0.0,0.0,0.0,0.0,0.0,0.0,187777.0,Jamie Maclaren,2024-10-07 05:34:46
12880,719942,2,43925897,94,Carlos Henrique França Freires (Mohammedan SC) Yellow Card at 19',Carlos Henrique França Freires Y,1,1140,19',20842,0,0,1980-01-01,0.0,0.0,0.0,0.0,0.0,0.0,270589.0,Carlos Henrique França Freires,2024-10-07 05:34:46
12880,719942,3,43926137,94,Alexis Gómez (Mohammedan SC) Yellow Card at 24',Alexis Gómez Yellow Card,1,1440,24',20842,0,0,1980-01-01,0.0,0.0,0.0,0.0,0.0,0.0,303114.0,Alexis Gómez,2024-10-07 05:34:46
12880,719942,4,43926190,94,Jamie Maclaren (Mohun Bagan Super Giant) Yellow Card at 28',Jamie Maclaren Yellow Card,1,1680,28',20774,0,0,1980-01-01,0.0,0.0,0.0,0.0,0.0,0.0,187777.0,Jamie Maclaren,2024-10-07 05:34:46
12880,719942,5,43926239,94,Joseph Adjei (Mohammedan SC) Yellow Card at 31',Joseph Adjei Yellow Card,1,1860,31',20842,0,0,1980-01-01,0.0,0.0,0.0,0.0,0.0,0.0,219311.0,Joseph Adjei,2024-10-07 05:34:46
12880,719942,6,43926274,70,Subashish Bose (Mohun Bagan Super Giant) Goal at 31',Subashish Bose Goal,1,1860,31',20774,0,0,1980-01-01,0.0,0.0,0.0,0.0,0.0,0.0,268007.0,Subashish Bose,2024-10-07 05:34:46
12880,719942,7,43926366,94,Gaurav Bora (Mohammedan SC) Yellow Card at 33',Gaurav Bora Yellow Card,1,1980,33',20842,0,0,1980-01-01,0.0,0.0,0.0,0.0,0.0,0.0,268382.0,Gaurav Bora,2024-10-07 05:34:46
12880,719942,8,43926447,70,Greg Stewart (Mohun Bagan Super Giant) Goal at 36',Greg Stewart Goal,1,2160,36',20774,0,0,1980-01-01,0.0,0.0,0.0,0.0,0.0,0.0,149777.0,Greg Stewart,2024-10-07 05:34:46
12880,719942,9,43927563,76,K Lalrinfela (Mohammedan SC) Substitution at 45',K Lalrinfela Substitution,2,2700,45',20842,0,0,1980-01-01,0.0,0.0,0.0,0.0,0.0,0.0,354746.0,K Lalrinfela,2024-10-07 05:34:46
12880,719942,10,43927564,76,Sagolsem Bikash Singh (Mohammedan SC) Substitution at 45',Sagolsem Bikash Singh Substituti,2,2700,45',20842,0,0,1980-01-01,0.0,0.0,0.0,0.0,0.0,0.0,299705.0,Sagolsem Bikash Singh,2024-10-07 05:34:46
12880,719942,11,43927565,76,Cèsar Lobi Manzoki (Mohammedan SC) Substitution at 45',Cèsar Lobi Manzoki Substitution,2,2700,45',20842,0,0,1980-01-01,0.0,0.0,0.0,0.0,0.0,0.0,247121.0,Cèsar Lobi Manzoki,2024-10-07 05:34:46
12880,719942,9,43927563,76,K Lalrinfela (Mohammedan SC) Substitution at 45',K Lalrinfela Substitution,2,2700,45',20842,0,0,1980-01-01,0.0,0.0,0.0,0.0,0.0,0.0,266619.0,Kiyam Amarjit Singh,2024-10-07 05:34:46
12880,719942,10,43927564,76,Sagolsem Bikash Singh (Mohammedan SC) Substitution at 45',Sagolsem Bikash Singh Substituti,2,2700,45',20842,0,0,1980-01-01,0.0,0.0,0.0,0.0,0.0,0.0,268495.0,Makan Chote,2024-10-07 05:34:46
12880,719942,11,43927565,76,Cèsar Lobi Manzoki (Mohammedan SC) Substitution at 45',Cèsar Lobi Manzoki Substitution,2,2700,45',20842,0,0,1980-01-01,0.0,0.0,0.0,0.0,0.0,0.0,270589.0,Carlos Henrique França Freires,2024-10-07 05:34:46
12880,719942,12,43927794,94,Manvir Singh (Mohun Bagan Super Giant) Yellow Card at 54',Manvir Singh Yellow Card,2,3240,54',20774,0,0,1980-01-01,0.0,0.0,0.0,0.0,0.0,0.0,262098.0,Manvir Singh,2024-10-07 05:34:46
12880,719942,13,43928628,94,Vanlalzuidika Chhakchhuak (Mohammedan SC) Yellow Card at 67',Vanlalzuidika Chhakchhuak Yellow,2,4020,67',20842,0,0,1980-01-01,0.0,0.0,0.0,0.0,0.0,0.0,311376.0,Vanlalzuidika Chhakchhuak,2024-10-07 05:34:46
12880,719942,14,43928629,76,Samad Mallick (Mohammedan SC) Substitution at 67',Samad Mallick Substitution,2,4020,67',20842,0,0,1980-01-01,0.0,0.0,0.0,0.0,0.0,0.0,268358.0,Samad Mallick,2024-10-07 05:34:46
12880,719942,14,43928629,76,Samad Mallick (Mohammedan SC) Substitution at 67',Samad Mallick Substitution,2,4020,67',20842,0,0,1980-01-01,0.0,0.0,0.0,0.0,0.0,0.0,311376.0,Vanlalzuidika Chhakchhuak,2024-10-07 05:34:46
12880,719942,15,43928972,76,Dimitrios Petratos (Mohun Bagan Super Giant) Substitution at 75',Dimitrios Petratos Substitution,2,4500,75',20774,0,0,1980-01-01,0.0,0.0,0.0,0.0,0.0,0.0,151922.0,Dimitrios Petratos,2024-10-07 05:34:46
12880,719942,16,43928973,76,Suhail Bhat (Mohun Bagan Super Giant) Substitution at 75',Suhail Bhat Substitution,2,4500,75',20774,0,0,1980-01-01,0.0,0.0,0.0,0.0,0.0,0.0,336719.0,Suhail Bhat,2024-10-07 05:34:46
12880,719942,15,43928972,76,Dimitrios Petratos (Mohun Bagan Super Giant) Substitution at 75',Dimitrios Petratos Substitution,2,4500,75',20774,0,0,1980-01-01,0.0,0.0,0.0,0.0,0.0,0.0,187777.0,Jamie Maclaren,2024-10-07 05:34:46
12880,719942,16,43928973,76,Suhail Bhat (Mohun Bagan Super Giant) Substitution at 75',Suhail Bhat Substitution,2,4500,75',20774,0,0,1980-01-01,0.0,0.0,0.0,0.0,0.0,0.0,262098.0,Manvir Singh,2024-10-07 05:34:46
12880,719942,17,43929125,76,Wahengbam Angousana Luwang (Mohammedan SC) Substitution at 76',Wahengbam Angousana Luwang Subst,2,4560,76',20842,0,0,1980-01-01,0.0,0.0,0.0,0.0,0.0,0.0,299734.0,Wahengbam Angousana Luwang,2024-10-07 05:34:46
12880,719942,17,43929125,76,Wahengbam Angousana Luwang (Mohammedan SC) Substitution at 76',Wahengbam Angousana Luwang Subst,2,4560,76',20842,0,0,1980-01-01,0.0,0.0,0.0,0.0,0.0,0.0,202265.0,Mirjalol Kosimov,2024-10-07 05:34:46
12880,719942,18,43929126,94,Tom Aldred (Mohun Bagan Super Giant) Yellow Card at 78',Tom Aldred Yellow Card,2,4680,78',20774,0,0,1980-01-01,0.0,0.0,0.0,0.0,0.0,0.0,129654.0,Tom Aldred,2024-10-07 05:34:46
12880,719942,19,43929286,76,Ashique Kuruniyan (Mohun Bagan Super Giant) Substitution at 82',Ashique Kuruniyan Substitution,2,4920,82',20774,0,0,1980-01-01,0.0,0.0,0.0,0.0,0.0,0.0,268080.0,Ashique Kuruniyan,2024-10-07 05:34:46
12880,719942,20,43929287,76,Deepak Tangri (Mohun Bagan Super Giant) Substitution at 82',Deepak Tangri Substitution,2,4920,82',20774,0,0,1980-01-01,0.0,0.0,0.0,0.0,0.0,0.0,268566.0,Deepak Tangri,2024-10-07 05:34:46
12880,719942,19,43929286,76,Ashique Kuruniyan (Mohun Bagan Super Giant) Substitution at 82',Ashique Kuruniyan Substitution,2,4920,82',20774,0,0,1980-01-01,0.0,0.0,0.0,0.0,0.0,0.0,149777.0,Greg Stewart,2024-10-07 05:34:46
12880,719942,20,43929287,76,Deepak Tangri (Mohun Bagan Super Giant) Substitution at 82',Deepak Tangri Substitution,2,4920,82',20774,0,0,1980-01-01,0.0,0.0,0.0,0.0,0.0,0.0,246791.0,Anirudh Thapa,2024-10-07 05:34:46
12880,719942,21,43929288,94,Samad Mallick (Mohammedan SC) Yellow Card at 83',Samad Mallick Yellow Card,2,4980,83',20842,0,0,1980-01-01,0.0,0.0,0.0,0.0,0.0,0.0,268358.0,Samad Mallick,2024-10-07 05:34:46
12880,719943,1,43996092,70,Nestor Albiach (NorthEast United FC) Goal at 5',Nestor Albiach Goal,1,300,5',18004,0,0,1980-01-01,0.0,0.0,0.0,0.0,0.0,0.0,253167.0,Nestor Albiach,2024-10-19 05:14:59
12880,719943,2,43996093,70,Jordán  (Chennaiyin FC) Goal at 25',Jordán  Goal,1,1500,25',18000,0,0,1980-01-01,0.0,0.0,0.0,0.0,0.0,0.0,98237.0,Jordán ,2024-10-19 05:14:59
12880,719943,3,43996094,98,Lukas Brambilla (Chennaiyin FC) Penalty - Scored at 36',Lukas Brambilla Penalty - Scored,1,2160,36',18000,0,0,1980-01-01,0.0,0.0,0.0,0.0,0.0,0.0,385952.0,Lukas Brambilla,2024-10-19 05:14:59
12880,719943,4,43996095,70,Jordán  (Chennaiyin FC) Goal at 51',Jordán  Goal,2,3060,51',18000,0,0,1980-01-01,0.0,0.0,0.0,0.0,0.0,0.0,98237.0,Jordán ,2024-10-19 05:14:59
12880,719943,5,43996096,76,Mohammed Ali Bemammer (NorthEast United FC) Substitution at 55',Mohammed Ali Bemammer Substituti,2,3300,55',18004,0,0,1980-01-01,0.0,0.0,0.0,0.0,0.0,0.0,273134.0,Mohammed Ali Bemammer,2024-10-19 05:14:59
12880,719943,5,43996096,76,Mohammed Ali Bemammer (NorthEast United FC) Substitution at 55',Mohammed Ali Bemammer Substituti,2,3300,55',18004,0,0,1980-01-01,0.0,0.0,0.0,0.0,0.0,0.0,273077.0,Hamza Regragui,2024-10-19 05:14:59
12880,719943,6,43996097,94,Mohammed Ali Bemammer (NorthEast United FC) Yellow Card at 60',Mohammed Ali Bemammer Yellow Car,2,3600,60',18004,0,0,1980-01-01,0.0,0.0,0.0,0.0,0.0,0.0,273134.0,Mohammed Ali Bemammer,2024-10-19 05:14:59
12880,719943,7,43996098,76,Daniel Chukwu Chima (Chennaiyin FC) Substitution at 63',Daniel Chukwu Chima Substitution,2,3780,63',18000,0,0,1980-01-01,0.0,0.0,0.0,0.0,0.0,0.0,205635.0,Daniel Chukwu Chima,2024-10-19 05:14:59
12880,719943,7,43996098,76,Daniel Chukwu Chima (Chennaiyin FC) Substitution at 63',Daniel Chukwu Chima Substitution,2,3780,63',18000,0,0,1980-01-01,0.0,0.0,0.0,0.0,0.0,0.0,98237.0,Jordán ,2024-10-19 05:14:59
12880,719943,8,43996099,76,Huidrom Thoi Singh (NorthEast United FC) Substitution at 71',Huidrom Thoi Singh Substitution,2,4260,71',18004,0,0,1980-01-01,0.0,0.0,0.0,0.0,0.0,0.0,310367.0,Huidrom Thoi Singh,2024-10-19 05:14:59
