seasonType,eventId,playOrder,playId,typeId,text,shortText,period,clockValue,clockDisplayValue,teamId,scoringPlay,shootout,wallclock,goalPositionX,goalPositionY,fieldpositionX,fieldPositionY,fieldPosition2X,fieldPosition2Y,athleteId,participant,updateDateTime
12657,705068,2,43465649,70,Willem Geubbels (St. Gallen) Goal at 18',Willem Geubbels Goal,1,1080,18',557,0,0,1980-01-01,0.0,0.0,0.0,0.0,0.0,0.0,259744.0,Willem Geubbels,2024-07-31 09:24:43
12657,705068,3,43465699,76,Felix Mambimbi (St. Gallen) Substitution at 36',Felix Mambimbi Substitution,1,2160,36',557,0,0,1980-01-01,0.0,0.0,0.0,0.0,0.0,0.0,285975.0,Felix Mambimbi,2024-07-31 09:24:43
12657,705068,3,43465699,76,Felix Mambimbi (St. Gallen) Substitution at 36',Felix Mambimbi Substitution,1,2160,36',557,0,0,1980-01-01,0.0,0.0,0.0,0.0,0.0,0.0,217526.0,Chadrac Akolo,2024-07-31 09:24:43
12657,705068,4,43465883,76,Jaouen Hadjam (Young Boys) Substitution at 45',Jaouen Hadjam Substitution,2,2700,45',2722,0,0,1980-01-01,0.0,0.0,0.0,0.0,0.0,0.0,306033.0,Jaouen Hadjam,2024-07-31 09:24:43
12657,705068,5,43465884,76,Miguel Chaiwa (Young Boys) Substitution at 45',Miguel Chaiwa Substitution,2,2700,45',2722,0,0,1980-01-01,0.0,0.0,0.0,0.0,0.0,0.0,330824.0,Miguel Chaiwa,2024-07-31 09:24:43
12657,705068,4,43465883,76,Jaouen Hadjam (Young Boys) Substitution at 45',Jaouen Hadjam Substitution,2,2700,45',2722,0,0,1980-01-01,0.0,0.0,0.0,0.0,0.0,0.0,318778.0,Noah Persson,2024-07-31 09:24:43
12657,705068,5,43465884,76,Miguel Chaiwa (Young Boys) Substitution at 45',Miguel Chaiwa Substitution,2,2700,45',2722,0,0,1980-01-01,0.0,0.0,0.0,0.0,0.0,0.0,284592.0,Cheikh Niasse,2024-07-31 09:24:43
12657,705068,6,43465910,70,Felix Mambimbi (St. Gallen) Goal at 51',Felix Mambimbi Goal,2,3060,51',557,0,0,1980-01-01,0.0,0.0,0.0,0.0,0.0,0.0,285975.0,Felix Mambimbi,2024-07-31 09:24:43
12657,705068,7,43465940,70,Christian Witzig (St. Gallen) Goal at 55',Christian Witzig Goal,2,3300,55',557,0,0,1980-01-01,0.0,0.0,0.0,0.0,0.0,0.0,320983.0,Christian Witzig,2024-07-31 09:24:43
12657,705068,8,43465989,76,Victor Ruiz (St. Gallen) Substitution at 57',Victor Ruiz Substitution,2,3420,57',557,0,0,1980-01-01,0.0,0.0,0.0,0.0,0.0,0.0,284245.0,Victor Ruiz,2024-07-31 09:24:43
12657,705068,8,43465989,76,Victor Ruiz (St. Gallen) Substitution at 57',Victor Ruiz Substitution,2,3420,57',557,0,0,1980-01-01,0.0,0.0,0.0,0.0,0.0,0.0,320983.0,Christian Witzig,2024-07-31 09:24:43
12657,705068,9,43465990,76,Corsin Konietzke (St. Gallen) Substitution at 58',Corsin Konietzke Substitution,2,3480,58',557,0,0,1980-01-01,0.0,0.0,0.0,0.0,0.0,0.0,379820.0,Corsin Konietzke,2024-07-31 09:24:43
12657,705068,10,43465991,76,Konrad Faber (St. Gallen) Substitution at 58',Konrad Faber Substitution,2,3480,58',557,0,0,1980-01-01,0.0,0.0,0.0,0.0,0.0,0.0,321205.0,Konrad Faber,2024-07-31 09:24:43
12657,705068,11,43465992,76,Kastiot Imeri (Young Boys) Substitution at 58',Kastiot Imeri Substitution,2,3480,58',2722,0,0,1980-01-01,0.0,0.0,0.0,0.0,0.0,0.0,289527.0,Kastiot Imeri,2024-07-31 09:24:43
12657,705068,12,43465993,76,Zachary Athekame (Young Boys) Substitution at 58',Zachary Athekame Substitution,2,3480,58',2722,0,0,1980-01-01,0.0,0.0,0.0,0.0,0.0,0.0,370758.0,Zachary Athekame,2024-07-31 09:24:43
12657,705068,9,43465990,76,Corsin Konietzke (St. Gallen) Substitution at 58',Corsin Konietzke Substitution,2,3480,58',557,0,0,1980-01-01,0.0,0.0,0.0,0.0,0.0,0.0,218836.0,Lukas Görtler,2024-07-31 09:24:43
12657,705068,10,43465991,76,Konrad Faber (St. Gallen) Substitution at 58',Konrad Faber Substitution,2,3480,58',557,0,0,1980-01-01,0.0,0.0,0.0,0.0,0.0,0.0,307242.0,Isaac Schmidt,2024-07-31 09:24:43
12657,705068,11,43465992,76,Kastiot Imeri (Young Boys) Substitution at 58',Kastiot Imeri Substitution,2,3480,58',2722,0,0,1980-01-01,0.0,0.0,0.0,0.0,0.0,0.0,232492.0,Meschack Elia,2024-07-31 09:24:43
12657,705068,12,43465993,76,Zachary Athekame (Young Boys) Substitution at 58',Zachary Athekame Substitution,2,3480,58',2722,0,0,1980-01-01,0.0,0.0,0.0,0.0,0.0,0.0,333320.0,Lewin Blum,2024-07-31 09:24:43
12657,705068,13,43466039,76,Moustapha Cissé (St. Gallen) Substitution at 64',Moustapha Cissé Substitution,2,3840,64',557,0,0,1980-01-01,0.0,0.0,0.0,0.0,0.0,0.0,337127.0,Moustapha Cissé,2024-07-31 09:24:43
12657,705068,13,43466039,76,Moustapha Cissé (St. Gallen) Substitution at 64',Moustapha Cissé Substitution,2,3840,64',557,0,0,1980-01-01,0.0,0.0,0.0,0.0,0.0,0.0,259744.0,Willem Geubbels,2024-07-31 09:24:43
12657,705068,14,43466084,76,Ebrima Colley (Young Boys) Substitution at 76',Ebrima Colley Substitution,2,4560,76',2722,0,0,1980-01-01,0.0,0.0,0.0,0.0,0.0,0.0,287077.0,Ebrima Colley,2024-07-31 09:24:43
12657,705068,14,43466084,76,Ebrima Colley (Young Boys) Substitution at 76',Ebrima Colley Substitution,2,4560,76',2722,0,0,1980-01-01,0.0,0.0,0.0,0.0,0.0,0.0,307893.0,Joel Monteiro,2024-07-31 09:24:43
12657,705068,15,43466096,94,Darian Males (Young Boys) Yellow Card at 81',Darian Males Yellow Card,2,4860,81',2722,0,0,1980-01-01,0.0,0.0,0.0,0.0,0.0,0.0,290139.0,Darian Males,2024-07-31 09:24:43
12657,705069,1,43489980,76,Hicham Mahou (FC Lugano) Substitution at 54',Hicham Mahou Substitution,2,3240,54',7672,0,0,1980-01-01,0.0,0.0,0.0,0.0,0.0,0.0,250856.0,Hicham Mahou,2024-08-04 09:28:16
12657,705069,1,43489980,76,Hicham Mahou (FC Lugano) Substitution at 54',Hicham Mahou Substitution,2,3240,54',7672,0,0,1980-01-01,0.0,0.0,0.0,0.0,0.0,0.0,162156.0,Mattia Bottani,2024-08-04 09:28:16
12657,705069,2,43490008,70,Dereck Kutesa (Servette) Goal at 61',Dereck Kutesa Goal,2,3660,61',20032,0,0,1980-01-01,0.0,0.0,0.0,0.0,0.0,0.0,238490.0,Dereck Kutesa,2024-08-04 09:28:16
12657,705069,3,43490043,76,Théo Magnin (Servette) Substitution at 67',Théo Magnin Substitution,2,4020,67',20032,0,0,1980-01-01,0.0,0.0,0.0,0.0,0.0,0.0,334979.0,Théo Magnin,2024-08-04 09:28:16
12657,705069,4,43490044,76,Jeremy Guillemenot (Servette) Substitution at 67',Jeremy Guillemenot Substitution,2,4020,67',20032,0,0,1980-01-01,0.0,0.0,0.0,0.0,0.0,0.0,261466.0,Jeremy Guillemenot,2024-08-04 09:28:16
12657,705069,5,43490052,76,Renato Steffen (FC Lugano) Substitution at 67',Renato Steffen Substitution,2,4020,67',7672,0,0,1980-01-01,0.0,0.0,0.0,0.0,0.0,0.0,193462.0,Renato Steffen,2024-08-04 09:28:16
12657,705069,6,43490053,76,Hadj Mahmoud (FC Lugano) Substitution at 67',Hadj Mahmoud Substitution,2,4020,67',7672,0,0,1980-01-01,0.0,0.0,0.0,0.0,0.0,0.0,299861.0,Hadj Mahmoud,2024-08-04 09:28:16
12657,705069,3,43490043,76,Théo Magnin (Servette) Substitution at 67',Théo Magnin Substitution,2,4020,67',20032,0,0,1980-01-01,0.0,0.0,0.0,0.0,0.0,0.0,238490.0,Dereck Kutesa,2024-08-04 09:28:16
12657,705069,4,43490044,76,Jeremy Guillemenot (Servette) Substitution at 67',Jeremy Guillemenot Substitution,2,4020,67',20032,0,0,1980-01-01,0.0,0.0,0.0,0.0,0.0,0.0,199645.0,Enzo Crivelli,2024-08-04 09:28:16
12657,705069,5,43490052,76,Renato Steffen (FC Lugano) Substitution at 67',Renato Steffen Substitution,2,4020,67',7672,0,0,1980-01-01,0.0,0.0,0.0,0.0,0.0,0.0,305659.0,Yanis Cimignani,2024-08-04 09:28:16
12657,705069,6,43490053,76,Hadj Mahmoud (FC Lugano) Substitution at 67',Hadj Mahmoud Substitution,2,4020,67',7672,0,0,1980-01-01,0.0,0.0,0.0,0.0,0.0,0.0,223234.0,Anto Grgic,2024-08-04 09:28:16
12657,705069,7,43490054,94,Ousmane Doumbia (FC Lugano) Yellow Card at 68',Ousmane Doumbia Yellow Card,2,4080,68',7672,0,0,1980-01-01,0.0,0.0,0.0,0.0,0.0,0.0,308847.0,Ousmane Doumbia,2024-08-04 09:28:16
12657,705069,8,43490068,70,Hadj Mahmoud (FC Lugano) Goal at 73',Hadj Mahmoud Goal,2,4380,73',7672,0,0,1980-01-01,0.0,0.0,0.0,0.0,0.0,0.0,299861.0,Hadj Mahmoud,2024-08-04 09:28:16
12657,705069,9,43490092,97,Bradley Mazikou (Servette) Own Goal at 78',Bradley Mazikou Own Goal,2,4680,78',7672,0,0,1980-01-01,0.0,0.0,0.0,0.0,0.0,0.0,,Bradley Mazikou,2024-08-04 09:28:16
12657,705069,10,43490105,76,Julian von Moos (Servette) Substitution at 80',Julian von Moos Substitution,2,4800,80',20032,0,0,1980-01-01,0.0,0.0,0.0,0.0,0.0,0.0,275426.0,Julian von Moos,2024-08-04 09:28:16
12657,705069,10,43490105,76,Julian von Moos (Servette) Substitution at 80',Julian von Moos Substitution,2,4800,80',20032,0,0,1980-01-01,0.0,0.0,0.0,0.0,0.0,0.0,308777.0,Keigo Tsunemoto,2024-08-04 09:28:16
12657,705069,11,43490124,76,Shkelqim Vladi (FC Lugano) Substitution at 83',Shkelqim Vladi Substitution,2,4980,83',7672,0,0,1980-01-01,0.0,0.0,0.0,0.0,0.0,0.0,350782.0,Shkelqim Vladi,2024-08-04 09:28:16
12657,705069,12,43490125,76,Daniel Correia (FC Lugano) Substitution at 83',Daniel Correia Substitution,2,4980,83',7672,0,0,1980-01-01,0.0,0.0,0.0,0.0,0.0,0.0,319631.0,Daniel Correia,2024-08-04 09:28:16
12657,705069,11,43490124,76,Shkelqim Vladi (FC Lugano) Substitution at 83',Shkelqim Vladi Substitution,2,4980,83',7672,0,0,1980-01-01,0.0,0.0,0.0,0.0,0.0,0.0,167387.0,Kacper Przybylko,2024-08-04 09:28:16
12657,705069,12,43490125,76,Daniel Correia (FC Lugano) Substitution at 83',Daniel Correia Substitution,2,4980,83',7672,0,0,1980-01-01,0.0,0.0,0.0,0.0,0.0,0.0,341382.0,Uran Bislimi,2024-08-04 09:28:16
12657,705069,13,43490126,70,Renato Steffen (FC Lugano) Goal at 84',Renato Steffen Goal,2,5040,84',7672,0,0,1980-01-01,0.0,0.0,0.0,0.0,0.0,0.0,193462.0,Renato Steffen,2024-08-04 09:28:16
12657,705069,14,43490135,94,Renato Steffen (FC Lugano) Yellow Card at 85',Renato Steffen Yellow Card,2,5100,85',7672,0,0,1980-01-01,0.0,0.0,0.0,0.0,0.0,0.0,193462.0,Renato Steffen,2024-08-04 09:28:16
12657,705069,15,43490136,76,Mamadou Simbakoli (Servette) Substitution at 86',Mamadou Simbakoli Substitution,2,5160,86',20032,0,0,1980-01-01,0.0,0.0,0.0,0.0,0.0,0.0,312399.0,Mamadou Simbakoli,2024-08-04 09:28:16
12657,705069,15,43490136,76,Mamadou Simbakoli (Servette) Substitution at 86',Mamadou Simbakoli Substitution,2,5160,86',20032,0,0,1980-01-01,0.0,0.0,0.0,0.0,0.0,0.0,290184.0,Alexis Antunes,2024-08-04 09:28:16
12657,705070,1,43489770,94,Adrian Leon Barisic (FC Basel) Yellow Card at 20',Adrian Leon Barisic Yellow Card,1,1200,20',989,0,0,1980-01-01,0.0,0.0,0.0,0.0,0.0,0.0,322209.0,Adrian Leon Barisic,2024-08-04 09:28:16
12657,705070,2,43489777,94,Pascal Schürpf (Grasshoppers) Yellow Card at 22',Pascal Schürpf Yellow Card,1,1320,22',492,0,0,1980-01-01,0.0,0.0,0.0,0.0,0.0,0.0,126518.0,Pascal Schürpf,2024-08-04 09:28:16
12657,705070,3,43489785,70,Bénie Traoré (FC Basel) Goal at 25',Bénie Traoré Goal,1,1500,25',989,0,0,1980-01-01,0.0,0.0,0.0,0.0,0.0,0.0,312850.0,Bénie Traoré,2024-08-04 09:28:16
12657,705070,4,43489800,94,Anton Kade (FC Basel) Yellow Card at 28',Anton Kade Yellow Card,1,1680,28',989,0,0,1980-01-01,0.0,0.0,0.0,0.0,0.0,0.0,333837.0,Anton Kade,2024-08-04 09:28:16
12657,705070,5,43489840,70,Thierno Barry (FC Basel) Goal at 36',Thierno Barry Goal,1,2160,36',989,0,0,1980-01-01,0.0,0.0,0.0,0.0,0.0,0.0,301166.0,Thierno Barry,2024-08-04 09:28:16
12657,705070,6,43489878,94,Leo Leroy (FC Basel) Yellow Card at 42',Leo Leroy Yellow Card,1,2520,42',989,0,0,1980-01-01,0.0,0.0,0.0,0.0,0.0,0.0,286120.0,Leo Leroy,2024-08-04 09:28:16
12657,705070,7,43489912,94,Leon Avdullahu (FC Basel) Yellow Card at 47',Leon Avdullahu Yellow Card,1,2700,45'+2',989,0,0,1980-01-01,0.0,0.0,0.0,0.0,0.0,0.0,362590.0,Leon Avdullahu,2024-08-04 09:28:16
12657,705070,8,43489971,94,Kristers Tobers (Grasshoppers) Yellow Card at 52',Kristers Tobers Yellow Card,2,3120,52',492,0,0,1980-01-01,0.0,0.0,0.0,0.0,0.0,0.0,274560.0,Kristers Tobers,2024-08-04 09:28:16
12657,705070,9,43489975,94,Maksim Paskotši (Grasshoppers) Yellow Card at 54',Maksim Paskotši Yellow Card,2,3240,54',492,0,0,1980-01-01,0.0,0.0,0.0,0.0,0.0,0.0,305459.0,Maksim Paskotši,2024-08-04 09:28:16
12657,705070,10,43490000,70,Thierno Barry (FC Basel) Goal at 58',Thierno Barry Goal,2,3480,58',989,0,0,1980-01-01,0.0,0.0,0.0,0.0,0.0,0.0,301166.0,Thierno Barry,2024-08-04 09:28:16
12657,705070,11,43490016,76,Bradley Fink (FC Basel) Substitution at 60',Bradley Fink Substitution,2,3600,60',989,0,0,1980-01-01,0.0,0.0,0.0,0.0,0.0,0.0,340465.0,Bradley Fink,2024-08-04 09:28:16
12657,705070,12,43490017,76,Fabian Frei (FC Basel) Substitution at 60',Fabian Frei Substitution,2,3600,60',989,0,0,1980-01-01,0.0,0.0,0.0,0.0,0.0,0.0,105140.0,Fabian Frei,2024-08-04 09:28:16
12657,705070,13,43490018,76,Evans Maurin (Grasshoppers) Substitution at 60',Evans Maurin Substitution,2,3600,60',492,0,0,1980-01-01,0.0,0.0,0.0,0.0,0.0,0.0,364133.0,Evans Maurin,2024-08-04 09:28:16
12657,705070,14,43490019,76,Asumah Abubakar (Grasshoppers) Substitution at 60',Asumah Abubakar Substitution,2,3600,60',492,0,0,1980-01-01,0.0,0.0,0.0,0.0,0.0,0.0,235477.0,Asumah Abubakar,2024-08-04 09:28:16
12657,705070,15,43490020,76,Dorian Babunski (Grasshoppers) Substitution at 60',Dorian Babunski Substitution,2,3600,60',492,0,0,1980-01-01,0.0,0.0,0.0,0.0,0.0,0.0,260719.0,Dorian Babunski,2024-08-04 09:28:16
12657,705070,11,43490016,76,Bradley Fink (FC Basel) Substitution at 60',Bradley Fink Substitution,2,3600,60',989,0,0,1980-01-01,0.0,0.0,0.0,0.0,0.0,0.0,312850.0,Bénie Traoré,2024-08-04 09:28:16
12657,705070,12,43490017,76,Fabian Frei (FC Basel) Substitution at 60',Fabian Frei Substitution,2,3600,60',989,0,0,1980-01-01,0.0,0.0,0.0,0.0,0.0,0.0,286120.0,Leo Leroy,2024-08-04 09:28:16
12657,705070,13,43490018,76,Evans Maurin (Grasshoppers) Substitution at 60',Evans Maurin Substitution,2,3600,60',492,0,0,1980-01-01,0.0,0.0,0.0,0.0,0.0,0.0,181707.0,Awer Mabil,2024-08-04 09:28:16
12657,705070,14,43490019,76,Asumah Abubakar (Grasshoppers) Substitution at 60',Asumah Abubakar Substitution,2,3600,60',492,0,0,1980-01-01,0.0,0.0,0.0,0.0,0.0,0.0,126518.0,Pascal Schürpf,2024-08-04 09:28:16
12657,705070,15,43490020,76,Dorian Babunski (Grasshoppers) Substitution at 60',Dorian Babunski Substitution,2,3600,60',492,0,0,1980-01-01,0.0,0.0,0.0,0.0,0.0,0.0,317872.0,Nikolas Muci,2024-08-04 09:28:16
12657,705070,16,43490076,76,Marin Soticek (FC Basel) Substitution at 73',Marin Soticek Substitution,2,4380,73',989,0,0,1980-01-01,0.0,0.0,0.0,0.0,0.0,0.0,345481.0,Marin Soticek,2024-08-04 09:28:16
12657,705070,17,43490077,76,Nicolas Vouilloz (FC Basel) Substitution at 73',Nicolas Vouilloz Substitution,2,4380,73',989,0,0,1980-01-01,0.0,0.0,0.0,0.0,0.0,0.0,303965.0,Nicolas Vouilloz,2024-08-04 09:28:16
12657,705070,18,43490078,76,Filipe De Carvalho Ferreira (Grasshoppers) Substitution at 73',Filipe De Carvalho Ferreira Subs,2,4380,73',492,0,0,1980-01-01,0.0,0.0,0.0,0.0,0.0,0.0,320851.0,Filipe De Carvalho Ferreira,2024-08-04 09:28:16
12657,705070,16,43490076,76,Marin Soticek (FC Basel) Substitution at 73',Marin Soticek Substitution,2,4380,73',989,0,0,1980-01-01,0.0,0.0,0.0,0.0,0.0,0.0,301166.0,Thierno Barry,2024-08-04 09:28:16
12657,705070,17,43490077,76,Nicolas Vouilloz (FC Basel) Substitution at 73',Nicolas Vouilloz Substitution,2,4380,73',989,0,0,1980-01-01,0.0,0.0,0.0,0.0,0.0,0.0,340623.0,Finn Van Breemen,2024-08-04 09:28:16
12657,705070,18,43490078,76,Filipe De Carvalho Ferreira (Grasshoppers) Substitution at 73',Filipe De Carvalho Ferreira Subs,2,4380,73',492,0,0,1980-01-01,0.0,0.0,0.0,0.0,0.0,0.0,259715.0,Giotto Morandi,2024-08-04 09:28:16
12657,705070,19,43490079,94,Dorian Babunski (Grasshoppers) Yellow Card at 75',Dorian Babunski Yellow Card,2,4500,75',492,0,0,1980-01-01,0.0,0.0,0.0,0.0,0.0,0.0,260719.0,Dorian Babunski,2024-08-04 09:28:16
12657,705070,20,43490102,76,Simone Stroscio (Grasshoppers) Substitution at 78',Simone Stroscio Substitution,2,4680,78',492,0,0,1980-01-01,0.0,0.0,0.0,0.0,0.0,0.0,329736.0,Simone Stroscio,2024-08-04 09:28:16
12657,705070,20,43490102,76,Simone Stroscio (Grasshoppers) Substitution at 78',Simone Stroscio Substitution,2,4680,78',492,0,0,1980-01-01,0.0,0.0,0.0,0.0,0.0,0.0,305459.0,Maksim Paskotši,2024-08-04 09:28:16
12657,705070,21,43490103,76,Taulant Xhaka (FC Basel) Substitution at 79',Taulant Xhaka Substitution,2,4740,79',989,0,0,1980-01-01,0.0,0.0,0.0,0.0,0.0,0.0,151553.0,Taulant Xhaka,2024-08-04 09:28:16
12657,705070,21,43490103,76,Taulant Xhaka (FC Basel) Substitution at 79',Taulant Xhaka Substitution,2,4740,79',989,0,0,1980-01-01,0.0,0.0,0.0,0.0,0.0,0.0,362590.0,Leon Avdullahu,2024-08-04 09:28:16
12657,705070,22,43490163,94,Simone Stroscio (Grasshoppers) Yellow Card at 95',Simone Stroscio Yellow Card,2,5400,90'+5',492,0,0,1980-01-01,0.0,0.0,0.0,0.0,0.0,0.0,329736.0,Simone Stroscio,2024-08-04 09:28:16
12657,705071,1,43490954,70,Nicky Medja Beloko (FC Luzern) Goal at 48',Nicky Medja Beloko Goal,2,2880,48',7640,0,0,1980-01-01,0.0,0.0,0.0,0.0,0.0,0.0,267619.0,Nicky Medja Beloko,2024-08-04 09:28:16
12657,705071,2,43491028,76,Aleksandar Stankovic (FC Luzern) Substitution at 54',Aleksandar Stankovic Substitutio,2,3240,54',7640,0,0,1980-01-01,0.0,0.0,0.0,0.0,0.0,0.0,240109.0,Aleksandar Stankovic,2024-08-04 09:28:16
12657,705071,2,43491028,76,Aleksandar Stankovic (FC Luzern) Substitution at 54',Aleksandar Stankovic Substitutio,2,3240,54',7640,0,0,1980-01-01,0.0,0.0,0.0,0.0,0.0,0.0,304259.0,Tyron Owusu,2024-08-04 09:28:16
12657,705071,3,43491154,76,Levin Winkler (FC Luzern) Substitution at 62',Levin Winkler Substitution,2,3720,62',7640,0,0,1980-01-01,0.0,0.0,0.0,0.0,0.0,0.0,377836.0,Levin Winkler,2024-08-04 09:28:16
12657,705071,3,43491154,76,Levin Winkler (FC Luzern) Substitution at 62',Levin Winkler Substitution,2,3720,62',7640,0,0,1980-01-01,0.0,0.0,0.0,0.0,0.0,0.0,274682.0,Jakub Kadak,2024-08-04 09:28:16
12657,705071,4,43491155,76,Thibault Klidje (FC Luzern) Substitution at 63',Thibault Klidje Substitution,2,3780,63',7640,0,0,1980-01-01,0.0,0.0,0.0,0.0,0.0,0.0,272137.0,Thibault Klidje,2024-08-04 09:28:16
12657,705071,4,43491155,76,Thibault Klidje (FC Luzern) Substitution at 63',Thibault Klidje Substitution,2,3780,63',7640,0,0,1980-01-01,0.0,0.0,0.0,0.0,0.0,0.0,283349.0,Sinan Karweina,2024-08-04 09:28:16
12657,705071,5,43491187,76,Kevin Bua (FC Sion) Substitution at 64',Kevin Bua Substitution,2,3840,64',3076,0,0,1980-01-01,0.0,0.0,0.0,0.0,0.0,0.0,223496.0,Kevin Bua,2024-08-04 09:28:16
12657,705071,5,43491187,76,Kevin Bua (FC Sion) Substitution at 64',Kevin Bua Substitution,2,3840,64',3076,0,0,1980-01-01,0.0,0.0,0.0,0.0,0.0,0.0,313093.0,Théo Berdayes,2024-08-04 09:28:16
12657,705071,6,43491188,76,Cristian Souza (FC Sion) Substitution at 65',Cristian Souza Substitution,2,3900,65',3076,0,0,1980-01-01,0.0,0.0,0.0,0.0,0.0,0.0,284859.0,Cristian Souza,2024-08-04 09:28:16
12657,705071,7,43491189,76,Dejan Djokic (FC Sion) Substitution at 65',Dejan Djokic Substitution,2,3900,65',3076,0,0,1980-01-01,0.0,0.0,0.0,0.0,0.0,0.0,304810.0,Dejan Djokic,2024-08-04 09:28:16
12657,705071,6,43491188,76,Cristian Souza (FC Sion) Substitution at 65',Cristian Souza Substitution,2,3900,65',3076,0,0,1980-01-01,0.0,0.0,0.0,0.0,0.0,0.0,356272.0,Théo Bouchlarhem,2024-08-04 09:28:16
12657,705071,7,43491189,76,Dejan Djokic (FC Sion) Substitution at 65',Dejan Djokic Substitution,2,3900,65',3076,0,0,1980-01-01,0.0,0.0,0.0,0.0,0.0,0.0,100518.0,Dejan Sorgic,2024-08-04 09:28:16
12657,705071,8,43491281,76,Liam Chipperfield (FC Sion) Substitution at 80',Liam Chipperfield Substitution,2,4800,80',3076,0,0,1980-01-01,0.0,0.0,0.0,0.0,0.0,0.0,323752.0,Liam Chipperfield,2024-08-04 09:28:16
12657,705071,8,43491281,76,Liam Chipperfield (FC Sion) Substitution at 80',Liam Chipperfield Substitution,2,4800,80',3076,0,0,1980-01-01,0.0,0.0,0.0,0.0,0.0,0.0,283802.0,Ylyas Chouaref,2024-08-04 09:28:16
12657,705071,9,43491322,76,Georgi Rusev (FC Sion) Substitution at 83',Georgi Rusev Substitution,2,4980,83',3076,0,0,1980-01-01,0.0,0.0,0.0,0.0,0.0,0.0,126645.0,Georgi Rusev,2024-08-05 09:30:21
12657,705071,10,43491323,76,Kevin Spadanuda (FC Luzern) Substitution at 83',Kevin Spadanuda Substitution,2,4980,83',7640,0,0,1980-01-01,0.0,0.0,0.0,0.0,0.0,0.0,343952.0,Kevin Spadanuda,2024-08-05 09:30:21
12657,705071,11,43491324,76,Dario Ulrich (FC Luzern) Substitution at 83',Dario Ulrich Substitution,2,4980,83',7640,0,0,1980-01-01,0.0,0.0,0.0,0.0,0.0,0.0,252807.0,Dario Ulrich,2024-08-05 09:30:21
12657,705071,9,43491322,76,Georgi Rusev (FC Sion) Substitution at 83',Georgi Rusev Substitution,2,4980,83',3076,0,0,1980-01-01,0.0,0.0,0.0,0.0,0.0,0.0,238879.0,Ali Kabacalman,2024-08-05 09:30:21
12657,705071,10,43491323,76,Kevin Spadanuda (FC Luzern) Substitution at 83',Kevin Spadanuda Substitution,2,4980,83',7640,0,0,1980-01-01,0.0,0.0,0.0,0.0,0.0,0.0,320006.0,Donat Rrudhani,2024-08-05 09:30:21
12657,705071,11,43491324,76,Dario Ulrich (FC Luzern) Substitution at 83',Dario Ulrich Substitution,2,4980,83',7640,0,0,1980-01-01,0.0,0.0,0.0,0.0,0.0,0.0,361268.0,Vars Villiger,2024-08-05 09:30:21
12657,705071,12,43491360,94,Pascal Loretz (FC Luzern) Yellow Card at 86',Pascal Loretz Yellow Card,2,5160,86',7640,0,0,1980-01-01,0.0,0.0,0.0,0.0,0.0,0.0,321208.0,Pascal Loretz,2024-08-05 09:30:21
12657,705071,13,43491447,94,Georgi Rusev (FC Sion) Yellow Card at 92',Georgi Rusev Yellow Card,2,5400,90'+2',3076,0,0,1980-01-01,0.0,0.0,0.0,0.0,0.0,0.0,126645.0,Georgi Rusev,2024-08-05 09:30:21
12657,705071,14,43491474,94,Numa Lavanchy (FC Sion) Yellow Card at 94',Numa Lavanchy Yellow Card,2,5400,90'+4',3076,0,0,1980-01-01,0.0,0.0,0.0,0.0,0.0,0.0,176495.0,Numa Lavanchy,2024-08-05 09:30:21
12657,705071,15,43491512,94,Timothy Fayulu (FC Sion) Yellow Card at 96',Timothy Fayulu Yellow Card,2,5400,90'+6',3076,0,0,1980-01-01,0.0,0.0,0.0,0.0,0.0,0.0,282757.0,Timothy Fayulu,2024-08-05 09:30:21
12657,705072,1,43495808,70,Isaac Schmidt (St. Gallen) Goal at 1',Isaac Schmidt Goal,1,60,1',557,0,0,1980-01-01,0.0,0.0,0.0,0.0,0.0,0.0,307242.0,Isaac Schmidt,2024-08-05 09:30:21
12657,705072,2,43495811,76,Manuel Polster (Lausanne Sports) Substitution at 13',Manuel Polster Substitution,1,780,13',11551,0,0,1980-01-01,0.0,0.0,0.0,0.0,0.0,0.0,324318.0,Manuel Polster,2024-08-05 09:30:21
12657,705072,2,43495811,76,Manuel Polster (Lausanne Sports) Substitution at 13',Manuel Polster Substitution,1,780,13',11551,0,0,1980-01-01,0.0,0.0,0.0,0.0,0.0,0.0,240260.0,Morgan Poaty,2024-08-05 09:30:21
12657,705072,3,43495812,94,Noe Dussenne (Lausanne Sports) Yellow Card at 18',Noe Dussenne Yellow Card,1,1080,18',11551,0,0,1980-01-01,0.0,0.0,0.0,0.0,0.0,0.0,194352.0,Noe Dussenne,2024-08-05 09:30:21
12657,705072,4,43495813,98,Willem Geubbels (St. Gallen) Penalty - Scored at 20',Willem Geubbels Penalty - Scored,1,1200,20',557,0,0,1980-01-01,0.0,0.0,0.0,0.0,0.0,0.0,259744.0,Willem Geubbels,2024-08-05 09:30:21
12657,705072,5,43495835,97,Chima Sean Okoroji (St. Gallen) Own Goal at 37',Chima Sean Okoroji Own Goal,1,2220,37',11551,0,0,1980-01-01,0.0,0.0,0.0,0.0,0.0,0.0,,Chima Sean Okoroji,2024-08-05 09:30:21
12657,705072,6,43495917,76,Mihailo Stevanovic (St. Gallen) Substitution at 45',Mihailo Stevanovic Substitution,2,2700,45',557,0,0,1980-01-01,0.0,0.0,0.0,0.0,0.0,0.0,304685.0,Mihailo Stevanovic,2024-08-05 09:30:21
12657,705072,6,43495917,76,Mihailo Stevanovic (St. Gallen) Substitution at 45',Mihailo Stevanovic Substitution,2,2700,45',557,0,0,1980-01-01,0.0,0.0,0.0,0.0,0.0,0.0,218836.0,Lukas Görtler,2024-08-05 09:30:21
12657,705072,7,43495927,70,Chadrac Akolo (St. Gallen) Goal at 50',Chadrac Akolo Goal,2,3000,50',557,0,0,1980-01-01,0.0,0.0,0.0,0.0,0.0,0.0,217526.0,Chadrac Akolo,2024-08-05 09:30:21
12657,705072,8,43495931,94,Abdoulaye Diaby (St. Gallen) Yellow Card at 54',Abdoulaye Diaby Yellow Card,2,3240,54',557,0,0,1980-01-01,0.0,0.0,0.0,0.0,0.0,0.0,266637.0,Abdoulaye Diaby,2024-08-05 09:30:21
12657,705072,9,43495935,94,Chima Sean Okoroji (St. Gallen) Yellow Card at 58',Chima Sean Okoroji Yellow Card,2,3480,58',557,0,0,1980-01-01,0.0,0.0,0.0,0.0,0.0,0.0,270295.0,Chima Sean Okoroji,2024-08-05 09:30:21
12657,705072,10,43495947,76,Yannick Noah (St. Gallen) Substitution at 63',Yannick Noah Substitution,2,3780,63',557,0,0,1980-01-01,0.0,0.0,0.0,0.0,0.0,0.0,354181.0,Yannick Noah,2024-08-05 09:30:21
12657,705072,11,43495948,76,Moustapha Cissé (St. Gallen) Substitution at 63',Moustapha Cissé Substitution,2,3780,63',557,0,0,1980-01-01,0.0,0.0,0.0,0.0,0.0,0.0,337127.0,Moustapha Cissé,2024-08-05 09:30:21
12657,705072,10,43495947,76,Yannick Noah (St. Gallen) Substitution at 63',Yannick Noah Substitution,2,3780,63',557,0,0,1980-01-01,0.0,0.0,0.0,0.0,0.0,0.0,270295.0,Chima Sean Okoroji,2024-08-05 09:30:21
12657,705072,11,43495948,76,Moustapha Cissé (St. Gallen) Substitution at 63',Moustapha Cissé Substitution,2,3780,63',557,0,0,1980-01-01,0.0,0.0,0.0,0.0,0.0,0.0,259744.0,Willem Geubbels,2024-08-05 09:30:21
12657,705072,12,43495953,70,Moustapha Cissé (St. Gallen) Goal at 70',Moustapha Cissé Goal,2,4200,70',557,0,0,1980-01-01,0.0,0.0,0.0,0.0,0.0,0.0,337127.0,Moustapha Cissé,2024-08-05 09:30:21
12657,705072,13,43495957,76,Jovan Milosevic (St. Gallen) Substitution at 71',Jovan Milosevic Substitution,2,4260,71',557,0,0,1980-01-01,0.0,0.0,0.0,0.0,0.0,0.0,364204.0,Jovan Milosevic,2024-08-05 09:30:21
12657,705072,14,43495958,76,Alban Ajdini (Lausanne Sports) Substitution at 71',Alban Ajdini Substitution,2,4260,71',11551,0,0,1980-01-01,0.0,0.0,0.0,0.0,0.0,0.0,304314.0,Alban Ajdini,2024-08-05 09:30:21
12657,705072,15,43495959,76,Konrad De La Fuente (Lausanne Sports) Substitution at 71',Konrad De La Fuente Substitution,2,4260,71',11551,0,0,1980-01-01,0.0,0.0,0.0,0.0,0.0,0.0,287498.0,Konrad De La Fuente,2024-08-05 09:30:21
12657,705072,13,43495957,76,Jovan Milosevic (St. Gallen) Substitution at 71',Jovan Milosevic Substitution,2,4260,71',557,0,0,1980-01-01,0.0,0.0,0.0,0.0,0.0,0.0,217526.0,Chadrac Akolo,2024-08-05 09:30:21
12657,705072,14,43495958,76,Alban Ajdini (Lausanne Sports) Substitution at 71',Alban Ajdini Substitution,2,4260,71',11551,0,0,1980-01-01,0.0,0.0,0.0,0.0,0.0,0.0,306297.0,Mamadou Kaly Sene,2024-08-05 09:30:21
12657,705072,15,43495959,76,Konrad De La Fuente (Lausanne Sports) Substitution at 71',Konrad De La Fuente Substitution,2,4260,71',11551,0,0,1980-01-01,0.0,0.0,0.0,0.0,0.0,0.0,255773.0,Teddy Okou,2024-08-05 09:30:21
12657,705072,16,43495963,94,Albert Vallci (St. Gallen) Yellow Card at 75',Albert Vallci Yellow Card,2,4500,75',557,0,0,1980-01-01,0.0,0.0,0.0,0.0,0.0,0.0,274923.0,Albert Vallci,2024-08-05 09:30:21
